,Location,Date,Type,Region,Latitude,Longitude,Split,Date_Loc,NEAR_FID,NEAR_DIST,Orig_FID
0,CA,5/26/2023,other,Morgan Hill,37.18806076,-121.7259008,1,2023-05-26 CA,,,1
1,CA,5/26/2023,other,Morgan Hill,37.18906803,-121.7245096,1,2023-05-26 CA,,,2
2,CA,5/26/2023,other,Morgan Hill,37.19022257,-121.7225615,1,2023-05-26 CA,,,3
3,CA,5/26/2023,other,Morgan Hill,37.18745087,-121.7196029,1,2023-05-26 CA,,,4
4,CA,5/26/2023,other,Morgan Hill,37.18940213,-121.7264547,1,2023-05-26 CA,,,5
5,CA,5/26/2023,other,Morgan Hill,37.19208933,-121.7215042,1,2023-05-26 CA,,,6
6,CA,5/26/2023,other,Morgan Hill,37.19245437,-121.7179894,1,2023-05-26 CA,,,7
7,CA,5/26/2023,other,Morgan Hill,37.19416832,-121.7191782,1,2023-05-26 CA,,,8
8,CA,5/26/2023,other,Morgan Hill,37.19153218,-121.7200928,1,2023-05-26 CA,,,9
9,CA,5/26/2023,other,Morgan Hill,37.18851608,-121.7198251,1,2023-05-26 CA,,,10
10,CA,5/26/2023,other,Morgan Hill,37.19049725,-121.7241191,1,2023-05-26 CA,,,11
11,CA,6/29/2023,other,Morgan Hill,37.04254633,-121.6334887,2,2023-06-29 CA,,,12
12,CA,6/29/2023,other,Morgan Hill,37.04125688,-121.6335318,2,2023-06-29 CA,,,13
13,CA,6/29/2023,other,Morgan Hill,37.04054996,-121.6330954,2,2023-06-29 CA,,,14
14,CA,6/29/2023,other,Morgan Hill,37.03938277,-121.6335216,2,2023-06-29 CA,,,15
15,CA,6/29/2023,other,Morgan Hill,37.03863298,-121.6330602,2,2023-06-29 CA,,,16
16,CA,6/29/2023,other,Morgan Hill,37.03003345,-121.6403828,2,2023-06-29 CA,,,17
17,CA,6/29/2023,other,Morgan Hill,37.03991706,-121.6409676,2,2023-06-29 CA,,,18
18,CA,6/29/2023,other,Morgan Hill,37.04215059,-121.6312921,2,2023-06-29 CA,,,19
19,CA,6/29/2023,other,Morgan Hill,37.04421186,-121.6403858,2,2023-06-29 CA,,,20
20,CA,6/29/2023,other,Morgan Hill,37.03714955,-121.6333094,2,2023-06-29 CA,,,21
21,CA,4/27/2023,other,Santa Maria,34.81783628,-120.4343591,1,2023-04-27 CA,,,22
22,CA,4/27/2023,other,Santa Maria,34.81728075,-120.4327705,1,2023-04-27 CA,,,23
23,CA,4/27/2023,other,Santa Maria,34.81693198,-120.4338105,1,2023-04-27 CA,,,24
24,CA,4/27/2023,other,Santa Maria,34.81766941,-120.431174,1,2023-04-27 CA,,,25
25,CA,4/27/2023,other,Santa Maria,34.81661933,-120.4309602,1,2023-04-27 CA,,,26
26,CA,4/27/2023,other,Santa Maria,34.81533843,-120.430994,1,2023-04-27 CA,,,27
27,CA,4/27/2023,other,Santa Maria,34.81609703,-120.4314351,1,2023-04-27 CA,,,28
28,CA,4/27/2023,other,Santa Maria,34.81511259,-120.4293844,1,2023-04-27 CA,,,29
29,CA,4/27/2023,other,Santa Maria,34.81609301,-120.4325118,1,2023-04-27 CA,,,30
30,CA,4/27/2023,other,Santa Maria,34.81660562,-120.4287906,1,2023-04-27 CA,,,31
31,CA,4/27/2023,other,Santa Maria,34.81675915,-120.429475,1,2023-04-27 CA,,,32
32,CA,4/27/2023,other,Santa Maria,34.81410491,-120.4299313,1,2023-04-27 CA,,,33
33,CA,4/27/2023,other,Santa Maria,34.81411769,-120.4322183,1,2023-04-27 CA,,,34
34,CA,4/27/2023,other,Santa Maria,34.81405873,-120.4278414,1,2023-04-27 CA,,,35
35,CA,4/27/2023,other,Santa Maria,34.81086834,-120.4293685,1,2023-04-27 CA,,,36
36,CA,4/27/2023,other,Santa Maria,34.81035517,-120.4289889,1,2023-04-27 CA,,,37
37,CA,4/27/2023,other,Santa Maria,34.8124162,-120.4283117,1,2023-04-27 CA,,,38
38,CA,4/27/2023,other,Santa Maria,34.81576416,-120.4275167,1,2023-04-27 CA,,,39
39,CA,3/10/2022,other,Santa Maria,34.96879257,-120.3749254,1,2022-03-10 CA,,,40
40,CA,3/10/2022,other,Santa Maria,34.96143954,-120.374753,1,2022-03-10 CA,,,41
41,CA,3/10/2022,other,Santa Maria,34.96632863,-120.375663,1,2022-03-10 CA,,,42
42,CA,3/10/2022,other,Santa Maria,34.96678635,-120.3700123,1,2022-03-10 CA,,,43
43,CA,3/10/2022,other,Santa Maria,34.96358604,-120.3747431,1,2022-03-10 CA,,,44
44,CA,3/10/2022,other,Santa Maria,34.95537785,-120.3672879,1,2022-03-10 CA,,,45
45,CA,3/10/2022,other,Santa Maria,34.95676907,-120.3688066,1,2022-03-10 CA,,,46
46,CA,3/10/2022,other,Santa Maria,34.9597931,-120.3698479,1,2022-03-10 CA,,,47
47,CA,3/10/2022,other,Santa Maria,34.95841734,-120.3659957,1,2022-03-10 CA,,,48
48,CA,3/10/2022,other,Santa Maria,34.95976415,-120.367448,1,2022-03-10 CA,,,49
49,CA,3/10/2022,other,Santa Maria,34.9623183,-120.3645459,1,2022-03-10 CA,,,50
50,CA,3/10/2022,other,Santa Maria,34.9614127,-120.3624877,1,2022-03-10 CA,,,51
51,CA,3/10/2022,other,Santa Maria,34.96060414,-120.3610709,1,2022-03-10 CA,,,52
52,CA,3/10/2022,other,Santa Maria,34.96187382,-120.3635139,1,2022-03-10 CA,,,53
53,CA,3/10/2022,other,Santa Maria,34.95892289,-120.3633495,1,2022-03-10 CA,,,54
54,CA,3/10/2022,other,Santa Maria,34.95622575,-120.3628821,1,2022-03-10 CA,,,55
55,CA,3/10/2022,other,Santa Maria,34.95542935,-120.361208,1,2022-03-10 CA,,,56
56,CA,3/10/2022,other,Santa Maria,34.96345111,-120.3579816,1,2022-03-10 CA,,,57
57,CA,3/10/2022,other,Santa Maria,34.95361923,-120.3625692,1,2022-03-10 CA,,,58
58,CA,3/10/2022,other,Santa Maria,34.95428584,-120.3558842,1,2022-03-10 CA,,,59
59,CA,3/10/2022,other,Santa Maria,34.95667432,-120.3528153,1,2022-03-10 CA,,,60
60,CA,3/10/2022,other,Santa Maria,34.95541952,-120.3564378,1,2022-03-10 CA,,,61
61,CA,3/10/2022,other,Santa Maria,34.95227349,-120.3590725,1,2022-03-10 CA,,,62
62,CA,3/10/2022,other,Santa Maria,34.95071001,-120.3558658,1,2022-03-10 CA,,,63
63,CA,3/10/2022,other,Santa Maria,34.95216261,-120.3527803,1,2022-03-10 CA,,,64
64,CA,3/10/2022,other,Santa Maria,34.95381249,-120.3499051,1,2022-03-10 CA,,,65
65,CA,3/10/2022,other,Santa Maria,34.94945536,-120.3527773,1,2022-03-10 CA,,,66
66,CA,3/10/2022,other,Santa Maria,34.95061265,-120.3491895,1,2022-03-10 CA,,,67
67,CA,3/10/2022,other,Santa Maria,34.94756975,-120.3523649,1,2022-03-10 CA,,,68
68,CA,3/10/2022,other,Santa Maria,34.94516953,-120.348377,1,2022-03-10 CA,,,69
69,CA,3/10/2022,other,Santa Maria,34.94808981,-120.3460368,1,2022-03-10 CA,,,70
70,CA,3/10/2022,other,Santa Maria,34.94738361,-120.3426848,1,2022-03-10 CA,,,71
71,CA,3/10/2022,other,Santa Maria,34.95280509,-120.3474927,1,2022-03-10 CA,,,72
72,CA,3/10/2022,other,Santa Maria,34.95282577,-120.3440774,1,2022-03-10 CA,,,73
73,CA,11/9/2023,other,Oxnard,34.30604625,-119.1506892,1,2023-11-09 CA,,,74
74,CA,11/9/2023,other,Oxnard,34.30992507,-119.1516215,1,2023-11-09 CA,,,75
75,CA,11/9/2023,other,Oxnard,34.30765994,-119.1500104,1,2023-11-09 CA,,,76
76,CA,11/9/2023,other,Oxnard,34.30731735,-119.1517045,1,2023-11-09 CA,,,77
77,CA,11/9/2023,other,Oxnard,34.30518806,-119.150306,1,2023-11-09 CA,,,78
78,CA,11/9/2023,other,Oxnard,34.30708618,-119.1484184,1,2023-11-09 CA,,,79
79,CA,11/9/2023,other,Oxnard,34.3087735,-119.1467042,1,2023-11-09 CA,,,80
80,CA,11/9/2023,other,Oxnard,34.31092857,-119.1470178,1,2023-11-09 CA,,,81
81,CA,11/9/2023,other,Oxnard,34.30673119,-119.1451008,1,2023-11-09 CA,,,82
82,CA,11/9/2023,other,Oxnard,34.30504087,-119.148291,1,2023-11-09 CA,,,83
83,CA,11/9/2023,other,Oxnard,34.30995795,-119.1482286,1,2023-11-09 CA,,,84
84,CA,11/9/2023,other,Oxnard,34.31250411,-119.1479341,1,2023-11-09 CA,,,85
85,CA,11/9/2023,other,Oxnard,34.31405313,-119.1516155,1,2023-11-09 CA,,,86
86,CA,11/9/2023,other,Oxnard,34.31200522,-119.151321,1,2023-11-09 CA,,,87
87,CA,11/9/2023,other,Oxnard,34.31311427,-119.152858,1,2023-11-09 CA,,,88
88,CA,11/9/2023,other,Oxnard,34.31145137,-119.149108,1,2023-11-09 CA,,,89
89,CA,11/9/2023,other,Oxnard,34.30426516,-119.1489298,1,2023-11-09 CA,,,90
90,CA,7/13/2023,other,Santa Barbara,34.45318233,-119.9186666,1,2023-07-13 CA,,,91
91,CA,7/13/2023,other,Santa Barbara,34.45326777,-119.9201452,1,2023-07-13 CA,,,92
92,CA,7/13/2023,other,Santa Barbara,34.45814117,-119.9201962,1,2023-07-13 CA,,,93
93,CA,7/13/2023,other,Santa Barbara,34.46259449,-119.9193858,1,2023-07-13 CA,,,94
94,CA,7/13/2023,other,Santa Barbara,34.46305333,-119.9199069,1,2023-07-13 CA,,,95
95,CA,7/13/2023,other,Santa Barbara,34.46459148,-119.9187386,1,2023-07-13 CA,,,96
96,CA,7/13/2023,other,Santa Barbara,34.46664583,-119.9197787,1,2023-07-13 CA,,,97
97,CA,7/13/2023,other,Santa Barbara,34.46792245,-119.9153718,1,2023-07-13 CA,,,98
98,CA,7/13/2023,other,Santa Barbara,34.46572041,-119.9153758,1,2023-07-13 CA,,,99
99,CA,7/13/2023,other,Santa Barbara,34.46927949,-119.9104488,1,2023-07-13 CA,,,100
100,CA,7/13/2023,other,Santa Barbara,34.47472162,-119.9034911,1,2023-07-13 CA,,,101
101,CA,7/13/2023,other,Santa Barbara,34.47673186,-119.9036802,1,2023-07-13 CA,,,102
102,CA,7/13/2023,other,Santa Barbara,34.47655351,-119.906172,1,2023-07-13 CA,,,103
103,CA,7/13/2023,other,Santa Barbara,34.47067086,-119.903641,1,2023-07-13 CA,,,104
104,CA,7/13/2023,other,Santa Barbara,34.46642283,-119.9051645,1,2023-07-13 CA,,,105
105,CA,7/13/2023,other,Santa Barbara,34.46263812,-119.9088948,1,2023-07-13 CA,,,106
106,CA,7/13/2023,other,Santa Barbara,34.46639656,-119.908836,1,2023-07-13 CA,,,107
107,CA,7/13/2023,other,Santa Barbara,34.46339952,-119.9046283,1,2023-07-13 CA,,,108
108,CA,7/13/2023,other,Santa Barbara,34.46050821,-119.9071514,1,2023-07-13 CA,,,109
109,CA,7/8/2023,other,Santa Barbara,34.39557707,-119.4970747,2,2023-07-08 CA,,,110
110,CA,7/8/2023,other,Santa Barbara,34.39633642,-119.4934333,2,2023-07-08 CA,,,111
111,CA,7/8/2023,other,Santa Barbara,34.39890846,-119.4947738,2,2023-07-08 CA,,,112
112,CA,7/8/2023,other,Santa Barbara,34.39943929,-119.4925473,2,2023-07-08 CA,,,113
113,CA,7/8/2023,other,Santa Barbara,34.39687386,-119.4937697,2,2023-07-08 CA,,,114
114,CA,7/8/2023,other,Santa Barbara,34.4017641,-119.4940015,2,2023-07-08 CA,,,115
115,CA,7/8/2023,other,Santa Barbara,34.4025061,-119.493714,2,2023-07-08 CA,,,116
116,CA,7/8/2023,other,Santa Barbara,34.4021126,-119.4959857,2,2023-07-08 CA,,,117
117,CA,7/8/2023,other,Santa Barbara,34.40299888,-119.4974677,2,2023-07-08 CA,,,118
118,CA,7/8/2023,other,Santa Barbara,34.3943293,-119.4973096,2,2023-07-08 CA,,,119
119,CA,7/8/2023,other,Santa Barbara,34.39542034,-119.4949027,2,2023-07-08 CA,,,120
120,CA,7/8/2023,other,Santa Barbara,34.3945755,-119.4896589,2,2023-07-08 CA,,,121
121,CA,7/8/2023,other,Santa Barbara,34.39618055,-119.4896316,2,2023-07-08 CA,,,122
122,CA,7/8/2023,other,Santa Barbara,34.39959112,-119.4896242,2,2023-07-08 CA,,,123
123,CA,7/8/2023,other,Santa Barbara,34.39832891,-119.4846049,2,2023-07-08 CA,,,124
124,CA,7/8/2023,other,Santa Barbara,34.39659343,-119.4856811,2,2023-07-08 CA,,,125
125,CA,8/1/2023,other,Maricopa,35.09212972,-119.1143387,1,2023-08-01 CA,,,126
126,CA,8/1/2023,other,Maricopa,35.09218039,-119.1053525,1,2023-08-01 CA,,,127
127,CA,8/1/2023,other,Maricopa,35.09001739,-119.1164064,1,2023-08-01 CA,,,128
128,CA,8/1/2023,other,Maricopa,35.09170459,-119.1090376,1,2023-08-01 CA,,,129
129,CA,8/1/2023,other,Maricopa,35.08274609,-119.1081179,1,2023-08-01 CA,,,130
130,CA,8/1/2023,other,Maricopa,35.07496038,-119.119034,1,2023-08-01 CA,,,131
131,CA,8/1/2023,other,Maricopa,35.07568575,-119.1094577,1,2023-08-01 CA,,,132
132,CA,8/1/2023,other,Maricopa,35.07384966,-119.1170825,1,2023-08-01 CA,,,133
133,CA,8/1/2023,other,Maricopa,35.07373037,-119.1031138,1,2023-08-01 CA,,,134
134,CA,8/1/2023,other,Maricopa,35.07047579,-119.127159,1,2023-08-01 CA,,,135
135,CA,8/1/2023,other,Maricopa,35.07441108,-119.1236721,1,2023-08-01 CA,,,136
136,CA,8/1/2023,other,Maricopa,35.07144787,-119.1086603,1,2023-08-01 CA,,,137
137,CA,8/1/2023,other,Maricopa,35.07056636,-119.1178487,1,2023-08-01 CA,,,138
138,CA,8/1/2023,other,Maricopa,35.07884473,-119.1162049,1,2023-08-01 CA,,,139
139,CA,8/1/2023,other,Maricopa,35.08302927,-119.1131077,1,2023-08-01 CA,,,140
140,CA,10/8/2022,other,Maricopa,35.08257309,-119.2087224,2,2022-10-08 CA,,,141
141,CA,10/8/2022,other,Maricopa,35.07756376,-119.2148151,2,2022-10-08 CA,,,142
142,CA,10/8/2022,other,Maricopa,35.08031864,-119.2187266,2,2022-10-08 CA,,,143
143,CA,10/8/2022,other,Maricopa,35.08256423,-119.2170161,2,2022-10-08 CA,,,144
144,CA,10/8/2022,other,Maricopa,35.08040184,-119.2222767,2,2022-10-08 CA,,,145
145,CA,10/8/2022,other,Maricopa,35.07969877,-119.2166171,2,2022-10-08 CA,,,146
146,CA,10/8/2022,other,Maricopa,35.07732913,-119.2091534,2,2022-10-08 CA,,,147
147,CA,10/8/2022,other,Maricopa,35.07989263,-119.2278904,2,2022-10-08 CA,,,148
148,CA,10/8/2022,other,Maricopa,35.08279635,-119.2283715,2,2022-10-08 CA,,,149
149,CA,10/8/2022,other,Maricopa,35.08037526,-119.2326018,2,2022-10-08 CA,,,150
150,CA,10/8/2022,other,Maricopa,35.07734863,-119.2306988,2,2022-10-08 CA,,,151
151,CA,12/23/2022,other,Maricopa,34.90399375,-119.6028389,1,2022-12-23 CA,,,152
152,CA,12/23/2022,other,Maricopa,34.90261472,-119.5973571,1,2022-12-23 CA,,,153
153,CA,12/23/2022,other,Maricopa,34.89889057,-119.6032387,1,2022-12-23 CA,,,154
154,CA,12/23/2022,other,Maricopa,34.90359505,-119.5996674,1,2022-12-23 CA,,,155
155,CA,12/23/2022,other,Maricopa,34.89954317,-119.599192,1,2022-12-23 CA,,,156
156,CA,12/23/2022,other,Maricopa,34.90369838,-119.5937449,1,2022-12-23 CA,,,157
157,CA,12/23/2022,other,Maricopa,34.90271364,-119.5929639,1,2022-12-23 CA,,,158
158,CA,12/23/2022,other,Maricopa,34.89992814,-119.5936184,1,2022-12-23 CA,,,159
159,CA,12/23/2022,other,Maricopa,34.90036967,-119.5903119,1,2022-12-23 CA,,,160
160,CA,12/23/2022,other,Maricopa,34.90321932,-119.5890282,1,2022-12-23 CA,,,161
161,CA,12/23/2022,other,Maricopa,34.90081216,-119.591903,1,2022-12-23 CA,,,162
162,CA,12/23/2022,other,Maricopa,34.90051872,-119.6011984,1,2022-12-23 CA,,,163
163,CA,12/23/2022,other,Maricopa,34.89999093,-119.6031582,1,2022-12-23 CA,,,164
164,CA,12/23/2022,other,Maricopa,34.90272216,-119.6011805,1,2022-12-23 CA,,,165
165,Oxnard,8/1/2023,mulch,,34.26084496800007,-119.25775345499994,2,2023-08-01 Oxnard,,,166
166,Oxnard,8/1/2023,mulch,,34.261969891000035,-119.25694700499996,2,2023-08-01 Oxnard,,,167
167,Oxnard,8/1/2023,mulch,,34.26157800000004,-119.25720869499996,2,2023-08-01 Oxnard,,,168
168,Oxnard,8/1/2023,mulch,,34.26138870400007,-119.25668413099999,2,2023-08-01 Oxnard,,,169
169,Oxnard,8/1/2023,mulch,,34.26116541100004,-119.25725412399999,2,2023-08-01 Oxnard,,,170
170,Oxnard,8/1/2023,mulch,,34.26087389600008,-119.25703662599994,2,2023-08-01 Oxnard,,,171
171,Oxnard,8/1/2023,mulch,,34.26056300400006,-119.257147079,2,2023-08-01 Oxnard,,,172
172,Oxnard,8/1/2023,mulch,,34.26142125000007,-119.25587836999993,2,2023-08-01 Oxnard,,,173
173,Oxnard,8/1/2023,mulch,,34.26090027500004,-119.25482044799996,2,2023-08-01 Oxnard,,,174
174,Oxnard,8/1/2023,mulch,,34.260763644000065,-119.255761136,2,2023-08-01 Oxnard,,,175
175,Oxnard,8/1/2023,mulch,,34.260528271000055,-119.25437658799996,2,2023-08-01 Oxnard,,,176
176,Oxnard,8/1/2023,mulch,,34.26040281500008,-119.25507830099995,2,2023-08-01 Oxnard,,,177
177,Oxnard,8/1/2023,mulch,,34.25995626400004,-119.25495216699994,2,2023-08-01 Oxnard,,,178
178,Oxnard,8/1/2023,mulch,,34.26042232500004,-119.25644961999996,2,2023-08-01 Oxnard,,,179
179,Oxnard,8/1/2023,blackmulch,,34.22153011100005,-119.119417984,2,2023-08-01 Oxnard,,,180
180,Oxnard,8/1/2023,blackmulch,,34.22039413400006,-119.11702393099993,2,2023-08-01 Oxnard,,,181
181,Oxnard,8/1/2023,blackmulch,,34.22005003400005,-119.11808447699995,2,2023-08-01 Oxnard,,,182
182,Oxnard,8/1/2023,blackmulch,,34.22040895600003,-119.11952090299997,2,2023-08-01 Oxnard,,,183
183,Oxnard,8/1/2023,blackmulch,,34.219239696000045,-119.11959697699996,2,2023-08-01 Oxnard,,,184
184,Oxnard,8/1/2023,blackmulch,,34.22112308000004,-119.11779359299997,2,2023-08-01 Oxnard,,,185
185,Oxnard,8/1/2023,blackmulch,,34.21871299600008,-119.11928668499996,2,2023-08-01 Oxnard,,,186
186,Oxnard,8/1/2023,blackmulch,,34.21898833800003,-119.11635959399996,2,2023-08-01 Oxnard,,,187
187,Oxnard,8/1/2023,blackmulch,,34.21988696000005,-119.11940937699995,2,2023-08-01 Oxnard,,,188
188,Oxnard,8/1/2023,blackmulch,,34.221046433000026,-119.11960219199995,2,2023-08-01 Oxnard,,,189
189,Oxnard,8/1/2023,blackmulch,,34.21929272800003,-119.11822626199996,2,2023-08-01 Oxnard,,,190
190,Oxnard,8/1/2023,blackmulch,,34.218749299000024,-119.11674728799994,2,2023-08-01 Oxnard,,,191
191,Oxnard,8/1/2023,blackmulch,,34.221285538000075,-119.11840994499993,2,2023-08-01 Oxnard,,,192
192,Oxnard,8/1/2023,blackmulch,,34.21875452200004,-119.11762901499996,2,2023-08-01 Oxnard,,,193
193,Oxnard,8/1/2023,blackmulch,,34.22100952400007,-119.11867447299994,2,2023-08-01 Oxnard,,,194
194,Oxnard,8/1/2023,blackmulch,,34.219868973000075,-119.11626229999996,2,2023-08-01 Oxnard,,,195
195,Oxnard,2/28/2021,other,,34.20447649300007,-119.08487664999996,2,2021-02-28 Oxnard,,,196
196,Oxnard,2/28/2021,other,,34.20475549900004,-119.07316981399998,2,2021-02-28 Oxnard,,,197
197,Oxnard,2/28/2021,other,,34.202304955000045,-119.06343896299995,2,2021-02-28 Oxnard,,,198
198,Oxnard,2/28/2021,other,,34.21080879300007,-119.05974339499994,2,2021-02-28 Oxnard,,,199
199,Oxnard,2/28/2021,other,,34.20756039300005,-119.05924477499995,2,2021-02-28 Oxnard,,,200
200,Oxnard,2/28/2021,other,,34.20582390800007,-119.05014679699995,2,2021-02-28 Oxnard,,,201
201,Oxnard,2/28/2021,other,,34.204767877000045,-119.04454442899998,2,2021-02-28 Oxnard,,,202
202,Oxnard,2/28/2021,other,,34.18487017800004,-119.04339275199997,2,2021-02-28 Oxnard,,,203
203,Oxnard,2/28/2021,other,,34.17706079200008,-119.05663936499997,2,2021-02-28 Oxnard,,,204
204,Oxnard,2/28/2021,other,,34.19494309000004,-119.02766292899996,2,2021-02-28 Oxnard,,,205
205,Oxnard,2/28/2021,other,,34.19068512300004,-119.003868867,2,2021-02-28 Oxnard,,,206
206,Oxnard,2/28/2021,other,,34.19824212700007,-119.07013791099996,2,2021-02-28 Oxnard,,,207
207,Oxnard,2/28/2021,other,,34.19736232200006,-119.05557325599995,2,2021-02-28 Oxnard,,,208
208,Oxnard,2/28/2021,other,,34.19509232500008,-119.05815666199997,2,2021-02-28 Oxnard,,,209
209,Oxnard,2/28/2021,other,,34.19165054000007,-119.04576521899996,2,2021-02-28 Oxnard,,,210
210,Oxnard,2/28/2021,other,,34.19023393700007,-119.03920598299997,2,2021-02-28 Oxnard,,,211
211,Oxnard,2/28/2021,other,,34.17458200000004,-119.05457502899996,2,2021-02-28 Oxnard,,,212
212,Oxnard,2/28/2021,other,,34.17540308300005,-119.05425391899996,2,2021-02-28 Oxnard,,,213
213,Oxnard,2/28/2021,other,,34.17356502400003,-119.06758716599995,2,2021-02-28 Oxnard,,,214
214,Oxnard,2/28/2021,other,,34.171371331000046,-119.06668382199996,2,2021-02-28 Oxnard,,,215
215,Oxnard,2/28/2021,other,,34.16768409100007,-119.07054830799996,2,2021-02-28 Oxnard,,,216
216,Oxnard,2/28/2021,other,,34.15453540500005,-119.08605414799996,2,2021-02-28 Oxnard,,,217
217,Oxnard,2/28/2021,other,,34.15651855400006,-119.08627335499995,2,2021-02-28 Oxnard,,,218
218,Oxnard,2/28/2021,other,,34.15103311100006,-119.06759323699998,2,2021-02-28 Oxnard,,,219
219,Oxnard,2/28/2021,other,,34.153203432000055,-119.06460279299993,2,2021-02-28 Oxnard,,,220
220,Oxnard,2/28/2021,other,,34.14007158600003,-119.05265341399996,2,2021-02-28 Oxnard,,,221
221,Oxnard,2/28/2021,other,,34.13613993000007,-119.05462554699994,2,2021-02-28 Oxnard,,,222
222,Oxnard,2/28/2021,other,,34.13409682400004,-119.056419657,2,2021-02-28 Oxnard,,,223
223,Oxnard,2/28/2021,other,,34.13640539200003,-119.07452912399998,2,2021-02-28 Oxnard,,,224
224,Oxnard,11/9/2023,hoop,,34.2408210858,-119.131110798,1,2023-11-09 Oxnard,,,225
225,Oxnard,11/9/2023,hoop,,34.2417215788,-119.132067049,1,2023-11-09 Oxnard,254.0,26.160596449928462,226
226,Oxnard,10/14/2019,hoop,,34.1890325845,-119.123641237,2,2019-10-14 Oxnard,,,227
227,Oxnard,5/6/2023,hoop,,34.1491488599,-119.106545193,1,2023-05-06 Oxnard,,,228
228,Oxnard,11/9/2023,hoop,,34.2003418633,-119.124230036,1,2023-11-09 Oxnard,,,229
229,Oxnard,10/14/2019,hoop,,34.1893481481,-119.121984762,2,2019-10-14 Oxnard,,,230
230,Oxnard,11/9/2023,hoop,,34.2411148111,-119.131351632,1,2023-11-09 Oxnard,,,231
231,Oxnard,10/14/2019,hoop,,34.1893318262,-119.121209874,2,2019-10-14 Oxnard,,,232
232,Oxnard,10/14/2019,hoop,,34.1893761106,-119.124073556,2,2019-10-14 Oxnard,,,233
233,Oxnard,10/14/2019,hoop,,34.1887687963,-119.124049141,2,2019-10-14 Oxnard,,,234
234,Oxnard,5/6/2023,hoop,,34.151196782,-119.104755202,1,2023-05-06 Oxnard,320.0,28.00599768200959,235
235,Oxnard,11/9/2023,hoop,,34.239965108,-119.132743855,1,2023-11-09 Oxnard,,,236
236,Oxnard,11/9/2023,hoop,,34.230884675,-119.136591939,1,2023-11-09 Oxnard,,,237
237,Oxnard,11/9/2023,hoop,,34.2309273997,-119.136943721,1,2023-11-09 Oxnard,,,238
238,Oxnard,10/14/2019,hoop,,34.1886124888,-119.122311192,2,2019-10-14 Oxnard,,,239
239,Oxnard,10/14/2019,hoop,,34.1887657024,-119.121814555,2,2019-10-14 Oxnard,,,240
240,Oxnard,10/14/2019,hoop,,34.1886657706,-119.123124007,2,2019-10-14 Oxnard,,,241
241,Oxnard,11/9/2023,hoop,,34.2313356017,-119.134718149,1,2023-11-09 Oxnard,,,242
243,Oxnard,10/14/2019,hoop,,34.188800136,-119.120383281,2,2019-10-14 Oxnard,,,244
244,Oxnard,10/14/2019,hoop,,34.1894034406,-119.123544444,2,2019-10-14 Oxnard,243.0,29.33601060568269,245
245,Oxnard,11/9/2023,hoop,,34.200471322,-119.122846681,1,2023-11-09 Oxnard,,,246
246,Oxnard,10/14/2019,hoop,,34.1885504304,-119.120804318,2,2019-10-14 Oxnard,,,247
247,Oxnard,11/9/2023,hoop,,34.2307302974,-119.135997887,1,2023-11-09 Oxnard,,,248
248,Oxnard,11/9/2023,hoop,,34.2320665806,-119.13634338,1,2023-11-09 Oxnard,281.0,29.84404959830041,249
249,Oxnard,10/14/2019,hoop,,34.188904795,-119.121175168,2,2019-10-14 Oxnard,,,250
250,Oxnard,11/9/2023,hoop,,34.231553582,-119.13550774,1,2023-11-09 Oxnard,282.0,27.54183105030843,251
251,Oxnard,5/6/2023,hoop,,34.1521045637,-119.10669787,1,2023-05-06 Oxnard,,,252
252,Oxnard,11/9/2023,hoop,,34.2003461864,-119.12233906,1,2023-11-09 Oxnard,,,253
254,Oxnard,11/9/2023,hoop,,34.2311219025,-119.137200773,1,2023-11-09 Oxnard,,,255
255,Oxnard,11/9/2023,hoop,,34.2313306397,-119.136710653,1,2023-11-09 Oxnard,,,256
256,Oxnard,10/14/2019,hoop,,34.188998759,-119.12423248,2,2019-10-14 Oxnard,,,257
257,Oxnard,11/9/2023,hoop,,34.2304313881,-119.136055181,1,2023-11-09 Oxnard,301.0,28.389000196539083,258
258,Oxnard,11/9/2023,hoop,,34.2004303967,-119.121453993,1,2023-11-09 Oxnard,,,259
259,Oxnard,10/14/2019,hoop,,34.1896716573,-119.122385845,2,2019-10-14 Oxnard,,,260
260,Oxnard,11/9/2023,hoop,,34.241282905,-119.131744275,1,2023-11-09 Oxnard,,,261
261,Oxnard,10/14/2019,hoop,,34.1888967753,-119.119788807,2,2019-10-14 Oxnard,269.0,29.38904633844381,262
262,Oxnard,11/9/2023,hoop,,34.2422045396,-119.132649513,1,2023-11-09 Oxnard,,,263
263,Oxnard,11/9/2023,hoop,,34.2319854558,-119.135737211,1,2023-11-09 Oxnard,281.0,26.83727177729305,264
264,Oxnard,11/9/2023,hoop,,34.2323288461,-119.136689759,1,2023-11-09 Oxnard,,,265
265,Oxnard,11/9/2023,hoop,,34.1985663575,-119.122488798,1,2023-11-09 Oxnard,,,266
266,Oxnard,5/6/2023,hoop,,34.1491240329,-119.107429821,1,2023-05-06 Oxnard,,,267
269,Oxnard,10/14/2019,hoop,,34.1889315557,-119.122551465,2,2019-10-14 Oxnard,,,270
270,Oxnard,5/6/2023,hoop,,34.1491884888,-119.106985462,1,2023-05-06 Oxnard,,,271
271,Oxnard,10/14/2019,hoop,,34.1897168382,-119.124090634,2,2019-10-14 Oxnard,,,272
272,Oxnard,10/14/2019,hoop,,34.1885221242,-119.120194506,2,2019-10-14 Oxnard,,,273
273,Oxnard,11/9/2023,hoop,,34.1982453905,-119.122328904,1,2023-11-09 Oxnard,277.0,29.78272751568156,274
274,Oxnard,11/9/2023,hoop,,34.2406781577,-119.120167665,1,2023-11-09 Oxnard,,,275
275,Oxnard,10/14/2019,hoop,,34.1894480613,-119.120847003,2,2019-10-14 Oxnard,268.0,26.082426232341845,276
277,Oxnard,11/9/2023,hoop,,34.200573313,-119.12353508,1,2023-11-09 Oxnard,,,278
278,Oxnard,10/14/2019,hoop,,34.1890774272,-119.120513671,2,2019-10-14 Oxnard,280.0,29.151630140071116,279
282,Oxnard,10/14/2019,hoop,,34.1885267645,-119.119569105,2,2019-10-14 Oxnard,314.0,26.833551796077103,283
283,Oxnard,11/9/2023,hoop,,34.2315248088,-119.137053513,1,2023-11-09 Oxnard,295.0,27.868292341090907,284
284,Oxnard,5/6/2023,hoop,,34.152070089,-119.106083923,1,2023-05-06 Oxnard,,,285
285,Oxnard,10/14/2019,hoop,,34.189460203,-119.119975175,2,2019-10-14 Oxnard,,,286
286,Oxnard,11/9/2023,hoop,,34.198663436,-119.121904937,1,2023-11-09 Oxnard,,,287
287,Oxnard,11/9/2023,hoop,,34.2412523148,-119.120957991,1,2023-11-09 Oxnard,,,288
288,Oxnard,11/9/2023,hoop,,34.2303955581,-119.135465202,1,2023-11-09 Oxnard,301.0,26.819064175954495,289
289,Oxnard,5/6/2023,hoop,,34.1492057129,-119.10585793,1,2023-05-06 Oxnard,313.0,29.4924640002332,290
290,Oxnard,11/9/2023,hoop,,34.2420468485,-119.121776214,1,2023-11-09 Oxnard,,,291
291,Oxnard,5/6/2023,hoop,,34.1520859048,-119.107966025,1,2023-05-06 Oxnard,,,292
292,Oxnard,5/6/2023,hoop,,34.1511745243,-119.103906639,1,2023-05-06 Oxnard,,,293
293,Oxnard,5/6/2023,hoop,,34.151841123,-119.10762628,1,2023-05-06 Oxnard,,,294
295,Oxnard,11/9/2023,hoop,,34.2417490241,-119.12170709,1,2023-11-09 Oxnard,,,296
296,Oxnard,11/9/2023,hoop,,34.1986885183,-119.121526821,1,2023-11-09 Oxnard,,,297
297,Oxnard,11/9/2023,hoop,,34.2396669151,-119.132598753,1,2023-11-09 Oxnard,,,298
298,Oxnard,10/14/2019,hoop,,34.1896699293,-119.121354106,2,2019-10-14 Oxnard,,,299
299,Oxnard,5/6/2023,hoop,,34.1519830718,-119.107317956,1,2023-05-06 Oxnard,,,300
301,Oxnard,5/6/2023,hoop,,34.1517941902,-119.107078864,1,2023-05-06 Oxnard,,,302
302,Oxnard,10/14/2019,hoop,,34.1895988964,-119.12029518,2,2019-10-14 Oxnard,268.0,27.838902180303705,303
303,Oxnard,11/9/2023,hoop,,34.2412477326,-119.120608956,1,2023-11-09 Oxnard,307.0,29.583298273304298,304
304,Oxnard,10/14/2019,hoop,,34.1896483722,-119.123689878,2,2019-10-14 Oxnard,243.0,28.30000402798784,305
305,Oxnard,10/14/2019,hoop,,34.1890709697,-119.122111674,2,2019-10-14 Oxnard,,,306
307,Oxnard,11/9/2023,hoop,,34.2306316525,-119.136315937,1,2023-11-09 Oxnard,,,308
308,Oxnard,11/9/2023,hoop,,34.1983411786,-119.121521056,1,2023-11-09 Oxnard,,,309
309,Oxnard,11/9/2023,hoop,,34.2312172969,-119.135222734,1,2023-11-09 Oxnard,,,310
310,Oxnard,10/14/2019,hoop,,34.1896230898,-119.119539806,2,2019-10-14 Oxnard,,,311
311,Oxnard,11/9/2023,hoop,,34.2003086924,-119.123746114,1,2023-11-09 Oxnard,,,312
314,Oxnard,11/9/2023,hoop,,34.2406906954,-119.130817699,1,2023-11-09 Oxnard,,,315
315,Oxnard,10/14/2019,hoop,,34.1892985926,-119.1203035,2,2019-10-14 Oxnard,,,316
316,Oxnard,5/6/2023,hoop,,34.1513306369,-119.104449949,1,2023-05-06 Oxnard,,,317
317,Oxnard,11/9/2023,hoop,,34.2003323273,-119.123337315,1,2023-11-09 Oxnard,,,318
318,Oxnard,11/9/2023,hoop,,34.2004132258,-119.121847732,1,2023-11-09 Oxnard,,,319
320,Oxnard,10/14/2019,hoop,,34.1897482112,-119.123044774,2,2019-10-14 Oxnard,,,321
321,Oxnard,11/9/2023,hoop,,34.2005650343,-119.123890313,1,2023-11-09 Oxnard,,,322
322,Oxnard,5/6/2023,hoop,,34.1517808194,-119.106148214,1,2023-05-06 Oxnard,,,323
323,Oxnard,10/1/2022,mulch,,34.1933489304,-119.143463642,2,2022-10-01 Oxnard,396.0,25.295628246437424,324
324,Oxnard,11/1/2022,blackmulch,,34.1850921462,-119.115793246,2,2022-11-01 Oxnard,,,325
325,Oxnard,11/1/2022,blackmulch,,34.1854768053,-119.116191666,2,2022-11-01 Oxnard,,,326
326,Oxnard,11/1/2022,mulch,,34.1956993944,-119.158465517,2,2022-11-01 Oxnard,532.0,28.429107219455094,327
327,Oxnard,5/6/2023,mulch,,34.1739101029,-119.102220073,1,2023-05-06 Oxnard,344.0,27.610361558036235,328
328,Oxnard,11/19/2018,mulch,,34.1947802682,-119.145931472,1,2018-11-19 Oxnard,,,329
329,Oxnard,4/1/2019,blackmulch,,34.1598925933,-119.127187357,2,2019-04-01 Oxnard,,,330
330,Oxnard,5/17/2019,mulch,,34.1743460592,-119.110614636,1,2019-05-17 Oxnard,,,331
331,Oxnard,5/17/2019,mulch,,34.171565971,-119.111198258,1,2019-05-17 Oxnard,,,332
332,Oxnard,11/1/2022,blackmulch,,34.1841045618,-119.119833087,2,2022-11-01 Oxnard,600.0,29.530337954060798,333
333,Oxnard,5/17/2019,mulch,,34.1631335855,-119.115673873,1,2019-05-17 Oxnard,,,334
334,Oxnard,11/1/2022,blackmulch,,34.1758618626,-119.141129677,2,2022-11-01 Oxnard,,,335
335,Oxnard,5/17/2019,mulch,,34.174590419,-119.110251822,1,2019-05-17 Oxnard,,,336
336,Oxnard,11/19/2018,mulch,,34.1947011762,-119.146750562,1,2018-11-19 Oxnard,,,337
337,Oxnard,5/17/2019,mulch,,34.1718822004,-119.111032459,1,2019-05-17 Oxnard,,,338
338,Oxnard,10/1/2022,mulch,,34.192013289,-119.145117333,2,2022-10-01 Oxnard,,,339
339,Oxnard,11/1/2022,blackmulch,,34.1752699851,-119.141214009,2,2022-11-01 Oxnard,,,340
341,Oxnard,5/17/2019,mulch,,34.1706905081,-119.111123556,1,2019-05-17 Oxnard,,,342
342,Oxnard,10/1/2022,mulch,,34.1933084664,-119.140329271,2,2022-10-01 Oxnard,,,343
344,Oxnard,4/1/2019,blackmulch,,34.1597935366,-119.12682311,2,2019-04-01 Oxnard,595.0,28.291932611447425,345
345,Oxnard,5/6/2023,mulch,,34.1735449286,-119.100377279,1,2023-05-06 Oxnard,,,346
346,Oxnard,11/1/2022,blackmulch,,34.1855986731,-119.120742575,2,2022-11-01 Oxnard,,,347
347,Oxnard,5/17/2019,mulch,,34.1712983925,-119.110917741,1,2019-05-17 Oxnard,,,348
348,Oxnard,5/17/2019,mulch,,34.1744183384,-119.111743562,1,2019-05-17 Oxnard,376.0,28.09912162886435,349
349,Oxnard,5/17/2019,mulch,,34.1630324127,-119.116863643,1,2019-05-17 Oxnard,,,350
350,Oxnard,5/17/2019,mulch,,34.1648346928,-119.115909149,1,2019-05-17 Oxnard,546.0,29.71199855496029,351
351,Oxnard,10/1/2022,mulch,,34.193052102,-119.143431184,2,2022-10-01 Oxnard,572.0,25.503204156336206,352
352,Oxnard,10/1/2022,mulch,,34.1936296013,-119.146773593,2,2022-10-01 Oxnard,,,353
353,Oxnard,11/19/2018,mulch,,34.1944745352,-119.142990514,1,2018-11-19 Oxnard,,,354
354,Oxnard,5/17/2019,mulch,,34.1639066558,-119.116537821,1,2019-05-17 Oxnard,,,355
355,Oxnard,11/1/2022,blackmulch,,34.1851739758,-119.120901698,2,2022-11-01 Oxnard,,,356
356,Oxnard,10/1/2022,mulch,,34.1933991608,-119.138485324,2,2022-10-01 Oxnard,,,357
357,Oxnard,5/17/2019,mulch,,34.1652597907,-119.116853813,1,2019-05-17 Oxnard,,,358
358,Oxnard,5/17/2019,mulch,,34.1735818915,-119.110668647,1,2019-05-17 Oxnard,521.0,29.52340423081265,359
359,Oxnard,11/1/2022,blackmulch,,34.1849418121,-119.117419659,2,2022-11-01 Oxnard,,,360
360,Oxnard,11/1/2022,mulch,,34.1956433225,-119.157952435,2,2022-11-01 Oxnard,,,361
361,Oxnard,5/17/2019,mulch,,34.1707163411,-119.110633143,1,2019-05-17 Oxnard,,,362
362,Oxnard,4/1/2019,blackmulch,,34.1603713421,-119.126910912,2,2019-04-01 Oxnard,501.0,29.788019473793863,363
363,Oxnard,10/1/2022,mulch,,34.1918002929,-119.144701567,2,2022-10-01 Oxnard,,,364
364,Oxnard,10/1/2022,mulch,,34.1936670778,-119.14574122,2,2022-10-01 Oxnard,,,365
365,Oxnard,11/1/2022,blackmulch,,34.1843883712,-119.119117793,2,2022-11-01 Oxnard,,,366
366,Oxnard,11/1/2022,mulch,,34.1954843464,-119.157192405,2,2022-11-01 Oxnard,,,367
367,Oxnard,11/19/2018,mulch,,34.1948909228,-119.145539655,1,2018-11-19 Oxnard,,,368
368,Oxnard,5/6/2023,mulch,,34.1734693047,-119.102005092,1,2023-05-06 Oxnard,,,369
369,Oxnard,5/17/2019,mulch,,34.1702849611,-119.11105843,1,2019-05-17 Oxnard,523.0,28.03506052809925,370
370,Oxnard,10/1/2022,mulch,,34.1923147047,-119.144750393,2,2022-10-01 Oxnard,478.0,29.56581447658099,371
371,Oxnard,11/19/2018,mulch,,34.1946010142,-119.14551174,1,2018-11-19 Oxnard,608.0,29.659340042159915,372
372,Oxnard,5/17/2019,mulch,,34.1725737326,-119.111551404,1,2019-05-17 Oxnard,,,373
373,Oxnard,10/1/2022,mulch,,34.1932448011,-119.14637445,2,2022-10-01 Oxnard,440.0,26.8735022071608,374
374,Oxnard,11/19/2018,mulch,,34.1942668136,-119.144376353,1,2018-11-19 Oxnard,,,375
376,Oxnard,11/1/2022,blackmulch,,34.184126753,-119.120441006,2,2022-11-01 Oxnard,454.0,26.254177122374635,377
377,Oxnard,5/17/2019,mulch,,34.1724972758,-119.11195917,1,2019-05-17 Oxnard,,,378
378,Oxnard,4/1/2019,blackmulch,,34.161075274,-119.126894586,2,2019-04-01 Oxnard,,,379
379,Oxnard,9/21/2022,mulch,,34.1925147845,-119.153930865,1,2022-09-21 Oxnard,569.0,29.806956134891983,380
380,Oxnard,5/17/2019,mulch,,34.1722864994,-119.111297527,1,2019-05-17 Oxnard,425.0,26.857490238779253,381
381,Oxnard,5/17/2019,mulch,,34.1716867316,-119.11179332,1,2019-05-17 Oxnard,404.0,29.70088830423786,382
382,Oxnard,5/17/2019,mulch,,34.1709669578,-119.111232742,1,2019-05-17 Oxnard,439.0,26.343590718390733,383
383,Oxnard,11/1/2022,blackmulch,,34.1838259217,-119.117043208,2,2022-11-01 Oxnard,485.0,27.47036189008704,384
384,Oxnard,5/17/2019,mulch,,34.1643529679,-119.116945018,1,2019-05-17 Oxnard,,,385
385,Oxnard,5/17/2019,mulch,,34.1628956129,-119.115968419,1,2019-05-17 Oxnard,,,386
386,Oxnard,9/21/2022,mulch,,34.1923716723,-119.153568238,1,2022-09-21 Oxnard,,,387
387,Oxnard,10/1/2022,mulch,,34.1936546411,-119.143175191,2,2022-10-01 Oxnard,,,388
388,Oxnard,11/19/2018,mulch,,34.194906937,-119.144466991,1,2018-11-19 Oxnard,,,389
389,Oxnard,5/17/2019,mulch,,34.1635148847,-119.117374141,1,2019-05-17 Oxnard,,,390
390,Oxnard,11/1/2022,blackmulch,,34.1850633503,-119.119614129,2,2022-11-01 Oxnard,573.0,28.525091177814655,391
391,Oxnard,5/17/2019,mulch,,34.1703817507,-119.112011465,1,2019-05-17 Oxnard,,,392
392,Oxnard,5/17/2019,mulch,,34.1699811701,-119.111977515,1,2019-05-17 Oxnard,,,393
393,Oxnard,10/1/2022,mulch,,34.1934158234,-119.138902387,2,2022-10-01 Oxnard,,,394
394,Oxnard,5/17/2019,mulch,,34.1730553148,-119.111765404,1,2019-05-17 Oxnard,,,395
396,Oxnard,11/1/2022,blackmulch,,34.1755549527,-119.139706716,2,2022-11-01 Oxnard,431.0,25.529463170284735,397
397,Oxnard,10/1/2022,mulch,,34.1919901285,-119.144424785,2,2022-10-01 Oxnard,,,398
398,Oxnard,11/1/2022,blackmulch,,34.1854214701,-119.117398809,2,2022-11-01 Oxnard,578.0,27.772614559637425,399
399,Oxnard,5/17/2019,mulch,,34.1714642915,-119.111563772,1,2019-05-17 Oxnard,,,400
400,Oxnard,4/1/2019,blackmulch,,34.1600475283,-119.126548984,2,2019-04-01 Oxnard,624.0,26.29317273474366,401
402,Oxnard,5/17/2019,mulch,,34.1638647364,-119.116104761,1,2019-05-17 Oxnard,,,403
404,Oxnard,11/1/2022,mulch,,34.1957826713,-119.157381544,2,2022-11-01 Oxnard,,,405
405,Oxnard,5/17/2019,mulch,,34.1711053965,-119.1119837,1,2019-05-17 Oxnard,,,406
406,Oxnard,5/17/2019,mulch,,34.1644407909,-119.116560578,1,2019-05-17 Oxnard,,,407
407,Oxnard,10/1/2022,mulch,,34.1921924026,-119.146953521,2,2022-10-01 Oxnard,,,408
408,Oxnard,5/17/2019,mulch,,34.1649077859,-119.116596953,1,2019-05-17 Oxnard,,,409
409,Oxnard,5/17/2019,mulch,,34.1707433046,-119.112008255,1,2019-05-17 Oxnard,,,410
410,Oxnard,10/1/2022,mulch,,34.1930400225,-119.144264203,2,2022-10-01 Oxnard,512.0,26.66911219496574,411
411,Oxnard,10/1/2022,mulch,,34.1925229386,-119.145587044,2,2022-10-01 Oxnard,,,412
412,Oxnard,5/17/2019,mulch,,34.1723324875,-119.110280066,1,2019-05-17 Oxnard,442.0,27.56514565771812,413
413,Oxnard,4/1/2019,blackmulch,,34.1607907779,-119.127368444,2,2019-04-01 Oxnard,597.0,27.700586214428057,414
414,Oxnard,5/17/2019,mulch,,34.1729993861,-119.11023275,1,2019-05-17 Oxnard,,,415
415,Oxnard,10/1/2022,mulch,,34.1935326754,-119.144854686,2,2022-10-01 Oxnard,599.0,28.84830606548152,416
416,Oxnard,5/17/2019,mulch,,34.1730355691,-119.110578156,1,2019-05-17 Oxnard,,,417
417,Oxnard,5/17/2019,mulch,,34.1713063662,-119.110538684,1,2019-05-17 Oxnard,,,418
418,Oxnard,11/19/2018,mulch,,34.1944426468,-119.143847577,1,2018-11-19 Oxnard,615.0,27.844598353968845,419
419,Oxnard,10/1/2022,mulch,,34.1921847576,-119.1455489,2,2022-10-01 Oxnard,570.0,25.70540500495501,420
420,Oxnard,10/1/2022,mulch,,34.1923686611,-119.143530558,2,2022-10-01 Oxnard,432.0,25.748594434966364,421
421,Oxnard,5/17/2019,mulch,,34.174060856,-119.111298774,1,2019-05-17 Oxnard,,,422
422,Oxnard,5/17/2019,mulch,,34.162700798,-119.117207056,1,2019-05-17 Oxnard,,,423
423,Oxnard,10/1/2022,mulch,,34.1919282023,-119.145936698,2,2022-10-01 Oxnard,,,424
425,Oxnard,11/1/2022,blackmulch,,34.1840711511,-119.117638427,2,2022-11-01 Oxnard,,,426
426,Oxnard,11/19/2018,mulch,,34.1946356071,-119.147220951,1,2018-11-19 Oxnard,,,427
427,Oxnard,5/6/2023,mulch,,34.1734058522,-119.101204137,1,2023-05-06 Oxnard,524.0,28.895249664424675,428
428,Oxnard,9/21/2022,mulch,,34.1923709464,-119.152424895,1,2022-09-21 Oxnard,,,429
429,Oxnard,10/1/2022,mulch,,34.1937877173,-119.139962855,2,2022-10-01 Oxnard,,,430
432,Oxnard,11/1/2022,blackmulch,,34.1842583483,-119.118721972,2,2022-11-01 Oxnard,,,433
433,Oxnard,5/17/2019,mulch,,34.1750258828,-119.110399732,1,2019-05-17 Oxnard,,,434
434,Oxnard,10/1/2022,mulch,,34.1934555219,-119.141409226,2,2022-10-01 Oxnard,566.0,27.74974416934148,435
435,Oxnard,11/1/2022,blackmulch,,34.1850502961,-119.11711785,2,2022-11-01 Oxnard,,,436
436,Oxnard,11/1/2022,blackmulch,,34.1751048304,-119.139875311,2,2022-11-01 Oxnard,,,437
442,Oxnard,5/6/2023,mulch,,34.1735882198,-119.100906138,1,2023-05-06 Oxnard,614.0,27.697275989196086,443
443,Oxnard,11/1/2022,blackmulch,,34.1842114195,-119.11672231,2,2022-11-01 Oxnard,,,444
444,Oxnard,11/1/2022,blackmulch,,34.1851720982,-119.117769465,2,2022-11-01 Oxnard,,,445
445,Oxnard,5/17/2019,mulch,,34.1733751365,-119.110307252,1,2019-05-17 Oxnard,521.0,25.111131212542816,446
446,Oxnard,5/17/2019,mulch,,34.1638290614,-119.117406215,1,2019-05-17 Oxnard,,,447
447,Oxnard,11/19/2018,mulch,,34.1944557915,-119.146888169,1,2018-11-19 Oxnard,,,448
448,Oxnard,11/1/2022,blackmulch,,34.1758917626,-119.140658585,2,2022-11-01 Oxnard,,,449
449,Oxnard,11/1/2022,mulch,,34.1955035402,-119.156521555,2,2022-11-01 Oxnard,,,450
450,Oxnard,11/1/2022,blackmulch,,34.18558757,-119.118746581,2,2022-11-01 Oxnard,,,451
452,Oxnard,11/19/2018,mulch,,34.1942328447,-119.145562548,1,2018-11-19 Oxnard,,,453
454,Oxnard,11/1/2022,blackmulch,,34.1857292526,-119.117289127,2,2022-11-01 Oxnard,,,455
455,Oxnard,10/1/2022,mulch,,34.1934283847,-119.143821389,2,2022-10-01 Oxnard,496.0,28.755615227653674,456
456,Oxnard,11/19/2018,mulch,,34.1943233085,-119.144969006,1,2018-11-19 Oxnard,,,457
457,Oxnard,9/21/2022,mulch,,34.1925300079,-119.152781272,1,2022-09-21 Oxnard,,,458
458,Oxnard,9/21/2022,mulch,,34.1922003875,-119.152004987,1,2022-09-21 Oxnard,,,459
459,Oxnard,10/1/2022,mulch,,34.1936065148,-119.139194626,2,2022-10-01 Oxnard,,,460
460,Oxnard,9/21/2022,mulch,,34.1923937413,-119.153085319,1,2022-09-21 Oxnard,,,461
461,Oxnard,10/1/2022,mulch,,34.1937666658,-119.141546557,2,2022-10-01 Oxnard,,,462
462,Oxnard,10/1/2022,mulch,,34.1937035183,-119.14454894,2,2022-10-01 Oxnard,,,463
463,Oxnard,10/1/2022,mulch,,34.1937695244,-119.138537192,2,2022-10-01 Oxnard,618.0,28.31834121799948,464
464,Oxnard,11/19/2018,mulch,,34.194669942,-119.143410888,1,2018-11-19 Oxnard,,,465
465,Oxnard,10/1/2022,mulch,,34.1934209074,-119.139574006,2,2022-10-01 Oxnard,621.0,29.493752337789843,466
466,Oxnard,11/19/2018,mulch,,34.1945258089,-119.144605065,1,2018-11-19 Oxnard,,,467
467,Oxnard,11/1/2022,blackmulch,,34.1839001363,-119.119061926,2,2022-11-01 Oxnard,,,468
468,Oxnard,11/1/2022,blackmulch,,34.1854033205,-119.120111568,2,2022-11-01 Oxnard,,,469
469,Oxnard,11/1/2022,blackmulch,,34.1851374458,-119.120018106,2,2022-11-01 Oxnard,,,470
470,Oxnard,5/17/2019,mulch,,34.1697770813,-119.111698431,1,2019-05-17 Oxnard,,,471
471,Oxnard,11/19/2018,mulch,,34.1949351148,-119.143928483,1,2018-11-19 Oxnard,,,472
472,Oxnard,11/1/2022,blackmulch,,34.1851652589,-119.120480253,2,2022-11-01 Oxnard,,,473
473,Oxnard,5/17/2019,mulch,,34.1640368708,-119.115663168,1,2019-05-17 Oxnard,555.0,29.452319743691024,474
474,Oxnard,11/19/2018,mulch,,34.194789452,-119.14288975,1,2018-11-19 Oxnard,,,475
475,Oxnard,11/1/2022,blackmulch,,34.1852754083,-119.118771515,2,2022-11-01 Oxnard,441.0,28.217534406336416,476
476,Oxnard,5/17/2019,mulch,,34.1626492836,-119.116202225,1,2019-05-17 Oxnard,,,477
478,Oxnard,5/17/2019,mulch,,34.1734477676,-119.111753139,1,2019-05-17 Oxnard,,,479
479,Oxnard,10/1/2022,mulch,,34.1921793967,-119.146422794,2,2022-10-01 Oxnard,613.0,25.439903078747463,480
480,Oxnard,5/17/2019,mulch,,34.1626882954,-119.116827697,1,2019-05-17 Oxnard,,,481
481,Oxnard,5/17/2019,mulch,,34.1697526471,-119.110573926,1,2019-05-17 Oxnard,,,482
482,Oxnard,5/17/2019,mulch,,34.1750761552,-119.110857844,1,2019-05-17 Oxnard,,,483
483,Oxnard,5/17/2019,mulch,,34.1630789974,-119.116219314,1,2019-05-17 Oxnard,508.0,25.902471346477128,484
485,Oxnard,10/1/2022,mulch,,34.1918167577,-119.143793266,2,2022-10-01 Oxnard,,,486
486,Oxnard,11/1/2022,blackmulch,,34.1854690729,-119.116728997,2,2022-11-01 Oxnard,,,487
487,Oxnard,11/19/2018,mulch,,34.1946872672,-119.1449349,1,2018-11-19 Oxnard,,,488
488,Oxnard,5/17/2019,mulch,,34.1641039264,-119.116787876,1,2019-05-17 Oxnard,,,489
489,Oxnard,11/1/2022,blackmulch,,34.184021011,-119.121067932,2,2022-11-01 Oxnard,,,490
490,Oxnard,5/17/2019,mulch,,34.1646412482,-119.115678683,1,2019-05-17 Oxnard,,,491
491,Oxnard,11/1/2022,blackmulch,,34.1838342697,-119.118676269,2,2022-11-01 Oxnard,,,492
492,Oxnard,11/1/2022,blackmulch,,34.1845111066,-119.116812742,2,2022-11-01 Oxnard,438.0,29.101090293119032,493
493,Oxnard,11/19/2018,mulch,,34.1945258162,-119.146471469,1,2018-11-19 Oxnard,,,494
494,Oxnard,5/17/2019,mulch,,34.1718772976,-119.111527649,1,2019-05-17 Oxnard,,,495
496,Oxnard,5/17/2019,mulch,,34.1721545746,-119.111591754,1,2019-05-17 Oxnard,,,497
497,Oxnard,5/17/2019,mulch,,34.1652205922,-119.116160808,1,2019-05-17 Oxnard,,,498
498,Oxnard,5/6/2023,mulch,,34.1738334037,-119.100337514,1,2023-05-06 Oxnard,402.0,29.892648544686143,499
499,Oxnard,5/17/2019,mulch,,34.1742187536,-119.110200927,1,2019-05-17 Oxnard,,,500
501,Oxnard,10/1/2022,mulch,,34.192505933,-119.146953383,2,2022-10-01 Oxnard,606.0,26.715000233183385,502
502,Oxnard,10/1/2022,mulch,,34.1924302545,-119.144330677,2,2022-10-01 Oxnard,,,503
503,Oxnard,11/19/2018,mulch,,34.194958252,-119.145002327,1,2018-11-19 Oxnard,,,504
504,Oxnard,11/1/2022,blackmulch,,34.1856654796,-119.115577584,2,2022-11-01 Oxnard,,,505
505,Oxnard,5/17/2019,mulch,,34.1745113306,-119.11095702,1,2019-05-17 Oxnard,,,506
506,Oxnard,5/6/2023,mulch,,34.173879683,-119.100921182,1,2023-05-06 Oxnard,402.0,25.680905218579195,507
508,Oxnard,11/1/2022,blackmulch,,34.1849451877,-119.116733009,2,2022-11-01 Oxnard,,,509
509,Oxnard,11/1/2022,blackmulch,,34.1845099358,-119.116432033,2,2022-11-01 Oxnard,,,510
510,Oxnard,10/1/2022,mulch,,34.1936970689,-119.140541447,2,2022-10-01 Oxnard,535.0,26.102441616226603,511
512,Oxnard,4/1/2019,blackmulch,,34.1601043018,-119.127611766,2,2019-04-01 Oxnard,,,513
513,Oxnard,5/17/2019,mulch,,34.1633030385,-119.116688545,1,2019-05-17 Oxnard,,,514
514,Oxnard,5/17/2019,mulch,,34.1725405249,-119.110736217,1,2019-05-17 Oxnard,577.0,26.489998473560732,515
515,Oxnard,11/1/2022,blackmulch,,34.1854090027,-119.115767779,2,2022-11-01 Oxnard,,,516
516,Oxnard,5/17/2019,mulch,,34.170284976,-119.110244772,1,2019-05-17 Oxnard,,,517
517,Oxnard,5/17/2019,mulch,,34.1738815862,-119.110749053,1,2019-05-17 Oxnard,,,518
518,Oxnard,5/17/2019,mulch,,34.1638012491,-119.117061531,1,2019-05-17 Oxnard,,,519
519,Oxnard,10/1/2022,mulch,,34.1935169941,-119.139919041,2,2022-10-01 Oxnard,,,520
521,Oxnard,11/1/2022,blackmulch,,34.1751141356,-119.139477497,2,2022-11-01 Oxnard,,,522
524,Oxnard,4/1/2019,blackmulch,,34.1609382173,-119.12656828,2,2019-04-01 Oxnard,,,525
525,Oxnard,5/6/2023,mulch,,34.1739559573,-119.10144584,1,2023-05-06 Oxnard,,,526
526,Oxnard,5/17/2019,mulch,,34.1712673533,-119.110208217,1,2019-05-17 Oxnard,,,527
527,Oxnard,10/1/2022,blackmulch,,34.1843441682,-119.150365478,2,2022-10-01 Oxnard,,,528
528,Oxnard,11/1/2022,blackmulch,,34.1843718047,-119.119623359,2,2022-11-01 Oxnard,,,529
529,Oxnard,11/1/2022,blackmulch,,34.1849991253,-119.11628072,2,2022-11-01 Oxnard,,,530
530,Oxnard,5/17/2019,mulch,,34.1698011045,-119.110140555,1,2019-05-17 Oxnard,,,531
532,Oxnard,10/1/2022,mulch,,34.193396401,-119.145984809,2,2022-10-01 Oxnard,,,533
533,Oxnard,10/1/2022,mulch,,34.1930303653,-119.143902247,2,2022-10-01 Oxnard,,,534
535,Oxnard,5/17/2019,mulch,,34.1750474558,-119.111444772,1,2019-05-17 Oxnard,,,536
536,Oxnard,11/19/2018,mulch,,34.1949842487,-119.147238865,1,2018-11-19 Oxnard,625.0,28.65336246174321,537
537,Oxnard,11/19/2018,mulch,,34.1945002168,-119.146085063,1,2018-11-19 Oxnard,626.0,27.034767763604066,538
538,Oxnard,11/1/2022,blackmulch,,34.1852164321,-119.11684774,2,2022-11-01 Oxnard,,,539
539,Oxnard,11/1/2022,blackmulch,,34.1756672175,-119.139319073,2,2022-11-01 Oxnard,,,540
540,Oxnard,5/17/2019,mulch,,34.1728724468,-119.111506535,1,2019-05-17 Oxnard,,,541
541,Oxnard,11/1/2022,blackmulch,,34.1841912132,-119.119345516,2,2022-11-01 Oxnard,,,542
542,Oxnard,11/1/2022,blackmulch,,34.1842358288,-119.12012607,2,2022-11-01 Oxnard,,,543
543,Oxnard,10/1/2022,mulch,,34.1919080447,-119.142957593,2,2022-10-01 Oxnard,,,544
544,Oxnard,5/17/2019,mulch,,34.1632692976,-119.117226246,1,2019-05-17 Oxnard,,,545
546,Oxnard,5/17/2019,mulch,,34.165200145,-119.115612713,1,2019-05-17 Oxnard,,,547
547,Oxnard,5/17/2019,mulch,,34.1735155041,-119.111006072,1,2019-05-17 Oxnard,,,548
548,Oxnard,11/19/2018,mulch,,34.1942445549,-119.143182566,1,2018-11-19 Oxnard,,,549
549,Oxnard,10/1/2022,mulch,,34.1935877073,-119.145322627,2,2022-10-01 Oxnard,599.0,26.71845926293312,550
550,Oxnard,11/1/2022,blackmulch,,34.1755950895,-119.141407776,2,2022-11-01 Oxnard,,,551
551,Oxnard,11/1/2022,blackmulch,,34.1751244893,-119.140815006,2,2022-11-01 Oxnard,,,552
552,Oxnard,11/1/2022,blackmulch,,34.1837877764,-119.117757124,2,2022-11-01 Oxnard,,,553
553,Oxnard,11/1/2022,blackmulch,,34.1844249849,-119.117721848,2,2022-11-01 Oxnard,,,554
555,Oxnard,5/17/2019,mulch,,34.1730739328,-119.110993081,1,2019-05-17 Oxnard,571.0,28.056424438889355,556
556,Oxnard,10/1/2022,mulch,,34.1922945464,-119.145901584,2,2022-10-01 Oxnard,613.0,28.630974423399323,557
557,Oxnard,5/17/2019,mulch,,34.1641105117,-119.116283585,1,2019-05-17 Oxnard,,,558
558,Oxnard,11/1/2022,blackmulch,,34.1854379491,-119.119606172,2,2022-11-01 Oxnard,,,559
559,Oxnard,10/1/2022,mulch,,34.1930573241,-119.144895016,2,2022-10-01 Oxnard,,,560
560,Oxnard,5/17/2019,mulch,,34.1647984085,-119.117169833,1,2019-05-17 Oxnard,,,561
561,Oxnard,5/17/2019,mulch,,34.1700334876,-119.110562426,1,2019-05-17 Oxnard,,,562
562,Oxnard,9/21/2022,mulch,,34.192131495,-119.152957734,1,2022-09-21 Oxnard,,,563
563,Oxnard,5/17/2019,mulch,,34.1713836298,-119.111927958,1,2019-05-17 Oxnard,,,564
564,Oxnard,5/6/2023,mulch,,34.1734429009,-119.102492298,1,2023-05-06 Oxnard,,,565
566,Oxnard,10/1/2022,mulch,,34.1930765523,-119.145508807,2,2022-10-01 Oxnard,452.0,26.651376626674224,567
567,Oxnard,11/19/2018,mulch,,34.1949392862,-119.143360526,1,2018-11-19 Oxnard,,,568
573,Oxnard,11/1/2022,blackmulch,,34.1754958021,-119.140843337,2,2022-11-01 Oxnard,341.0,28.294526690430352,574
574,Oxnard,4/1/2019,blackmulch,,34.1596650599,-119.127493487,2,2019-04-01 Oxnard,,,575
575,Oxnard,5/6/2023,mulch,,34.173761822,-119.102503039,1,2023-05-06 Oxnard,,,576
578,Oxnard,5/17/2019,mulch,,34.1636213997,-119.11678472,1,2019-05-17 Oxnard,,,579
579,Oxnard,10/1/2022,mulch,,34.1936904485,-119.143563598,2,2022-10-01 Oxnard,,,580
580,Oxnard,11/1/2022,blackmulch,,34.1759244029,-119.140219054,2,2022-11-01 Oxnard,,,581
581,Oxnard,11/19/2018,mulch,,34.1946117932,-119.144197429,1,2018-11-19 Oxnard,,,582
582,Oxnard,11/1/2022,blackmulch,,34.1756689963,-119.140384099,2,2022-11-01 Oxnard,,,583
583,Oxnard,5/17/2019,mulch,,34.1646493979,-119.116845274,1,2019-05-17 Oxnard,,,584
584,Oxnard,10/1/2022,mulch,,34.1918339329,-119.145389884,2,2022-10-01 Oxnard,,,585
585,Oxnard,10/1/2022,mulch,,34.1919286245,-119.146550581,2,2022-10-01 Oxnard,,,586
586,Oxnard,5/17/2019,mulch,,34.1626459459,-119.115838938,1,2019-05-17 Oxnard,,,587
587,Oxnard,10/1/2022,mulch,,34.1933339372,-119.14694554,2,2022-10-01 Oxnard,,,588
588,Oxnard,10/1/2022,mulch,,34.1933702108,-119.145557508,2,2022-10-01 Oxnard,,,589
589,Oxnard,4/1/2019,blackmulch,,34.1604082637,-119.12737338,2,2019-04-01 Oxnard,,,590
590,Oxnard,5/17/2019,mulch,,34.1635363332,-119.116115351,1,2019-05-17 Oxnard,,,591
591,Oxnard,5/17/2019,mulch,,34.1749451813,-119.111990588,1,2019-05-17 Oxnard,,,592
592,Oxnard,11/1/2022,blackmulch,,34.1843431823,-119.117344053,2,2022-11-01 Oxnard,438.0,26.304954526826894,593
593,Oxnard,11/19/2018,mulch,,34.1949363689,-119.146516487,1,2018-11-19 Oxnard,,,594
595,Oxnard,5/17/2019,mulch,,34.1705961791,-119.111686575,1,2019-05-17 Oxnard,,,596
597,Oxnard,11/1/2022,mulch,,34.1958170319,-119.156982647,2,2022-11-01 Oxnard,,,598
600,Oxnard,5/17/2019,mulch,,34.1636641085,-119.115801631,1,2019-05-17 Oxnard,,,601
601,Oxnard,11/1/2022,blackmulch,,34.185716893,-119.116928927,2,2022-11-01 Oxnard,,,602
602,Oxnard,11/1/2022,blackmulch,,34.183836111,-119.120525678,2,2022-11-01 Oxnard,,,603
603,Oxnard,10/1/2022,blackmulch,,34.1839911231,-119.150462864,2,2022-10-01 Oxnard,,,604
604,Oxnard,10/1/2022,mulch,,34.1933638775,-119.140917708,2,2022-10-01 Oxnard,,,605
606,Oxnard,5/17/2019,mulch,,34.1726256753,-119.110160797,1,2019-05-17 Oxnard,577.0,27.426492971645715,607
608,Oxnard,10/1/2022,mulch,,34.1918717934,-119.143462345,2,2022-10-01 Oxnard,,,609
609,Oxnard,5/17/2019,mulch,,34.1703555611,-119.11148307,1,2019-05-17 Oxnard,,,610
610,Oxnard,11/1/2022,blackmulch,,34.1751875464,-119.140391647,2,2022-11-01 Oxnard,341.0,29.245899114601443,611
611,Oxnard,11/1/2022,blackmulch,,34.1855228907,-119.120428793,2,2022-11-01 Oxnard,,,612
615,Oxnard,10/1/2022,mulch,,34.1924524999,-119.146237333,2,2022-10-01 Oxnard,,,616
616,Oxnard,10/1/2022,mulch,,34.192389421,-119.143116117,2,2022-10-01 Oxnard,,,617
618,Oxnard,10/1/2022,mulch,,34.1937357042,-119.146358979,2,2022-10-01 Oxnard,,,619
619,Oxnard,5/17/2019,mulch,,34.1700933128,-119.111622152,1,2019-05-17 Oxnard,,,620
621,Oxnard,5/17/2019,mulch,,34.1706386676,-119.110216336,1,2019-05-17 Oxnard,,,622
622,Oxnard,10/1/2022,mulch,,34.1918872914,-119.146898514,2,2022-10-01 Oxnard,,,623
626,Oxnard,11/9/2023,other,,34.1278445277,-119.159921921,1,2023-11-09 Oxnard,969.0,29.31900381969762,627
627,Oxnard,5/6/2023,other,,34.2537806138,-119.092870714,1,2023-05-06 Oxnard,1224.0,27.99478123809875,628
628,Oxnard,6/13/2022,other,,34.1869517171,-119.152987244,2,2022-06-13 Oxnard,,,629
629,Oxnard,5/6/2023,other,,34.2027611897,-119.057712512,1,2023-05-06 Oxnard,1133.0,27.706173159961967,630
630,Oxnard,6/13/2022,other,,34.1816109637,-119.131953961,2,2022-06-13 Oxnard,1644.0,27.161260571764327,631
631,Oxnard,7/13/2021,other,,34.1419659301,-119.15045187,2,2021-07-13 Oxnard,,,632
632,Oxnard,5/6/2023,other,,34.2556070017,-119.089266825,1,2023-05-06 Oxnard,,,633
633,Oxnard,5/6/2023,other,,34.255568986,-119.087412601,1,2023-05-06 Oxnard,,,634
634,Oxnard,10/17/2023,other,,34.2020299189,-119.065758193,2,2023-10-17 Oxnard,,,635
636,Oxnard,6/13/2022,other,,34.1878809502,-119.152633091,2,2022-06-13 Oxnard,,,637
637,Oxnard,2/15/2020,other,,34.2295772856,-119.247529874,1,2020-02-15 Oxnard,,,638
638,Oxnard,2/15/2020,other,,34.2289061978,-119.24711236,1,2020-02-15 Oxnard,,,639
639,Oxnard,5/6/2023,other,,34.2581578264,-119.091943894,1,2023-05-06 Oxnard,1505.0,28.34741784183763,640
640,Oxnard,5/6/2023,other,,34.1504692163,-119.083627553,1,2023-05-06 Oxnard,,,641
641,Oxnard,5/6/2023,other,,34.256473447,-119.088660664,1,2023-05-06 Oxnard,,,642
642,Oxnard,7/13/2021,other,,34.1409481556,-119.151269781,2,2021-07-13 Oxnard,1010.0,26.291440680363465,643
643,Oxnard,6/13/2022,other,,34.1829173584,-119.15291507,2,2022-06-13 Oxnard,1522.0,26.952975722778405,644
644,Oxnard,5/6/2023,other,,34.2542110818,-119.091945251,1,2023-05-06 Oxnard,,,645
645,Oxnard,7/13/2021,other,,34.1415356588,-119.150161951,2,2021-07-13 Oxnard,1105.0,25.478876918437564,646
646,Oxnard,5/6/2023,other,,34.2567526385,-119.090530634,1,2023-05-06 Oxnard,1667.0,27.35237766361981,647
647,Oxnard,5/6/2023,other,,34.151053322,-119.083298433,1,2023-05-06 Oxnard,,,648
648,Oxnard,11/9/2023,other,,34.1307023202,-119.159039882,1,2023-11-09 Oxnard,1221.0,26.3923962493084,649
649,Oxnard,11/9/2023,other,,34.1296387175,-119.158491108,1,2023-11-09 Oxnard,1312.0,28.425747219959728,650
650,Oxnard,11/9/2023,other,,34.1348883968,-119.157247103,1,2023-11-09 Oxnard,,,651
651,Oxnard,6/13/2022,other,,34.1816461312,-119.132527402,2,2022-06-13 Oxnard,1644.0,28.439295193271047,652
652,Oxnard,11/9/2023,other,,34.1299628004,-119.159081282,1,2023-11-09 Oxnard,,,653
653,Oxnard,5/6/2023,other,,34.2566173612,-119.087865162,1,2023-05-06 Oxnard,,,654
654,Oxnard,6/13/2022,other,,34.1809608155,-119.131253979,2,2022-06-13 Oxnard,1656.0,28.172350321882377,655
655,Oxnard,5/11/2023,other,,34.2837963612,-119.069981697,1,2023-05-11 Oxnard,986.0,28.616340661675945,656
656,Oxnard,11/9/2023,other,,34.1341159135,-119.155591312,1,2023-11-09 Oxnard,,,657
657,Oxnard,11/9/2023,other,,34.1309382781,-119.157702533,1,2023-11-09 Oxnard,,,658
658,Oxnard,5/6/2023,other,,34.2536370129,-119.08930158,1,2023-05-06 Oxnard,,,659
659,Oxnard,5/6/2023,other,,34.148939462,-119.084096215,1,2023-05-06 Oxnard,,,660
660,Oxnard,10/17/2023,other,,34.2016633828,-119.064357146,2,2023-10-17 Oxnard,1358.0,25.95484635433888,661
661,Oxnard,5/6/2023,other,,34.1749122812,-119.079326286,1,2023-05-06 Oxnard,,,662
662,Oxnard,5/6/2023,other,,34.2593420435,-119.085351947,1,2023-05-06 Oxnard,1503.0,29.183896318523,663
663,Oxnard,11/9/2023,other,,34.1291988383,-119.160370061,1,2023-11-09 Oxnard,1079.0,25.849383873879976,664
664,Oxnard,5/11/2023,other,,34.2838388347,-119.069097102,1,2023-05-11 Oxnard,,,665
666,Oxnard,5/6/2023,other,,34.1515739704,-119.083373729,1,2023-05-06 Oxnard,,,667
667,Oxnard,11/9/2023,other,,34.1346444149,-119.155445844,1,2023-11-09 Oxnard,817.0,29.030761615333393,668
668,Oxnard,5/6/2023,other,,34.1731196146,-119.079090815,1,2023-05-06 Oxnard,,,669
669,Oxnard,6/13/2022,other,,34.1851373899,-119.151887904,2,2022-06-13 Oxnard,910.0,29.679239275442956,670
670,Oxnard,7/13/2021,other,,34.1410593778,-119.150701213,2,2021-07-13 Oxnard,1462.0,29.19070269592402,671
671,Oxnard,10/17/2023,other,,34.2048362333,-119.065439893,2,2023-10-17 Oxnard,1514.0,25.845950400985437,672
672,Oxnard,5/6/2023,other,,34.254486323,-119.090254856,1,2023-05-06 Oxnard,,,673
673,Oxnard,10/17/2023,other,,34.2059843365,-119.046400039,2,2023-10-17 Oxnard,,,674
674,Oxnard,5/6/2023,other,,34.2555315403,-119.091210294,1,2023-05-06 Oxnard,,,675
675,Oxnard,2/15/2020,other,,34.2298593091,-119.247703788,1,2020-02-15 Oxnard,,,676
676,Oxnard,5/6/2023,other,,34.2580904272,-119.093331602,1,2023-05-06 Oxnard,,,677
677,Oxnard,5/6/2023,other,,34.2021118192,-119.060620305,1,2023-05-06 Oxnard,,,678
678,Oxnard,11/9/2023,other,,34.1333977081,-119.155336689,1,2023-11-09 Oxnard,,,679
679,Oxnard,11/9/2023,other,,34.135608389,-119.156126794,1,2023-11-09 Oxnard,,,680
680,Oxnard,6/13/2022,other,,34.1841269572,-119.152593414,2,2022-06-13 Oxnard,,,681
681,Oxnard,11/9/2023,other,,34.1350963556,-119.156648745,1,2023-11-09 Oxnard,1286.0,29.59242204356384,682
682,Oxnard,7/13/2021,other,,34.1428045326,-119.151966768,2,2021-07-13 Oxnard,,,683
684,Oxnard,5/6/2023,other,,34.2567738284,-119.093086773,1,2023-05-06 Oxnard,,,685
685,Oxnard,6/13/2022,other,,34.186659052,-119.152650537,2,2022-06-13 Oxnard,1599.0,29.882372439057768,686
686,Oxnard,5/6/2023,other,,34.2534694736,-119.087392929,1,2023-05-06 Oxnard,,,687
687,Oxnard,8/19/2019,other,,34.2750276789,-119.058497771,2,2019-08-19 Oxnard,949.0,27.07825671517892,688
688,Oxnard,2/15/2020,other,,34.2298706852,-119.248734585,1,2020-02-15 Oxnard,1659.0,28.1110915482753,689
689,Oxnard,5/6/2023,other,,34.2577121727,-119.087464919,1,2023-05-06 Oxnard,,,690
691,Oxnard,5/6/2023,other,,34.2537461453,-119.08850843,1,2023-05-06 Oxnard,1357.0,27.02869884891856,692
692,Oxnard,5/6/2023,other,,34.2535826842,-119.087749842,1,2023-05-06 Oxnard,,,693
693,Oxnard,5/6/2023,other,,34.256434345,-119.091395096,1,2023-05-06 Oxnard,1272.0,26.611516940916328,694
694,Oxnard,5/7/2023,other,,34.2255980744,-119.242191714,2,2023-05-07 Oxnard,,,695
695,Oxnard,11/9/2023,other,,34.1292618841,-119.15949262,1,2023-11-09 Oxnard,,,696
696,Oxnard,10/17/2023,other,,34.2070420297,-119.047964088,2,2023-10-17 Oxnard,1495.0,29.85155899756372,697
697,Oxnard,5/6/2023,other,,34.255162832,-119.091852224,1,2023-05-06 Oxnard,1234.0,29.941488046500226,698
698,Oxnard,10/17/2023,other,,34.2071005115,-119.046386195,2,2023-10-17 Oxnard,1532.0,28.151190407151606,699
699,Oxnard,5/6/2023,other,,34.2533614643,-119.090417963,1,2023-05-06 Oxnard,963.0,28.497489031816155,700
700,Oxnard,11/9/2023,other,,34.1334162208,-119.154800461,1,2023-11-09 Oxnard,,,701
701,Oxnard,10/17/2023,other,,34.2060706914,-119.047368854,2,2023-10-17 Oxnard,,,702
702,Oxnard,10/17/2023,other,,34.2015394859,-119.065209848,2,2023-10-17 Oxnard,,,703
703,Oxnard,6/13/2022,other,,34.1867895329,-119.153308347,2,2022-06-13 Oxnard,,,704
704,Oxnard,6/13/2022,other,,34.1851752484,-119.152231115,2,2022-06-13 Oxnard,,,705
705,Oxnard,5/7/2023,other,,34.2257300068,-119.243016176,2,2023-05-07 Oxnard,1102.0,28.38177783252696,706
706,Oxnard,5/6/2023,other,,34.1742103277,-119.129474924,1,2023-05-06 Oxnard,,,707
707,Oxnard,7/13/2021,other,,34.1429290178,-119.147808632,2,2021-07-13 Oxnard,,,708
708,Oxnard,5/6/2023,other,,34.1747673093,-119.131443862,1,2023-05-06 Oxnard,1091.0,28.799168342223968,709
709,Oxnard,6/13/2022,other,,34.1866759673,-119.151859329,2,2022-06-13 Oxnard,,,710
710,Oxnard,10/17/2023,other,,34.1997675562,-119.04752167,2,2023-10-17 Oxnard,1668.0,29.7484741908045,711
711,Oxnard,7/13/2021,other,,34.1417784829,-119.151325763,2,2021-07-13 Oxnard,1506.0,28.02142036871016,712
712,Oxnard,10/17/2023,other,,34.1991930394,-119.04546013,2,2023-10-17 Oxnard,,,713
713,Oxnard,5/6/2023,other,,34.2561093903,-119.089854107,1,2023-05-06 Oxnard,,,714
714,Oxnard,5/6/2023,other,,34.1741554828,-119.131815727,1,2023-05-06 Oxnard,,,715
715,Oxnard,7/13/2021,other,,34.142897396,-119.150140263,2,2021-07-13 Oxnard,1475.0,28.122532370527896,716
716,Oxnard,5/6/2023,other,,34.174804168,-119.080024082,1,2023-05-06 Oxnard,773.0,26.416756118214373,717
717,Oxnard,5/7/2023,other,,34.2255939395,-119.241675589,2,2023-05-07 Oxnard,,,718
718,Oxnard,10/17/2023,other,,34.2050850441,-119.064906037,2,2023-10-17 Oxnard,,,719
719,Oxnard,5/6/2023,other,,34.1489562848,-119.085991703,1,2023-05-06 Oxnard,,,720
720,Oxnard,5/6/2023,other,,34.1495306362,-119.084492356,1,2023-05-06 Oxnard,,,721
721,Oxnard,6/13/2022,other,,34.1870623124,-119.152256145,2,2022-06-13 Oxnard,1599.0,28.544354456874377,722
722,Oxnard,5/6/2023,other,,34.2551505483,-119.088808918,1,2023-05-06 Oxnard,,,723
723,Oxnard,5/6/2023,other,,34.2015344112,-119.059428543,1,2023-05-06 Oxnard,,,724
724,Oxnard,6/13/2022,other,,34.1877124475,-119.15224878,2,2022-06-13 Oxnard,,,725
725,Oxnard,11/9/2023,other,,34.1302339037,-119.157765351,1,2023-11-09 Oxnard,,,726
726,Oxnard,7/13/2021,other,,34.1415330108,-119.152188389,2,2021-07-13 Oxnard,1075.0,29.732537824764684,727
727,Oxnard,5/6/2023,other,,34.260090651,-119.084187388,1,2023-05-06 Oxnard,1645.0,27.025274403731345,728
728,Oxnard,5/6/2023,other,,34.2572770085,-119.092565392,1,2023-05-06 Oxnard,,,729
729,Oxnard,5/6/2023,other,,34.2568001861,-119.088897481,1,2023-05-06 Oxnard,1670.0,24.95806657479085,730
730,Oxnard,5/6/2023,other,,34.2551818852,-119.088407285,1,2023-05-06 Oxnard,,,731
731,Oxnard,11/9/2023,other,,34.1280239054,-119.158759796,1,2023-11-09 Oxnard,,,732
732,Oxnard,6/13/2022,other,,34.1879763341,-119.151874632,2,2022-06-13 Oxnard,,,733
733,Oxnard,5/6/2023,other,,34.2026161227,-119.060575017,1,2023-05-06 Oxnard,1416.0,26.77305649956667,734
734,Oxnard,5/6/2023,other,,34.1749084639,-119.130010258,1,2023-05-06 Oxnard,1084.0,28.263413326430623,735
735,Oxnard,5/6/2023,other,,34.1745626008,-119.13284766,1,2023-05-06 Oxnard,1436.0,27.29234142615907,736
736,Oxnard,5/6/2023,other,,34.2539942389,-119.089105292,1,2023-05-06 Oxnard,1678.0,29.963066956401534,737
737,Oxnard,11/9/2023,other,,34.1337233082,-119.154561545,1,2023-11-09 Oxnard,,,738
738,Oxnard,8/19/2019,other,,34.2749554609,-119.058886814,2,2019-08-19 Oxnard,,,739
739,Oxnard,6/13/2022,other,,34.1813531407,-119.132647673,2,2022-06-13 Oxnard,,,740
740,Oxnard,5/6/2023,other,,34.2591442913,-119.085108217,1,2023-05-06 Oxnard,818.0,27.522562282368465,741
741,Oxnard,5/6/2023,other,,34.2597199648,-119.08449418,1,2023-05-06 Oxnard,,,742
742,Oxnard,5/6/2023,other,,34.2568773867,-119.08754809,1,2023-05-06 Oxnard,,,743
743,Oxnard,5/6/2023,other,,34.2580093839,-119.087371229,1,2023-05-06 Oxnard,,,744
744,Oxnard,7/13/2021,other,,34.1426360395,-119.151541325,2,2021-07-13 Oxnard,,,745
745,Oxnard,5/6/2023,other,,34.2571548313,-119.093082115,1,2023-05-06 Oxnard,1672.0,28.94662402555405,746
746,Oxnard,5/6/2023,other,,34.2533367979,-119.090910983,1,2023-05-06 Oxnard,,,747
747,Oxnard,11/9/2023,other,,34.131140798,-119.15955861,1,2023-11-09 Oxnard,1402.0,29.37000176208783,748
748,Oxnard,5/6/2023,other,,34.1749091448,-119.131880181,1,2023-05-06 Oxnard,,,749
749,Oxnard,11/9/2023,other,,34.1341344383,-119.156605631,1,2023-11-09 Oxnard,1497.0,29.531456025103473,750
750,Oxnard,6/13/2022,other,,34.1885852385,-119.151871736,2,2022-06-13 Oxnard,1634.0,29.175316728994257,751
751,Oxnard,5/6/2023,other,,34.2535139907,-119.093279942,1,2023-05-06 Oxnard,1597.0,27.880188126016712,752
752,Oxnard,10/17/2023,other,,34.2004218663,-119.04597946,2,2023-10-17 Oxnard,,,753
753,Oxnard,5/6/2023,other,,34.1514128768,-119.083987087,1,2023-05-06 Oxnard,1352.0,26.43301992783581,754
754,Oxnard,6/13/2022,other,,34.1814084982,-119.12924814,2,2022-06-13 Oxnard,,,755
755,Oxnard,11/9/2023,other,,34.1348408468,-119.154901969,1,2023-11-09 Oxnard,1652.0,29.15794817139233,756
756,Oxnard,11/9/2023,other,,34.1310113489,-119.160148346,1,2023-11-09 Oxnard,,,757
757,Oxnard,5/6/2023,other,,34.256201122,-119.090302352,1,2023-05-06 Oxnard,1600.0,27.471253049147165,758
758,Oxnard,2/15/2020,other,,34.2292411705,-119.248111448,1,2020-02-15 Oxnard,1490.0,27.95812798857397,759
759,Oxnard,5/6/2023,other,,34.2025753446,-119.059681885,1,2023-05-06 Oxnard,966.0,28.18499333321049,760
760,Oxnard,5/6/2023,other,,34.2550785003,-119.08948225,1,2023-05-06 Oxnard,1253.0,28.1508089992426,761
761,Oxnard,6/13/2022,other,,34.1876499295,-119.153386735,2,2022-06-13 Oxnard,1648.0,29.801180179525694,762
762,Oxnard,11/9/2023,other,,34.128408717,-119.158274327,1,2023-11-09 Oxnard,1406.0,28.9436693905097,763
763,Oxnard,8/19/2019,other,,34.2753585971,-119.058365128,2,2019-08-19 Oxnard,799.0,27.223488738812296,764
764,Oxnard,5/6/2023,other,,34.174369655,-119.132285723,1,2023-05-06 Oxnard,,,765
765,Oxnard,5/6/2023,other,,34.2015426929,-119.060474522,1,2023-05-06 Oxnard,,,766
767,Oxnard,5/6/2023,other,,34.1503618585,-119.085117114,1,2023-05-06 Oxnard,,,768
768,Oxnard,7/13/2021,other,,34.1428312728,-119.150801604,2,2021-07-13 Oxnard,,,769
769,Oxnard,5/6/2023,other,,34.2578811601,-119.089013246,1,2023-05-06 Oxnard,992.0,25.752711891217754,770
770,Oxnard,10/17/2023,other,,34.2002533591,-119.047415321,2,2023-10-17 Oxnard,1284.0,29.970883478165533,771
771,Oxnard,5/6/2023,other,,34.1744206136,-119.079850559,1,2023-05-06 Oxnard,993.0,27.215106826003613,772
773,Oxnard,10/17/2023,other,,34.2041854818,-119.064654991,2,2023-10-17 Oxnard,,,774
774,Oxnard,5/6/2023,other,,34.1498014077,-119.08278281,1,2023-05-06 Oxnard,,,775
775,Oxnard,11/9/2023,other,,34.1343794532,-119.156883543,1,2023-11-09 Oxnard,1227.0,26.523386717644936,776
778,Oxnard,5/6/2023,other,,34.2566538881,-119.088309111,1,2023-05-06 Oxnard,,,779
779,Oxnard,11/9/2023,other,,34.1302859027,-119.159003722,1,2023-11-09 Oxnard,,,780
780,Oxnard,5/6/2023,other,,34.2571969298,-119.092110386,1,2023-05-06 Oxnard,,,781
781,Oxnard,10/17/2023,other,,34.2000361358,-119.045749314,2,2023-10-17 Oxnard,,,782
782,Oxnard,5/6/2023,other,,34.1739059437,-119.079324443,1,2023-05-06 Oxnard,1543.0,28.85678834721578,783
783,Oxnard,6/13/2022,other,,34.1815928446,-119.129871933,2,2022-06-13 Oxnard,,,784
784,Oxnard,2/15/2020,other,,34.2288271147,-119.24923572,1,2020-02-15 Oxnard,1577.0,27.22941918549189,785
785,Oxnard,5/6/2023,other,,34.2540861101,-119.09003971,1,2023-05-06 Oxnard,1279.0,29.58844962446917,786
786,Oxnard,5/6/2023,other,,34.1742157913,-119.130764124,1,2023-05-06 Oxnard,,,787
787,Oxnard,5/6/2023,other,,34.2552343128,-119.087357997,1,2023-05-06 Oxnard,1674.0,25.25520558089984,788
788,Oxnard,5/6/2023,other,,34.2561377415,-119.092640197,1,2023-05-06 Oxnard,,,789
789,Oxnard,5/6/2023,other,,34.1499064669,-119.083101766,1,2023-05-06 Oxnard,,,790
790,Oxnard,11/9/2023,other,,34.1283979815,-119.159940566,1,2023-11-09 Oxnard,,,791
791,Oxnard,6/13/2022,other,,34.1809144872,-119.128660611,2,2022-06-13 Oxnard,,,792
792,Oxnard,5/6/2023,other,,34.1740992298,-119.080283504,1,2023-05-06 Oxnard,,,793
794,Oxnard,5/6/2023,other,,34.150577816,-119.083135494,1,2023-05-06 Oxnard,,,795
796,Oxnard,5/6/2023,other,,34.2538906259,-119.091580581,1,2023-05-06 Oxnard,,,797
797,Oxnard,6/13/2022,other,,34.1818554438,-119.130197428,2,2022-06-13 Oxnard,1546.0,29.17312319195145,798
799,Oxnard,5/6/2023,other,,34.1514567091,-119.086010833,1,2023-05-06 Oxnard,894.0,28.41445042759545,800
800,Oxnard,10/17/2023,other,,34.202896741,-119.06534586,2,2023-10-17 Oxnard,,,801
801,Oxnard,2/15/2020,other,,34.2288193432,-119.250630069,1,2020-02-15 Oxnard,,,802
802,Oxnard,10/17/2023,other,,34.2045911045,-119.06558549,2,2023-10-17 Oxnard,1040.0,28.697846008479665,803
803,Oxnard,5/6/2023,other,,34.1492130875,-119.084202164,1,2023-05-06 Oxnard,,,804
804,Oxnard,11/9/2023,other,,34.12791034,-119.158155954,1,2023-11-09 Oxnard,,,805
805,Oxnard,5/6/2023,other,,34.148948565,-119.085646563,1,2023-05-06 Oxnard,906.0,29.29037043890965,806
806,Oxnard,10/17/2023,other,,34.2065064193,-119.046446496,2,2023-10-17 Oxnard,1291.0,29.31765482298696,807
807,Oxnard,5/6/2023,other,,34.1499588592,-119.084077949,1,2023-05-06 Oxnard,,,808
808,Oxnard,7/13/2021,other,,34.1422572244,-119.150417809,2,2021-07-13 Oxnard,,,809
809,Oxnard,5/6/2023,other,,34.1504348582,-119.082481146,1,2023-05-06 Oxnard,,,810
810,Oxnard,5/6/2023,other,,34.2534955526,-119.088889316,1,2023-05-06 Oxnard,1571.0,28.08353066551471,811
811,Oxnard,10/17/2023,other,,34.2075196938,-119.046871362,2,2023-10-17 Oxnard,928.0,29.573040180662176,812
813,Oxnard,11/9/2023,other,,34.1333281725,-119.155708353,1,2023-11-09 Oxnard,,,814
814,Oxnard,5/6/2023,other,,34.2555358028,-119.090702452,1,2023-05-06 Oxnard,1346.0,25.197568822926893,815
815,Oxnard,7/13/2021,other,,34.1409610902,-119.149489717,2,2021-07-13 Oxnard,,,816
818,Oxnard,5/6/2023,other,,34.1742901832,-119.078746946,1,2023-05-06 Oxnard,1642.0,28.67072967062961,819
819,Oxnard,6/13/2022,other,,34.1852115885,-119.153092951,2,2022-06-13 Oxnard,841.0,29.06041878621148,820
820,Oxnard,5/6/2023,other,,34.1733147443,-119.078580192,1,2023-05-06 Oxnard,1596.0,26.395588090655934,821
821,Oxnard,5/6/2023,other,,34.1490848198,-119.083478298,1,2023-05-06 Oxnard,,,822
822,Oxnard,7/13/2021,other,,34.1411831157,-119.151669365,2,2021-07-13 Oxnard,1010.0,29.10724540040648,823
823,Oxnard,5/6/2023,other,,34.1508636876,-119.085285973,1,2023-05-06 Oxnard,1594.0,27.4172966075556,824
824,Oxnard,5/6/2023,other,,34.2555001691,-119.092866632,1,2023-05-06 Oxnard,1106.0,27.555680950863383,825
825,Oxnard,6/13/2022,other,,34.1814460529,-119.131177281,2,2022-06-13 Oxnard,1688.0,27.42470690424176,826
826,Oxnard,5/6/2023,other,,34.2538987848,-119.090741525,1,2023-05-06 Oxnard,,,827
827,Oxnard,6/13/2022,other,,34.1818512548,-119.129057413,2,2022-06-13 Oxnard,,,828
828,Oxnard,11/9/2023,other,,34.1299334691,-119.158267898,1,2023-11-09 Oxnard,1069.0,25.422249812221875,829
829,Oxnard,6/13/2022,other,,34.1812284732,-119.129866586,2,2022-06-13 Oxnard,1385.0,26.97768304587759,830
830,Oxnard,10/17/2023,other,,34.2026065972,-119.064856966,2,2023-10-17 Oxnard,,,831
831,Oxnard,11/9/2023,other,,34.1301701418,-119.159408853,1,2023-11-09 Oxnard,,,832
832,Oxnard,11/9/2023,other,,34.135420481,-119.154998526,1,2023-11-09 Oxnard,942.0,27.71277191672732,833
833,Oxnard,5/6/2023,other,,34.151095705,-119.084321663,1,2023-05-06 Oxnard,1343.0,27.716671142995647,834
834,Oxnard,6/13/2022,other,,34.1813260831,-119.131534,2,2022-06-13 Oxnard,,,835
835,Oxnard,5/6/2023,other,,34.1514676821,-119.0848999,1,2023-05-06 Oxnard,1219.0,29.728838534864245,836
836,Oxnard,5/6/2023,other,,34.2537478866,-119.092364395,1,2023-05-06 Oxnard,,,837
837,Oxnard,5/6/2023,other,,34.1728332647,-119.080296914,1,2023-05-06 Oxnard,1658.0,29.87743932542716,838
838,Oxnard,5/6/2023,other,,34.1743617123,-119.129055558,1,2023-05-06 Oxnard,,,839
839,Oxnard,2/15/2020,other,,34.229391922,-119.246573802,1,2020-02-15 Oxnard,1282.0,28.504306956925294,840
841,Oxnard,7/13/2021,other,,34.1417305051,-119.14786182,2,2021-07-13 Oxnard,684.0,28.48128454194892,842
842,Oxnard,8/19/2019,other,,34.2757022296,-119.057997817,2,2019-08-19 Oxnard,,,843
843,Oxnard,10/17/2023,other,,34.201797731,-119.064846058,2,2023-10-17 Oxnard,,,844
844,Oxnard,5/6/2023,other,,34.2566002491,-119.092599554,1,2023-05-06 Oxnard,,,845
845,Oxnard,6/13/2022,other,,34.180757877,-119.131931372,2,2022-06-13 Oxnard,,,846
846,Oxnard,5/6/2023,other,,34.1746345498,-119.130376052,1,2023-05-06 Oxnard,1573.0,27.363915185037907,847
847,Oxnard,7/13/2021,other,,34.1416761243,-119.148744451,2,2021-07-13 Oxnard,,,848
848,Oxnard,10/17/2023,other,,34.2026017865,-119.066227998,2,2023-10-17 Oxnard,,,849
849,Oxnard,5/6/2023,other,,34.2540633242,-119.089690028,1,2023-05-06 Oxnard,,,850
850,Oxnard,5/6/2023,other,,34.2533114761,-119.087688297,1,2023-05-06 Oxnard,,,851
851,Oxnard,11/9/2023,other,,34.1333519095,-119.156378481,1,2023-11-09 Oxnard,1624.0,25.07338738764337,852
852,Oxnard,8/19/2019,other,,34.27559201,-119.058982081,2,2019-08-19 Oxnard,,,853
853,Oxnard,6/13/2022,other,,34.1854529415,-119.152292925,2,2022-06-13 Oxnard,,,854
854,Oxnard,5/6/2023,other,,34.1505080713,-119.085687958,1,2023-05-06 Oxnard,,,855
856,Oxnard,5/6/2023,other,,34.2540118245,-119.091066944,1,2023-05-06 Oxnard,,,857
857,Oxnard,5/6/2023,other,,34.2562094601,-119.091127592,1,2023-05-06 Oxnard,,,858
858,Oxnard,5/6/2023,other,,34.174630597,-119.1308816,1,2023-05-06 Oxnard,,,859
859,Oxnard,5/7/2023,other,,34.2255795526,-119.241254296,2,2023-05-07 Oxnard,1453.0,29.76720421784412,860
860,Oxnard,5/6/2023,other,,34.2606176526,-119.085115761,1,2023-05-06 Oxnard,,,861
861,Oxnard,6/13/2022,other,,34.1849859773,-119.152472438,2,2022-06-13 Oxnard,,,862
862,Oxnard,11/9/2023,other,,34.1303616061,-119.160314211,1,2023-11-09 Oxnard,,,863
863,Oxnard,5/6/2023,other,,34.2581395,-119.089815588,1,2023-05-06 Oxnard,,,864
864,Oxnard,7/13/2021,other,,34.1414330184,-119.151848813,2,2021-07-13 Oxnard,,,865
865,Oxnard,7/13/2021,other,,34.142609516,-119.148758073,2,2021-07-13 Oxnard,,,866
866,Oxnard,5/6/2023,other,,34.2574687441,-119.091870857,1,2023-05-06 Oxnard,,,867
867,Oxnard,8/19/2019,other,,34.2757393793,-119.058473288,2,2019-08-19 Oxnard,1631.0,27.720595779194667,868
868,Oxnard,5/6/2023,other,,34.2564713736,-119.090218423,1,2023-05-06 Oxnard,,,869
869,Oxnard,5/6/2023,other,,34.2589650596,-119.085535419,1,2023-05-06 Oxnard,1549.0,29.309192783715147,870
870,Oxnard,6/13/2022,other,,34.1807500574,-119.130784934,2,2022-06-13 Oxnard,1656.0,27.737577115374982,871
871,Oxnard,5/6/2023,other,,34.1748451048,-119.078736148,1,2023-05-06 Oxnard,,,872
872,Oxnard,6/13/2022,other,,34.1814261311,-119.132281908,2,2022-06-13 Oxnard,,,873
874,Oxnard,11/9/2023,other,,34.135245446,-119.154477388,1,2023-11-09 Oxnard,,,875
875,Oxnard,5/7/2023,other,,34.2252748935,-119.241259041,2,2023-05-07 Oxnard,,,876
876,Oxnard,7/13/2021,other,,34.1424093203,-119.150722965,2,2021-07-13 Oxnard,,,877
877,Oxnard,5/6/2023,other,,34.2606066455,-119.085866643,1,2023-05-06 Oxnard,1569.0,27.669100103007263,878
878,Oxnard,5/6/2023,other,,34.1493739489,-119.083303907,1,2023-05-06 Oxnard,,,879
879,Oxnard,11/9/2023,other,,34.129900583,-119.157766641,1,2023-11-09 Oxnard,,,880
880,Oxnard,5/6/2023,other,,34.2554698069,-119.092530213,1,2023-05-06 Oxnard,,,881
881,Oxnard,6/13/2022,other,,34.1817139969,-119.13312738,2,2022-06-13 Oxnard,,,882
882,Oxnard,5/6/2023,other,,34.1739583386,-119.131086683,1,2023-05-06 Oxnard,,,883
883,Oxnard,6/13/2022,other,,34.1839667195,-119.15170193,2,2022-06-13 Oxnard,,,884
884,Oxnard,11/9/2023,other,,34.1354899912,-119.156653423,1,2023-11-09 Oxnard,,,885
885,Oxnard,5/6/2023,other,,34.2560736969,-119.092102739,1,2023-05-06 Oxnard,1491.0,27.322473756591325,886
886,Oxnard,11/9/2023,other,,34.1287556533,-119.15791088,1,2023-11-09 Oxnard,,,887
887,Oxnard,5/6/2023,other,,34.2577411251,-119.0879331,1,2023-05-06 Oxnard,909.0,25.848882815363865,888
888,Oxnard,5/6/2023,other,,34.1750459011,-119.079009564,1,2023-05-06 Oxnard,1116.0,27.88375316262193,889
889,Oxnard,5/6/2023,other,,34.1497343592,-119.086009021,1,2023-05-06 Oxnard,,,890
890,Oxnard,5/6/2023,other,,34.2027251255,-119.058645865,1,2023-05-06 Oxnard,,,891
891,Oxnard,6/13/2022,other,,34.1819665118,-119.129711141,2,2022-06-13 Oxnard,,,892
892,Oxnard,6/13/2022,other,,34.1820426517,-119.132523076,2,2022-06-13 Oxnard,,,893
894,Oxnard,11/9/2023,other,,34.1309367313,-119.158345417,1,2023-11-09 Oxnard,,,895
895,Oxnard,10/17/2023,other,,34.2037737401,-119.066262359,2,2023-10-17 Oxnard,796.0,25.980941251642044,896
896,Oxnard,6/13/2022,other,,34.1814367364,-119.128473931,2,2022-06-13 Oxnard,,,897
897,Oxnard,10/17/2023,other,,34.2062597222,-119.047608595,2,2023-10-17 Oxnard,1685.0,29.361919262216464,898
898,Oxnard,7/13/2021,other,,34.1415374406,-119.147521289,2,2021-07-13 Oxnard,,,899
899,Oxnard,5/6/2023,other,,34.1512763693,-119.083092904,1,2023-05-06 Oxnard,,,900
900,Oxnard,11/9/2023,other,,34.1342393304,-119.154718126,1,2023-11-09 Oxnard,1365.0,29.667103803529024,901
901,Oxnard,5/6/2023,other,,34.2545753909,-119.088202131,1,2023-05-06 Oxnard,1215.0,27.683912235964566,902
902,Oxnard,5/6/2023,other,,34.1495824478,-119.084822405,1,2023-05-06 Oxnard,,,903
903,Oxnard,5/6/2023,other,,34.2532737567,-119.091323499,1,2023-05-06 Oxnard,964.0,27.4402484312114,904
904,Oxnard,5/6/2023,other,,34.256153073,-119.089416884,1,2023-05-06 Oxnard,,,905
906,Oxnard,6/13/2022,other,,34.1830541895,-119.15253408,2,2022-06-13 Oxnard,,,907
907,Oxnard,5/6/2023,other,,34.174278708,-119.080686795,1,2023-05-06 Oxnard,,,908
910,Oxnard,5/6/2023,other,,34.2016553487,-119.057609821,1,2023-05-06 Oxnard,1247.0,29.148064657047566,911
911,Oxnard,5/6/2023,other,,34.2015687431,-119.058856523,1,2023-05-06 Oxnard,,,912
912,Oxnard,5/6/2023,other,,34.2020888259,-119.058306045,1,2023-05-06 Oxnard,,,913
913,Oxnard,5/6/2023,other,,34.173593874,-119.079299814,1,2023-05-06 Oxnard,,,914
914,Oxnard,5/11/2023,other,,34.2830375419,-119.069501422,1,2023-05-11 Oxnard,,,915
915,Oxnard,6/13/2022,other,,34.1884195758,-119.152843778,2,2022-06-13 Oxnard,919.0,27.39171740294189,916
916,Oxnard,5/6/2023,other,,34.2547038649,-119.089258866,1,2023-05-06 Oxnard,,,917
917,Oxnard,7/13/2021,other,,34.141388639,-119.147955293,2,2021-07-13 Oxnard,,,918
919,Oxnard,5/6/2023,other,,34.2581075611,-119.091136531,1,2023-05-06 Oxnard,1104.0,26.93937643023421,920
920,Oxnard,5/6/2023,other,,34.2015023188,-119.058479868,1,2023-05-06 Oxnard,,,921
921,Oxnard,5/6/2023,other,,34.2019794737,-119.058831567,1,2023-05-06 Oxnard,,,922
922,Oxnard,5/6/2023,other,,34.1501729939,-119.08611607,1,2023-05-06 Oxnard,,,923
923,Oxnard,6/13/2022,other,,34.1863908996,-119.152569374,2,2022-06-13 Oxnard,,,924
924,Oxnard,10/17/2023,other,,34.2041335771,-119.064311129,2,2023-10-17 Oxnard,,,925
925,Oxnard,7/13/2021,other,,34.141699212,-119.149174609,2,2021-07-13 Oxnard,,,926
926,Oxnard,5/6/2023,other,,34.2555878571,-119.092073226,1,2023-05-06 Oxnard,1316.0,29.5681200646876,927
928,Oxnard,5/6/2023,other,,34.1732388709,-119.079559601,1,2023-05-06 Oxnard,,,929
929,Oxnard,7/13/2021,other,,34.1424317337,-119.147787081,2,2021-07-13 Oxnard,,,930
930,Oxnard,7/13/2021,other,,34.1428907074,-119.151300799,2,2021-07-13 Oxnard,,,931
931,Oxnard,6/13/2022,other,,34.183537584,-119.152548598,2,2022-06-13 Oxnard,,,932
932,Oxnard,7/13/2021,other,,34.1427108938,-119.147545039,2,2021-07-13 Oxnard,,,933
933,Oxnard,5/6/2023,other,,34.1495703352,-119.085741036,1,2023-05-06 Oxnard,,,934
934,Oxnard,11/9/2023,other,,34.1291958353,-119.159061952,1,2023-11-09 Oxnard,,,935
935,Oxnard,2/15/2020,other,,34.2290844285,-119.249022211,1,2020-02-15 Oxnard,1421.0,29.85961408914732,936
936,Oxnard,5/6/2023,other,,34.1514385091,-119.082769287,1,2023-05-06 Oxnard,,,937
937,Oxnard,2/15/2020,other,,34.2298591712,-119.250441089,1,2020-02-15 Oxnard,1615.0,28.894498274601883,938
938,Oxnard,7/13/2021,other,,34.1410468205,-119.147918368,2,2021-07-13 Oxnard,1427.0,27.455637744594355,939
939,Oxnard,5/7/2023,other,,34.2254364551,-119.244715772,2,2023-05-07 Oxnard,,,940
942,Oxnard,11/9/2023,other,,34.1295452896,-119.159889282,1,2023-11-09 Oxnard,,,943
943,Oxnard,5/7/2023,other,,34.2256740281,-119.244885901,2,2023-05-07 Oxnard,,,944
944,Oxnard,7/13/2021,other,,34.1425253395,-119.151941283,2,2021-07-13 Oxnard,,,945
945,Oxnard,5/6/2023,other,,34.1753228047,-119.080454773,1,2023-05-06 Oxnard,,,946
946,Oxnard,6/13/2022,other,,34.1871566419,-119.152613996,2,2022-06-13 Oxnard,,,947
947,Oxnard,5/6/2023,other,,34.1491536617,-119.082612418,1,2023-05-06 Oxnard,,,948
949,Oxnard,5/6/2023,other,,34.2560192239,-119.089042121,1,2023-05-06 Oxnard,1265.0,29.890431688002824,950
950,Oxnard,6/13/2022,other,,34.1838427719,-119.151996328,2,2022-06-13 Oxnard,,,951
951,Oxnard,5/6/2023,other,,34.257128943,-119.091790039,1,2023-05-06 Oxnard,874.0,28.58957584831388,952
952,Oxnard,5/7/2023,other,,34.2258290949,-119.241998854,2,2023-05-07 Oxnard,,,953
954,Oxnard,5/6/2023,other,,34.2549063456,-119.092176677,1,2023-05-06 Oxnard,,,955
955,Oxnard,6/13/2022,other,,34.1812024843,-119.130514769,2,2022-06-13 Oxnard,,,956
956,Oxnard,5/6/2023,other,,34.1494097373,-119.083859046,1,2023-05-06 Oxnard,,,957
957,Oxnard,11/9/2023,other,,34.1305481509,-119.157891189,1,2023-11-09 Oxnard,,,958
958,Oxnard,2/15/2020,other,,34.2295843415,-119.248964511,1,2020-02-15 Oxnard,,,959
959,Oxnard,10/17/2023,other,,34.1995111862,-119.045655303,2,2023-10-17 Oxnard,1583.0,29.68947398958576,960
960,Oxnard,2/15/2020,other,,34.2295851665,-119.248081853,1,2020-02-15 Oxnard,,,961
961,Oxnard,5/6/2023,other,,34.2024847496,-119.057559424,1,2023-05-06 Oxnard,,,962
964,Oxnard,10/17/2023,other,,34.2045925299,-119.064943951,2,2023-10-17 Oxnard,1649.0,27.67316762973786,965
966,Oxnard,5/6/2023,other,,34.2564213492,-119.09206382,1,2023-05-06 Oxnard,1491.0,29.03952914577433,967
969,Oxnard,6/13/2022,other,,34.1833618995,-119.152280648,2,2022-06-13 Oxnard,,,970
970,Oxnard,2/15/2020,other,,34.2298430602,-119.246858122,1,2020-02-15 Oxnard,1661.0,27.605793279102024,971
971,Oxnard,2/15/2020,other,,34.2295120558,-119.249651861,1,2020-02-15 Oxnard,941.0,27.297871560197887,972
972,Oxnard,6/13/2022,other,,34.1849684646,-119.153427022,2,2022-06-13 Oxnard,1443.0,28.874327791986985,973
973,Oxnard,5/6/2023,other,,34.2562419257,-119.091670395,1,2023-05-06 Oxnard,,,974
974,Oxnard,10/17/2023,other,,34.2075899549,-119.047299483,2,2023-10-17 Oxnard,,,975
976,Oxnard,5/6/2023,other,,34.2598700901,-119.085104777,1,2023-05-06 Oxnard,,,977
977,Oxnard,5/6/2023,other,,34.2566736044,-119.089452461,1,2023-05-06 Oxnard,,,978
978,Oxnard,6/13/2022,other,,34.181877189,-119.131347803,2,2022-06-13 Oxnard,1688.0,29.86427598095293,979
979,Oxnard,5/6/2023,other,,34.1505576863,-119.084394056,1,2023-05-06 Oxnard,,,980
980,Oxnard,5/6/2023,other,,34.2024265885,-119.060034931,1,2023-05-06 Oxnard,1566.0,29.11893600361072,981
981,Oxnard,5/6/2023,other,,34.2534692807,-119.092497843,1,2023-05-06 Oxnard,,,982
982,Oxnard,5/7/2023,other,,34.2256335644,-119.244438151,2,2023-05-07 Oxnard,,,983
983,Oxnard,10/17/2023,other,,34.2032844604,-119.065802365,2,2023-10-17 Oxnard,1518.0,29.9299868549216,984
984,Oxnard,5/6/2023,other,,34.2578759952,-119.091784135,1,2023-05-06 Oxnard,,,985
986,Oxnard,11/9/2023,other,,34.1288697474,-119.158293912,1,2023-11-09 Oxnard,,,987
987,Oxnard,10/17/2023,other,,34.203610786,-119.065499877,2,2023-10-17 Oxnard,1690.0,28.54977802145681,988
989,Oxnard,5/6/2023,other,,34.253244458,-119.092122921,1,2023-05-06 Oxnard,,,990
990,Oxnard,6/13/2022,other,,34.1820093519,-119.132030062,2,2022-06-13 Oxnard,,,991
993,Oxnard,5/6/2023,other,,34.257059243,-119.090061595,1,2023-05-06 Oxnard,1667.0,27.664839020675043,994
994,Oxnard,11/9/2023,other,,34.1299008745,-119.159913642,1,2023-11-09 Oxnard,,,995
995,Oxnard,5/6/2023,other,,34.2575830421,-119.093102601,1,2023-05-06 Oxnard,,,996
996,Oxnard,11/9/2023,other,,34.1281116072,-119.158440366,1,2023-11-09 Oxnard,,,997
997,Oxnard,5/6/2023,other,,34.1506835685,-119.084011828,1,2023-05-06 Oxnard,,,998
998,Oxnard,5/6/2023,other,,34.1738145069,-119.079979829,1,2023-05-06 Oxnard,1493.0,29.49559626069412,999
999,Oxnard,5/6/2023,other,,34.2572391301,-119.090819653,1,2023-05-06 Oxnard,,,1000
1000,Oxnard,5/6/2023,other,,34.2558792868,-119.0879725,1,2023-05-06 Oxnard,1159.0,25.815017094932283,1001
1001,Oxnard,11/9/2023,other,,34.1342531723,-119.156023334,1,2023-11-09 Oxnard,1497.0,26.391438662784157,1002
1002,Oxnard,7/13/2021,other,,34.1429305984,-119.149760192,2,2021-07-13 Oxnard,,,1003
1003,Oxnard,10/17/2023,other,,34.2019262196,-119.064434299,2,2023-10-17 Oxnard,1557.0,29.896321067767403,1004
1004,Oxnard,11/9/2023,other,,34.13383427,-119.156007245,1,2023-11-09 Oxnard,1195.0,28.43082702834104,1005
1005,Oxnard,5/6/2023,other,,34.2598233278,-119.085897872,1,2023-05-06 Oxnard,,,1006
1006,Oxnard,5/6/2023,other,,34.1745805127,-119.129505262,1,2023-05-06 Oxnard,,,1007
1007,Oxnard,11/9/2023,other,,34.1286407635,-119.158850809,1,2023-11-09 Oxnard,1055.0,27.67372021891228,1008
1008,Oxnard,5/6/2023,other,,34.2551683153,-119.092339319,1,2023-05-06 Oxnard,,,1009
1010,Oxnard,6/13/2022,other,,34.1877038961,-119.1529547,2,2022-06-13 Oxnard,1469.0,27.778385648384695,1011
1011,Oxnard,6/13/2022,other,,34.1872718452,-119.151834841,2,2022-06-13 Oxnard,,,1012
1012,Oxnard,5/7/2023,other,,34.2255287541,-119.243731154,2,2023-05-07 Oxnard,,,1013
1014,Oxnard,6/13/2022,other,,34.1881923022,-119.152428837,2,2022-06-13 Oxnard,,,1015
1015,Oxnard,5/6/2023,other,,34.1739111322,-119.078878718,1,2023-05-06 Oxnard,1530.0,25.505213293217608,1016
1016,Oxnard,11/9/2023,other,,34.1353900399,-119.157246796,1,2023-11-09 Oxnard,,,1017
1017,Oxnard,5/6/2023,other,,34.2545496043,-119.093202226,1,2023-05-06 Oxnard,,,1018
1018,Oxnard,5/6/2023,other,,34.2564219745,-119.090679476,1,2023-05-06 Oxnard,,,1019
1019,Oxnard,5/6/2023,other,,34.2595369332,-119.085047524,1,2023-05-06 Oxnard,,,1020
1020,Oxnard,10/17/2023,other,,34.2050617413,-119.066273356,2,2023-10-17 Oxnard,,,1021
1021,Oxnard,7/13/2021,other,,34.1421726015,-119.149466003,2,2021-07-13 Oxnard,,,1022
1022,Oxnard,5/6/2023,other,,34.2015936687,-119.059753369,1,2023-05-06 Oxnard,,,1023
1023,Oxnard,5/6/2023,other,,34.2572449226,-119.08779226,1,2023-05-06 Oxnard,1299.0,29.989222440028342,1024
1024,Oxnard,10/17/2023,other,,34.2033909232,-119.064813271,2,2023-10-17 Oxnard,,,1025
1025,Oxnard,5/6/2023,other,,34.2572826974,-119.091212369,1,2023-05-06 Oxnard,874.0,28.135755751615346,1026
1026,Oxnard,11/9/2023,other,,34.1305756462,-119.158612148,1,2023-11-09 Oxnard,,,1027
1027,Oxnard,6/13/2022,other,,34.1842413559,-119.153043506,2,2022-06-13 Oxnard,,,1028
1028,Oxnard,6/13/2022,other,,34.1807869153,-119.127858695,2,2022-06-13 Oxnard,,,1029
1029,Oxnard,5/11/2023,other,,34.2828918589,-119.070045138,1,2023-05-11 Oxnard,1499.0,25.103140620220795,1030
1030,Oxnard,5/6/2023,other,,34.1749246024,-119.080674318,1,2023-05-06 Oxnard,,,1031
1031,Oxnard,11/9/2023,other,,34.1290445251,-119.158624077,1,2023-11-09 Oxnard,,,1032
1032,Oxnard,5/6/2023,other,,34.2599988525,-119.085563715,1,2023-05-06 Oxnard,,,1033
1033,Oxnard,7/13/2021,other,,34.1421503328,-119.15140716,2,2021-07-13 Oxnard,,,1034
1034,Oxnard,5/6/2023,other,,34.2545282096,-119.088966057,1,2023-05-06 Oxnard,,,1035
1035,Oxnard,10/17/2023,other,,34.2005003881,-119.045400239,2,2023-10-17 Oxnard,,,1036
1036,Oxnard,7/13/2021,other,,34.1421790024,-119.148300202,2,2021-07-13 Oxnard,,,1037
1037,Oxnard,5/6/2023,other,,34.1726888358,-119.078402924,1,2023-05-06 Oxnard,,,1038
1038,Oxnard,5/6/2023,other,,34.1509924866,-119.082444854,1,2023-05-06 Oxnard,1304.0,27.600961707638,1039
1041,Oxnard,5/6/2023,other,,34.2562676245,-119.093041266,1,2023-05-06 Oxnard,,,1042
1042,Oxnard,6/13/2022,other,,34.1817321187,-119.131064664,2,2022-06-13 Oxnard,1063.0,27.010712402985657,1043
1043,Oxnard,5/6/2023,other,,34.25637555,-119.088274609,1,2023-05-06 Oxnard,,,1044
1044,Oxnard,5/6/2023,other,,34.2580790634,-119.09038224,1,2023-05-06 Oxnard,1415.0,26.343340752750485,1045
1045,Oxnard,7/13/2021,other,,34.1420200696,-119.152295825,2,2021-07-13 Oxnard,,,1046
1047,Oxnard,5/6/2023,other,,34.2581446802,-119.088270068,1,2023-05-06 Oxnard,767.0,29.838973251409517,1048
1048,Oxnard,7/13/2021,other,,34.1424760007,-119.151240009,2,2021-07-13 Oxnard,,,1049
1049,Oxnard,5/6/2023,other,,34.2016822513,-119.058099736,1,2023-05-06 Oxnard,,,1050
1050,Oxnard,5/6/2023,other,,34.2550068536,-119.091560134,1,2023-05-06 Oxnard,1611.0,28.832169046175583,1051
1051,Oxnard,5/11/2023,other,,34.2841287724,-119.068877853,1,2023-05-11 Oxnard,,,1052
1053,Oxnard,5/6/2023,other,,34.2020240121,-119.060024587,1,2023-05-06 Oxnard,1534.0,28.36457797323817,1054
1055,Oxnard,6/13/2022,other,,34.1856587512,-119.152846987,2,2022-06-13 Oxnard,1121.0,29.687075200066307,1056
1056,Oxnard,5/6/2023,other,,34.1748553947,-119.132267108,1,2023-05-06 Oxnard,1233.0,26.847910661469555,1057
1057,Oxnard,5/6/2023,other,,34.2573867347,-119.089810675,1,2023-05-06 Oxnard,1601.0,25.115073859046554,1058
1058,Oxnard,5/7/2023,other,,34.2250283021,-119.242414849,2,2023-05-07 Oxnard,,,1059
1059,Oxnard,5/6/2023,other,,34.2547448545,-119.09248959,1,2023-05-06 Oxnard,1501.0,24.971241400491454,1060
1060,Oxnard,5/6/2023,other,,34.149843486,-119.083648957,1,2023-05-06 Oxnard,1131.0,29.13679480187304,1061
1061,Oxnard,11/9/2023,other,,34.1291385345,-119.158159833,1,2023-11-09 Oxnard,,,1062
1063,Oxnard,11/9/2023,other,,34.1287608068,-119.159158152,1,2023-11-09 Oxnard,,,1064
1064,Oxnard,10/17/2023,other,,34.2067846982,-119.047832957,2,2023-10-17 Oxnard,,,1065
1065,Oxnard,5/6/2023,other,,34.1738360825,-119.133018506,1,2023-05-06 Oxnard,,,1066
1066,Oxnard,5/6/2023,other,,34.2566977757,-119.092231442,1,2023-05-06 Oxnard,1083.0,29.48622384815546,1067
1067,Oxnard,11/9/2023,other,,34.1347982117,-119.156134785,1,2023-11-09 Oxnard,,,1068
1069,Oxnard,5/6/2023,other,,34.2579778418,-119.09290984,1,2023-05-06 Oxnard,,,1070
1070,Oxnard,11/9/2023,other,,34.1284798858,-119.159608862,1,2023-11-09 Oxnard,,,1071
1071,Oxnard,5/6/2023,other,,34.1506346351,-119.084748582,1,2023-05-06 Oxnard,,,1072
1072,Oxnard,5/7/2023,other,,34.2257442236,-119.243459879,2,2023-05-07 Oxnard,,,1073
1073,Oxnard,5/6/2023,other,,34.2577093561,-119.09064974,1,2023-05-06 Oxnard,,,1074
1075,Oxnard,7/13/2021,other,,34.1411406364,-119.148991696,2,2021-07-13 Oxnard,,,1076
1076,Oxnard,5/6/2023,other,,34.1512204904,-119.085820761,1,2023-05-06 Oxnard,,,1077
1077,Oxnard,5/6/2023,other,,34.1743935941,-119.129887307,1,2023-05-06 Oxnard,,,1078
1079,Oxnard,7/13/2021,other,,34.1410669573,-119.151974568,2,2021-07-13 Oxnard,,,1080
1080,Oxnard,6/13/2022,other,,34.1859701729,-119.15298634,2,2022-06-13 Oxnard,1606.0,27.670505563963243,1081
1081,Oxnard,5/6/2023,other,,34.2602880028,-119.085535871,1,2023-05-06 Oxnard,,,1082
1084,Oxnard,2/15/2020,other,,34.2292507465,-119.250460454,1,2020-02-15 Oxnard,1047.0,26.66925528077034,1085
1085,Oxnard,5/7/2023,other,,34.2255972305,-119.244054345,2,2023-05-07 Oxnard,,,1086
1086,Oxnard,5/6/2023,other,,34.1727539017,-119.078805366,1,2023-05-06 Oxnard,,,1087
1087,Oxnard,5/6/2023,other,,34.1508568593,-119.086139512,1,2023-05-06 Oxnard,,,1088
1088,Oxnard,6/13/2022,other,,34.1820908179,-119.131085041,2,2022-06-13 Oxnard,,,1089
1089,Oxnard,10/17/2023,other,,34.204618102,-119.06613967,2,2023-10-17 Oxnard,,,1090
1091,Oxnard,2/15/2020,other,,34.2298087651,-119.247238465,1,2020-02-15 Oxnard,1152.0,28.96194018757995,1092
1092,Oxnard,5/6/2023,other,,34.1490032881,-119.085117835,1,2023-05-06 Oxnard,,,1093
1093,Oxnard,5/11/2023,other,,34.2834700222,-119.069947129,1,2023-05-11 Oxnard,,,1094
1094,Oxnard,10/17/2023,other,,34.2030840344,-119.066170975,2,2023-10-17 Oxnard,,,1095
1095,Oxnard,5/11/2023,other,,34.2835827245,-119.068913604,1,2023-05-11 Oxnard,,,1096
1097,Oxnard,7/13/2021,other,,34.1429818411,-119.148703074,2,2021-07-13 Oxnard,,,1098
1098,Oxnard,5/6/2023,other,,34.2564224851,-119.093313211,1,2023-05-06 Oxnard,,,1099
1099,Oxnard,5/6/2023,other,,34.2551680836,-119.090721229,1,2023-05-06 Oxnard,666.0,27.17611045301583,1100
1100,Oxnard,10/17/2023,other,,34.2070761307,-119.047589152,2,2023-10-17 Oxnard,1454.0,27.44795935770124,1101
1102,Oxnard,7/13/2021,other,,34.1425707115,-119.149282657,2,2021-07-13 Oxnard,1584.0,28.298242802943356,1103
1106,Oxnard,10/17/2023,other,,34.2031091774,-119.065007371,2,2023-10-17 Oxnard,,,1107
1107,Oxnard,5/6/2023,other,,34.1495121568,-119.086215191,1,2023-05-06 Oxnard,,,1108
1108,Oxnard,6/13/2022,other,,34.1820940952,-119.129224678,2,2022-06-13 Oxnard,,,1109
1109,Oxnard,5/6/2023,other,,34.254939044,-119.090395442,1,2023-05-06 Oxnard,,,1110
1110,Oxnard,5/6/2023,other,,34.2568820838,-119.089717959,1,2023-05-06 Oxnard,1319.0,29.23139405676076,1111
1111,Oxnard,5/6/2023,other,,34.2023961427,-119.057881132,1,2023-05-06 Oxnard,1467.0,28.884886935505637,1112
1112,Oxnard,6/13/2022,other,,34.1859098045,-119.152521971,2,2022-06-13 Oxnard,1053.0,28.456330991444965,1113
1113,Oxnard,10/17/2023,other,,34.2025653041,-119.065616536,2,2023-10-17 Oxnard,1191.0,27.21261860438229,1114
1114,Oxnard,6/13/2022,other,,34.1809179832,-119.130216694,2,2022-06-13 Oxnard,,,1115
1116,Oxnard,5/6/2023,other,,34.2575908634,-119.088803145,1,2023-05-06 Oxnard,,,1117
1117,Oxnard,6/13/2022,other,,34.1810720216,-119.132790377,2,2022-06-13 Oxnard,1197.0,28.16727661335845,1118
1118,Oxnard,5/6/2023,other,,34.2571487647,-119.090455657,1,2023-05-06 Oxnard,,,1119
1119,Oxnard,6/13/2022,other,,34.1807777658,-119.132264084,2,2022-06-13 Oxnard,1698.0,28.90073453114748,1120
1121,Oxnard,11/9/2023,other,,34.1285571965,-119.160263331,1,2023-11-09 Oxnard,,,1122
1122,Oxnard,5/6/2023,other,,34.2544760469,-119.091816218,1,2023-05-06 Oxnard,794.0,25.5862100722242,1123
1123,Oxnard,5/6/2023,other,,34.1745721279,-119.078411128,1,2023-05-06 Oxnard,,,1124
1124,Oxnard,5/6/2023,other,,34.2578026377,-119.092333878,1,2023-05-06 Oxnard,1560.0,25.374147393957863,1125
1125,Oxnard,6/13/2022,other,,34.1882134677,-119.151685323,2,2022-06-13 Oxnard,1236.0,28.184582091489062,1126
1126,Oxnard,5/6/2023,other,,34.2532354901,-119.08935132,1,2023-05-06 Oxnard,,,1127
1127,Oxnard,10/17/2023,other,,34.1999087986,-119.045371092,2,2023-10-17 Oxnard,,,1128
1128,Oxnard,11/9/2023,other,,34.1353139886,-119.156916384,1,2023-11-09 Oxnard,,,1129
1129,Oxnard,5/6/2023,other,,34.2563147047,-119.089050887,1,2023-05-06 Oxnard,,,1130
1131,Oxnard,10/17/2023,other,,34.2017260476,-119.0659742,2,2023-10-17 Oxnard,,,1132
1133,Oxnard,5/6/2023,other,,34.2567212577,-119.090881546,1,2023-05-06 Oxnard,1610.0,25.676122508992258,1134
1134,Oxnard,10/17/2023,other,,34.2025183381,-119.064194869,2,2023-10-17 Oxnard,,,1135
1135,Oxnard,5/6/2023,other,,34.1729507519,-119.080627554,1,2023-05-06 Oxnard,,,1136
1136,Oxnard,10/17/2023,other,,34.2037391578,-119.064076949,2,2023-10-17 Oxnard,,,1137
1137,Oxnard,5/7/2023,other,,34.2253681563,-119.242908458,2,2023-05-07 Oxnard,,,1138
1138,Oxnard,5/6/2023,other,,34.1513008203,-119.085208719,1,2023-05-06 Oxnard,1340.0,25.776015477303563,1139
1139,Oxnard,5/6/2023,other,,34.2610170117,-119.085195845,1,2023-05-06 Oxnard,1430.0,28.625212098251527,1140
1140,Oxnard,8/19/2019,other,,34.2761788464,-119.058917706,2,2019-08-19 Oxnard,,,1141
1142,Oxnard,6/13/2022,other,,34.1809345546,-119.129886894,2,2022-06-13 Oxnard,,,1143
1143,Oxnard,11/9/2023,other,,34.1297050887,-119.15958167,1,2023-11-09 Oxnard,1198.0,25.89553339531848,1144
1144,Oxnard,10/17/2023,other,,34.2030487563,-119.065626908,2,2023-10-17 Oxnard,,,1145
1145,Oxnard,10/17/2023,other,,34.2028516304,-119.065970884,2,2023-10-17 Oxnard,,,1146
1146,Oxnard,6/13/2022,other,,34.188089948,-119.152864087,2,2022-06-13 Oxnard,,,1147
1147,Oxnard,10/17/2023,other,,34.2064283695,-119.047141611,2,2023-10-17 Oxnard,,,1148
1148,Oxnard,10/17/2023,other,,34.1990966671,-119.045972681,2,2023-10-17 Oxnard,,,1149
1149,Oxnard,5/7/2023,other,,34.2254881154,-119.242559666,2,2023-05-07 Oxnard,,,1150
1150,Oxnard,6/13/2022,other,,34.1881809697,-119.153202376,2,2022-06-13 Oxnard,,,1151
1152,Oxnard,7/13/2021,other,,34.141313704,-119.148479826,2,2021-07-13 Oxnard,,,1153
1153,Oxnard,5/6/2023,other,,34.2021701803,-119.059139003,1,2023-05-06 Oxnard,,,1154
1154,Oxnard,5/6/2023,other,,34.2535384895,-119.089772212,1,2023-05-06 Oxnard,1417.0,28.974270174957294,1155
1155,Oxnard,7/13/2021,other,,34.1417919431,-119.150964031,2,2021-07-13 Oxnard,1575.0,25.00932686049359,1156
1156,Oxnard,6/13/2022,other,,34.1817935884,-119.13281205,2,2022-06-13 Oxnard,,,1157
1157,Oxnard,6/13/2022,other,,34.188646599,-119.153176298,2,2022-06-13 Oxnard,,,1158
1159,Oxnard,5/11/2023,other,,34.2841008888,-119.069409288,1,2023-05-11 Oxnard,,,1160
1160,Oxnard,5/7/2023,other,,34.225094126,-119.242829406,2,2023-05-07 Oxnard,778.0,29.971160244248477,1161
1161,Oxnard,5/6/2023,other,,34.1507665296,-119.085804951,1,2023-05-06 Oxnard,,,1162
1162,Oxnard,5/6/2023,other,,34.1502487396,-119.083019432,1,2023-05-06 Oxnard,,,1163
1163,Oxnard,5/6/2023,other,,34.1727996369,-119.079577098,1,2023-05-06 Oxnard,1695.0,27.666516601352285,1164
1164,Oxnard,2/15/2020,other,,34.2288629429,-119.246595444,1,2020-02-15 Oxnard,,,1165
1165,Oxnard,10/17/2023,other,,34.204332332,-119.065424704,2,2023-10-17 Oxnard,,,1166
1166,Oxnard,5/6/2023,other,,34.2556159272,-119.08882837,1,2023-05-06 Oxnard,,,1167
1167,Oxnard,5/6/2023,other,,34.2594139963,-119.084588711,1,2023-05-06 Oxnard,818.0,29.704149953193845,1168
1168,Oxnard,5/6/2023,other,,34.253884182,-119.087711956,1,2023-05-06 Oxnard,1230.0,25.802876238783945,1169
1169,Oxnard,10/17/2023,other,,34.2038023148,-119.064443699,2,2023-10-17 Oxnard,,,1170
1170,Oxnard,5/6/2023,other,,34.2548034723,-119.088494439,1,2023-05-06 Oxnard,,,1171
1171,Oxnard,11/9/2023,other,,34.1335876748,-119.156566667,1,2023-11-09 Oxnard,1174.0,27.393369164053656,1172
1172,Oxnard,10/17/2023,other,,34.2060646384,-119.047030054,2,2023-10-17 Oxnard,1626.0,27.9679552585996,1173
1174,Oxnard,5/6/2023,other,,34.2570431377,-119.088466565,1,2023-05-06 Oxnard,1540.0,27.2082199268038,1175
1175,Oxnard,5/6/2023,other,,34.2595103474,-119.084035193,1,2023-05-06 Oxnard,,,1176
1177,Oxnard,11/9/2023,other,,34.1312862092,-119.158425905,1,2023-11-09 Oxnard,,,1178
1178,Oxnard,10/17/2023,other,,34.2040590734,-119.065355496,2,2023-10-17 Oxnard,,,1179
1179,Oxnard,5/6/2023,other,,34.1494750411,-119.082454439,1,2023-05-06 Oxnard,,,1180
1180,Oxnard,5/6/2023,other,,34.2557160494,-119.088414553,1,2023-05-06 Oxnard,,,1181
1181,Oxnard,6/13/2022,other,,34.1811642124,-119.128406051,2,2022-06-13 Oxnard,,,1182
1182,Oxnard,6/13/2022,other,,34.1834007629,-119.152926105,2,2022-06-13 Oxnard,1194.0,29.42752102643762,1183
1183,Oxnard,11/9/2023,other,,34.1353725591,-119.155680192,1,2023-11-09 Oxnard,1361.0,28.894477078513496,1184
1184,Oxnard,5/6/2023,other,,34.2568970462,-119.092563573,1,2023-05-06 Oxnard,1672.0,26.714503484814813,1185
1185,Oxnard,2/15/2020,other,,34.2298617748,-119.249339018,1,2020-02-15 Oxnard,,,1186
1186,Oxnard,11/9/2023,other,,34.1351502049,-119.156023968,1,2023-11-09 Oxnard,,,1187
1187,Oxnard,5/6/2023,other,,34.1743811241,-119.079289069,1,2023-05-06 Oxnard,1468.0,26.27213177625905,1188
1188,Oxnard,11/9/2023,other,,34.1311807399,-119.158101624,1,2023-11-09 Oxnard,,,1189
1189,Oxnard,6/13/2022,other,,34.1865686895,-119.153057185,2,2022-06-13 Oxnard,,,1190
1191,Oxnard,11/9/2023,other,,34.128935585,-119.159422424,1,2023-11-09 Oxnard,,,1192
1192,Oxnard,6/13/2022,other,,34.1820946444,-119.128468251,2,2022-06-13 Oxnard,,,1193
1195,Oxnard,5/6/2023,other,,34.1487981978,-119.083187249,1,2023-05-06 Oxnard,,,1196
1198,Oxnard,11/9/2023,other,,34.1348250957,-119.156663415,1,2023-11-09 Oxnard,1286.0,28.553341400914466,1199
1199,Oxnard,5/6/2023,other,,34.1502914357,-119.083920789,1,2023-05-06 Oxnard,,,1200
1200,Oxnard,6/13/2022,other,,34.1831282183,-119.153124377,2,2022-06-13 Oxnard,1194.0,29.110196414740564,1201
1201,Oxnard,11/9/2023,other,,34.1301908698,-119.159885838,1,2023-11-09 Oxnard,,,1202
1202,Oxnard,6/13/2022,other,,34.1808181147,-119.129061378,2,2022-06-13 Oxnard,1425.0,27.49489436139962,1203
1203,Oxnard,5/6/2023,other,,34.2558483377,-119.090333984,1,2023-05-06 Oxnard,1372.0,26.08316912741532,1204
1204,Oxnard,6/13/2022,other,,34.1856491836,-119.152042817,2,2022-06-13 Oxnard,,,1205
1205,Oxnard,10/17/2023,other,,34.2028985651,-119.064105416,2,2023-10-17 Oxnard,,,1206
1206,Oxnard,5/6/2023,other,,34.1741617784,-119.13288959,1,2023-05-06 Oxnard,1622.0,28.318465050663555,1207
1207,Oxnard,10/17/2023,other,,34.1991811467,-119.046307971,2,2023-10-17 Oxnard,,,1208
1208,Oxnard,6/13/2022,other,,34.1869964946,-119.151892445,2,2022-06-13 Oxnard,,,1209
1209,Oxnard,11/9/2023,other,,34.1293561676,-119.157822047,1,2023-11-09 Oxnard,,,1210
1210,Oxnard,6/13/2022,other,,34.1867151558,-119.152230571,2,2022-06-13 Oxnard,,,1211
1211,Oxnard,6/13/2022,other,,34.1830706422,-119.1521031,2,2022-06-13 Oxnard,1396.0,26.498888866281,1212
1212,Oxnard,5/6/2023,other,,34.1733700464,-119.080359744,1,2023-05-06 Oxnard,1676.0,27.606342274202763,1213
1213,Oxnard,10/17/2023,other,,34.2001794491,-119.046176325,2,2023-10-17 Oxnard,,,1214
1215,Oxnard,5/6/2023,other,,34.1510576556,-119.084711016,1,2023-05-06 Oxnard,,,1216
1216,Oxnard,6/13/2022,other,,34.1820524342,-119.130598555,2,2022-06-13 Oxnard,,,1217
1217,Oxnard,5/6/2023,other,,34.1744270729,-119.080362957,1,2023-05-06 Oxnard,,,1218
1219,Oxnard,5/11/2023,other,,34.2836596261,-119.069569759,1,2023-05-11 Oxnard,986.0,29.160916809806636,1220
1221,Oxnard,5/6/2023,other,,34.2548967206,-119.090931053,1,2023-05-06 Oxnard,,,1222
1222,Oxnard,5/6/2023,other,,34.2577900139,-119.090022316,1,2023-05-06 Oxnard,,,1223
1224,Oxnard,10/17/2023,other,,34.1992940932,-119.046714003,2,2023-10-17 Oxnard,,,1225
1225,Oxnard,5/6/2023,other,,34.2591897537,-119.084208878,1,2023-05-06 Oxnard,,,1226
1227,Oxnard,5/6/2023,other,,34.1491252006,-119.083848196,1,2023-05-06 Oxnard,,,1228
1228,Oxnard,11/9/2023,other,,34.1293820617,-119.158638024,1,2023-11-09 Oxnard,,,1229
1230,Oxnard,5/6/2023,other,,34.1750927041,-119.080063428,1,2023-05-06 Oxnard,1275.0,25.957049149735003,1231
1231,Oxnard,5/6/2023,other,,34.1739247882,-119.080545982,1,2023-05-06 Oxnard,1646.0,28.73192110462173,1232
1234,Oxnard,5/6/2023,other,,34.2545585378,-119.090736947,1,2023-05-06 Oxnard,,,1235
1236,Oxnard,10/17/2023,other,,34.2038453386,-119.065089466,2,2023-10-17 Oxnard,,,1237
1237,Oxnard,10/17/2023,other,,34.1991197778,-119.047343997,2,2023-10-17 Oxnard,,,1238
1238,Oxnard,5/6/2023,other,,34.1738158629,-119.130046402,1,2023-05-06 Oxnard,,,1239
1239,Oxnard,5/6/2023,other,,34.1738724307,-119.132427114,1,2023-05-06 Oxnard,1603.0,29.116075622411735,1240
1240,Oxnard,6/13/2022,other,,34.1872832591,-119.15311731,2,2022-06-13 Oxnard,,,1241
1241,Oxnard,7/13/2021,other,,34.1419658589,-119.15166507,2,2021-07-13 Oxnard,1392.0,28.390142516519404,1242
1242,Oxnard,8/19/2019,other,,34.2759799644,-119.058013578,2,2019-08-19 Oxnard,,,1243
1243,Oxnard,11/9/2023,other,,34.1283556056,-119.158727618,1,2023-11-09 Oxnard,976.0,27.979104925454376,1244
1244,Oxnard,5/11/2023,other,,34.2830315632,-119.068870291,1,2023-05-11 Oxnard,,,1245
1245,Oxnard,7/13/2021,other,,34.1416085964,-119.14975053,2,2021-07-13 Oxnard,954.0,27.499081010823645,1246
1247,Oxnard,5/6/2023,other,,34.1744529381,-119.131152304,1,2023-05-06 Oxnard,,,1248
1248,Oxnard,7/13/2021,other,,34.1420874004,-119.149020748,2,2021-07-13 Oxnard,,,1249
1249,Oxnard,6/13/2022,other,,34.1845828071,-119.153382864,2,2022-06-13 Oxnard,,,1250
1250,Oxnard,5/7/2023,other,,34.2250294406,-119.243447571,2,2023-05-07 Oxnard,778.0,29.10278344910729,1251
1251,Oxnard,5/6/2023,other,,34.1487997572,-119.082416938,1,2023-05-06 Oxnard,,,1252
1253,Oxnard,10/17/2023,other,,34.2041946723,-119.065056367,2,2023-10-17 Oxnard,,,1254
1254,Oxnard,11/9/2023,other,,34.1305686004,-119.159659733,1,2023-11-09 Oxnard,,,1255
1255,Oxnard,7/13/2021,other,,34.1412811948,-119.149765012,2,2021-07-13 Oxnard,1336.0,28.516087065658336,1256
1256,Oxnard,5/6/2023,other,,34.2547958171,-119.093059406,1,2023-05-06 Oxnard,1501.0,28.010678480846128,1257
1257,Oxnard,5/6/2023,other,,34.150743949,-119.083669726,1,2023-05-06 Oxnard,,,1258
1258,Oxnard,7/13/2021,other,,34.1420688562,-119.14771025,2,2021-07-13 Oxnard,1504.0,27.3445296113648,1259
1259,Oxnard,7/13/2021,other,,34.1423196779,-119.148592256,2,2021-07-13 Oxnard,,,1260
1260,Oxnard,5/6/2023,other,,34.1496446904,-119.085392149,1,2023-05-06 Oxnard,813.0,29.543746800521216,1261
1261,Oxnard,6/13/2022,other,,34.1860274732,-119.153483012,2,2022-06-13 Oxnard,1639.0,29.98331609339891,1262
1262,Oxnard,10/17/2023,other,,34.2021064836,-119.065180538,2,2023-10-17 Oxnard,1591.0,29.819814273518816,1263
1263,Oxnard,5/6/2023,other,,34.2017706446,-119.05857834,1,2023-05-06 Oxnard,,,1264
1265,Oxnard,5/6/2023,other,,34.2543245044,-119.088650313,1,2023-05-06 Oxnard,,,1266
1266,Oxnard,5/6/2023,other,,34.2559511165,-119.090980968,1,2023-05-06 Oxnard,,,1267
1267,Oxnard,2/15/2020,other,,34.2292061005,-119.249888386,1,2020-02-15 Oxnard,1047.0,26.360262957439463,1268
1268,Oxnard,5/6/2023,other,,34.2547883004,-119.087304223,1,2023-05-06 Oxnard,1673.0,28.192930266307183,1269
1269,Oxnard,5/6/2023,other,,34.1489375855,-119.082899265,1,2023-05-06 Oxnard,,,1270
1270,Oxnard,5/6/2023,other,,34.2017812618,-119.059076739,1,2023-05-06 Oxnard,,,1271
1272,Oxnard,6/13/2022,other,,34.1837016562,-119.152284971,2,2022-06-13 Oxnard,,,1273
1273,Oxnard,11/9/2023,other,,34.1336236864,-119.155713298,1,2023-11-09 Oxnard,,,1274
1275,Oxnard,5/7/2023,other,,34.2252147075,-119.244462414,2,2023-05-07 Oxnard,1397.0,27.9231537752682,1276
1276,Oxnard,5/6/2023,other,,34.1494886707,-119.082886829,1,2023-05-06 Oxnard,,,1277
1277,Oxnard,5/6/2023,other,,34.2543469752,-119.089355945,1,2023-05-06 Oxnard,,,1278
1279,Oxnard,7/13/2021,other,,34.1426133738,-119.152313244,2,2021-07-13 Oxnard,,,1280
1280,Oxnard,8/19/2019,other,,34.2760105765,-119.058421435,2,2019-08-19 Oxnard,1452.0,29.285077346790647,1281
1282,Oxnard,10/17/2023,other,,34.2031252839,-119.064504013,2,2023-10-17 Oxnard,,,1283
1284,Oxnard,6/13/2022,other,,34.1843896166,-119.151685318,2,2022-06-13 Oxnard,,,1285
1286,Oxnard,5/6/2023,other,,34.2559647381,-119.093266926,1,2023-05-06 Oxnard,1338.0,25.241274083697693,1287
1287,Oxnard,5/6/2023,other,,34.2551879233,-119.092989534,1,2023-05-06 Oxnard,1294.0,28.35878083169571,1288
1288,Oxnard,5/6/2023,other,,34.2536742032,-119.09050884,1,2023-05-06 Oxnard,,,1289
1289,Oxnard,11/9/2023,other,,34.1344842431,-119.156503309,1,2023-11-09 Oxnard,,,1290
1291,Oxnard,5/6/2023,other,,34.1512413212,-119.086251906,1,2023-05-06 Oxnard,,,1292
1292,Oxnard,5/6/2023,other,,34.2538942435,-119.091955001,1,2023-05-06 Oxnard,,,1293
1294,Oxnard,6/13/2022,other,,34.1843398698,-119.152151825,2,2022-06-13 Oxnard,,,1295
1295,Oxnard,6/13/2022,other,,34.1811271319,-119.132222446,2,2022-06-13 Oxnard,,,1296
1296,Oxnard,5/7/2023,other,,34.2251304313,-119.241550521,2,2023-05-07 Oxnard,,,1297
1297,Oxnard,10/17/2023,other,,34.2066353833,-119.047377641,2,2023-10-17 Oxnard,,,1298
1299,Oxnard,5/6/2023,other,,34.2563423752,-119.089682516,1,2023-05-06 Oxnard,,,1300
1300,Oxnard,10/17/2023,other,,34.202293341,-119.064523489,2,2023-10-17 Oxnard,1557.0,29.169803218522215,1301
1301,Oxnard,5/11/2023,other,,34.2840793774,-119.069950771,1,2023-05-11 Oxnard,,,1302
1304,Oxnard,5/6/2023,other,,34.2571316766,-119.089413847,1,2023-05-06 Oxnard,1601.0,29.972235626713307,1305
1305,Oxnard,5/6/2023,other,,34.1735197374,-119.079857264,1,2023-05-06 Oxnard,,,1306
1306,Oxnard,5/6/2023,other,,34.1737287939,-119.078404139,1,2023-05-06 Oxnard,1530.0,29.809993532719957,1307
1307,Oxnard,10/17/2023,other,,34.2034961933,-119.066302308,2,2023-10-17 Oxnard,,,1308
1308,Oxnard,5/7/2023,other,,34.2254230144,-119.240955434,2,2023-05-07 Oxnard,,,1309
1309,Oxnard,5/6/2023,other,,34.2016048863,-119.060080002,1,2023-05-06 Oxnard,,,1310
1310,Oxnard,5/6/2023,other,,34.2535791587,-119.092007697,1,2023-05-06 Oxnard,,,1311
1312,Oxnard,6/13/2022,other,,34.1817316761,-119.128269571,2,2022-06-13 Oxnard,,,1313
1313,Oxnard,5/6/2023,other,,34.2546009854,-119.089623741,1,2023-05-06 Oxnard,1621.0,29.47339765083542,1314
1314,Oxnard,11/9/2023,other,,34.1345471223,-119.15491276,1,2023-11-09 Oxnard,,,1315
1316,Oxnard,5/6/2023,other,,34.1516270424,-119.082464695,1,2023-05-06 Oxnard,,,1317
1317,Oxnard,5/6/2023,other,,34.2576607059,-119.092789095,1,2023-05-06 Oxnard,,,1318
1319,Oxnard,5/6/2023,other,,34.2535649167,-119.091088752,1,2023-05-06 Oxnard,1508.0,27.903288967518733,1320
1320,Oxnard,10/17/2023,other,,34.2023256136,-119.066139447,2,2023-10-17 Oxnard,1541.0,26.730319608007154,1321
1321,Oxnard,2/15/2020,other,,34.2297979977,-119.249790782,1,2020-02-15 Oxnard,,,1322
1322,Oxnard,5/6/2023,other,,34.2575209666,-119.092264389,1,2023-05-06 Oxnard,,,1323
1323,Oxnard,11/9/2023,other,,34.1305038649,-119.15929554,1,2023-11-09 Oxnard,,,1324
1324,Oxnard,6/13/2022,other,,34.1855234871,-119.153382763,2,2022-06-13 Oxnard,,,1325
1325,Oxnard,5/6/2023,other,,34.2557450742,-119.09269465,1,2023-05-06 Oxnard,,,1326
1326,Oxnard,5/7/2023,other,,34.22538198,-119.241957512,2,2023-05-07 Oxnard,,,1327
1327,Oxnard,5/6/2023,other,,34.1500756776,-119.084827139,1,2023-05-06 Oxnard,1014.0,27.803759328542274,1328
1328,Oxnard,6/13/2022,other,,34.1846629401,-119.151894877,2,2022-06-13 Oxnard,,,1329
1329,Oxnard,5/6/2023,other,,34.2547311577,-119.089996883,1,2023-05-06 Oxnard,,,1330
1330,Oxnard,5/6/2023,other,,34.2604251024,-119.084356506,1,2023-05-06 Oxnard,,,1331
1331,Oxnard,6/13/2022,other,,34.1807706294,-119.128292268,2,2022-06-13 Oxnard,,,1332
1332,Oxnard,5/6/2023,other,,34.1488217978,-119.084408725,1,2023-05-06 Oxnard,,,1333
1333,Oxnard,5/6/2023,other,,34.2544811206,-119.091273628,1,2023-05-06 Oxnard,794.0,28.34762858993767,1334
1334,Oxnard,5/6/2023,other,,34.2606273059,-119.084071167,1,2023-05-06 Oxnard,1618.0,29.868099172628195,1335
1336,Oxnard,10/17/2023,other,,34.2051550605,-119.064333605,2,2023-10-17 Oxnard,1581.0,27.573582827148552,1337
1338,Oxnard,11/9/2023,other,,34.1283702224,-119.157706917,1,2023-11-09 Oxnard,1406.0,25.56315884721632,1339
1340,Oxnard,5/6/2023,other,,34.2535681942,-119.088120642,1,2023-05-06 Oxnard,1177.0,29.26709474995329,1341
1341,Oxnard,10/17/2023,other,,34.200238513,-119.046615247,2,2023-10-17 Oxnard,,,1342
1343,Oxnard,11/9/2023,other,,34.1306939656,-119.158166048,1,2023-11-09 Oxnard,,,1344
1344,Oxnard,2/15/2020,other,,34.2292901991,-119.247490361,1,2020-02-15 Oxnard,,,1345
1346,Oxnard,5/6/2023,other,,34.2558038688,-119.089990725,1,2023-05-06 Oxnard,,,1347
1347,Oxnard,5/6/2023,other,,34.2027296311,-119.059328857,1,2023-05-06 Oxnard,,,1348
1348,Oxnard,5/6/2023,other,,34.151712839,-119.084618132,1,2023-05-06 Oxnard,,,1349
1349,Oxnard,5/6/2023,other,,34.1743325088,-119.13039962,1,2023-05-06 Oxnard,,,1350
1350,Oxnard,6/13/2022,other,,34.1810984068,-119.127858972,2,2022-06-13 Oxnard,,,1351
1352,Oxnard,11/9/2023,other,,34.1287142089,-119.159848061,1,2023-11-09 Oxnard,,,1353
1353,Oxnard,5/6/2023,other,,34.2020377313,-119.059601388,1,2023-05-06 Oxnard,,,1354
1354,Oxnard,10/17/2023,other,,34.2019949077,-119.066228893,2,2023-10-17 Oxnard,,,1355
1355,Oxnard,5/6/2023,other,,34.175361596,-119.079620695,1,2023-05-06 Oxnard,1275.0,29.30640165448485,1356
1358,Oxnard,5/6/2023,other,,34.2562759458,-119.087413089,1,2023-05-06 Oxnard,1439.0,25.050983236893927,1359
1359,Oxnard,7/13/2021,other,,34.1419013369,-119.149674806,2,2021-07-13 Oxnard,954.0,29.118081408910992,1360
1361,Oxnard,11/9/2023,other,,34.1281627227,-119.157979743,1,2023-11-09 Oxnard,,,1362
1362,Oxnard,10/17/2023,other,,34.2004927109,-119.047128546,2,2023-10-17 Oxnard,,,1363
1363,Oxnard,10/17/2023,other,,34.2000034621,-119.047087689,2,2023-10-17 Oxnard,,,1364
1365,Oxnard,5/6/2023,other,,34.1725451349,-119.079233013,1,2023-05-06 Oxnard,,,1366
1366,Oxnard,6/13/2022,other,,34.1809942724,-119.13336462,2,2022-06-13 Oxnard,1197.0,29.44827365256163,1367
1367,Oxnard,6/13/2022,other,,34.187280187,-119.153517958,2,2022-06-13 Oxnard,,,1368
1368,Oxnard,5/6/2023,other,,34.2555001543,-119.089622234,1,2023-05-06 Oxnard,,,1369
1369,Oxnard,7/13/2021,other,,34.1428306428,-119.148256555,2,2021-07-13 Oxnard,,,1370
1370,Oxnard,10/17/2023,other,,34.2076204889,-119.04784103,2,2023-10-17 Oxnard,1303.0,27.91919518428491,1371
1372,Oxnard,7/13/2021,other,,34.1412417177,-119.150152033,2,2021-07-13 Oxnard,,,1373
1373,Oxnard,5/6/2023,other,,34.1498044497,-119.084480248,1,2023-05-06 Oxnard,,,1374
1374,Oxnard,10/17/2023,other,,34.2034602906,-119.064474784,2,2023-10-17 Oxnard,,,1375
1375,Oxnard,5/6/2023,other,,34.1751032433,-119.078504421,1,2023-05-06 Oxnard,,,1376
1376,Oxnard,7/13/2021,other,,34.1421358088,-119.151052922,2,2021-07-13 Oxnard,1459.0,27.84888088067085,1377
1377,Oxnard,5/6/2023,other,,34.1494204771,-119.0850845,1,2023-05-06 Oxnard,1494.0,28.714030593416798,1378
1378,Oxnard,6/13/2022,other,,34.1883482192,-119.153478062,2,2022-06-13 Oxnard,,,1379
1379,Oxnard,6/13/2022,other,,34.1838448277,-119.15257846,2,2022-06-13 Oxnard,,,1380
1380,Oxnard,2/15/2020,other,,34.2291114248,-119.247803844,1,2020-02-15 Oxnard,,,1381
1381,Oxnard,5/6/2023,other,,34.2610114918,-119.084758128,1,2023-05-06 Oxnard,1465.0,26.1617065863052,1382
1382,Oxnard,6/13/2022,other,,34.1811398261,-119.128997909,2,2022-06-13 Oxnard,,,1383
1383,Oxnard,11/9/2023,other,,34.1295838102,-119.158880952,1,2023-11-09 Oxnard,,,1384
1385,Oxnard,6/13/2022,other,,34.1816638692,-119.129512989,2,2022-06-13 Oxnard,,,1386
1386,Oxnard,5/6/2023,other,,34.2602627444,-119.085891192,1,2023-05-06 Oxnard,,,1387
1387,Oxnard,5/6/2023,other,,34.2607283619,-119.084768152,1,2023-05-06 Oxnard,,,1388
1388,Oxnard,5/6/2023,other,,34.1749522814,-119.130968195,1,2023-05-06 Oxnard,,,1389
1389,Oxnard,11/9/2023,other,,34.1290595992,-119.157759775,1,2023-11-09 Oxnard,,,1390
1390,Oxnard,5/6/2023,other,,34.1739167557,-119.13049123,1,2023-05-06 Oxnard,1524.0,28.012070684857015,1391
1392,Oxnard,5/6/2023,other,,34.2557996028,-119.09139203,1,2023-05-06 Oxnard,,,1393
1393,Oxnard,5/6/2023,other,,34.1739021391,-119.129470895,1,2023-05-06 Oxnard,1412.0,25.97685613456201,1394
1394,Oxnard,5/6/2023,other,,34.2554851736,-119.088034502,1,2023-05-06 Oxnard,,,1395
1397,Oxnard,11/9/2023,other,,34.1281450434,-119.160354409,1,2023-11-09 Oxnard,969.0,26.021013285640343,1398
1398,Oxnard,11/9/2023,other,,34.129110925,-119.159771879,1,2023-11-09 Oxnard,,,1399
1399,Oxnard,5/7/2023,other,,34.2254721762,-119.2432297,2,2023-05-07 Oxnard,,,1400
1400,Oxnard,6/13/2022,other,,34.1816339442,-119.128847795,2,2022-06-13 Oxnard,,,1401
1402,Oxnard,10/17/2023,other,,34.2002257807,-119.045438143,2,2023-10-17 Oxnard,,,1403
1403,Oxnard,10/17/2023,other,,34.2070390046,-119.047023537,2,2023-10-17 Oxnard,1454.0,25.10486589782982,1404
1404,Oxnard,10/17/2023,other,,34.2005562325,-119.046288555,2,2023-10-17 Oxnard,,,1405
1406,Oxnard,2/15/2020,other,,34.2295879545,-119.250174821,1,2020-02-15 Oxnard,,,1407
1407,Oxnard,10/17/2023,other,,34.2067454097,-119.046708465,2,2023-10-17 Oxnard,1515.0,29.5976274319708,1408
1408,Oxnard,5/6/2023,other,,34.1730413799,-119.078634627,1,2023-05-06 Oxnard,,,1409
1409,Oxnard,2/15/2020,other,,34.2295224272,-119.24854419,1,2020-02-15 Oxnard,,,1410
1410,Oxnard,5/6/2023,other,,34.2568963945,-119.091410305,1,2023-05-06 Oxnard,,,1411
1412,Oxnard,11/9/2023,other,,34.1352993841,-119.15642015,1,2023-11-09 Oxnard,,,1413
1413,Oxnard,6/13/2022,other,,34.1820631178,-119.127691179,2,2022-06-13 Oxnard,,,1414
1417,Oxnard,6/13/2022,other,,34.1846373098,-119.152894622,2,2022-06-13 Oxnard,,,1418
1418,Oxnard,5/6/2023,other,,34.1729932168,-119.079955823,1,2023-05-06 Oxnard,,,1419
1419,Oxnard,6/13/2022,other,,34.1838414555,-119.153248197,2,2022-06-13 Oxnard,1582.0,28.964023194464264,1420
1421,Oxnard,5/6/2023,other,,34.254157458,-119.087816355,1,2023-05-06 Oxnard,,,1422
1422,Oxnard,5/6/2023,other,,34.1738123787,-119.131594286,1,2023-05-06 Oxnard,,,1423
1423,Oxnard,5/6/2023,other,,34.1515631754,-119.085359247,1,2023-05-06 Oxnard,,,1424
1425,Oxnard,11/9/2023,other,,34.1339891409,-119.157416333,1,2023-11-09 Oxnard,,,1426
1427,Oxnard,5/6/2023,other,,34.2532416512,-119.089720117,1,2023-05-06 Oxnard,,,1428
1428,Oxnard,10/17/2023,other,,34.204784105,-119.064323942,2,2023-10-17 Oxnard,1581.0,27.76987534819493,1429
1430,Oxnard,11/9/2023,other,,34.128017102,-119.159613897,1,2023-11-09 Oxnard,1041.0,28.822872566952547,1431
1431,Oxnard,5/6/2023,other,,34.2602263171,-119.084604501,1,2023-05-06 Oxnard,1645.0,28.901437171992743,1432
1432,Oxnard,11/9/2023,other,,34.133813473,-119.155232254,1,2023-11-09 Oxnard,1507.0,27.41680640169024,1433
1433,Oxnard,5/6/2023,other,,34.2551517594,-119.090123531,1,2023-05-06 Oxnard,1696.0,26.948018767578827,1434
1434,Oxnard,7/13/2021,other,,34.1425587941,-119.148123065,2,2021-07-13 Oxnard,,,1435
1436,Oxnard,5/6/2023,other,,34.1492093657,-119.083025291,1,2023-05-06 Oxnard,,,1437
1437,Oxnard,5/6/2023,other,,34.2574225385,-119.089120247,1,2023-05-06 Oxnard,,,1438
1440,Oxnard,6/13/2022,other,,34.1813933153,-119.133290065,2,2022-06-13 Oxnard,,,1441
1441,Oxnard,5/6/2023,other,,34.2540710299,-119.088414082,1,2023-05-06 Oxnard,,,1442
1443,Oxnard,7/13/2021,other,,34.1414288032,-119.148931972,2,2021-07-13 Oxnard,968.0,27.25050344922938,1444
1444,Oxnard,5/6/2023,other,,34.2572147497,-119.088758741,1,2023-05-06 Oxnard,,,1445
1445,Oxnard,7/13/2021,other,,34.1423472976,-119.147435807,2,2021-07-13 Oxnard,,,1446
1446,Oxnard,10/17/2023,other,,34.2028537437,-119.064461849,2,2023-10-17 Oxnard,,,1447
1447,Oxnard,10/17/2023,other,,34.2051493382,-119.065923837,2,2023-10-17 Oxnard,,,1448
1448,Oxnard,2/15/2020,other,,34.2291821234,-119.247051871,1,2020-02-15 Oxnard,,,1449
1449,Oxnard,7/13/2021,other,,34.142857551,-119.149439175,2,2021-07-13 Oxnard,,,1450
1450,Oxnard,5/6/2023,other,,34.1501715508,-119.085419805,1,2023-05-06 Oxnard,1014.0,28.964121109900688,1451
1454,Oxnard,7/13/2021,other,,34.1424310214,-119.149679775,2,2021-07-13 Oxnard,,,1455
1455,Oxnard,5/6/2023,other,,34.2024532282,-119.059064869,1,2023-05-06 Oxnard,,,1456
1456,Oxnard,5/6/2023,other,,34.2575880992,-119.090987396,1,2023-05-06 Oxnard,636.0,27.85070032853612,1457
1457,Oxnard,8/19/2019,other,,34.2750512009,-119.05788406,2,2019-08-19 Oxnard,949.0,29.516200937919837,1458
1459,Oxnard,6/13/2022,other,,34.1814813628,-119.127642316,2,2022-06-13 Oxnard,,,1460
1460,Oxnard,7/13/2021,other,,34.1409541117,-119.148328972,2,2021-07-13 Oxnard,,,1461
1462,Oxnard,5/6/2023,other,,34.2544306646,-119.092223184,1,2023-05-06 Oxnard,,,1463
1463,Oxnard,5/6/2023,other,,34.1746197737,-119.131915486,1,2023-05-06 Oxnard,1091.0,25.633583007512108,1464
1465,Oxnard,2/15/2020,other,,34.2288227324,-119.247756615,1,2020-02-15 Oxnard,,,1466
1469,Oxnard,5/6/2023,other,,34.1746923587,-119.129139861,1,2023-05-06 Oxnard,,,1470
1470,Oxnard,5/6/2023,other,,34.1487554393,-119.084903833,1,2023-05-06 Oxnard,,,1471
1471,Oxnard,7/13/2021,other,,34.1422363313,-119.150067854,2,2021-07-13 Oxnard,,,1472
1472,Oxnard,10/17/2023,other,,34.2005244848,-119.046649957,2,2023-10-17 Oxnard,,,1473
1473,Oxnard,5/6/2023,other,,34.2532531793,-119.088229097,1,2023-05-06 Oxnard,,,1474
1475,Oxnard,5/6/2023,other,,34.2580785952,-119.089457585,1,2023-05-06 Oxnard,,,1476
1476,Oxnard,5/6/2023,other,,34.2576712951,-119.088467553,1,2023-05-06 Oxnard,,,1477
1477,Oxnard,8/19/2019,other,,34.2753638002,-119.057942269,2,2019-08-19 Oxnard,,,1478
1478,Oxnard,11/9/2023,other,,34.1333224857,-119.154488414,1,2023-11-09 Oxnard,,,1479
1479,Oxnard,5/7/2023,other,,34.2249818097,-119.241923734,2,2023-05-07 Oxnard,,,1480
1480,Oxnard,7/13/2021,other,,34.1412267209,-119.151035991,2,2021-07-13 Oxnard,,,1481
1481,Oxnard,5/6/2023,other,,34.2539256658,-119.088088432,1,2023-05-06 Oxnard,,,1482
1482,Oxnard,5/6/2023,other,,34.2020451932,-119.057787601,1,2023-05-06 Oxnard,,,1483
1483,Oxnard,6/13/2022,other,,34.1842031091,-119.15345758,2,2022-06-13 Oxnard,,,1484
1484,Oxnard,6/13/2022,other,,34.1817330042,-119.12782523,2,2022-06-13 Oxnard,,,1485
1485,Oxnard,10/17/2023,other,,34.1999004178,-119.046301148,2,2023-10-17 Oxnard,,,1486
1486,Oxnard,5/6/2023,other,,34.1749376349,-119.130611072,1,2023-05-06 Oxnard,,,1487
1487,Oxnard,5/6/2023,other,,34.2018599414,-119.060440146,1,2023-05-06 Oxnard,1564.0,25.345328644952343,1488
1488,Oxnard,5/6/2023,other,,34.2540859258,-119.092674849,1,2023-05-06 Oxnard,,,1489
1491,Oxnard,5/6/2023,other,,34.1741581351,-119.131413451,1,2023-05-06 Oxnard,,,1492
1495,Oxnard,6/13/2022,other,,34.1807298357,-119.132765399,2,2022-06-13 Oxnard,1521.0,28.104137831770657,1496
1497,Oxnard,6/13/2022,other,,34.184712141,-119.152462842,2,2022-06-13 Oxnard,,,1498
1499,Oxnard,5/6/2023,other,,34.2554827067,-119.090138782,1,2023-05-06 Oxnard,1346.0,27.623401912050934,1500
1501,Oxnard,5/6/2023,other,,34.1517261684,-119.083721724,1,2023-05-06 Oxnard,,,1502
1508,Oxnard,5/11/2023,other,,34.2828154914,-119.069158535,1,2023-05-11 Oxnard,,,1509
1509,Oxnard,5/6/2023,other,,34.1747135607,-119.133159768,1,2023-05-06 Oxnard,,,1510
1510,Oxnard,11/9/2023,other,,34.1345510895,-119.155943071,1,2023-11-09 Oxnard,,,1511
1511,Oxnard,11/9/2023,other,,34.1338588875,-119.156573854,1,2023-11-09 Oxnard,,,1512
1512,Oxnard,6/13/2022,other,,34.1876686866,-119.1518802,2,2022-06-13 Oxnard,,,1513
1515,Oxnard,6/13/2022,other,,34.1814729401,-119.128068847,2,2022-06-13 Oxnard,,,1516
1516,Oxnard,11/9/2023,other,,34.1277827426,-119.159111014,1,2023-11-09 Oxnard,1041.0,26.92302707301385,1517
1518,Oxnard,6/13/2022,other,,34.1814169705,-119.130230858,2,2022-06-13 Oxnard,,,1519
1519,Oxnard,10/17/2023,other,,34.2018425639,-119.065380684,2,2023-10-17 Oxnard,,,1520
1522,Oxnard,5/11/2023,other,,34.2833174216,-119.069025392,1,2023-05-11 Oxnard,856.0,25.5296710730904,1523
1524,Oxnard,5/6/2023,other,,34.2543055974,-119.092995318,1,2023-05-06 Oxnard,,,1525
1525,Oxnard,5/6/2023,other,,34.1500908292,-119.082727958,1,2023-05-06 Oxnard,,,1526
1526,Oxnard,10/17/2023,other,,34.1995045667,-119.046121705,2,2023-10-17 Oxnard,1583.0,27.459712796133807,1527
1527,Oxnard,6/13/2022,other,,34.1810912465,-119.131795822,2,2022-06-13 Oxnard,,,1528
1528,Oxnard,5/6/2023,other,,34.1502668914,-119.084516291,1,2023-05-06 Oxnard,,,1529
1532,Oxnard,7/13/2021,other,,34.141836331,-119.148437348,2,2021-07-13 Oxnard,684.0,26.214479510946585,1533
1534,Oxnard,5/6/2023,other,,34.2596017041,-119.085568354,1,2023-05-06 Oxnard,,,1535
1535,Oxnard,5/6/2023,other,,34.1745810741,-119.080690487,1,2023-05-06 Oxnard,,,1536
1536,Oxnard,11/9/2023,other,,34.1350130611,-119.155570419,1,2023-11-09 Oxnard,,,1537
1537,Oxnard,11/9/2023,other,,34.1299746275,-119.160305571,1,2023-11-09 Oxnard,,,1538
1538,Oxnard,5/6/2023,other,,34.151311071,-119.084529691,1,2023-05-06 Oxnard,,,1539
1541,Oxnard,5/7/2023,other,,34.2252631488,-119.243803237,2,2023-05-07 Oxnard,,,1542
1543,Oxnard,6/13/2022,other,,34.1820856498,-119.133353456,2,2022-06-13 Oxnard,,,1544
1544,Oxnard,5/6/2023,other,,34.1510705601,-119.082792061,1,2023-05-06 Oxnard,,,1545
1546,Oxnard,10/17/2023,other,,34.1996273929,-119.04645459,2,2023-10-17 Oxnard,691.0,26.209621601570763,1547
1547,Oxnard,10/17/2023,other,,34.204081103,-119.066242882,2,2023-10-17 Oxnard,,,1548
1549,Oxnard,2/15/2020,other,,34.2288953085,-119.250156938,1,2020-02-15 Oxnard,,,1550
1550,Oxnard,11/9/2023,other,,34.1308108012,-119.15937904,1,2023-11-09 Oxnard,,,1551
1551,Oxnard,5/11/2023,other,,34.2833736359,-119.069562224,1,2023-05-11 Oxnard,856.0,25.31462846992596,1552
1552,Oxnard,5/7/2023,other,,34.2251577334,-119.240836786,2,2023-05-07 Oxnard,1650.0,28.186455678793248,1553
1553,Oxnard,11/9/2023,other,,34.1306403461,-119.160079073,1,2023-11-09 Oxnard,,,1554
1554,Oxnard,6/13/2022,other,,34.1811800959,-119.130980728,2,2022-06-13 Oxnard,,,1555
1555,Oxnard,5/6/2023,other,,34.2575095007,-119.091402042,1,2023-05-06 Oxnard,,,1556
1557,Oxnard,5/6/2023,other,,34.2022625074,-119.058627507,1,2023-05-06 Oxnard,,,1558
1558,Oxnard,5/6/2023,other,,34.2589664773,-119.084751102,1,2023-05-06 Oxnard,,,1559
1560,Oxnard,10/17/2023,other,,34.2059823648,-119.048014064,2,2023-10-17 Oxnard,,,1561
1561,Oxnard,5/6/2023,other,,34.2021953573,-119.057499293,1,2023-05-06 Oxnard,,,1562
1562,Oxnard,5/6/2023,other,,34.2548382902,-119.091841337,1,2023-05-06 Oxnard,,,1563
1564,Oxnard,11/9/2023,other,,34.131273767,-119.158994839,1,2023-11-09 Oxnard,,,1565
1566,Oxnard,10/17/2023,other,,34.204511007,-119.064413151,2,2023-10-17 Oxnard,,,1567
1567,Oxnard,10/17/2023,other,,34.1996485027,-119.047003892,2,2023-10-17 Oxnard,1668.0,25.137729281566184,1568
1569,Oxnard,11/9/2023,other,,34.1277980415,-119.158496056,1,2023-11-09 Oxnard,,,1570
1571,Oxnard,7/13/2021,other,,34.1423005029,-119.152268676,2,2021-07-13 Oxnard,,,1572
1573,Oxnard,11/9/2023,other,,34.1288213372,-119.160361731,1,2023-11-09 Oxnard,,,1574
1575,Oxnard,11/9/2023,other,,34.1341903804,-119.155045895,1,2023-11-09 Oxnard,,,1576
1577,Oxnard,5/6/2023,other,,34.2542810874,-119.093333901,1,2023-05-06 Oxnard,,,1578
1578,Oxnard,11/9/2023,other,,34.1283455793,-119.159305141,1,2023-11-09 Oxnard,976.0,25.5757376718324,1579
1579,Oxnard,6/13/2022,other,,34.1862119155,-119.152833881,2,2022-06-13 Oxnard,,,1580
1584,Oxnard,5/6/2023,other,,34.1499751265,-119.085786255,1,2023-05-06 Oxnard,813.0,28.59470599477241,1585
1585,Oxnard,6/13/2022,other,,34.1864024329,-119.152102418,2,2022-06-13 Oxnard,,,1586
1586,Oxnard,5/6/2023,other,,34.2532407385,-119.092723196,1,2023-05-06 Oxnard,,,1587
1587,Oxnard,5/6/2023,other,,34.2565356077,-119.087315877,1,2023-05-06 Oxnard,,,1588
1588,Oxnard,5/6/2023,other,,34.2602858636,-119.085134936,1,2023-05-06 Oxnard,,,1589
1589,Oxnard,5/6/2023,other,,34.1492468908,-119.085984944,1,2023-05-06 Oxnard,,,1590
1591,Oxnard,5/6/2023,other,,34.2544627713,-119.092567256,1,2023-05-06 Oxnard,,,1592
1592,Oxnard,2/15/2020,other,,34.2296205124,-119.250648857,1,2020-02-15 Oxnard,,,1593
1594,Oxnard,5/6/2023,other,,34.2573363968,-119.087391755,1,2023-05-06 Oxnard,,,1595
1597,Oxnard,10/17/2023,other,,34.2031777804,-119.064163686,2,2023-10-17 Oxnard,,,1598
1601,Oxnard,11/9/2023,other,,34.1336956007,-119.157274567,1,2023-11-09 Oxnard,,,1602
1603,Oxnard,11/9/2023,other,,34.1346338511,-119.157033558,1,2023-11-09 Oxnard,1531.0,26.806295468937194,1604
1604,Oxnard,5/6/2023,other,,34.2542754326,-119.090900384,1,2023-05-06 Oxnard,,,1605
1606,Oxnard,5/6/2023,other,,34.2562055717,-119.087969141,1,2023-05-06 Oxnard,1439.0,27.70346297944377,1607
1607,Oxnard,6/13/2022,other,,34.1837086852,-119.152960285,2,2022-06-13 Oxnard,,,1608
1608,Oxnard,6/13/2022,other,,34.1855257679,-119.1517111,2,2022-06-13 Oxnard,,,1609
1611,Oxnard,5/6/2023,other,,34.2568933244,-119.089250483,1,2023-05-06 Oxnard,,,1612
1612,Oxnard,7/13/2021,other,,34.1429404398,-119.149124869,2,2021-07-13 Oxnard,,,1613
1613,Oxnard,6/13/2022,other,,34.1807327956,-119.129641321,2,2022-06-13 Oxnard,1425.0,29.011211474260264,1614
1615,Oxnard,10/17/2023,other,,34.2062698445,-119.046259088,2,2023-10-17 Oxnard,,,1616
1616,Oxnard,5/6/2023,other,,34.1746602193,-119.079200132,1,2023-05-06 Oxnard,,,1617
1618,Oxnard,11/9/2023,other,,34.127822243,-119.16029089,1,2023-11-09 Oxnard,,,1619
1619,Oxnard,5/6/2023,other,,34.2589218362,-119.084273091,1,2023-05-06 Oxnard,,,1620
1622,Oxnard,5/6/2023,other,,34.1739189409,-119.12900323,1,2023-05-06 Oxnard,,,1623
1624,Oxnard,7/13/2021,other,,34.1425711665,-119.150444519,2,2021-07-13 Oxnard,1671.0,25.901378770047398,1625
1626,Oxnard,6/13/2022,other,,34.1858887835,-119.151794689,2,2022-06-13 Oxnard,1142.0,29.064746224218275,1627
1627,Oxnard,7/13/2021,other,,34.1415187892,-119.150914542,2,2021-07-13 Oxnard,,,1628
1628,Oxnard,5/6/2023,other,,34.151727138,-119.082784235,1,2023-05-06 Oxnard,,,1629
1629,Oxnard,5/6/2023,other,,34.1488018701,-119.083654751,1,2023-05-06 Oxnard,,,1630
1631,Oxnard,11/9/2023,other,,34.1312947131,-119.160278105,1,2023-11-09 Oxnard,,,1632
1632,Oxnard,5/6/2023,other,,34.2550303675,-119.092716576,1,2023-05-06 Oxnard,,,1633
1634,Oxnard,5/6/2023,other,,34.1505710404,-119.086117503,1,2023-05-06 Oxnard,,,1635
1635,Oxnard,5/6/2023,other,,34.151262333,-119.082354848,1,2023-05-06 Oxnard,,,1636
1636,Oxnard,5/6/2023,other,,34.2558003422,-119.089640912,1,2023-05-06 Oxnard,,,1637
1637,Oxnard,5/6/2023,other,,34.1516903267,-119.084084607,1,2023-05-06 Oxnard,,,1638
1639,Oxnard,5/6/2023,other,,34.1743221224,-119.133162907,1,2023-05-06 Oxnard,,,1640
1640,Oxnard,10/17/2023,other,,34.1991886965,-119.047015637,2,2023-10-17 Oxnard,,,1641
1642,Oxnard,6/13/2022,other,,34.1808639997,-119.131573616,2,2022-06-13 Oxnard,,,1643
1646,Oxnard,10/17/2023,other,,34.2022922621,-119.065561714,2,2023-10-17 Oxnard,,,1647
1650,Oxnard,5/6/2023,other,,34.2581102174,-119.087752143,1,2023-05-06 Oxnard,,,1651
1652,Oxnard,6/13/2022,other,,34.1819041461,-119.13168062,2,2022-06-13 Oxnard,,,1653
1653,Oxnard,5/6/2023,other,,34.258166725,-119.088897286,1,2023-05-06 Oxnard,767.0,29.866927566378763,1654
1654,Oxnard,11/9/2023,other,,34.1356824255,-119.156976917,1,2023-11-09 Oxnard,,,1655
1656,Oxnard,11/9/2023,other,,34.1355935349,-119.154449594,1,2023-11-09 Oxnard,942.0,29.83998352911371,1657
1659,Oxnard,5/6/2023,other,,34.2542730813,-119.087376487,1,2023-05-06 Oxnard,777.0,27.11154098832843,1660
1661,Oxnard,6/13/2022,other,,34.1832563163,-119.153488349,2,2022-06-13 Oxnard,1194.0,25.929799030131683,1662
1662,Oxnard,6/13/2022,other,,34.1834257932,-119.151807645,2,2022-06-13 Oxnard,,,1663
1663,Oxnard,5/6/2023,other,,34.1498609868,-119.082373669,1,2023-05-06 Oxnard,,,1664
1664,Oxnard,11/9/2023,other,,34.1295507819,-119.160279366,1,2023-11-09 Oxnard,,,1665
1665,Oxnard,5/6/2023,other,,34.2540704627,-119.092299082,1,2023-05-06 Oxnard,,,1666
1668,Oxnard,5/6/2023,other,,34.173657009,-119.078749686,1,2023-05-06 Oxnard,,,1669
1674,Oxnard,5/7/2023,other,,34.225114999,-119.244864855,2,2023-05-07 Oxnard,,,1675
1676,Oxnard,10/17/2023,other,,34.2039250908,-119.065709988,2,2023-10-17 Oxnard,796.0,28.4995688906654,1677
1678,Oxnard,5/6/2023,other,,34.2028033161,-119.059006837,1,2023-05-06 Oxnard,,,1679
1679,Oxnard,2/15/2020,other,,34.2291829278,-119.249367239,1,2020-02-15 Oxnard,941.0,29.96583274490361,1680
1680,Oxnard,5/6/2023,other,,34.1500999765,-119.083381188,1,2023-05-06 Oxnard,,,1681
1681,Oxnard,5/7/2023,other,,34.2257734679,-119.240944387,2,2023-05-07 Oxnard,,,1682
1682,Oxnard,11/9/2023,other,,34.1339665208,-119.157069807,1,2023-11-09 Oxnard,,,1683
1683,Oxnard,11/9/2023,other,,34.134021976,-119.154470007,1,2023-11-09 Oxnard,,,1684
1685,Oxnard,10/17/2023,other,,34.2042179936,-119.065750519,2,2023-10-17 Oxnard,1040.0,29.30275265271117,1686
1686,Oxnard,5/6/2023,other,,34.2560865389,-119.088441956,1,2023-05-06 Oxnard,1265.0,26.45980776602328,1687
1688,Oxnard,2/15/2020,other,,34.2289515071,-119.248588747,1,2020-02-15 Oxnard,1490.0,29.28423802923044,1689
1690,Oxnard,10/17/2023,other,,34.2062654094,-119.04801817,2,2023-10-17 Oxnard,,,1691
1691,Oxnard,10/17/2023,other,,34.207443324,-119.046249167,2,2023-10-17 Oxnard,,,1692
1692,Oxnard,11/9/2023,other,,34.1303577668,-119.158239656,1,2023-11-09 Oxnard,,,1693
1693,Oxnard,11/9/2023,other,,34.1277781459,-119.15784314,1,2023-11-09 Oxnard,,,1694
1696,Oxnard,11/9/2023,other,,34.1356720234,-119.155457103,1,2023-11-09 Oxnard,,,1697
1698,Watsonville,5/9/2018,mulch,,36.87131450500004,-121.78616731199996,1,2018-05-09 Watsonville,,,1699
1699,Watsonville,5/9/2018,mulch,,36.87121836600005,-121.78663012599996,1,2018-05-09 Watsonville,,,1700
1700,Watsonville,5/9/2018,mulch,,36.87073209000005,-121.78641978599995,1,2018-05-09 Watsonville,,,1701
1701,Watsonville,5/9/2018,mulch,,36.87087884300007,-121.78700023099996,1,2018-05-09 Watsonville,,,1702
1702,Watsonville,5/9/2018,mulch,,36.870413401000064,-121.78701371899996,1,2018-05-09 Watsonville,,,1703
1703,Watsonville,5/9/2018,mulch,,36.87049622300003,-121.78761374199996,1,2018-05-09 Watsonville,,,1704
1704,Watsonville,5/9/2018,mulch,,36.86990185100007,-121.78763636099995,1,2018-05-09 Watsonville,,,1705
1705,Watsonville,5/9/2018,mulch,,36.87014006600003,-121.78820689999996,1,2018-05-09 Watsonville,,,1706
1706,Watsonville,5/9/2018,mulch,,36.869741912000045,-121.78823778199995,1,2018-05-09 Watsonville,,,1707
1707,Watsonville,5/9/2018,mulch,,36.869650945000046,-121.78887788499996,1,2018-05-09 Watsonville,,,1708
1708,Watsonville,5/9/2018,mulch,,36.87079939400007,-121.78559592299996,1,2018-05-09 Watsonville,,,1709
1709,Watsonville,5/9/2018,mulch,,36.87049566400003,-121.78607929199995,1,2018-05-09 Watsonville,,,1710
1710,Watsonville,5/9/2018,mulch,,36.86997530900004,-121.78666338899995,1,2018-05-09 Watsonville,,,1711
1711,Watsonville,5/9/2018,mulch,,36.86971436800008,-121.78704235099995,1,2018-05-09 Watsonville,,,1712
1712,Watsonville,5/9/2018,mulch,,36.86941556700003,-121.78743979399997,1,2018-05-09 Watsonville,,,1713
1713,Watsonville,5/9/2018,mulch,,36.86903332000002,-121.78762217099997,1,2018-05-09 Watsonville,1715.0,23.096861976630425,1714
1715,Watsonville,5/9/2018,mulch,,36.86861836800006,-121.78837604699999,1,2018-05-09 Watsonville,,,1716
1716,Watsonville,5/9/2018,mulch,,36.869100813000045,-121.78870415999997,1,2018-05-09 Watsonville,,,1717
1717,Watsonville,5/9/2018,mulch,,36.86910565000005,-121.78941126899996,1,2018-05-09 Watsonville,,,1718
1718,Watsonville,5/9/2018,mulch,,36.87181041200006,-121.78658717599995,1,2018-05-09 Watsonville,,,1719
1719,Watsonville,5/9/2018,mulch,,36.87189490000002,-121.78705638999996,1,2018-05-09 Watsonville,,,1720
1720,Watsonville,5/9/2018,mulch,,36.87137267500003,-121.78719661999996,1,2018-05-09 Watsonville,,,1721
1721,Watsonville,5/9/2018,mulch,,36.87141189700003,-121.787788074,1,2018-05-09 Watsonville,,,1722
1722,Watsonville,5/9/2018,mulch,,36.870872447000075,-121.78790349499997,1,2018-05-09 Watsonville,,,1723
1723,Watsonville,5/9/2018,mulch,,36.870998428000064,-121.788459935,1,2018-05-09 Watsonville,,,1724
1724,Watsonville,5/9/2018,mulch,,36.870372331000056,-121.78842796599996,1,2018-05-09 Watsonville,,,1725
1725,Watsonville,5/9/2018,mulch,,36.870483842000056,-121.78914447899996,1,2018-05-09 Watsonville,,,1726
1726,Watsonville,5/9/2018,mulch,,36.87010706800004,-121.78898933699996,1,2018-05-09 Watsonville,,,1727
1727,Watsonville,5/9/2018,mulch,,36.869710242000046,-121.789624028,1,2018-05-09 Watsonville,,,1728
1728,Watsonville,5/9/2018,mulch,,36.87249791800008,-121.78715210299998,1,2018-05-09 Watsonville,,,1729
1729,Watsonville,5/9/2018,mulch,,36.87246628700007,-121.78765965199995,1,2018-05-09 Watsonville,,,1730
1730,Watsonville,5/9/2018,mulch,,36.893085549000034,-121.66169513699998,1,2018-05-09 Watsonville,1733.0,23.34876693330651,1731
1731,Watsonville,5/9/2018,mulch,,36.89283164000005,-121.66200443499996,1,2018-05-09 Watsonville,1734.0,20.62477008054955,1732
1735,Watsonville,5/9/2018,mulch,,36.89317941000007,-121.66221341799996,1,2018-05-09 Watsonville,1735.0,22.286823749243087,1736
1739,Watsonville,5/9/2018,mulch,,36.87282506100007,-121.787723428,1,2018-05-09 Watsonville,,,1740
1740,Watsonville,5/9/2018,mulch,,36.871904831000045,-121.78821602999994,1,2018-05-09 Watsonville,,,1741
1741,Watsonville,5/9/2018,mulch,,36.87203509500006,-121.78876692399996,1,2018-05-09 Watsonville,,,1742
1742,Watsonville,5/9/2018,mulch,,36.871411315000046,-121.78892622199999,1,2018-05-09 Watsonville,,,1743
1743,Watsonville,5/9/2018,mulch,,36.871430631000074,-121.78953170099997,1,2018-05-09 Watsonville,,,1744
1744,Watsonville,5/9/2018,mulch,,36.87067754000003,-121.79000678099997,1,2018-05-09 Watsonville,,,1745
1745,Watsonville,5/9/2018,mulch,,36.87071449900003,-121.79070506499994,1,2018-05-09 Watsonville,,,1746
1746,Watsonville,5/9/2018,mulch,,36.87097929700008,-121.79002456599994,1,2018-05-09 Watsonville,,,1747
1747,Watsonville,5/9/2018,mulch,,36.873125497000046,-121.78808144399994,1,2018-05-09 Watsonville,,,1748
1748,Watsonville,5/9/2018,mulch,,36.87314610800007,-121.78877207699996,1,2018-05-09 Watsonville,,,1749
1749,Watsonville,5/9/2018,mulch,,36.87260204200004,-121.78887185599996,1,2018-05-09 Watsonville,,,1750
1750,Watsonville,5/9/2018,mulch,,36.87256746100008,-121.78949833299998,1,2018-05-09 Watsonville,,,1751
1751,Watsonville,5/9/2018,mulch,,36.872052844000045,-121.789585467,1,2018-05-09 Watsonville,,,1752
1752,Watsonville,5/9/2018,mulch,,36.87214759200003,-121.79021022699997,1,2018-05-09 Watsonville,,,1753
1753,Watsonville,5/9/2018,mulch,,36.87154408000004,-121.79033221799995,1,2018-05-09 Watsonville,,,1754
1754,Watsonville,5/9/2018,mulch,,36.87176775300002,-121.79086267099996,1,2018-05-09 Watsonville,,,1755
1755,Watsonville,5/9/2018,mulch,,36.87106913300005,-121.79102277799996,1,2018-05-09 Watsonville,,,1756
1756,Watsonville,5/9/2018,mulch,,36.87136141700007,-121.791153383,1,2018-05-09 Watsonville,,,1757
1757,Watsonville,5/9/2018,mulch,,36.87374040800007,-121.78870879299996,1,2018-05-09 Watsonville,,,1758
1758,Watsonville,5/9/2018,mulch,,36.87317704200007,-121.789515903,1,2018-05-09 Watsonville,,,1759
1759,Watsonville,5/9/2018,mulch,,36.87269854600004,-121.79036571199998,1,2018-05-09 Watsonville,,,1760
1760,Watsonville,5/9/2018,mulch,,36.87215230200008,-121.79111668499996,1,2018-05-09 Watsonville,,,1761
1761,Watsonville,5/9/2018,mulch,,36.871908561000055,-121.79209813799996,1,2018-05-09 Watsonville,,,1762
1762,Watsonville,5/9/2018,mulch,,36.874395381000056,-121.78958706399997,1,2018-05-09 Watsonville,,,1763
1763,Watsonville,5/9/2018,mulch,,36.87469533900003,-121.79073106799996,1,2018-05-09 Watsonville,,,1764
1764,Watsonville,5/9/2018,mulch,,36.87418388000003,-121.792802301,1,2018-05-09 Watsonville,,,1765
1765,Watsonville,5/9/2018,mulch,,36.876299388000064,-121.79206368899996,1,2018-05-09 Watsonville,,,1766
1766,Watsonville,5/9/2018,mulch,,36.86901968200005,-121.79052647499996,1,2018-05-09 Watsonville,,,1767
1767,Watsonville,5/9/2018,mulch,,36.86925095000004,-121.79159345,1,2018-05-09 Watsonville,,,1768
1768,Watsonville,5/9/2018,mulch,,36.86610083900007,-121.79105455099995,1,2018-05-09 Watsonville,,,1769
1769,Watsonville,5/9/2018,mulch,,36.86516381900003,-121.79314815299993,1,2018-05-09 Watsonville,,,1770
1770,Watsonville,5/9/2018,mulch,,36.86855874900005,-121.79271126799993,1,2018-05-09 Watsonville,,,1771
1771,Watsonville,5/9/2018,mulch,,36.87415665800006,-121.79019559399995,1,2018-05-09 Watsonville,,,1772
1772,Watsonville,5/9/2018,mulch,,36.87239356500004,-121.79204482799996,1,2018-05-09 Watsonville,,,1773
1773,Watsonville,5/9/2018,mulch,,36.87302254100007,-121.79138025199995,1,2018-05-09 Watsonville,,,1774
1774,Watsonville,5/9/2018,mulch,,36.87349703700005,-121.79079276299996,1,2018-05-09 Watsonville,,,1775
1775,Watsonville,5/9/2018,mulch,,36.875455362000025,-121.790403863,1,2018-05-09 Watsonville,,,1776
1776,Watsonville,5/9/2018,mulch,,36.87456642000007,-121.79141798399996,1,2018-05-09 Watsonville,,,1777
1777,Watsonville,5/9/2018,mulch,,36.87343596800002,-121.79197642499996,1,2018-05-09 Watsonville,,,1778
1778,Watsonville,5/9/2018,mulch,,36.873822923000034,-121.79218300699993,1,2018-05-09 Watsonville,,,1779
1779,Watsonville,5/9/2018,mulch,,36.87590784700007,-121.79076017199996,1,2018-05-09 Watsonville,,,1780
1780,Watsonville,5/9/2018,mulch,,36.87546768500005,-121.791856409,1,2018-05-09 Watsonville,,,1781
1781,Watsonville,5/9/2018,mulch,,36.87458854000005,-121.79223166399998,1,2018-05-09 Watsonville,,,1782
1782,Watsonville,5/9/2018,mulch,,36.87385270400006,-121.79340738299997,1,2018-05-09 Watsonville,,,1783
1783,Watsonville,5/9/2018,mulch,,36.87405212300007,-121.79435084399996,1,2018-05-09 Watsonville,,,1784
1784,Watsonville,5/9/2018,mulch,,36.87475882600006,-121.79395775699999,1,2018-05-09 Watsonville,,,1785
1785,Watsonville,5/9/2018,mulch,,36.875211300000046,-121.793210279,1,2018-05-09 Watsonville,,,1786
1786,Watsonville,5/9/2018,mulch,,36.876006105000044,-121.79278312499996,1,2018-05-09 Watsonville,,,1787
1787,Watsonville,5/9/2018,mulch,,36.86825354400003,-121.79152373899996,1,2018-05-09 Watsonville,,,1788
1788,Watsonville,5/9/2018,mulch,,36.868581049000056,-121.79161279799996,1,2018-05-09 Watsonville,,,1789
1789,Watsonville,5/9/2018,mulch,,36.868739412000025,-121.79104830099998,1,2018-05-09 Watsonville,,,1790
1790,Watsonville,5/9/2018,mulch,,36.86930633300005,-121.790594667,1,2018-05-09 Watsonville,,,1791
1791,Watsonville,5/9/2018,mulch,,36.869622855000046,-121.790776097,1,2018-05-09 Watsonville,,,1792
1792,Watsonville,5/9/2018,mulch,,36.86981285500008,-121.79115256299995,1,2018-05-09 Watsonville,,,1793
1793,Watsonville,5/9/2018,mulch,,36.86910140800006,-121.79227876799996,1,2018-05-09 Watsonville,,,1794
1794,Watsonville,5/9/2018,mulch,,36.868760304000034,-121.79200104199998,1,2018-05-09 Watsonville,,,1795
1795,Watsonville,5/9/2018,mulch,,36.86886455800004,-121.79280093399996,1,2018-05-09 Watsonville,,,1796
1796,Watsonville,5/9/2018,mulch,,36.86819535000007,-121.79346577099994,1,2018-05-09 Watsonville,,,1797
1797,Watsonville,5/9/2018,mulch,,36.86833358500007,-121.79419443499997,1,2018-05-09 Watsonville,,,1798
1798,Watsonville,5/9/2018,mulch,,36.86855793800004,-121.79325137099994,1,2018-05-09 Watsonville,,,1799
1799,Watsonville,5/9/2018,mulch,,36.86607167200003,-121.79157575199996,1,2018-05-09 Watsonville,,,1800
1800,Watsonville,5/9/2018,mulch,,36.865910003000074,-121.79212722299997,1,2018-05-09 Watsonville,,,1801
1801,Watsonville,5/9/2018,mulch,,36.86601874200005,-121.79303510799996,1,2018-05-09 Watsonville,,,1802
1802,Watsonville,5/9/2018,mulch,,36.86627786100007,-121.79397598099996,1,2018-05-09 Watsonville,,,1803
1803,Watsonville,5/9/2018,mulch,,36.86438488600004,-121.79176077399995,1,2018-05-09 Watsonville,,,1804
1804,Watsonville,5/9/2018,mulch,,36.86455715900007,-121.79229794999996,1,2018-05-09 Watsonville,,,1805
1805,Watsonville,5/9/2018,mulch,,36.86453806500003,-121.79314944999997,1,2018-05-09 Watsonville,,,1806
1806,Watsonville,5/9/2018,mulch,,36.86517110700004,-121.79175914899996,1,2018-05-09 Watsonville,,,1807
1807,Watsonville,5/9/2018,hoop,,36.90780609900003,-121.73816073299996,1,2018-05-09 Watsonville,,,1808
1808,Watsonville,5/9/2018,hoop,,36.90782565800004,-121.73858836799997,1,2018-05-09 Watsonville,,,1809
1809,Watsonville,5/9/2018,hoop,,36.907581038000046,-121.73873552699996,1,2018-05-09 Watsonville,,,1810
1810,Watsonville,5/9/2018,hoop,,36.90785287500007,-121.73910779899995,1,2018-05-09 Watsonville,,,1811
1811,Watsonville,5/9/2018,hoop,,36.907685076000064,-121.73956985199997,1,2018-05-09 Watsonville,,,1812
1812,Watsonville,5/9/2018,hoop,,36.90784792000005,-121.73999686199994,1,2018-05-09 Watsonville,,,1813
1813,Watsonville,5/9/2018,hoop,,36.90770656700005,-121.74054350999997,1,2018-05-09 Watsonville,,,1814
1814,Watsonville,5/9/2018,hoop,,36.90789484700008,-121.74085801899996,1,2018-05-09 Watsonville,,,1815
1815,Watsonville,5/9/2018,hoop,,36.90769531900003,-121.74164567799994,1,2018-05-09 Watsonville,,,1816
1816,Watsonville,5/9/2018,hoop,,36.907943129000046,-121.74133441499998,1,2018-05-09 Watsonville,,,1817
1817,Watsonville,5/9/2018,hoop,,36.90684358900006,-121.73801524799995,1,2018-05-09 Watsonville,,,1818
1818,Watsonville,5/9/2018,hoop,,36.90724147000003,-121.73809133099996,1,2018-05-09 Watsonville,,,1819
1819,Watsonville,5/9/2018,hoop,,36.907130712000026,-121.738472318,1,2018-05-09 Watsonville,,,1820
1820,Watsonville,5/9/2018,hoop,,36.90724908200008,-121.73917223899996,1,2018-05-09 Watsonville,,,1821
1821,Watsonville,5/9/2018,hoop,,36.906981048000034,-121.73954575799996,1,2018-05-09 Watsonville,,,1822
1822,Watsonville,5/9/2018,hoop,,36.90728130300005,-121.73976546199998,1,2018-05-09 Watsonville,,,1823
1823,Watsonville,5/9/2018,hoop,,36.906956869000055,-121.74005882899996,1,2018-05-09 Watsonville,,,1824
1824,Watsonville,5/9/2018,hoop,,36.90726932900003,-121.74041905599996,1,2018-05-09 Watsonville,,,1825
1825,Watsonville,5/9/2018,hoop,,36.90697330500007,-121.74080871599995,1,2018-05-09 Watsonville,,,1826
1826,Watsonville,5/9/2018,hoop,,36.907292822000045,-121.74102513099996,1,2018-05-09 Watsonville,,,1827
1827,Watsonville,5/9/2018,hoop,,36.90654135100005,-121.73802538299996,1,2018-05-09 Watsonville,,,1828
1828,Watsonville,5/9/2018,hoop,,36.906432789000064,-121.73869491799996,1,2018-05-09 Watsonville,,,1829
1829,Watsonville,5/9/2018,hoop,,36.90656028200005,-121.73909624699996,1,2018-05-09 Watsonville,,,1830
1830,Watsonville,5/9/2018,hoop,,36.90630742800005,-121.73954859199993,1,2018-05-09 Watsonville,,,1831
1831,Watsonville,5/9/2018,hoop,,36.90660484600005,-121.73980265199998,1,2018-05-09 Watsonville,,,1832
1832,Watsonville,5/9/2018,hoop,,36.90633768400005,-121.74027073599996,1,2018-05-09 Watsonville,,,1833
1833,Watsonville,5/9/2018,hoop,,36.906569054000045,-121.74045865199996,1,2018-05-09 Watsonville,,,1834
1834,Watsonville,5/9/2018,hoop,,36.90665369000004,-121.74087299799999,1,2018-05-09 Watsonville,,,1835
1835,Watsonville,5/9/2018,hoop,,36.90630132800004,-121.74116104599995,1,2018-05-09 Watsonville,,,1836
1836,Watsonville,5/9/2018,hoop,,36.90665654500003,-121.74147720399996,1,2018-05-09 Watsonville,,,1837
1837,Watsonville,5/9/2018,hoop,,36.90586586400008,-121.73804470399995,1,2018-05-09 Watsonville,,,1838
1838,Watsonville,5/9/2018,hoop,,36.90548740000003,-121.73873522999996,1,2018-05-09 Watsonville,,,1839
1839,Watsonville,5/9/2018,hoop,,36.90593662500004,-121.73871121299997,1,2018-05-09 Watsonville,,,1840
1840,Watsonville,5/9/2018,hoop,,36.90552210800007,-121.73919249899996,1,2018-05-09 Watsonville,1849.0,28.59205966812073,1841
1841,Watsonville,5/9/2018,hoop,,36.905952652000046,-121.73943755199996,1,2018-05-09 Watsonville,,,1842
1842,Watsonville,5/9/2018,hoop,,36.90565070300005,-121.73987654999996,1,2018-05-09 Watsonville,,,1843
1843,Watsonville,5/9/2018,hoop,,36.90594226700006,-121.74043518199994,1,2018-05-09 Watsonville,,,1844
1844,Watsonville,5/9/2018,hoop,,36.90562938600005,-121.74107043099995,1,2018-05-09 Watsonville,,,1845
1845,Watsonville,5/9/2018,hoop,,36.90588555200002,-121.74153022799997,1,2018-05-09 Watsonville,,,1846
1846,Watsonville,5/9/2018,hoop,,36.90567699400003,-121.74220565199992,1,2018-05-09 Watsonville,,,1847
1847,Watsonville,5/9/2018,hoop,,36.904999556000064,-121.73871228699994,1,2018-05-09 Watsonville,,,1848
1849,Watsonville,5/9/2018,hoop,,36.904939557000034,-121.739582687,1,2018-05-09 Watsonville,,,1850
1850,Watsonville,5/9/2018,hoop,,36.90520291200005,-121.73971894299996,1,2018-05-09 Watsonville,,,1851
1851,Watsonville,5/9/2018,hoop,,36.90504203000006,-121.74000270299996,1,2018-05-09 Watsonville,,,1852
1852,Watsonville,5/9/2018,hoop,,36.908432221000055,-121.74283170099994,1,2018-05-09 Watsonville,,,1853
1853,Watsonville,5/9/2018,hoop,,36.90848070000004,-121.74341680099997,1,2018-05-09 Watsonville,,,1854
1854,Watsonville,5/9/2018,hoop,,36.90863657600005,-121.74396140599998,1,2018-05-09 Watsonville,,,1855
1855,Watsonville,5/9/2018,hoop,,36.908478006000045,-121.74437015399997,1,2018-05-09 Watsonville,,,1856
1856,Watsonville,5/9/2018,hoop,,36.908734993000046,-121.744786719,1,2018-05-09 Watsonville,,,1857
1857,Watsonville,5/9/2018,hoop,,36.90806810500004,-121.74293284199996,1,2018-05-09 Watsonville,,,1858
1858,Watsonville,5/9/2018,hoop,,36.90776917100004,-121.74344863699996,1,2018-05-09 Watsonville,,,1859
1859,Watsonville,5/9/2018,hoop,,36.90805874200004,-121.74384826299996,1,2018-05-09 Watsonville,,,1860
1860,Watsonville,5/9/2018,hoop,,36.908030558000064,-121.74449253799996,1,2018-05-09 Watsonville,,,1861
1861,Watsonville,5/9/2018,hoop,,36.908013881000045,-121.74500358799996,1,2018-05-09 Watsonville,,,1862
1862,Watsonville,5/9/2018,hoop,,36.90735436200004,-121.74288553599996,1,2018-05-09 Watsonville,,,1863
1863,Watsonville,5/9/2018,hoop,,36.90711740900008,-121.74329341699996,1,2018-05-09 Watsonville,,,1864
1864,Watsonville,5/9/2018,hoop,,36.90742076800007,-121.743700145,1,2018-05-09 Watsonville,,,1865
1865,Watsonville,5/9/2018,hoop,,36.90713328100002,-121.74421321299997,1,2018-05-09 Watsonville,,,1866
1866,Watsonville,5/9/2018,hoop,,36.90743053700004,-121.74460559199996,1,2018-05-09 Watsonville,,,1867
1867,Watsonville,5/9/2018,hoop,,36.90667314800004,-121.74470728699998,1,2018-05-09 Watsonville,,,1868
1868,Watsonville,5/9/2018,hoop,,36.90632313900005,-121.74498073899996,1,2018-05-09 Watsonville,1872.0,25.785752910934267,1869
1870,Watsonville,5/9/2018,hoop,,36.90670863900005,-121.74527034999994,1,2018-05-09 Watsonville,1872.0,27.62329277638433,1871
1872,Watsonville,5/9/2018,hoop,,36.90705031600004,-121.74565695799998,1,2018-05-09 Watsonville,,,1873
1873,Watsonville,5/9/2018,hoop,,36.90745593200006,-121.74574842199996,1,2018-05-09 Watsonville,,,1874
1874,Watsonville,5/9/2018,hoop,,36.90783851600003,-121.74563542099996,1,2018-05-09 Watsonville,,,1875
1875,Watsonville,5/9/2018,hoop,,36.907107214000064,-121.74608786699996,1,2018-05-09 Watsonville,1877.0,26.885194559138736,1876
1877,Watsonville,5/9/2018,hoop,,36.90193202700004,-121.73864572099995,1,2018-05-09 Watsonville,,,1878
1878,Watsonville,5/9/2018,hoop,,36.90232473000003,-121.742184297,1,2018-05-09 Watsonville,,,1879
1879,Watsonville,5/9/2018,hoop,,36.90208932600007,-121.74113520799995,1,2018-05-09 Watsonville,,,1880
1880,Watsonville,5/9/2018,hoop,,36.90215814600003,-121.73979997699996,1,2018-05-09 Watsonville,,,1881
1881,Watsonville,5/9/2018,hoop,,36.90234455500007,-121.74086366499994,1,2018-05-09 Watsonville,,,1882
1882,Watsonville,5/9/2018,hoop,,36.90277037200008,-121.73869886899996,1,2018-05-09 Watsonville,,,1883
1883,Watsonville,5/9/2018,hoop,,36.903109724000046,-121.73955236999996,1,2018-05-09 Watsonville,,,1884
1884,Watsonville,5/9/2018,hoop,,36.90275514500007,-121.74016686899996,1,2018-05-09 Watsonville,,,1885
1885,Watsonville,5/9/2018,hoop,,36.90312252300004,-121.74072392699996,1,2018-05-09 Watsonville,,,1886
1886,Watsonville,5/9/2018,hoop,,36.902994629000034,-121.74148792799996,1,2018-05-09 Watsonville,,,1887
1887,Watsonville,5/9/2018,hoop,,36.90354735100004,-121.73879079999995,1,2018-05-09 Watsonville,,,1888
1888,Watsonville,5/9/2018,hoop,,36.90394036300006,-121.73927736299999,1,2018-05-09 Watsonville,,,1889
1889,Watsonville,5/9/2018,hoop,,36.903617809000025,-121.740090598,1,2018-05-09 Watsonville,,,1890
1890,Watsonville,5/9/2018,hoop,,36.90395849500004,-121.74042745899997,1,2018-05-09 Watsonville,,,1891
1891,Watsonville,5/9/2018,hoop,,36.903508317000046,-121.74144880899996,1,2018-05-09 Watsonville,,,1892
1892,Watsonville,5/9/2018,hoop,,36.90201598800007,-121.742688333,1,2018-05-09 Watsonville,,,1893
1893,Watsonville,5/9/2018,hoop,,36.90241418800008,-121.74341335199993,1,2018-05-09 Watsonville,,,1894
1894,Watsonville,5/9/2018,hoop,,36.90207796100003,-121.74409539399994,1,2018-05-09 Watsonville,,,1895
1895,Watsonville,5/9/2018,hoop,,36.90238305300005,-121.74468010499999,1,2018-05-09 Watsonville,,,1896
1896,Watsonville,5/9/2018,hoop,,36.90216247300003,-121.74569349599994,1,2018-05-09 Watsonville,,,1897
1897,Watsonville,5/9/2018,hoop,,36.90284082900007,-121.74284456599996,1,2018-05-09 Watsonville,,,1898
1898,Watsonville,5/9/2018,hoop,,36.90322559600003,-121.74358589199994,1,2018-05-09 Watsonville,,,1899
1899,Watsonville,5/9/2018,hoop,,36.902806690000034,-121.74399259899997,1,2018-05-09 Watsonville,,,1900
1900,Watsonville,5/9/2018,hoop,,36.90331048600007,-121.744750867,1,2018-05-09 Watsonville,,,1901
1901,Watsonville,5/9/2018,hoop,,36.90284317200008,-121.74540754299994,1,2018-05-09 Watsonville,,,1902
1902,Watsonville,5/9/2018,hoop,,36.90359023800005,-121.74278811299996,1,2018-05-09 Watsonville,,,1903
1903,Watsonville,5/9/2018,hoop,,36.90368503000008,-121.74360540699996,1,2018-05-09 Watsonville,,,1904
1904,Watsonville,5/9/2018,hoop,,36.904090778000075,-121.74405718299992,1,2018-05-09 Watsonville,,,1905
1905,Watsonville,5/9/2018,hoop,,36.903698709000025,-121.74472457299998,1,2018-05-09 Watsonville,,,1906
1906,Watsonville,5/9/2018,hoop,,36.90391877100007,-121.74533900199998,1,2018-05-09 Watsonville,,,1907
1907,Watsonville,5/9/2018,hoop,,36.90363368900007,-121.74597132099996,1,2018-05-09 Watsonville,,,1908
1908,Watsonville,5/9/2018,other,,36.92209392400008,-121.73460643599996,1,2018-05-09 Watsonville,,,1909
1909,Watsonville,5/9/2018,other,,36.91970474200008,-121.73568117899998,1,2018-05-09 Watsonville,,,1910
1910,Watsonville,5/9/2018,other,,36.92220553400006,-121.73845647699994,1,2018-05-09 Watsonville,,,1911
1911,Watsonville,5/9/2018,other,,36.923010119000025,-121.73837485099995,1,2018-05-09 Watsonville,,,1912
1912,Watsonville,5/9/2018,other,,36.92099991500004,-121.73604058199999,1,2018-05-09 Watsonville,,,1913
1914,Watsonville,5/9/2018,other,,36.916721473000045,-121.73400992799996,1,2018-05-09 Watsonville,1924.0,9.777628620851656,1915
1915,Watsonville,5/9/2018,other,,36.91685501300003,-121.73329547099996,1,2018-05-09 Watsonville,,,1916
1916,Watsonville,5/9/2018,other,,36.91709906300008,-121.73304747099996,1,2018-05-09 Watsonville,1925.0,29.54728882278227,1917
1917,Watsonville,5/9/2018,other,,36.91711706500007,-121.73339938699996,1,2018-05-09 Watsonville,,,1918
1918,Watsonville,5/9/2018,other,,36.91738155600007,-121.73366623399994,1,2018-05-09 Watsonville,,,1919
1919,Watsonville,5/9/2018,other,,36.917008829000046,-121.73391757199992,1,2018-05-09 Watsonville,1914.0,23.19584324957575,1920
1920,Watsonville,5/9/2018,other,,36.91747335000008,-121.73315975499996,1,2018-05-09 Watsonville,,,1921
1921,Watsonville,5/9/2018,other,,36.91709590800008,-121.73238149899998,1,2018-05-09 Watsonville,,,1922
1922,Watsonville,5/9/2018,other,,36.916544790000046,-121.73352198099995,1,2018-05-09 Watsonville,,,1923
1925,Watsonville,5/9/2018,other,,36.91629491000003,-121.73422325799999,1,2018-05-09 Watsonville,,,1926
1926,Watsonville,5/9/2018,other,,36.91656407100004,-121.73444827599997,1,2018-05-09 Watsonville,,,1927
1927,Watsonville,5/9/2018,other,,36.91783012300005,-121.73203883999996,1,2018-05-09 Watsonville,,,1928
1928,Watsonville,5/9/2018,other,,36.918628170000034,-121.73191110399993,1,2018-05-09 Watsonville,,,1929
1929,Watsonville,5/9/2018,other,,36.91835279800006,-121.73170517099997,1,2018-05-09 Watsonville,,,1930
1930,Watsonville,5/9/2018,other,,36.91929786300005,-121.732182804,1,2018-05-09 Watsonville,,,1931
1931,Watsonville,5/9/2018,other,,36.917292891000045,-121.73068691599995,1,2018-05-09 Watsonville,,,1932
1932,Watsonville,5/9/2018,other,,36.917547728000045,-121.73047313899995,1,2018-05-09 Watsonville,,,1933
1933,Watsonville,5/9/2018,other,,36.91779621000006,-121.73079513199995,1,2018-05-09 Watsonville,1935.0,26.002776247702524,1934
1935,Watsonville,5/9/2018,other,,36.918235466000056,-121.73084805599996,1,2018-05-09 Watsonville,1935.0,28.779689030936385,1936
1936,Watsonville,5/9/2018,other,,36.91859970500008,-121.73076564799997,1,2018-05-09 Watsonville,1938.0,23.138280186076813,1937
1938,Watsonville,5/9/2018,other,,36.91888801400006,-121.730806084,1,2018-05-09 Watsonville,1938.0,23.064267611659087,1939
1939,Watsonville,5/9/2018,other,,36.919079372000056,-121.731121799,1,2018-05-09 Watsonville,1941.0,26.76903933014829,1940
1941,Watsonville,5/9/2018,other,,36.919576549000055,-121.73115960599993,1,2018-05-09 Watsonville,,,1942
1942,Watsonville,5/9/2018,other,,36.91634809900006,-121.732420091,1,2018-05-09 Watsonville,,,1943
1943,Watsonville,5/9/2018,other,,36.91595322900002,-121.73222738399994,1,2018-05-09 Watsonville,,,1944
1944,Watsonville,5/9/2018,other,,36.915486660000056,-121.73165934199994,1,2018-05-09 Watsonville,,,1945
1945,Watsonville,5/9/2018,other,,36.91477336700007,-121.73090985699996,1,2018-05-09 Watsonville,1947.0,27.3560113288002,1946
1947,Watsonville,5/9/2018,other,,36.91439583800008,-121.73035470899998,1,2018-05-09 Watsonville,,,1948
1948,Watsonville,5/9/2018,other,,36.91390238400004,-121.73038116999999,1,2018-05-09 Watsonville,,,1949
1949,Watsonville,5/9/2018,other,,36.914025122000055,-121.729928127,1,2018-05-09 Watsonville,,,1950
1950,Watsonville,5/9/2018,other,,36.90511904500005,-121.77876622899998,1,2018-05-09 Watsonville,,,1951
1951,Watsonville,5/9/2018,other,,36.90548409000007,-121.77886647899999,1,2018-05-09 Watsonville,,,1952
1952,Watsonville,5/9/2018,other,,36.90582271900007,-121.77956575899996,1,2018-05-09 Watsonville,,,1953
1953,Watsonville,5/9/2018,other,,36.91449283000002,-121.73000962999998,1,2018-05-09 Watsonville,,,1954
1954,Watsonville,5/9/2018,other,,36.91475022800006,-121.72984710199997,1,2018-05-09 Watsonville,,,1955
1955,Watsonville,5/9/2018,other,,36.91495438300007,-121.72948042499996,1,2018-05-09 Watsonville,,,1956
1956,Watsonville,5/9/2018,other,,36.91493925500004,-121.73024496099998,1,2018-05-09 Watsonville,,,1957
1957,Watsonville,5/9/2018,other,,36.90614003500008,-121.77929905399996,1,2018-05-09 Watsonville,,,1958
1958,Watsonville,5/9/2018,other,,36.90647537700005,-121.77938348699996,1,2018-05-09 Watsonville,,,1959
1959,Watsonville,5/9/2018,other,,36.90428818200007,-121.77825591499997,1,2018-05-09 Watsonville,,,1960
1960,Watsonville,5/9/2018,other,,36.906883704000045,-121.77993406399996,1,2018-05-09 Watsonville,,,1961
1961,Watsonville,5/9/2018,other,,36.90502563800004,-121.77709775799995,1,2018-05-09 Watsonville,,,1962
1962,Watsonville,5/9/2018,other,,36.90829888200005,-121.77598574899996,1,2018-05-09 Watsonville,,,1963
1963,Watsonville,5/9/2018,other,,36.90524233900004,-121.77969821999994,1,2018-05-09 Watsonville,,,1964
1964,Watsonville,5/9/2018,other,,36.905713392000045,-121.78010966999994,1,2018-05-09 Watsonville,,,1965
1965,Watsonville,5/9/2018,other,,36.90177911400008,-121.77446006099996,1,2018-05-09 Watsonville,,,1966
1966,Watsonville,5/9/2018,other,,36.90146888700008,-121.77483342799997,1,2018-05-09 Watsonville,,,1967
1967,Watsonville,5/9/2018,other,,36.90131135300004,-121.77420566499995,1,2018-05-09 Watsonville,,,1968
1968,Watsonville,5/9/2018,other,,36.90280018600004,-121.77318802899998,1,2018-05-09 Watsonville,,,1969
1969,Watsonville,5/9/2018,other,,36.90126137900006,-121.775631407,1,2018-05-09 Watsonville,,,1970
1970,Watsonville,5/9/2018,other,,36.90003070500006,-121.77612361799999,1,2018-05-09 Watsonville,,,1971
1971,Watsonville,5/9/2018,other,,36.90076547900002,-121.77537779599999,1,2018-05-09 Watsonville,,,1972
1972,Watsonville,5/9/2018,other,,36.90005421400008,-121.77704015699997,1,2018-05-09 Watsonville,,,1973
1973,Watsonville,5/9/2018,other,,36.904278568000045,-121.77449480399996,1,2018-05-09 Watsonville,,,1974
1974,Watsonville,5/9/2018,other,,36.90160090000006,-121.77368525399999,1,2018-05-09 Watsonville,,,1975
1975,Watsonville,5/9/2018,other,,36.90332723200004,-121.77197539899998,1,2018-05-09 Watsonville,,,1976
1976,Watsonville,5/9/2018,other,,36.903366451000075,-121.77234420199994,1,2018-05-09 Watsonville,,,1977
1977,Watsonville,5/9/2018,other,,36.90234557900004,-121.77209476899996,1,2018-05-09 Watsonville,,,1978
1978,Watsonville,5/9/2018,other,,36.903358464000064,-121.77047600299994,1,2018-05-09 Watsonville,,,1979
1979,Watsonville,5/9/2018,other,,36.90358774600002,-121.77084906999994,1,2018-05-09 Watsonville,,,1980
1980,Watsonville,5/9/2018,other,,36.903724330000045,-121.77052717199996,1,2018-05-09 Watsonville,,,1981
1981,Watsonville,5/9/2018,other,,36.90427103200005,-121.770619394,1,2018-05-09 Watsonville,1983.0,25.758145469220025,1982
1983,Watsonville,5/9/2018,other,,36.90498746600008,-121.77005017199996,1,2018-05-09 Watsonville,,,1984
1984,Watsonville,5/9/2018,other,,36.90414359900007,-121.76771009499998,1,2018-05-09 Watsonville,,,1985
1985,Watsonville,5/9/2018,other,,36.90323961100006,-121.76817234299995,1,2018-05-09 Watsonville,,,1986
1986,Watsonville,5/9/2018,other,,36.90493417700003,-121.76889496399995,1,2018-05-09 Watsonville,,,1987
1987,Watsonville,5/9/2018,other,,36.90238087400007,-121.76771380999996,1,2018-05-09 Watsonville,,,1988
1988,Watsonville,5/9/2018,other,,36.90398857400004,-121.76633460699996,1,2018-05-09 Watsonville,,,1989
1989,Watsonville,5/9/2018,other,,36.90427542800006,-121.76579037199996,1,2018-05-09 Watsonville,,,1990
1990,Watsonville,5/9/2018,other,,36.90267528000004,-121.76539374999999,1,2018-05-09 Watsonville,,,1991
1991,Watsonville,5/9/2018,other,,36.90529235500002,-121.76414242799996,1,2018-05-09 Watsonville,,,1992
1992,Watsonville,5/9/2018,other,,36.90684071000004,-121.76605791199997,1,2018-05-09 Watsonville,,,1993
1993,Watsonville,5/9/2018,other,,36.90321591800006,-121.76718479399995,1,2018-05-09 Watsonville,,,1994
1994,Watsonville,5/9/2018,other,,36.90114489900003,-121.76539770599997,1,2018-05-09 Watsonville,,,1995
1995,Watsonville,5/9/2018,other,,36.90177642700007,-121.76455059499995,1,2018-05-09 Watsonville,,,1996
1996,Watsonville,5/9/2018,other,,36.90171631200008,-121.76608959099995,1,2018-05-09 Watsonville,,,1997
1997,Watsonville,5/9/2018,other,,36.90371146200005,-121.76130092199996,1,2018-05-09 Watsonville,,,1998
1998,Watsonville,5/9/2018,other,,36.90408395000002,-121.761570485,1,2018-05-09 Watsonville,,,1999
1999,Watsonville,5/9/2018,other,,36.902546718000046,-121.762539431,1,2018-05-09 Watsonville,,,2000
2000,Watsonville,5/9/2018,other,,36.89937001700002,-121.76860068599996,1,2018-05-09 Watsonville,,,2001
2001,Watsonville,5/9/2018,other,,36.90070216800007,-121.76929989899996,1,2018-05-09 Watsonville,,,2002
2002,Watsonville,5/9/2018,other,,36.905456108000074,-121.76145326399995,1,2018-05-09 Watsonville,,,2003
2003,Watsonville,5/9/2018,other,,36.90713409500007,-121.76134919999998,1,2018-05-09 Watsonville,,,2004
2004,Watsonville,5/9/2018,other,,36.90651553200007,-121.76046935499994,1,2018-05-09 Watsonville,,,2005
2005,Watsonville,5/9/2018,other,,36.90689893200005,-121.76495900299994,1,2018-05-09 Watsonville,,,2006
2006,Watsonville,5/9/2018,other,,36.908060146000025,-121.76507543699996,1,2018-05-09 Watsonville,,,2007
2007,Watsonville,5/9/2018,other,,36.904732508000045,-121.76512220799998,1,2018-05-09 Watsonville,,,2008
2008,Watsonville,5/9/2018,mulch,,36.892881542000055,-121.66283682199996,1,2018-05-09 Watsonville,2011.0,20.906065966190077,2009
2009,Watsonville,5/9/2018,mulch,,36.89316905600003,-121.66274691199997,1,2018-05-09 Watsonville,1739.0,22.517661117634194,2010
2012,Watsonville,5/9/2018,mulch,,36.89291873600007,-121.66328833899996,1,2018-05-09 Watsonville,2015.0,14.725441105358096,2013
2013,Watsonville,5/9/2018,mulch,,36.89333148000002,-121.66324623099996,1,2018-05-09 Watsonville,2012.0,21.165675311749787,2014
2017,Watsonville,5/9/2018,mulch,,36.89342553700004,-121.663755542,1,2018-05-09 Watsonville,2021.0,18.490892314755943,2018
2018,Watsonville,5/9/2018,mulch,,36.89312497500004,-121.66372320499994,1,2018-05-09 Watsonville,2017.0,18.04821319610143,2019
2021,Watsonville,5/9/2018,mulch,,36.89320856400008,-121.66415205699997,1,2018-05-09 Watsonville,2023.0,17.26639725024733,2022
2023,Watsonville,5/9/2018,mulch,,36.89349580400005,-121.66421929499997,1,2018-05-09 Watsonville,2023.0,16.84880631597769,2024
2024,Watsonville,5/9/2018,mulch,,36.89317077100003,-121.66458238399996,1,2018-05-09 Watsonville,2027.0,15.857562031804656,2025
2027,Watsonville,5/9/2018,mulch,,36.89358880100008,-121.66481196099994,1,2018-05-09 Watsonville,2026.0,25.86741225676312,2028
2028,Watsonville,5/9/2018,mulch,,36.89327551200006,-121.66508348999996,1,2018-05-09 Watsonville,2030.0,16.724605494724297,2029
2030,Watsonville,5/9/2018,mulch,,36.89362511000007,-121.66515046999996,1,2018-05-09 Watsonville,2030.0,22.595910089635524,2031
2034,Watsonville,5/9/2018,mulch,,36.89373216000007,-121.66570052799995,1,2018-05-09 Watsonville,2033.0,23.247813423552003,2035
2035,Watsonville,5/9/2018,mulch,,36.893452671000034,-121.66570338399998,1,2018-05-09 Watsonville,2034.0,24.002615948063625,2036
2040,Watsonville,5/9/2018,mulch,,36.89348835700002,-121.66640343299996,1,2018-05-09 Watsonville,2043.0,24.701984627366468,2041
2043,Watsonville,5/9/2018,mulch,,36.89396545100004,-121.66677355899996,1,2018-05-09 Watsonville,2042.0,27.360156317941765,2044
2045,Watsonville,5/9/2018,mulch,,36.89378800600008,-121.66715783199999,1,2018-05-09 Watsonville,2045.0,25.339994809202373,2046
2046,Watsonville,5/9/2018,mulch,,36.89405368600006,-121.66723215299999,1,2018-05-09 Watsonville,2049.0,29.753961323764933,2047
2047,Watsonville,5/9/2018,mulch,,36.89369265400006,-121.66750147799996,1,2018-05-09 Watsonville,2050.0,18.74971705035925,2048
2050,Watsonville,5/9/2018,mulch,,36.89418283400005,-121.66782368799994,1,2018-05-09 Watsonville,2049.0,26.77660927551505,2051
2051,Watsonville,5/9/2018,mulch,,36.89389075200006,-121.66801293099996,1,2018-05-09 Watsonville,2053.0,23.885266194414687,2052
2053,Watsonville,5/9/2018,mulch,,36.89428731000004,-121.66840339799997,1,2018-05-09 Watsonville,2056.0,29.613992845217226,2054
2054,Watsonville,5/9/2018,mulch,,36.89396879500004,-121.66875272799996,1,2018-05-09 Watsonville,2056.0,24.605530761091742,2055
2056,Watsonville,5/9/2018,hoop,,36.88657812100007,-121.66584843299997,1,2018-05-09 Watsonville,2058.0,26.293992047749164,2057
2058,Watsonville,5/9/2018,hoop,,36.88604498000007,-121.66682849799996,1,2018-05-09 Watsonville,2060.0,23.62319947502867,2059
2060,Watsonville,5/9/2018,hoop,,36.885912448000056,-121.66750247099996,1,2018-05-09 Watsonville,,,2061
2061,Watsonville,5/9/2018,hoop,,36.88566705100004,-121.667746535,1,2018-05-09 Watsonville,2063.0,27.679291116283046,2062
2063,Watsonville,5/9/2018,hoop,,36.88576481000007,-121.66840956199997,1,2018-05-09 Watsonville,,,2064
2064,Watsonville,5/9/2018,hoop,,36.88599533500008,-121.66906109699994,1,2018-05-09 Watsonville,,,2065
2065,Watsonville,5/9/2018,hoop,,36.88564883800007,-121.66929329499997,1,2018-05-09 Watsonville,2067.0,23.098288308076928,2066
2067,Watsonville,5/9/2018,hoop,,36.88611604500005,-121.66950470999996,1,2018-05-09 Watsonville,,,2068
2068,Watsonville,5/9/2018,hoop,,36.88570941600005,-121.66966431999998,1,2018-05-09 Watsonville,2070.0,14.485828915822276,2069
2070,Watsonville,5/9/2018,hoop,,36.88627976500004,-121.66994258899996,1,2018-05-09 Watsonville,,,2071
2071,Watsonville,5/9/2018,hoop,,36.88586053400008,-121.670035666,1,2018-05-09 Watsonville,2075.0,27.986836815033968,2072
2072,Watsonville,5/9/2018,hoop,,36.885486851000046,-121.67016833899999,1,2018-05-09 Watsonville,2075.0,17.189747949551048,2073
2073,Watsonville,5/9/2018,hoop,,36.886096966000025,-121.67021843099997,1,2018-05-09 Watsonville,2078.0,23.65467573683359,2074
2075,Watsonville,5/9/2018,hoop,,36.88637550900006,-121.67028453899997,1,2018-05-09 Watsonville,2081.0,26.639097086206483,2076
2079,Watsonville,5/9/2018,hoop,,36.88543032800004,-121.67054953999995,1,2018-05-09 Watsonville,2079.0,25.80044910213608,2080
2083,Watsonville,5/9/2018,hoop,,36.88664470300006,-121.67138237299996,1,2018-05-09 Watsonville,2083.0,25.629053333318293,2084
2084,Watsonville,5/9/2018,hoop,,36.88641186700005,-121.67094977699996,1,2018-05-09 Watsonville,2086.0,22.067154961374246,2085
2086,Watsonville,5/9/2018,hoop,,36.886371305000075,-121.67139964999996,1,2018-05-09 Watsonville,2086.0,24.144795818237117,2087
2087,Watsonville,5/9/2018,hoop,,36.88607500000006,-121.67085074399994,1,2018-05-09 Watsonville,2090.0,23.755380322460034,2088
2088,Watsonville,5/9/2018,hoop,,36.88608638100004,-121.67132856999996,1,2018-05-09 Watsonville,2086.0,27.959637924454857,2089
2091,Watsonville,5/9/2018,hoop,,36.88562660500003,-121.67090468799996,1,2018-05-09 Watsonville,2090.0,26.318052534394823,2092
2092,Watsonville,5/9/2018,hoop,,36.88576431300004,-121.67131080899996,1,2018-05-09 Watsonville,2091.0,21.142817674401655,2093
2093,Watsonville,5/9/2018,hoop,,36.88886147100004,-121.67094725699997,1,2018-05-09 Watsonville,2096.0,29.665039747248816,2094
2094,Watsonville,5/9/2018,hoop,,36.88852078800005,-121.67103167399993,1,2018-05-09 Watsonville,,,2095
2096,Watsonville,5/9/2018,hoop,,36.88803147900006,-121.67095858299996,1,2018-05-09 Watsonville,2099.0,20.19244617318944,2097
2097,Watsonville,5/9/2018,hoop,,36.88831391800005,-121.67129861799998,1,2018-05-09 Watsonville,,,2098
2099,Watsonville,5/9/2018,hoop,,36.88748409400006,-121.67104156299996,1,2018-05-09 Watsonville,,,2100
2100,Watsonville,5/9/2018,hoop,,36.88677652500007,-121.67190451699996,1,2018-05-09 Watsonville,,,2101
2101,Watsonville,5/9/2018,hoop,,36.88662377500003,-121.67247908799997,1,2018-05-09 Watsonville,,,2102
2102,Watsonville,5/9/2018,hoop,,36.88630041000005,-121.67188709499997,1,2018-05-09 Watsonville,,,2103
2103,Watsonville,5/9/2018,hoop,,36.88607577300007,-121.67248686299996,1,2018-05-09 Watsonville,,,2104
2104,Watsonville,5/9/2018,hoop,,36.88536497500007,-121.67285604299995,1,2018-05-09 Watsonville,,,2105
2105,Watsonville,5/9/2018,hoop,,36.88652115300005,-121.67324181699996,1,2018-05-09 Watsonville,2107.0,29.634062666363207,2106
2107,Watsonville,5/9/2018,hoop,,36.88492646500004,-121.67312319399996,1,2018-05-09 Watsonville,,,2108
2108,Watsonville,5/9/2018,hoop,,36.886599526000055,-121.67396564899995,1,2018-05-09 Watsonville,,,2109
2109,Watsonville,5/9/2018,hoop,,36.88535459000008,-121.673830324,1,2018-05-09 Watsonville,,,2110
2110,Watsonville,5/9/2018,hoop,,36.88592594700003,-121.674450832,1,2018-05-09 Watsonville,,,2111
2111,Watsonville,5/9/2018,other,,36.89113663500007,-121.67332192299995,1,2018-05-09 Watsonville,2118.0,16.737739865290614,2112
2112,Watsonville,5/9/2018,other,,36.89058576900004,-121.67334933599994,1,2018-05-09 Watsonville,2114.0,22.967130173321923,2113
2114,Watsonville,5/9/2018,other,,36.89057849200003,-121.67384907499996,1,2018-05-09 Watsonville,,,2115
2115,Watsonville,5/9/2018,other,,36.890927584000046,-121.67376100799999,1,2018-05-09 Watsonville,2117.0,22.430532599219266,2116
2118,Watsonville,5/9/2018,other,,36.89142933000005,-121.67336176899992,1,2018-05-09 Watsonville,2118.0,15.98882404179672,2119
2121,Watsonville,5/9/2018,other,,36.89067993900005,-121.67300431499996,1,2018-05-09 Watsonville,2157.0,23.324036090054182,2122
2122,Watsonville,5/9/2018,other,,36.89116664200003,-121.67218918999998,1,2018-05-09 Watsonville,2162.0,23.72138122993131,2123
2123,Watsonville,5/9/2018,other,,36.89143847300005,-121.67408107099997,1,2018-05-09 Watsonville,2121.0,28.461842469924573,2124
2124,Watsonville,5/9/2018,other,,36.89231929500005,-121.67329924799996,1,2018-05-09 Watsonville,2127.0,17.408308897237333,2125
2125,Watsonville,5/9/2018,other,,36.891898955000045,-121.67397166799996,1,2018-05-09 Watsonville,,,2126
2128,Watsonville,5/9/2018,other,,36.89245155700007,-121.67398950799996,1,2018-05-09 Watsonville,2130.0,22.92399700717652,2129
2130,Watsonville,5/9/2018,other,,36.89193905100007,-121.67266225199997,1,2018-05-09 Watsonville,,,2131
2131,Watsonville,5/9/2018,other,,36.89194514900004,-121.67317976199996,1,2018-05-09 Watsonville,,,2132
2132,Watsonville,5/9/2018,other,,36.89252445300008,-121.67092296699995,1,2018-05-09 Watsonville,,,2133
2133,Watsonville,5/9/2018,other,,36.89295499200006,-121.67097743999994,1,2018-05-09 Watsonville,,,2134
2134,Watsonville,5/9/2018,other,,36.892605067000034,-121.673232365,1,2018-05-09 Watsonville,2136.0,28.23181375887759,2135
2137,Watsonville,5/9/2018,other,,36.893165415000055,-121.673576132,1,2018-05-09 Watsonville,2139.0,19.099602216059694,2138
2139,Watsonville,5/9/2018,other,,36.89337194200005,-121.67325951499998,1,2018-05-09 Watsonville,2137.0,15.211729125140144,2140
2141,Watsonville,5/9/2018,other,,36.89371698300005,-121.67345139399998,1,2018-05-09 Watsonville,2141.0,29.916774509985885,2142
2142,Watsonville,5/9/2018,other,,36.89387230300008,-121.67375488399993,1,2018-05-09 Watsonville,2146.0,13.764683115768158,2143
2144,Watsonville,5/9/2018,other,,36.893925843000034,-121.67412593599992,1,2018-05-09 Watsonville,2144.0,27.458770096340103,2145
2146,Watsonville,5/9/2018,other,,36.89360966100002,-121.67390029599994,1,2018-05-09 Watsonville,2146.0,18.381387925102164,2147
2147,Watsonville,5/9/2018,other,,36.89428083800004,-121.67226246599996,1,2018-05-09 Watsonville,,,2148
2148,Watsonville,5/9/2018,other,,36.893077453000046,-121.67224683299996,1,2018-05-09 Watsonville,,,2149
2149,Watsonville,5/9/2018,other,,36.89407046000008,-121.67119859599995,1,2018-05-09 Watsonville,,,2150
2150,Watsonville,5/9/2018,other,,36.89089749800007,-121.67078052699996,1,2018-05-09 Watsonville,,,2151
2152,Watsonville,5/9/2018,other,,36.890938971000026,-121.67117348599999,1,2018-05-09 Watsonville,2152.0,14.919377338283166,2153
2153,Watsonville,5/9/2018,other,,36.89058352600006,-121.67128358899998,1,2018-05-09 Watsonville,2152.0,28.420369243730452,2154
2154,Watsonville,5/9/2018,other,,36.89056438900008,-121.67219421299995,1,2018-05-09 Watsonville,2156.0,26.51054990408568,2155
2158,Watsonville,5/9/2018,other,,36.89148167200005,-121.67241438499995,1,2018-05-09 Watsonville,2158.0,12.282361739754698,2159
2159,Watsonville,5/9/2018,other,,36.89166392900007,-121.672093986,1,2018-05-09 Watsonville,,,2160
2160,Watsonville,5/9/2018,other,,36.89105471000005,-121.67262912199998,1,2018-05-09 Watsonville,2162.0,18.577618754083797,2161
2162,Watsonville,9/26/2020,mulch,,36.90705706800002,-121.68455943099995,1,2020-09-26 Watsonville,,,2163
2163,Watsonville,9/26/2020,mulch,,36.906981005000034,-121.68726194599996,1,2020-09-26 Watsonville,,,2164
2164,Watsonville,9/26/2020,mulch,,36.90779195700002,-121.68719473399995,1,2020-09-26 Watsonville,,,2165
2165,Watsonville,9/26/2020,mulch,,36.90731081200005,-121.68679244099997,1,2020-09-26 Watsonville,,,2166
2166,Watsonville,9/26/2020,mulch,,36.90755289100008,-121.68607853099996,1,2020-09-26 Watsonville,,,2167
2167,Watsonville,9/26/2020,mulch,,36.90715183500004,-121.685902968,1,2020-09-26 Watsonville,,,2168
2168,Watsonville,9/26/2020,mulch,,36.906532551000055,-121.68725885299995,1,2020-09-26 Watsonville,,,2169
2169,Watsonville,9/26/2020,mulch,,36.90682447800003,-121.686363444,1,2020-09-26 Watsonville,,,2170
2170,Watsonville,9/26/2020,mulch,,36.90635101800007,-121.68638601199996,1,2020-09-26 Watsonville,,,2171
2171,Watsonville,9/26/2020,mulch,,36.90662501200006,-121.68544084499996,1,2020-09-26 Watsonville,,,2172
2172,Watsonville,9/26/2020,mulch,,36.906191787000076,-121.68559091099996,1,2020-09-26 Watsonville,,,2173
2173,Watsonville,9/26/2020,mulch,,36.90653777900008,-121.68461502999996,1,2020-09-26 Watsonville,,,2174
2174,Watsonville,9/26/2020,mulch,,36.90610046900008,-121.68468889499997,1,2020-09-26 Watsonville,,,2175
2175,Watsonville,9/26/2020,mulch,,36.906144289000046,-121.68762165899994,1,2020-09-26 Watsonville,,,2176
2176,Watsonville,9/26/2020,mulch,,36.90571523600005,-121.68751154199998,1,2020-09-26 Watsonville,,,2177
2177,Watsonville,9/26/2020,mulch,,36.90597985900007,-121.686882127,1,2020-09-26 Watsonville,,,2178
2178,Watsonville,9/26/2020,mulch,,36.90557302100007,-121.68660403599993,1,2020-09-26 Watsonville,,,2179
2179,Watsonville,9/26/2020,mulch,,36.90577856600004,-121.68595726299996,1,2020-09-26 Watsonville,,,2180
2180,Watsonville,9/26/2020,mulch,,36.90539048200003,-121.68573134299999,1,2020-09-26 Watsonville,,,2181
2181,Watsonville,9/26/2020,mulch,,36.90558713000007,-121.68494813199997,1,2020-09-26 Watsonville,,,2182
2182,Watsonville,9/26/2020,mulch,,36.905363239000046,-121.68806041099998,1,2020-09-26 Watsonville,,,2183
2183,Watsonville,9/26/2020,mulch,,36.905011312000056,-121.68757199399992,1,2020-09-26 Watsonville,,,2184
2184,Watsonville,9/26/2020,mulch,,36.90512068100002,-121.68700187599995,1,2020-09-26 Watsonville,,,2185
2185,Watsonville,9/26/2020,mulch,,36.90469972300008,-121.68663396499994,1,2020-09-26 Watsonville,,,2186
2186,Watsonville,9/26/2020,mulch,,36.90500068800003,-121.68601608699998,1,2020-09-26 Watsonville,,,2187
2187,Watsonville,9/26/2020,mulch,,36.90446483300008,-121.68607142599996,1,2020-09-26 Watsonville,2190.0,27.94008932974305,2188
2188,Watsonville,9/26/2020,mulch,,36.90473397300008,-121.68531301599997,1,2020-09-26 Watsonville,,,2189
2190,Watsonville,9/26/2020,mulch,,36.90412284000007,-121.68569081799996,1,2020-09-26 Watsonville,,,2191
2191,Watsonville,9/26/2020,mulch,,36.90856585100005,-121.68966521799996,1,2020-09-26 Watsonville,,,2192
2192,Watsonville,9/26/2020,mulch,,36.90819102400008,-121.68929165299994,1,2020-09-26 Watsonville,,,2193
2193,Watsonville,9/26/2020,mulch,,36.90805157100005,-121.68967409699997,1,2020-09-26 Watsonville,,,2194
2194,Watsonville,9/26/2020,mulch,,36.90819704500007,-121.68868103999993,1,2020-09-26 Watsonville,,,2195
2195,Watsonville,9/26/2020,mulch,,36.907767429000046,-121.68897888499998,1,2020-09-26 Watsonville,,,2196
2196,Watsonville,9/26/2020,mulch,,36.90789039100008,-121.68818665599996,1,2020-09-26 Watsonville,,,2197
2197,Watsonville,9/26/2020,mulch,,36.90757161100004,-121.68827899599997,1,2020-09-26 Watsonville,,,2198
2198,Watsonville,9/26/2020,mulch,,36.90768071900004,-121.68954051399999,1,2020-09-26 Watsonville,,,2199
2199,Watsonville,9/26/2020,mulch,,36.90747540800004,-121.68865455199995,1,2020-09-26 Watsonville,,,2200
2200,Watsonville,9/26/2020,mulch,,36.90748149700005,-121.68987734499996,1,2020-09-26 Watsonville,,,2201
2201,Watsonville,9/26/2020,mulch,,36.90617338900007,-121.69043431399996,1,2020-09-26 Watsonville,,,2202
2202,Watsonville,9/26/2020,mulch,,36.90531329000004,-121.68868608399998,1,2020-09-26 Watsonville,,,2203
2203,Watsonville,9/26/2020,mulch,,36.90694745900004,-121.69017890099995,1,2020-09-26 Watsonville,,,2204
2204,Watsonville,9/26/2020,mulch,,36.906837161000055,-121.68946603999996,1,2020-09-26 Watsonville,,,2205
2205,Watsonville,9/26/2020,mulch,,36.90670286700004,-121.68883961499994,1,2020-09-26 Watsonville,,,2206
2206,Watsonville,9/26/2020,mulch,,36.90611083400007,-121.68862271599994,1,2020-09-26 Watsonville,,,2207
2207,Watsonville,9/26/2020,hoop,,36.89867918400006,-121.67901181699995,1,2020-09-26 Watsonville,,,2208
2208,Watsonville,9/26/2020,hoop,,36.90182486000003,-121.67898010199995,1,2020-09-26 Watsonville,,,2209
2209,Watsonville,9/26/2020,hoop,,36.901416359000045,-121.67992566399992,1,2020-09-26 Watsonville,,,2210
2210,Watsonville,9/26/2020,hoop,,36.90080677000003,-121.68112852499996,1,2020-09-26 Watsonville,,,2211
2211,Watsonville,9/26/2020,hoop,,36.900582617000055,-121.68045732099993,1,2020-09-26 Watsonville,,,2212
2212,Watsonville,9/26/2020,hoop,,36.90098240000003,-121.67973625899998,1,2020-09-26 Watsonville,,,2213
2213,Watsonville,9/26/2020,hoop,,36.90031715400005,-121.67926929799997,1,2020-09-26 Watsonville,,,2214
2214,Watsonville,9/26/2020,hoop,,36.900102205000046,-121.68111032299998,1,2020-09-26 Watsonville,,,2215
2215,Watsonville,9/26/2020,hoop,,36.89968063100002,-121.68024636599993,1,2020-09-26 Watsonville,,,2216
2216,Watsonville,9/26/2020,hoop,,36.89958744000006,-121.67903886299996,1,2020-09-26 Watsonville,,,2217
2217,Watsonville,9/26/2020,hoop,,36.89915987500007,-121.68120746399995,1,2020-09-26 Watsonville,,,2218
2218,Watsonville,9/26/2020,hoop,,36.897788870000056,-121.68168920399997,1,2020-09-26 Watsonville,,,2219
2219,Watsonville,9/26/2020,hoop,,36.89791001700007,-121.68108579999993,1,2020-09-26 Watsonville,,,2220
2220,Watsonville,9/26/2020,hoop,,36.898030791000046,-121.68033693299996,1,2020-09-26 Watsonville,,,2221
2221,Watsonville,9/26/2020,hoop,,36.898778591000045,-121.68160060699996,1,2020-09-26 Watsonville,,,2222
2222,Watsonville,9/26/2020,hoop,,36.89889088700005,-121.68053193199997,1,2020-09-26 Watsonville,,,2223
2223,Watsonville,9/26/2020,hoop,,36.89889928900004,-121.67963470799998,1,2020-09-26 Watsonville,,,2224
2224,Watsonville,9/26/2020,hoop,,36.89797697100005,-121.67897081899996,1,2020-09-26 Watsonville,,,2225
2225,Watsonville,9/26/2020,hoop,,36.89729264300007,-121.67881281599993,1,2020-09-26 Watsonville,,,2226
2226,Watsonville,9/26/2020,hoop,,36.89762588400004,-121.67930911099997,1,2020-09-26 Watsonville,,,2227
2227,Watsonville,9/26/2020,hoop,,36.90701863600003,-121.68357347999996,1,2020-09-26 Watsonville,,,2228
2228,Watsonville,9/26/2020,hoop,,36.90669248800003,-121.68265716199994,1,2020-09-26 Watsonville,,,2229
2229,Watsonville,9/26/2020,hoop,,36.90629713100003,-121.68342955199996,1,2020-09-26 Watsonville,,,2230
2230,Watsonville,9/26/2020,hoop,,36.905725878000055,-121.68286743199997,1,2020-09-26 Watsonville,,,2231
2231,Watsonville,9/26/2020,hoop,,36.905582037000045,-121.68399779599996,1,2020-09-26 Watsonville,,,2232
2232,Watsonville,9/26/2020,hoop,,36.904903183000044,-121.68346510199996,1,2020-09-26 Watsonville,,,2233
2233,Watsonville,9/26/2020,hoop,,36.90524097200006,-121.68256483,1,2020-09-26 Watsonville,,,2234
2234,Watsonville,9/26/2020,hoop,,36.90463798200005,-121.68435373899996,1,2020-09-26 Watsonville,,,2235
2235,Watsonville,9/26/2020,hoop,,36.90413174100007,-121.68397779799994,1,2020-09-26 Watsonville,,,2236
2236,Watsonville,9/26/2020,hoop,,36.904250674000025,-121.68307882899995,1,2020-09-26 Watsonville,,,2237
2237,Watsonville,9/26/2020,hoop,,36.903859186000034,-121.68463480499996,1,2020-09-26 Watsonville,,,2238
2238,Watsonville,9/26/2020,hoop,,36.90363326100004,-121.68409604299995,1,2020-09-26 Watsonville,,,2239
2239,Watsonville,9/26/2020,hoop,,36.90353858000003,-121.68357359099996,1,2020-09-26 Watsonville,,,2240
2240,Watsonville,9/26/2020,hoop,,36.90351686200007,-121.68288488199993,1,2020-09-26 Watsonville,,,2241
2241,Watsonville,9/26/2020,hoop,,36.90381425900006,-121.68253620799997,1,2020-09-26 Watsonville,,,2242
2242,Watsonville,9/26/2020,hoop,,36.90792374400007,-121.679728104,1,2020-09-26 Watsonville,,,2243
2243,Watsonville,9/26/2020,hoop,,36.90736606500008,-121.67980596499996,1,2020-09-26 Watsonville,,,2244
2244,Watsonville,9/26/2020,hoop,,36.90757753600008,-121.67921728899996,1,2020-09-26 Watsonville,,,2245
2245,Watsonville,9/26/2020,hoop,,36.90828283800005,-121.677943847,1,2020-09-26 Watsonville,,,2246
2246,Watsonville,9/26/2020,hoop,,36.907767558000046,-121.67732590399999,1,2020-09-26 Watsonville,,,2247
2247,Watsonville,9/26/2020,hoop,,36.91169332300007,-121.68590794999994,1,2020-09-26 Watsonville,,,2248
2248,Watsonville,9/26/2020,hoop,,36.91133582800006,-121.68499594699993,1,2020-09-26 Watsonville,,,2249
2249,Watsonville,9/26/2020,hoop,,36.91087918300008,-121.68569128699994,1,2020-09-26 Watsonville,,,2250
2250,Watsonville,9/26/2020,hoop,,36.910462608000046,-121.685028967,1,2020-09-26 Watsonville,,,2251
2251,Watsonville,9/26/2020,hoop,,36.91052736300002,-121.68577876599994,1,2020-09-26 Watsonville,,,2252
2252,Watsonville,9/26/2020,hoop,,36.91019127700002,-121.68602702299997,1,2020-09-26 Watsonville,,,2253
2253,Watsonville,9/26/2020,hoop,,36.90974406300006,-121.68576777799996,1,2020-09-26 Watsonville,,,2254
2254,Watsonville,9/26/2020,hoop,,36.90964457000007,-121.68519440799996,1,2020-09-26 Watsonville,,,2255
2255,Watsonville,9/26/2020,hoop,,36.909246262000075,-121.68589165099996,1,2020-09-26 Watsonville,,,2256
2256,Watsonville,9/26/2020,hoop,,36.90879722600005,-121.68546837499996,1,2020-09-26 Watsonville,,,2257
2257,Watsonville,9/26/2020,hoop,,36.90911555600008,-121.68481212599994,1,2020-09-26 Watsonville,,,2258
2258,Watsonville,9/26/2020,hoop,,36.90874428600006,-121.68472143399998,1,2020-09-26 Watsonville,,,2259
2259,Watsonville,9/26/2020,hoop,,36.908472463000074,-121.68416897699996,1,2020-09-26 Watsonville,,,2260
2260,Watsonville,9/26/2020,hoop,,36.90882111000008,-121.68375305899995,1,2020-09-26 Watsonville,,,2261
2261,Watsonville,9/26/2020,hoop,,36.90838917200006,-121.68311571799995,1,2020-09-26 Watsonville,,,2262
2262,Watsonville,9/26/2020,hoop,,36.90865801800004,-121.68233349699995,1,2020-09-26 Watsonville,,,2263
2263,Watsonville,9/26/2020,hoop,,36.90821391700007,-121.68213533799997,1,2020-09-26 Watsonville,,,2264
2264,Watsonville,9/26/2020,hoop,,36.90834951100004,-121.68125703199996,1,2020-09-26 Watsonville,,,2265
2265,Watsonville,9/26/2020,hoop,,36.90794986000003,-121.68084562899996,1,2020-09-26 Watsonville,,,2266
2266,Watsonville,9/26/2020,hoop,,36.908257400000025,-121.68021806799997,1,2020-09-26 Watsonville,,,2267
2267,Watsonville,9/26/2020,hoop,,36.90834606100003,-121.68590962699994,1,2020-09-26 Watsonville,,,2268
2268,Watsonville,9/26/2020,hoop,,36.90805579200003,-121.68536537499995,1,2020-09-26 Watsonville,,,2269
2269,Watsonville,9/26/2020,hoop,,36.90795099900004,-121.68461612899993,1,2020-09-26 Watsonville,,,2270
2270,Watsonville,9/26/2020,hoop,,36.90783867700002,-121.68389755599996,1,2020-09-26 Watsonville,,,2271
2271,Watsonville,9/26/2020,hoop,,36.90798214800003,-121.683166342,1,2020-09-26 Watsonville,,,2272
2272,Watsonville,9/26/2020,hoop,,36.90782948800006,-121.68210881299996,1,2020-09-26 Watsonville,,,2273
2273,Watsonville,9/26/2020,hoop,,36.90745917200008,-121.682387469,1,2020-09-26 Watsonville,,,2274
2274,Watsonville,9/26/2020,hoop,,36.910065246000045,-121.69279172599992,1,2020-09-26 Watsonville,,,2275
2275,Watsonville,9/26/2020,hoop,,36.910229640000075,-121.69205433099997,1,2020-09-26 Watsonville,,,2276
2276,Watsonville,9/26/2020,hoop,,36.90971247600004,-121.69189473299996,1,2020-09-26 Watsonville,,,2277
2277,Watsonville,9/26/2020,hoop,,36.909467852000034,-121.69084128599997,1,2020-09-26 Watsonville,,,2278
2278,Watsonville,9/26/2020,hoop,,36.91038366300006,-121.69088903199996,1,2020-09-26 Watsonville,,,2279
2279,Watsonville,9/26/2020,hoop,,36.90939970900007,-121.68966897699994,1,2020-09-26 Watsonville,,,2280
2280,Watsonville,9/26/2020,hoop,,36.91093667900003,-121.68964014499994,1,2020-09-26 Watsonville,,,2281
2281,Watsonville,9/26/2020,hoop,,36.91016738600007,-121.68931629899998,1,2020-09-26 Watsonville,,,2282
2282,Watsonville,9/26/2020,hoop,,36.91025777400006,-121.68778753199996,1,2020-09-26 Watsonville,,,2283
2283,Watsonville,9/26/2020,hoop,,36.91088328600006,-121.68866081099996,1,2020-09-26 Watsonville,,,2284
2284,Watsonville,9/26/2020,hoop,,36.909630640000046,-121.68887322399996,1,2020-09-26 Watsonville,,,2285
2285,Watsonville,9/26/2020,hoop,,36.90923891200004,-121.68889847399998,1,2020-09-26 Watsonville,,,2286
2286,Watsonville,9/26/2020,hoop,,36.90905490700004,-121.68916239899994,1,2020-09-26 Watsonville,,,2287
2287,Watsonville,9/26/2020,hoop,,36.91003271900007,-121.690266507,1,2020-09-26 Watsonville,,,2288
2288,Watsonville,9/26/2020,hoop,,36.90896895800007,-121.68958880399998,1,2020-09-26 Watsonville,,,2289
2289,Watsonville,9/26/2020,hoop,,36.90972067800004,-121.68762227699995,1,2020-09-26 Watsonville,,,2290
2290,Watsonville,9/26/2020,hoop,,36.90890865900008,-121.68805762399997,1,2020-09-26 Watsonville,,,2291
2291,Watsonville,9/26/2020,hoop,,36.90963495600005,-121.68704530899998,1,2020-09-26 Watsonville,,,2292
2292,Watsonville,9/26/2020,hoop,,36.90930320900002,-121.68749062799996,1,2020-09-26 Watsonville,,,2293
2293,Watsonville,9/26/2020,hoop,,36.908837924000075,-121.68767095399994,1,2020-09-26 Watsonville,,,2294
2294,Watsonville,9/26/2020,hoop,,36.90849198500007,-121.68711137899999,1,2020-09-26 Watsonville,,,2295
2295,Watsonville,9/26/2020,hoop,,36.909215979000074,-121.68671342999994,1,2020-09-26 Watsonville,,,2296
2296,Watsonville,9/26/2020,hoop,,36.90859659000006,-121.688482938,1,2020-09-26 Watsonville,,,2297
2297,Watsonville,9/26/2020,hoop,,36.90953794800004,-121.69155836999992,1,2020-09-26 Watsonville,,,2298
2298,Watsonville,9/26/2020,hoop,,36.91277660600008,-121.68709635,1,2020-09-26 Watsonville,,,2299
2299,Watsonville,9/26/2020,hoop,,36.91262534700007,-121.68667615099996,1,2020-09-26 Watsonville,,,2300
2300,Watsonville,9/26/2020,hoop,,36.91338177000006,-121.686352307,1,2020-09-26 Watsonville,,,2301
2301,Watsonville,9/26/2020,hoop,,36.91254791400007,-121.686117073,1,2020-09-26 Watsonville,,,2302
2302,Watsonville,9/26/2020,hoop,,36.91354112700003,-121.68739383999996,1,2020-09-26 Watsonville,,,2303
2303,Watsonville,9/26/2020,hoop,,36.91467024900004,-121.687233156,1,2020-09-26 Watsonville,,,2304
2304,Watsonville,9/26/2020,mulch,,36.90648578500002,-121.68960170799994,1,2020-09-26 Watsonville,,,2305
2305,Watsonville,9/26/2020,mulch,,36.90613480200005,-121.68912728499998,1,2020-09-26 Watsonville,,,2306
2306,Watsonville,9/26/2020,mulch,,36.90611594600006,-121.68960745899994,1,2020-09-26 Watsonville,,,2307
2307,Watsonville,9/26/2020,mulch,,36.90555238400003,-121.68937348799994,1,2020-09-26 Watsonville,,,2308
2308,Watsonville,9/26/2020,mulch,,36.90582217200006,-121.68989315299996,1,2020-09-26 Watsonville,,,2309
2309,Watsonville,9/26/2020,hoop,,36.91412609300005,-121.68790280599995,1,2020-09-26 Watsonville,,,2310
2310,Watsonville,9/26/2020,hoop,,36.91348792600007,-121.68919085099996,1,2020-09-26 Watsonville,,,2311
2311,Watsonville,9/26/2020,hoop,,36.91397083000004,-121.68544470599994,1,2020-09-26 Watsonville,,,2312
2312,Watsonville,9/26/2020,hoop,,36.91398086500004,-121.68987318899995,1,2020-09-26 Watsonville,,,2313
2313,Watsonville,9/26/2020,other,,36.90569903600005,-121.69388934399996,1,2020-09-26 Watsonville,,,2314
2314,Watsonville,9/26/2020,other,,36.90538670100005,-121.69350463599994,1,2020-09-26 Watsonville,,,2315
2315,Watsonville,9/26/2020,other,,36.90575961200005,-121.69316465499996,1,2020-09-26 Watsonville,,,2316
2316,Watsonville,9/26/2020,other,,36.90506523900007,-121.691083887,1,2020-09-26 Watsonville,,,2317
2317,Watsonville,9/26/2020,other,,36.904672539000046,-121.69107107399996,1,2020-09-26 Watsonville,,,2318
2318,Watsonville,9/26/2020,other,,36.90463887600004,-121.69066554499994,1,2020-09-26 Watsonville,,,2319
2319,Watsonville,9/26/2020,other,,36.90384939900008,-121.69113764199994,1,2020-09-26 Watsonville,,,2320
2320,Watsonville,9/26/2020,other,,36.903728486000034,-121.69249520299996,1,2020-09-26 Watsonville,,,2321
2321,Watsonville,9/26/2020,other,,36.90316662700008,-121.68857870299996,1,2020-09-26 Watsonville,,,2322
2322,Watsonville,9/26/2020,other,,36.90307749400006,-121.68903105299997,1,2020-09-26 Watsonville,,,2323
2323,Watsonville,9/26/2020,other,,36.90209478000003,-121.68847083999997,1,2020-09-26 Watsonville,,,2324
2324,Watsonville,9/26/2020,other,,36.90165089600004,-121.68819238999998,1,2020-09-26 Watsonville,,,2325
2325,Watsonville,9/26/2020,other,,36.90134134900006,-121.68788599799996,1,2020-09-26 Watsonville,,,2326
2326,Watsonville,9/26/2020,other,,36.901182627000026,-121.68847314899995,1,2020-09-26 Watsonville,,,2327
2327,Watsonville,9/26/2020,other,,36.90016736700005,-121.68506668999999,1,2020-09-26 Watsonville,,,2328
2328,Watsonville,9/26/2020,other,,36.89967480200005,-121.683067301,1,2020-09-26 Watsonville,,,2329
2329,Watsonville,9/26/2020,other,,36.89983839900003,-121.68490287599997,1,2020-09-26 Watsonville,,,2330
2330,Watsonville,9/26/2020,other,,36.89937859500003,-121.68468477799996,1,2020-09-26 Watsonville,,,2331
2331,Watsonville,9/26/2020,other,,36.89825008300005,-121.68346260899995,1,2020-09-26 Watsonville,,,2332
2332,Watsonville,9/26/2020,other,,36.89829965200005,-121.682335422,1,2020-09-26 Watsonville,,,2333
2333,Watsonville,9/26/2020,other,,36.89828275600007,-121.68666070299996,1,2020-09-26 Watsonville,,,2334
2334,Watsonville,9/26/2020,other,,36.89779506600007,-121.68619460399997,1,2020-09-26 Watsonville,,,2335
2335,Watsonville,9/26/2020,other,,36.89758918200005,-121.68668743899995,1,2020-09-26 Watsonville,,,2336
2336,Watsonville,9/26/2020,other,,36.89870391100004,-121.68754716099994,1,2020-09-26 Watsonville,,,2337
2337,Watsonville,9/26/2020,other,,36.89835953300008,-121.68728864299997,1,2020-09-26 Watsonville,2339.0,28.298997496740736,2338
2339,Watsonville,9/26/2020,other,,36.89909837700003,-121.68875657799998,1,2020-09-26 Watsonville,,,2340
2340,Watsonville,9/26/2020,other,,36.89865357600007,-121.68809571499996,1,2020-09-26 Watsonville,,,2341
2341,Watsonville,9/26/2020,other,,36.898321430000074,-121.68854051699996,1,2020-09-26 Watsonville,,,2342
2342,Watsonville,9/26/2020,other,,36.89684974900007,-121.68754244699994,1,2020-09-26 Watsonville,,,2343
2343,Watsonville,9/26/2020,other,,36.89672611000003,-121.68867998099996,1,2020-09-26 Watsonville,,,2344
2344,Watsonville,9/26/2020,other,,36.89722401000006,-121.69011671099996,1,2020-09-26 Watsonville,,,2345
2345,Watsonville,9/26/2020,other,,36.897988422000026,-121.69011893799996,1,2020-09-26 Watsonville,,,2346
2346,Watsonville,9/26/2020,other,,36.900399767000074,-121.68947656199998,1,2020-09-26 Watsonville,,,2347
2347,Watsonville,9/26/2020,other,,36.90139818500006,-121.69027636399994,1,2020-09-26 Watsonville,,,2348
2348,Watsonville,9/26/2020,other,,36.90142276300002,-121.69147661799995,1,2020-09-26 Watsonville,,,2349
2349,Watsonville,9/26/2020,other,,36.90209428000002,-121.69829324699998,1,2020-09-26 Watsonville,,,2350
2350,Watsonville,9/26/2020,other,,36.90207621700006,-121.69905094999996,1,2020-09-26 Watsonville,,,2351
2351,Watsonville,9/26/2020,other,,36.90152571300007,-121.69795543299993,1,2020-09-26 Watsonville,,,2352
2352,Watsonville,9/26/2020,other,,36.90134647000008,-121.69882213499994,1,2020-09-26 Watsonville,,,2353
2353,Watsonville,9/26/2020,other,,36.90468004400003,-121.70355230399996,1,2020-09-26 Watsonville,2357.0,28.10099646619,2354
2354,Watsonville,9/26/2020,other,,36.90511211900008,-121.70360774899996,1,2020-09-26 Watsonville,2358.0,25.267836468558745,2355
2355,Watsonville,9/26/2020,other,,36.90497654600006,-121.70328871199996,1,2020-09-26 Watsonville,2358.0,14.771303026063132,2356
2358,Watsonville,9/26/2020,other,,36.90427611900003,-121.70326210099996,1,2020-09-26 Watsonville,2357.0,23.728349624180545,2359
2359,Watsonville,9/26/2020,other,,36.90441412100006,-121.70364968799998,1,2020-09-26 Watsonville,2357.0,24.183897474022615,2360
2360,Watsonville,9/26/2020,other,,36.904446162000056,-121.70409444399996,1,2020-09-26 Watsonville,,,2361
2361,Watsonville,9/26/2020,other,,36.90556811400006,-121.70415125299996,1,2020-09-26 Watsonville,,,2362
2362,Watsonville,9/26/2020,other,,36.90502743600007,-121.70409633999996,1,2020-09-26 Watsonville,,,2363
2363,Watsonville,9/26/2020,other,,36.905680775000064,-121.70495908199996,1,2020-09-26 Watsonville,,,2364
2364,Watsonville,9/26/2020,other,,36.905379108000034,-121.70485244499996,1,2020-09-26 Watsonville,,,2365
2365,Watsonville,9/26/2020,other,,36.904882288000074,-121.70502943199995,1,2020-09-26 Watsonville,,,2366
2366,Watsonville,9/26/2020,other,,36.90448850300004,-121.70497905299997,1,2020-09-26 Watsonville,,,2367
2367,Watsonville,9/26/2020,other,,36.90578478300006,-121.70547417599992,1,2020-09-26 Watsonville,,,2368
2368,Watsonville,9/26/2020,other,,36.90525427500006,-121.705423108,1,2020-09-26 Watsonville,,,2369
2369,Watsonville,9/26/2020,other,,36.90495059800002,-121.70542392699996,1,2020-09-26 Watsonville,,,2370
2370,Watsonville,9/26/2020,other,,36.904994902000055,-121.702901522,1,2020-09-26 Watsonville,,,2371
2371,Watsonville,9/26/2020,other,,36.90626236800006,-121.70392610199995,1,2020-09-26 Watsonville,,,2372
2372,Watsonville,9/26/2020,other,,36.90655518100005,-121.70367066799996,1,2020-09-26 Watsonville,,,2373
2373,Watsonville,9/26/2020,other,,36.889199443000045,-121.67280103799997,1,2020-09-26 Watsonville,2375.0,22.47606069030229,2374
2375,Watsonville,9/26/2020,other,,36.88920802500007,-121.67222321499996,1,2020-09-26 Watsonville,,,2376
2376,Watsonville,9/26/2020,other,,36.88891697500002,-121.67298625099994,1,2020-09-26 Watsonville,2378.0,22.960250848409054,2377
2378,Watsonville,9/26/2020,other,,36.888702610000045,-121.67256188299996,1,2020-09-26 Watsonville,2378.0,28.43440202812908,2379
2379,Watsonville,9/26/2020,other,,36.888702083000055,-121.67195713599995,1,2020-09-26 Watsonville,,,2380
2380,Watsonville,9/26/2020,other,,36.88853204700007,-121.67293579899996,1,2020-09-26 Watsonville,2378.0,22.438251147057183,2381
2381,Watsonville,9/26/2020,other,,36.88892521400004,-121.67236941099996,1,2020-09-26 Watsonville,2375.0,26.776740574937392,2382
2382,Watsonville,9/26/2020,other,,36.89061991400007,-121.67117341999995,1,2020-09-26 Watsonville,,,2383
2383,Watsonville,9/26/2020,other,,36.890663631000045,-121.67218627199996,1,2020-09-26 Watsonville,,,2384
2384,Watsonville,9/26/2020,other,,36.89115808400004,-121.67232822199996,1,2020-09-26 Watsonville,,,2385
2385,Watsonville,9/26/2020,other,,36.89056835100007,-121.673803782,1,2020-09-26 Watsonville,,,2386
2386,Watsonville,9/26/2020,other,,36.89056078100003,-121.67329125899992,1,2020-09-26 Watsonville,,,2387
2387,Watsonville,9/26/2020,other,,36.89139430200004,-121.67386565599996,1,2020-09-26 Watsonville,,,2388
2388,Watsonville,9/26/2020,other,,36.89115306600007,-121.673323531,1,2020-09-26 Watsonville,,,2389
2389,Watsonville,9/26/2020,other,,36.892366122000055,-121.67386910399993,1,2020-09-26 Watsonville,,,2390
2390,Watsonville,9/26/2020,other,,36.89191940300003,-121.67372157999993,1,2020-09-26 Watsonville,,,2391
2391,Watsonville,9/26/2020,other,,36.89339265900002,-121.67357762999995,1,2020-09-26 Watsonville,,,2392
2392,Watsonville,9/26/2020,other,,36.892985149000026,-121.67091919799996,1,2020-09-26 Watsonville,,,2393
2393,Watsonville,9/26/2020,other,,36.89410299400004,-121.673939787,1,2020-09-26 Watsonville,,,2394
2394,Watsonville,9/26/2020,other,,36.892557907000025,-121.673286524,1,2020-09-26 Watsonville,,,2395
2395,Watsonville,9/26/2020,other,,36.92791996000005,-121.68204626899995,1,2020-09-26 Watsonville,2397.0,18.086071479517848,2396
2397,Watsonville,9/26/2020,other,,36.92763010200008,-121.68204877199996,1,2020-09-26 Watsonville,2403.0,19.0764506804352,2398
2398,Watsonville,9/26/2020,other,,36.92760396500007,-121.681588869,1,2020-09-26 Watsonville,2400.0,14.924089843806051,2399
2400,Watsonville,9/26/2020,other,,36.92804782400003,-121.68246802699996,1,2020-09-26 Watsonville,,,2401
2403,Watsonville,9/26/2020,other,,36.92727350400003,-121.68181377199994,1,2020-09-26 Watsonville,2400.0,27.491039370607435,2404
2404,Watsonville,9/26/2020,other,,36.92702507400002,-121.68226890099999,1,2020-09-26 Watsonville,2413.0,23.22716201342654,2405
2405,Watsonville,9/26/2020,other,,36.92760501000004,-121.68327719899996,1,2020-09-26 Watsonville,,,2406
2406,Watsonville,9/26/2020,other,,36.92741680000007,-121.68289422899994,1,2020-09-26 Watsonville,,,2407
2407,Watsonville,9/26/2020,other,,36.92791577600008,-121.68302132199995,1,2020-09-26 Watsonville,,,2408
2408,Watsonville,9/26/2020,other,,36.92762486300006,-121.68263579999996,1,2020-09-26 Watsonville,,,2409
2409,Watsonville,9/26/2020,other,,36.92833841300006,-121.682335078,1,2020-09-26 Watsonville,2415.0,25.2739723930103,2410
2410,Watsonville,9/26/2020,other,,36.927168946000045,-121.682630341,1,2020-09-26 Watsonville,,,2411
2411,Watsonville,9/26/2020,other,,36.92699712700005,-121.683804883,1,2020-09-26 Watsonville,,,2412
2413,Watsonville,9/26/2020,other,,36.92796805600005,-121.68366555499993,1,2020-09-26 Watsonville,,,2414
2415,Watsonville,9/26/2020,mulch,,36.93194884700006,-121.69089998099996,1,2020-09-26 Watsonville,,,2416
2416,Watsonville,9/26/2020,mulch,,36.932469025000046,-121.69053298499993,1,2020-09-26 Watsonville,,,2417
2417,Watsonville,9/26/2020,mulch,,36.93294928900008,-121.69024922999994,1,2020-09-26 Watsonville,,,2418
2418,Watsonville,9/26/2020,mulch,,36.93333012700003,-121.690102831,1,2020-09-26 Watsonville,,,2419
2419,Watsonville,9/26/2020,mulch,,36.93192253000007,-121.69159882099996,1,2020-09-26 Watsonville,,,2420
2420,Watsonville,9/26/2020,mulch,,36.932512959000064,-121.691210201,1,2020-09-26 Watsonville,2424.0,27.337512641779703,2421
2421,Watsonville,9/26/2020,mulch,,36.932949052000026,-121.69090034099996,1,2020-09-26 Watsonville,,,2422
2422,Watsonville,9/26/2020,mulch,,36.93344294800005,-121.69056003699995,1,2020-09-26 Watsonville,,,2423
2424,Watsonville,9/26/2020,mulch,,36.93221989200004,-121.69225264,1,2020-09-26 Watsonville,,,2425
2425,Watsonville,9/26/2020,mulch,,36.93278408300006,-121.69189054699996,1,2020-09-26 Watsonville,,,2426
2426,Watsonville,9/26/2020,mulch,,36.93345719600006,-121.69186809099995,1,2020-09-26 Watsonville,,,2427
2427,Watsonville,9/26/2020,mulch,,36.93283611200008,-121.69296129599996,1,2020-09-26 Watsonville,,,2428
2428,Watsonville,9/26/2020,mulch,,36.93351877700008,-121.69284813399996,1,2020-09-26 Watsonville,,,2429
2429,Watsonville,9/26/2020,mulch,,36.93315100600007,-121.69412538799996,1,2020-09-26 Watsonville,,,2430
2430,Watsonville,9/26/2020,mulch,,36.92493787400008,-121.68286750199997,1,2020-09-26 Watsonville,,,2431
2431,Watsonville,9/26/2020,mulch,,36.92506729100006,-121.68207008599995,1,2020-09-26 Watsonville,,,2432
2432,Watsonville,9/26/2020,mulch,,36.925540442000056,-121.68142749599996,1,2020-09-26 Watsonville,,,2433
2433,Watsonville,9/26/2020,mulch,,36.92565537000007,-121.68092675099996,1,2020-09-26 Watsonville,,,2434
2434,Watsonville,9/26/2020,mulch,,36.92656958400005,-121.68148275799996,1,2020-09-26 Watsonville,,,2435
2435,Watsonville,9/26/2020,mulch,,36.926597222000055,-121.68045847399996,1,2020-09-26 Watsonville,,,2436
2436,Watsonville,9/26/2020,mulch,,36.92731305800004,-121.68098484899996,1,2020-09-26 Watsonville,,,2437
2437,Watsonville,9/26/2020,mulch,,36.92739200400007,-121.67994287399993,1,2020-09-26 Watsonville,,,2438
2438,Watsonville,9/26/2020,mulch,,36.92535288000005,-121.68362878599999,1,2020-09-26 Watsonville,,,2439
2439,Watsonville,9/26/2020,mulch,,36.92614403600004,-121.68331637899996,1,2020-09-26 Watsonville,,,2440
2440,Watsonville,9/26/2020,mulch,,36.925595111000064,-121.68474398299996,1,2020-09-26 Watsonville,,,2441
2441,Watsonville,9/26/2020,mulch,,36.92605359200007,-121.68394253099996,1,2020-09-26 Watsonville,,,2442
2442,Watsonville,9/26/2020,mulch,,36.92497938100007,-121.68389800199996,1,2020-09-26 Watsonville,,,2443
2443,Watsonville,9/26/2020,mulch,,36.924489366000046,-121.68181256199993,1,2020-09-26 Watsonville,,,2444
2444,Watsonville,9/26/2020,mulch,,36.925165107000055,-121.681335301,1,2020-09-26 Watsonville,,,2445
2445,Watsonville,9/26/2020,hoop,,36.919478956000034,-121.68121641,1,2020-09-26 Watsonville,,,2446
2446,Watsonville,9/26/2020,hoop,,36.91989536100005,-121.68092161099996,1,2020-09-26 Watsonville,,,2447
2447,Watsonville,9/26/2020,hoop,,36.92030004200007,-121.68055865799992,1,2020-09-26 Watsonville,,,2448
2448,Watsonville,9/26/2020,hoop,,36.920696365000026,-121.68023449699996,1,2020-09-26 Watsonville,,,2449
2449,Watsonville,9/26/2020,hoop,,36.92119950500006,-121.67991793199997,1,2020-09-26 Watsonville,,,2450
2450,Watsonville,9/26/2020,hoop,,36.919839884000055,-121.68133108799996,1,2020-09-26 Watsonville,,,2451
2451,Watsonville,9/26/2020,hoop,,36.920449028000064,-121.68087688399999,1,2020-09-26 Watsonville,,,2452
2452,Watsonville,9/26/2020,hoop,,36.92106102300005,-121.68037732,1,2020-09-26 Watsonville,,,2453
2453,Watsonville,9/26/2020,hoop,,36.92157580100008,-121.68011141899996,1,2020-09-26 Watsonville,,,2454
2454,Watsonville,9/26/2020,hoop,,36.92183791000008,-121.67969310799998,1,2020-09-26 Watsonville,,,2455
2455,Watsonville,9/26/2020,hoop,,36.92043411100008,-121.679811369,1,2020-09-26 Watsonville,,,2456
2456,Watsonville,9/26/2020,hoop,,36.92052612500004,-121.67928632599995,1,2020-09-26 Watsonville,,,2457
2457,Watsonville,9/26/2020,hoop,,36.92101061500006,-121.67926309099992,1,2020-09-26 Watsonville,,,2458
2458,Watsonville,9/26/2020,hoop,,36.921006932000076,-121.67883801299996,1,2020-09-26 Watsonville,,,2459
2459,Watsonville,9/26/2020,hoop,,36.92143968100004,-121.67885992699996,1,2020-09-26 Watsonville,,,2460
2460,Watsonville,9/26/2020,hoop,,36.92045935400006,-121.67841941399996,1,2020-09-26 Watsonville,,,2461
2461,Watsonville,9/26/2020,hoop,,36.92049383500006,-121.67800629499997,1,2020-09-26 Watsonville,,,2462
2462,Watsonville,9/26/2020,hoop,,36.92085216500004,-121.67810768199996,1,2020-09-26 Watsonville,,,2463
2463,Watsonville,9/26/2020,hoop,,36.92099711900005,-121.677604466,1,2020-09-26 Watsonville,,,2464
2464,Watsonville,9/26/2020,hoop,,36.92131677300006,-121.67761254399994,1,2020-09-26 Watsonville,,,2465
2465,Watsonville,9/26/2020,hoop,,36.92015515400004,-121.68255657299994,1,2020-09-26 Watsonville,2468.0,26.25156615511858,2466
2466,Watsonville,9/26/2020,hoop,,36.92025317300005,-121.68178163599998,1,2020-09-26 Watsonville,2470.0,27.622798044993896,2467
2468,Watsonville,9/26/2020,hoop,,36.92047061700004,-121.68230742499996,1,2020-09-26 Watsonville,2470.0,25.263313421908432,2469
2470,Watsonville,9/26/2020,hoop,,36.91997342500008,-121.68205338599996,1,2020-09-26 Watsonville,2468.0,23.102802545886604,2471
2471,Watsonville,9/26/2020,hoop,,36.92093553400008,-121.68213967899997,1,2020-09-26 Watsonville,,,2472
2472,Watsonville,9/26/2020,hoop,,36.92110533300007,-121.68163153499997,1,2020-09-26 Watsonville,,,2473
2473,Watsonville,9/26/2020,hoop,,36.92080370800005,-121.68160891199994,1,2020-09-26 Watsonville,,,2474
2474,Watsonville,9/26/2020,hoop,,36.92091789600005,-121.68125431799996,1,2020-09-26 Watsonville,,,2475
2475,Watsonville,9/26/2020,hoop,,36.920963294000046,-121.68314077099996,1,2020-09-26 Watsonville,,,2476
2476,Watsonville,9/26/2020,hoop,,36.92171883500004,-121.68254511199996,1,2020-09-26 Watsonville,,,2477
2477,Watsonville,9/26/2020,hoop,,36.92240704700004,-121.68219205899997,1,2020-09-26 Watsonville,,,2478
2478,Watsonville,9/26/2020,hoop,,36.92294589800008,-121.68172248599996,1,2020-09-26 Watsonville,2484.0,25.425262715477565,2479
2479,Watsonville,9/26/2020,hoop,,36.92329874200004,-121.68145936099997,1,2020-09-26 Watsonville,,,2480
2480,Watsonville,9/26/2020,hoop,,36.92101314800004,-121.68267806999997,1,2020-09-26 Watsonville,,,2481
2481,Watsonville,9/26/2020,hoop,,36.92161276500008,-121.68219030299996,1,2020-09-26 Watsonville,,,2482
2482,Watsonville,9/26/2020,hoop,,36.92224841000007,-121.681885379,1,2020-09-26 Watsonville,,,2483
2484,Watsonville,9/26/2020,hoop,,36.92288365700006,-121.68101533499998,1,2020-09-26 Watsonville,,,2485
2485,Watsonville,9/26/2020,hoop,,36.92119044000003,-121.68475137799997,1,2020-09-26 Watsonville,,,2486
2486,Watsonville,9/26/2020,hoop,,36.921523568000055,-121.68442273799997,1,2020-09-26 Watsonville,,,2487
2487,Watsonville,9/26/2020,hoop,,36.92193330300007,-121.68412081699996,1,2020-09-26 Watsonville,,,2488
2488,Watsonville,9/26/2020,hoop,,36.922416723000026,-121.68364715699992,1,2020-09-26 Watsonville,,,2489
2489,Watsonville,9/26/2020,hoop,,36.922734150000046,-121.68343990699996,1,2020-09-26 Watsonville,,,2490
2490,Watsonville,9/26/2020,hoop,,36.92086445300004,-121.68394833599996,1,2020-09-26 Watsonville,,,2491
2491,Watsonville,9/26/2020,hoop,,36.921230355000034,-121.68369729699998,1,2020-09-26 Watsonville,,,2492
2492,Watsonville,9/26/2020,hoop,,36.92157721800004,-121.68338591399998,1,2020-09-26 Watsonville,,,2493
2493,Watsonville,9/26/2020,hoop,,36.921943191000025,-121.68314584499996,1,2020-09-26 Watsonville,,,2494
2494,Watsonville,9/26/2020,hoop,,36.92231765700007,-121.68288855499996,1,2020-09-26 Watsonville,,,2495
2495,Watsonville,9/26/2020,other,,36.92227194800006,-121.68575630199996,1,2020-09-26 Watsonville,,,2496
2496,Watsonville,9/26/2020,other,,36.92258788700008,-121.68549604599995,1,2020-09-26 Watsonville,,,2497
2497,Watsonville,9/26/2020,other,,36.92295596500002,-121.68521760799996,1,2020-09-26 Watsonville,,,2498
2498,Watsonville,9/26/2020,other,,36.923306336000046,-121.68494556699994,1,2020-09-26 Watsonville,,,2499
2499,Watsonville,9/26/2020,other,,36.92360892000005,-121.68467122299997,1,2020-09-26 Watsonville,,,2500
2500,Watsonville,9/26/2020,other,,36.922464666000046,-121.68604069299992,1,2020-09-26 Watsonville,,,2501
2501,Watsonville,9/26/2020,other,,36.92281672200005,-121.68572710299996,1,2020-09-26 Watsonville,,,2502
2502,Watsonville,9/26/2020,other,,36.92319769700004,-121.68546430899994,1,2020-09-26 Watsonville,,,2503
2503,Watsonville,9/26/2020,other,,36.92352226100007,-121.68522528499994,1,2020-09-26 Watsonville,,,2504
2504,Watsonville,9/26/2020,other,,36.923901730000075,-121.68495955699996,1,2020-09-26 Watsonville,,,2505
2505,Watsonville,9/26/2020,other,,36.92029116500004,-121.68775914399998,1,2020-09-26 Watsonville,,,2506
2506,Watsonville,9/26/2020,other,,36.92065643000007,-121.687478452,1,2020-09-26 Watsonville,2510.0,22.921300370046335,2507
2507,Watsonville,9/26/2020,other,,36.92105362000007,-121.68716905699993,1,2020-09-26 Watsonville,2511.0,25.957921576704432,2508
2508,Watsonville,9/26/2020,other,,36.921409637000075,-121.68691279499996,1,2020-09-26 Watsonville,2512.0,27.93866922853603,2509
2512,Watsonville,9/26/2020,other,,36.92173521600006,-121.68674525899996,1,2020-09-26 Watsonville,,,2513
2513,Watsonville,9/26/2020,other,,36.92142064500007,-121.68657356299995,1,2020-09-26 Watsonville,,,2514
2514,Watsonville,9/26/2020,other,,36.921855966000074,-121.68620518499993,1,2020-09-26 Watsonville,,,2515
2515,Watsonville,9/26/2020,other,,36.91561947200007,-121.68759154299994,1,2020-09-26 Watsonville,,,2516
2516,Watsonville,9/26/2020,other,,36.91598028600004,-121.68728632799996,1,2020-09-26 Watsonville,2518.0,28.410361969070408,2517
2518,Watsonville,9/26/2020,other,,36.915424846000064,-121.68728626099994,1,2020-09-26 Watsonville,2521.0,25.740840134179464,2519
2519,Watsonville,9/26/2020,other,,36.91586999300006,-121.68694837699996,1,2020-09-26 Watsonville,2522.0,25.10155502504533,2520
2523,Watsonville,9/26/2020,other,,36.915118560000046,-121.68673638099995,1,2020-09-26 Watsonville,,,2524
2524,Watsonville,9/26/2020,other,,36.915524799000025,-121.68642425899996,1,2020-09-26 Watsonville,2523.0,27.32790426686889,2525
2525,Watsonville,9/26/2020,other,,36.91624593800003,-121.68705015799996,1,2020-09-26 Watsonville,,,2526
2526,Watsonville,9/26/2020,other,,36.91664574200007,-121.68674678399996,1,2020-09-26 Watsonville,2528.0,27.164769481467587,2527
2528,Watsonville,9/26/2020,other,,36.91611475700006,-121.68662850199996,1,2020-09-26 Watsonville,,,2529
2529,Watsonville,9/26/2020,other,,36.91646994000007,-121.68627180299995,1,2020-09-26 Watsonville,2532.0,25.676711790040724,2530
2530,Watsonville,9/26/2020,other,,36.915927066000044,-121.68633712599996,1,2020-09-26 Watsonville,2533.0,25.526689171332496,2531
2533,Watsonville,9/26/2020,other,,36.915737068000055,-121.68606466099997,1,2020-09-26 Watsonville,,,2534
2534,Watsonville,9/26/2020,other,,36.91612831700007,-121.68577954999996,1,2020-09-26 Watsonville,2533.0,28.90676011838297,2535
2535,Watsonville,9/26/2020,other,,36.911433745000075,-121.68801218599998,1,2020-09-26 Watsonville,,,2536
2536,Watsonville,9/26/2020,other,,36.91182921700005,-121.68745382099996,1,2020-09-26 Watsonville,,,2537
2537,Watsonville,9/26/2020,other,,36.91131241500005,-121.68758727399997,1,2020-09-26 Watsonville,,,2538
2538,Watsonville,9/26/2020,other,,36.91093275700007,-121.68751438799995,1,2020-09-26 Watsonville,,,2539
2539,Watsonville,9/26/2020,other,,36.91157157700008,-121.68690740199996,1,2020-09-26 Watsonville,,,2540
2540,Watsonville,9/26/2020,other,,36.91259747200007,-121.68527764799995,1,2020-09-26 Watsonville,,,2541
2541,Watsonville,9/26/2020,other,,36.91334956000002,-121.68467321699995,1,2020-09-26 Watsonville,,,2542
2542,Watsonville,9/26/2020,other,,36.91252015100002,-121.684595377,1,2020-09-26 Watsonville,,,2543
2543,Watsonville,9/26/2020,other,,36.91306362400008,-121.68392192399995,1,2020-09-26 Watsonville,,,2544
2544,Watsonville,9/26/2020,other,,36.91241594100006,-121.68339904199996,1,2020-09-26 Watsonville,,,2545
2545,Watsonville,9/26/2020,black mulch,,36.92007304500004,-121.67379626099996,1,2020-09-26 Watsonville,,,2546
2546,Watsonville,9/26/2020,black mulch,,36.920542219000026,-121.67488924699995,1,2020-09-26 Watsonville,,,2547
2547,Watsonville,9/26/2020,black mulch,,36.91951398800006,-121.67278418499995,1,2020-09-26 Watsonville,,,2548
2548,Watsonville,9/26/2020,black mulch,,36.91930891300007,-121.672499556,1,2020-09-26 Watsonville,,,2549
2549,Watsonville,9/26/2020,black mulch,,36.92049729500008,-121.67348348899996,1,2020-09-26 Watsonville,,,2550
2550,Watsonville,9/26/2020,black mulch,,36.92020354700002,-121.67265683099998,1,2020-09-26 Watsonville,,,2551
2551,Watsonville,9/26/2020,black mulch,,36.91986038500005,-121.67267550599996,1,2020-09-26 Watsonville,,,2552
2552,Watsonville,9/26/2020,black mulch,,36.91990088400007,-121.672272922,1,2020-09-26 Watsonville,,,2553
2553,Watsonville,9/26/2020,black mulch,,36.92070238900004,-121.67419691899993,1,2020-09-26 Watsonville,,,2554
2554,Watsonville,9/26/2020,black mulch,,36.92017419500007,-121.67326911899994,1,2020-09-26 Watsonville,,,2555
2555,Watsonville,9/26/2020,black mulch,,36.92096369300003,-121.674474579,1,2020-09-26 Watsonville,,,2556
2556,Watsonville,9/26/2020,black mulch,,36.92031746300007,-121.674358558,1,2020-09-26 Watsonville,,,2557
2557,Watsonville,9/26/2020,black mulch,,36.86492420500008,-121.80709253699996,1,2020-09-26 Watsonville,,,2558
2558,Watsonville,9/26/2020,black mulch,,36.86546303800003,-121.80859304399996,1,2020-09-26 Watsonville,,,2559
2559,Watsonville,9/26/2020,black mulch,,36.86506600000007,-121.80803443199994,1,2020-09-26 Watsonville,,,2560
2560,Watsonville,9/26/2020,black mulch,,36.86553510500005,-121.81075251099996,1,2020-09-26 Watsonville,,,2561
2561,Watsonville,9/26/2020,black mulch,,36.86558689100008,-121.80985010499997,1,2020-09-26 Watsonville,,,2562
2562,Watsonville,9/27/2021,mulch,,36.85600711200004,-121.78523140799996,2,2021-09-27 Watsonville,2569.0,14.23400938699641,2563
2565,Watsonville,9/27/2021,mulch,,36.85651239400005,-121.78559936899995,2,2021-09-27 Watsonville,2571.0,14.190090643628128,2566
2571,Watsonville,9/27/2021,mulch,,36.85619191700005,-121.78566655699996,2,2021-09-27 Watsonville,2570.0,12.777955013307665,2572
2575,Watsonville,9/27/2021,mulch,,36.85637367000004,-121.78596764499996,2,2021-09-27 Watsonville,2577.0,14.035998690371304,2576
2578,Watsonville,9/27/2021,mulch,,36.85681712000007,-121.78631478399996,2,2021-09-27 Watsonville,2580.0,16.900980320169573,2579
2581,Watsonville,9/27/2021,mulch,,36.856570506000025,-121.78648324099998,2,2021-09-27 Watsonville,2583.0,16.800363797957633,2582
2583,Watsonville,9/27/2021,mulch,,36.85586131100007,-121.78565276799996,2,2021-09-27 Watsonville,2586.0,19.233750476351226,2584
2587,Watsonville,9/27/2021,mulch,,36.85540747400007,-121.78546610099994,2,2021-09-27 Watsonville,2592.0,18.66900674104371,2588
2592,Watsonville,9/27/2021,mulch,,36.85540329600008,-121.78607078099996,2,2021-09-27 Watsonville,2595.0,18.664078153297936,2593
2593,Watsonville,9/27/2021,mulch,,36.85514839300004,-121.78571791199992,2,2021-09-27 Watsonville,2592.0,18.92727511789436,2594
2599,Watsonville,9/27/2021,mulch,,36.85502474500004,-121.78635167399995,2,2021-09-27 Watsonville,2601.0,22.76311443065165,2600
2601,Watsonville,9/27/2021,mulch,,36.854589479000026,-121.78597658299996,2,2021-09-27 Watsonville,2599.0,23.972114854225655,2602
2603,Watsonville,9/27/2021,mulch,,36.856078059000026,-121.78633934699997,2,2021-09-27 Watsonville,2608.0,18.26624062813835,2604
2604,Watsonville,9/27/2021,mulch,,36.85454668800002,-121.786491373,2,2021-09-27 Watsonville,2603.0,21.64975566832845,2605
2610,Watsonville,9/27/2021,mulch,,36.85589660400007,-121.78684287899993,2,2021-09-27 Watsonville,2612.0,22.31757947493494,2611
2612,Watsonville,9/27/2021,mulch,,36.85561693900007,-121.78637878599994,2,2021-09-27 Watsonville,2617.0,19.387475441833427,2613
2617,Watsonville,9/27/2021,mulch,,36.85530338400002,-121.78655005399996,2,2021-09-27 Watsonville,2619.0,18.45803868836512,2618
2620,Watsonville,9/27/2021,mulch,,36.85552655400005,-121.78716035999996,2,2021-09-27 Watsonville,2620.0,21.36605425576588,2621
2623,Watsonville,9/27/2021,mulch,,36.85522358800006,-121.78724020399994,2,2021-09-27 Watsonville,2626.0,25.99075650558217,2624
2624,Watsonville,9/27/2021,mulch,,36.854886372000074,-121.78683000999996,2,2021-09-27 Watsonville,2627.0,23.895773468805807,2625
2627,Watsonville,9/27/2021,mulch,,36.85493386300004,-121.78743799899996,2,2021-09-27 Watsonville,2626.0,24.974316420888115,2628
2628,Watsonville,9/27/2021,mulch,,36.82605127500005,-121.79305977699993,2,2021-09-27 Watsonville,,,2629
2629,Watsonville,9/27/2021,mulch,,36.82452001200005,-121.79343748599996,2,2021-09-27 Watsonville,,,2630
2630,Watsonville,9/27/2021,mulch,,36.82610382700005,-121.79362096099997,2,2021-09-27 Watsonville,,,2631
2631,Watsonville,9/27/2021,mulch,,36.82604042400004,-121.79422419499996,2,2021-09-27 Watsonville,,,2632
2632,Watsonville,9/27/2021,mulch,,36.82552613800004,-121.79294611799996,2,2021-09-27 Watsonville,,,2633
2633,Watsonville,9/27/2021,mulch,,36.825547398000026,-121.79336226399992,2,2021-09-27 Watsonville,,,2634
2634,Watsonville,9/27/2021,mulch,,36.82562505200008,-121.79400280199997,2,2021-09-27 Watsonville,,,2635
2635,Watsonville,9/27/2021,mulch,,36.82500260500007,-121.79294812299996,2,2021-09-27 Watsonville,2638.0,29.764167373309604,2636
2636,Watsonville,9/27/2021,mulch,,36.82497715300008,-121.79365770299997,2,2021-09-27 Watsonville,,,2637
2638,Watsonville,9/27/2021,mulch,,36.82336963100005,-121.78941321299997,2,2021-09-27 Watsonville,,,2639
2639,Watsonville,9/27/2021,mulch,,36.82325123100002,-121.79053936399998,2,2021-09-27 Watsonville,,,2640
2640,Watsonville,9/27/2021,mulch,,36.82318843500008,-121.79148428899998,2,2021-09-27 Watsonville,,,2641
2641,Watsonville,9/27/2021,mulch,,36.82339701500007,-121.792216355,2,2021-09-27 Watsonville,,,2642
2642,Watsonville,9/27/2021,mulch,,36.82294423600007,-121.78971441899994,2,2021-09-27 Watsonville,,,2643
2643,Watsonville,9/27/2021,mulch,,36.82272116100006,-121.791011175,2,2021-09-27 Watsonville,,,2644
2644,Watsonville,9/27/2021,other,,36.85437650000006,-121.78494798799994,2,2021-09-27 Watsonville,,,2645
2645,Watsonville,9/27/2021,other,,36.85486941000005,-121.78370990999996,2,2021-09-27 Watsonville,2650.0,16.521740082887174,2646
2647,Watsonville,9/27/2021,other,,36.85500733100002,-121.78415467199994,2,2021-09-27 Watsonville,2649.0,16.313422087478987,2648
2653,Watsonville,9/27/2021,other,,36.854594959000046,-121.783761213,2,2021-09-27 Watsonville,2650.0,18.43896026940052,2654
2654,Watsonville,9/27/2021,other,,36.85523943300007,-121.78459783799995,2,2021-09-27 Watsonville,2657.0,18.882989619683208,2655
2655,Watsonville,9/27/2021,other,,36.85522932100002,-121.78502711099996,2,2021-09-27 Watsonville,2658.0,18.45153818451832,2656
2659,Watsonville,9/27/2021,other,,36.85450672700006,-121.78438421299995,2,2021-09-27 Watsonville,2653.0,21.48515791476662,2660
2660,Watsonville,9/27/2021,other,,36.85497145100004,-121.78523110999998,2,2021-09-27 Watsonville,2658.0,15.541056111163876,2661
2662,Watsonville,9/27/2021,other,,36.85448521800004,-121.78542987299994,2,2021-09-27 Watsonville,,,2663
2663,Watsonville,9/27/2021,other,,36.85484998000004,-121.78487571399997,2,2021-09-27 Watsonville,2659.0,22.562408724241415,2664
2664,Watsonville,9/27/2021,other,,36.853847659000046,-121.78447940899996,2,2021-09-27 Watsonville,2666.0,13.816029629796883,2665
2669,Watsonville,9/27/2021,other,,36.853297699000045,-121.78449920099996,2,2021-09-27 Watsonville,2675.0,29.75856305639711,2670
2670,Watsonville,9/27/2021,other,,36.85309592600004,-121.78504757499996,2,2021-09-27 Watsonville,2669.0,20.432154294455287,2671
2671,Watsonville,9/27/2021,other,,36.85270675900006,-121.78486782999992,2,2021-09-27 Watsonville,,,2672
2672,Watsonville,9/27/2021,other,,36.85355873000003,-121.78462487699994,2,2021-09-27 Watsonville,2674.0,14.686361164484662,2673
2675,Watsonville,9/27/2021,other,,36.85286100300005,-121.785322915,2,2021-09-27 Watsonville,,,2676
2676,Watsonville,9/27/2021,other,,36.85341401400007,-121.78496388699995,2,2021-09-27 Watsonville,2675.0,17.74384678897685,2677
2677,Watsonville,9/27/2021,other,,36.851831119000046,-121.78339928399998,2,2021-09-27 Watsonville,,,2678
2678,Watsonville,9/27/2021,other,,36.851773563000044,-121.78374981399996,2,2021-09-27 Watsonville,,,2679
2679,Watsonville,9/27/2021,other,,36.85100092900007,-121.78384921199996,2,2021-09-27 Watsonville,,,2680
2680,Watsonville,9/27/2021,other,,36.851171736000026,-121.78411257899997,2,2021-09-27 Watsonville,2682.0,18.997958729197165,2681
2682,Watsonville,9/27/2021,other,,36.85082400500005,-121.78430265799994,2,2021-09-27 Watsonville,,,2683
2683,Watsonville,9/27/2021,other,,36.86582687700008,-121.77312852399996,2,2021-09-27 Watsonville,,,2684
2684,Watsonville,9/27/2021,other,,36.86562118200004,-121.77353553499997,2,2021-09-27 Watsonville,,,2685
2685,Watsonville,9/27/2021,other,,36.866002649000045,-121.77358077799992,2,2021-09-27 Watsonville,2688.0,25.184092374097627,2686
2688,Watsonville,9/27/2021,other,,36.86587970100004,-121.77419664299998,2,2021-09-27 Watsonville,2687.0,27.73181390753499,2689
2689,Watsonville,9/27/2021,other,,36.86655498100004,-121.77414526899996,2,2021-09-27 Watsonville,2692.0,14.040964958892369,2690
2690,Watsonville,9/27/2021,other,,36.86625489500005,-121.77434517299996,2,2021-09-27 Watsonville,,,2691
2692,Watsonville,9/27/2021,other,,36.86587690900007,-121.77457142099996,2,2021-09-27 Watsonville,,,2693
2693,Watsonville,9/27/2021,other,,36.865731579000055,-121.77512769199996,2,2021-09-27 Watsonville,,,2694
2694,Watsonville,9/27/2021,other,,36.86676508400007,-121.77486615599996,2,2021-09-27 Watsonville,2697.0,21.245825011073848,2695
2695,Watsonville,9/27/2021,other,,36.86654563400003,-121.77513201999994,2,2021-09-27 Watsonville,,,2696
2697,Watsonville,9/27/2021,other,,36.86568966800007,-121.77637622499996,2,2021-09-27 Watsonville,2701.0,22.83237211344186,2698
2698,Watsonville,9/27/2021,other,,36.86533937800005,-121.77659933499996,2,2021-09-27 Watsonville,,,2699
2699,Watsonville,9/27/2021,other,,36.86492442100007,-121.77690050899996,2,2021-09-27 Watsonville,,,2700
2701,Watsonville,9/27/2021,other,,36.86521051600005,-121.77584926599997,2,2021-09-27 Watsonville,,,2702
2702,Watsonville,9/27/2021,other,,36.864499399000074,-121.77685566599996,2,2021-09-27 Watsonville,2705.0,27.632543788931788,2703
2703,Watsonville,9/27/2021,other,,36.86479430400004,-121.77558915799995,2,2021-09-27 Watsonville,,,2704
2705,Watsonville,9/27/2021,other,,36.86449909700008,-121.77589702899996,2,2021-09-27 Watsonville,,,2706
2706,Watsonville,9/27/2021,other,,36.86630351700006,-121.77555919499996,2,2021-09-27 Watsonville,,,2707
2707,Watsonville,9/27/2021,other,,36.86552657800007,-121.77398332099995,2,2021-09-27 Watsonville,2687.0,24.076640495478365,2708
2708,Watsonville,9/27/2021,other,,36.865197102000025,-121.77549874299996,2,2021-09-27 Watsonville,,,2709
2709,Watsonville,9/27/2021,other,,36.86555966800007,-121.77432338399996,2,2021-09-27 Watsonville,,,2710
2710,Watsonville,9/27/2021,other,,36.86529612100002,-121.77311704099996,2,2021-09-27 Watsonville,,,2711
2711,Watsonville,9/27/2021,other,,36.86430690100008,-121.77274793099996,2,2021-09-27 Watsonville,,,2712
2712,Watsonville,9/27/2021,other,,36.86436049300005,-121.77347437499996,2,2021-09-27 Watsonville,,,2713
2713,Watsonville,9/27/2021,other,,36.86471423500007,-121.77396014599996,2,2021-09-27 Watsonville,,,2714
2714,Watsonville,9/27/2021,other,,36.87074789500008,-121.76139270799996,2,2021-09-27 Watsonville,,,2715
2715,Watsonville,9/27/2021,other,,36.87080753800007,-121.76200579099996,2,2021-09-27 Watsonville,,,2716
2716,Watsonville,9/27/2021,other,,36.86965153500007,-121.76169737299993,2,2021-09-27 Watsonville,,,2717
2717,Watsonville,9/27/2021,other,,36.87046366000004,-121.76223253899995,2,2021-09-27 Watsonville,,,2718
2718,Watsonville,9/27/2021,other,,36.87016295500007,-121.761583299,2,2021-09-27 Watsonville,,,2719
2719,Watsonville,9/27/2021,other,,36.86992758600008,-121.76200955299998,2,2021-09-27 Watsonville,,,2720
2720,Watsonville,9/27/2021,other,,36.89040999500003,-121.74822097699996,2,2021-09-27 Watsonville,2722.0,14.045334144693244,2721
2722,Watsonville,9/27/2021,other,,36.893016514000074,-121.74790835899996,2,2021-09-27 Watsonville,,,2723
2723,Watsonville,9/27/2021,other,,36.89425618900003,-121.74795708199996,2,2021-09-27 Watsonville,2725.0,20.185174465497912,2724
2725,Watsonville,9/27/2021,other,,36.89491343500004,-121.74279670599996,2,2021-09-27 Watsonville,,,2726
2726,Watsonville,9/27/2021,other,,36.89438417200006,-121.74281878099998,2,2021-09-27 Watsonville,,,2727
2727,Watsonville,9/27/2021,other,,36.89688074800006,-121.74329015399996,2,2021-09-27 Watsonville,,,2728
2728,Watsonville,9/27/2021,other,,36.89714817500004,-121.74339253099998,2,2021-09-27 Watsonville,,,2729
2729,Watsonville,9/27/2021,other,,36.89687341000007,-121.74367866399996,2,2021-09-27 Watsonville,2731.0,29.943435068298147,2730
2731,Watsonville,9/27/2021,other,,36.89681486600006,-121.74421468699995,2,2021-09-27 Watsonville,2731.0,19.88617015193123,2732
2732,Watsonville,9/27/2021,other,,36.896580030000045,-121.74388093999994,2,2021-09-27 Watsonville,2731.0,24.618207324906585,2733
2733,Watsonville,9/27/2021,other,,36.89652607800008,-121.74503498299998,2,2021-09-27 Watsonville,,,2734
2734,Watsonville,9/27/2021,other,,36.89747957000003,-121.74400710799993,2,2021-09-27 Watsonville,,,2735
2735,Watsonville,9/27/2021,other,,36.89663719200007,-121.74572410299999,2,2021-09-27 Watsonville,,,2736
2736,Watsonville,9/27/2021,other,,36.89685257700006,-121.74718497999999,2,2021-09-27 Watsonville,2741.0,20.741414069890517,2737
2737,Watsonville,9/27/2021,other,,36.89739327600006,-121.746286936,2,2021-09-27 Watsonville,,,2738
2738,Watsonville,9/27/2021,other,,36.897835206000025,-121.74669830199996,2,2021-09-27 Watsonville,,,2739
2739,Watsonville,9/27/2021,other,,36.898052388000046,-121.74631516699996,2,2021-09-27 Watsonville,,,2740
2741,Watsonville,9/27/2021,other,,36.89787417300005,-121.74716339699997,2,2021-09-27 Watsonville,,,2742
2742,Watsonville,9/27/2021,other,,36.89719216800006,-121.74864783099996,2,2021-09-27 Watsonville,,,2743
2743,Watsonville,9/27/2021,other,,36.89701296700008,-121.74952516199994,2,2021-09-27 Watsonville,,,2744
2744,Watsonville,9/27/2021,other,,36.85376522500008,-121.78548957899994,2,2021-09-27 Watsonville,,,2745
2745,Watsonville,9/27/2021,other,,36.852753000000064,-121.78588085499996,2,2021-09-27 Watsonville,,,2746
2746,Watsonville,9/27/2021,hoop,,36.91459457600007,-121.73770795799997,2,2021-09-27 Watsonville,,,2747
2747,Watsonville,9/27/2021,hoop,,36.91398770400008,-121.73782295199997,2,2021-09-27 Watsonville,,,2748
2748,Watsonville,9/27/2021,hoop,,36.914356101000074,-121.73834738399997,2,2021-09-27 Watsonville,,,2749
2749,Watsonville,9/27/2021,hoop,,36.91388480100005,-121.73854206099996,2,2021-09-27 Watsonville,,,2750
2750,Watsonville,9/27/2021,hoop,,36.91416168000006,-121.73893781199996,2,2021-09-27 Watsonville,,,2751
2751,Watsonville,9/27/2021,hoop,,36.91371274300008,-121.73727816499996,2,2021-09-27 Watsonville,,,2752
2752,Watsonville,9/27/2021,hoop,,36.91318421200003,-121.73730115999996,2,2021-09-27 Watsonville,,,2753
2753,Watsonville,9/27/2021,hoop,,36.91356986700004,-121.73795800299996,2,2021-09-27 Watsonville,,,2754
2754,Watsonville,9/27/2021,hoop,,36.91308171900005,-121.73801401399999,2,2021-09-27 Watsonville,,,2755
2755,Watsonville,9/27/2021,hoop,,36.913314101000026,-121.73839191199994,2,2021-09-27 Watsonville,,,2756
2756,Watsonville,9/27/2021,hoop,,36.912011592000056,-121.73653318899994,2,2021-09-27 Watsonville,,,2757
2757,Watsonville,9/27/2021,hoop,,36.911596862000074,-121.73671768999996,2,2021-09-27 Watsonville,,,2758
2758,Watsonville,9/27/2021,hoop,,36.91183673300003,-121.73698872999996,2,2021-09-27 Watsonville,,,2759
2759,Watsonville,9/27/2021,hoop,,36.91179791200005,-121.73747507499996,2,2021-09-27 Watsonville,,,2760
2760,Watsonville,9/27/2021,hoop,,36.91135910600008,-121.73734203999997,2,2021-09-27 Watsonville,,,2761
2761,Watsonville,9/27/2021,hoop,,36.91136004700007,-121.73623027499995,2,2021-09-27 Watsonville,,,2762
2762,Watsonville,9/27/2021,hoop,,36.911024198000064,-121.73664018999995,2,2021-09-27 Watsonville,,,2763
2763,Watsonville,9/27/2021,hoop,,36.910960252000045,-121.73764960899996,2,2021-09-27 Watsonville,,,2764
2764,Watsonville,9/27/2021,hoop,,36.910850767000056,-121.73713121099996,2,2021-09-27 Watsonville,2766.0,27.026105296375448,2765
2766,Watsonville,9/27/2021,hoop,,36.91032376400005,-121.73567744199994,2,2021-09-27 Watsonville,,,2767
2767,Watsonville,9/27/2021,hoop,,36.91064734100007,-121.73608954599996,2,2021-09-27 Watsonville,2771.0,20.92956004361232,2768
2768,Watsonville,9/27/2021,hoop,,36.91021967300002,-121.73627402399995,2,2021-09-27 Watsonville,,,2769
2769,Watsonville,9/27/2021,hoop,,36.910496514000044,-121.73657812699996,2,2021-09-27 Watsonville,2771.0,27.824006137711827,2770
2771,Watsonville,9/27/2021,hoop,,36.90982881300005,-121.73638080099992,2,2021-09-27 Watsonville,,,2772
2772,Watsonville,9/27/2021,hoop,,36.90938775200004,-121.73628162699998,2,2021-09-27 Watsonville,,,2773
2773,Watsonville,9/27/2021,hoop,,36.90936139000007,-121.73673568899994,2,2021-09-27 Watsonville,2775.0,22.770914722642956,2774
2775,Watsonville,9/27/2021,hoop,,36.90966074800008,-121.73687103299994,2,2021-09-27 Watsonville,2775.0,28.112312692517307,2776
2776,Watsonville,9/27/2021,hoop,,36.913161569000074,-121.73915436199997,2,2021-09-27 Watsonville,,,2777
2777,Watsonville,9/27/2021,hoop,,36.91341718500007,-121.73953310999995,2,2021-09-27 Watsonville,,,2778
2778,Watsonville,9/27/2021,hoop,,36.91287532800004,-121.73954723999996,2,2021-09-27 Watsonville,,,2779
2779,Watsonville,9/27/2021,hoop,,36.91277579300004,-121.73993645099993,2,2021-09-27 Watsonville,,,2780
2780,Watsonville,9/27/2021,hoop,,36.91323916300007,-121.73997926799996,2,2021-09-27 Watsonville,,,2781
2781,Watsonville,9/27/2021,hoop,,36.912491768000045,-121.73893521199994,2,2021-09-27 Watsonville,,,2782
2782,Watsonville,9/27/2021,hoop,,36.91205729800004,-121.73883606099996,2,2021-09-27 Watsonville,2785.0,28.88161598204196,2783
2783,Watsonville,9/27/2021,hoop,,36.912419879000026,-121.73941498699996,2,2021-09-27 Watsonville,,,2784
2785,Watsonville,9/27/2021,hoop,,36.91202762000007,-121.73961472499995,2,2021-09-27 Watsonville,,,2786
2786,Watsonville,9/27/2021,hoop,,36.91162893600006,-121.73852120599996,2,2021-09-27 Watsonville,,,2787
2787,Watsonville,9/27/2021,hoop,,36.911151350000075,-121.73853331699996,2,2021-09-27 Watsonville,,,2788
2788,Watsonville,9/27/2021,hoop,,36.91105276300004,-121.73909247599993,2,2021-09-27 Watsonville,,,2789
2789,Watsonville,9/27/2021,hoop,,36.91136828500004,-121.73889987499996,2,2021-09-27 Watsonville,,,2790
2790,Watsonville,9/27/2021,hoop,,36.91147064000006,-121.73934346399994,2,2021-09-27 Watsonville,,,2791
2791,Watsonville,9/27/2021,hoop,,36.91086518700007,-121.738246705,2,2021-09-27 Watsonville,,,2792
2792,Watsonville,9/27/2021,hoop,,36.91038180900006,-121.73813204499999,2,2021-09-27 Watsonville,,,2793
2793,Watsonville,9/27/2021,hoop,,36.91019847200005,-121.73871754599996,2,2021-09-27 Watsonville,,,2794
2794,Watsonville,9/27/2021,hoop,,36.91051266200003,-121.73851250699992,2,2021-09-27 Watsonville,,,2795
2795,Watsonville,9/27/2021,hoop,,36.91062405000002,-121.73897954799996,2,2021-09-27 Watsonville,,,2796
2796,Watsonville,9/27/2021,hoop,,36.909286833000074,-121.73756548899996,2,2021-09-27 Watsonville,,,2797
2797,Watsonville,9/27/2021,hoop,,36.909821056000055,-121.73787638699996,2,2021-09-27 Watsonville,,,2798
2798,Watsonville,9/27/2021,hoop,,36.909573915000074,-121.73820582399996,2,2021-09-27 Watsonville,,,2799
2799,Watsonville,9/27/2021,hoop,,36.90981254800005,-121.73872328299996,2,2021-09-27 Watsonville,,,2800
2800,Watsonville,9/27/2021,hoop,,36.909988002000034,-121.73822021399997,2,2021-09-27 Watsonville,,,2801
2801,Watsonville,9/27/2021,hoop,,36.909289700000045,-121.73882985599992,2,2021-09-27 Watsonville,,,2802
2802,Watsonville,9/27/2021,hoop,,36.90963512000008,-121.73915682299996,2,2021-09-27 Watsonville,,,2803
2803,Watsonville,9/27/2021,hoop,,36.90949276400005,-121.739446107,2,2021-09-27 Watsonville,,,2804
2804,Watsonville,9/27/2021,hoop,,36.90960463500005,-121.73982000799998,2,2021-09-27 Watsonville,,,2805
2805,Watsonville,9/27/2021,hoop,,36.90942936000005,-121.74018377299996,2,2021-09-27 Watsonville,,,2806
2806,Watsonville,9/27/2021,hoop,,36.91007171300004,-121.73923873399995,2,2021-09-27 Watsonville,,,2807
2807,Watsonville,9/27/2021,hoop,,36.910497275000075,-121.73952683399995,2,2021-09-27 Watsonville,,,2808
2808,Watsonville,9/27/2021,hoop,,36.91010830100004,-121.73997613999995,2,2021-09-27 Watsonville,,,2809
2809,Watsonville,9/27/2021,hoop,,36.91035686800007,-121.74015723499996,2,2021-09-27 Watsonville,,,2810
2810,Watsonville,9/27/2021,hoop,,36.90997456900004,-121.74069449499996,2,2021-09-27 Watsonville,,,2811
2811,Watsonville,9/27/2021,hoop,,36.91100951600004,-121.73965899499996,2,2021-09-27 Watsonville,,,2812
2812,Watsonville,9/27/2021,hoop,,36.91123802800007,-121.74018118899994,2,2021-09-27 Watsonville,,,2813
2813,Watsonville,9/27/2021,hoop,,36.91079075900007,-121.74026546699996,2,2021-09-27 Watsonville,,,2814
2814,Watsonville,9/27/2021,hoop,,36.91078539800003,-121.74076735799996,2,2021-09-27 Watsonville,,,2815
2815,Watsonville,9/27/2021,hoop,,36.91082753800004,-121.741490404,2,2021-09-27 Watsonville,,,2816
2816,Watsonville,9/27/2021,hoop,,36.91175759000004,-121.74005617599992,2,2021-09-27 Watsonville,,,2817
2817,Watsonville,9/27/2021,hoop,,36.91202107100003,-121.74060050699995,2,2021-09-27 Watsonville,,,2818
2818,Watsonville,9/27/2021,hoop,,36.91154393500005,-121.74073714999996,2,2021-09-27 Watsonville,,,2819
2819,Watsonville,9/27/2021,hoop,,36.91192580200004,-121.74149822299997,2,2021-09-27 Watsonville,,,2820
2820,Watsonville,9/27/2021,hoop,,36.91144409700007,-121.74183582499997,2,2021-09-27 Watsonville,,,2821
2821,Watsonville,9/27/2021,hoop,,36.91257424100007,-121.74025671299997,2,2021-09-27 Watsonville,,,2822
2822,Watsonville,9/27/2021,hoop,,36.91246212100003,-121.74078200399998,2,2021-09-27 Watsonville,,,2823
2823,Watsonville,9/27/2021,hoop,,36.91284592800002,-121.74042778299996,2,2021-09-27 Watsonville,,,2824
2824,Watsonville,9/27/2021,hoop,,36.91175512700005,-121.74209824699994,2,2021-09-27 Watsonville,,,2825
2825,Watsonville,9/27/2021,hoop,,36.91180503200008,-121.741039662,2,2021-09-27 Watsonville,,,2826
2826,Watsonville,9/27/2021,hoop,,36.90641812000007,-121.73913645999994,2,2021-09-27 Watsonville,,,2827
2827,Watsonville,9/27/2021,hoop,,36.90659073500007,-121.73960897299996,2,2021-09-27 Watsonville,,,2828
2828,Watsonville,9/27/2021,hoop,,36.90639268600006,-121.74038288699995,2,2021-09-27 Watsonville,,,2829
2829,Watsonville,9/27/2021,hoop,,36.90655761100004,-121.74108449899995,2,2021-09-27 Watsonville,,,2830
2830,Watsonville,9/27/2021,hoop,,36.90652975900008,-121.74241826599996,2,2021-09-27 Watsonville,,,2831
2831,Watsonville,9/27/2021,hoop,,36.905788573000045,-121.73928236499997,2,2021-09-27 Watsonville,,,2832
2832,Watsonville,9/27/2021,hoop,,36.90596001900008,-121.73977526999992,2,2021-09-27 Watsonville,,,2833
2833,Watsonville,9/27/2021,hoop,,36.90584330400003,-121.74030667699996,2,2021-09-27 Watsonville,,,2834
2834,Watsonville,9/27/2021,hoop,,36.90585038800003,-121.740901007,2,2021-09-27 Watsonville,,,2835
2835,Watsonville,9/27/2021,hoop,,36.905913389000034,-121.74195446699996,2,2021-09-27 Watsonville,,,2836
2836,Watsonville,9/27/2021,hoop,,36.90776972800006,-121.73837131299996,2,2021-09-27 Watsonville,,,2837
2837,Watsonville,9/27/2021,hoop,,36.90708542600004,-121.73941666199994,2,2021-09-27 Watsonville,,,2838
2838,Watsonville,9/27/2021,hoop,,36.90785363400005,-121.739226686,2,2021-09-27 Watsonville,,,2839
2839,Watsonville,9/27/2021,hoop,,36.90778005800007,-121.74012327499996,2,2021-09-27 Watsonville,,,2840
2840,Watsonville,9/27/2021,hoop,,36.90788728800004,-121.74101768599996,2,2021-09-27 Watsonville,,,2841
2841,Watsonville,9/27/2021,hoop,,36.90494399200002,-121.74157134199999,2,2021-09-27 Watsonville,,,2842
2842,Watsonville,9/27/2021,hoop,,36.905125961000074,-121.73957455899993,2,2021-09-27 Watsonville,,,2843
2843,Watsonville,9/27/2021,hoop,,36.905169890000025,-121.73873190299996,2,2021-09-27 Watsonville,,,2844
2844,Watsonville,9/27/2021,hoop,,36.905202041000045,-121.74309340699995,2,2021-09-27 Watsonville,,,2845
2845,Watsonville,9/27/2021,hoop,,36.90471773600007,-121.743705122,2,2021-09-27 Watsonville,,,2846
2846,Watsonville,9/27/2021,mulch,,36.847888539000046,-121.79027133499994,2,2021-09-27 Watsonville,,,2847
2847,Watsonville,9/27/2021,mulch,,36.847583628000045,-121.79019636499999,2,2021-09-27 Watsonville,,,2848
2848,Watsonville,9/27/2021,mulch,,36.84727246500007,-121.79004390899996,2,2021-09-27 Watsonville,,,2849
2849,Watsonville,9/27/2021,mulch,,36.847559408000045,-121.79059723899996,2,2021-09-27 Watsonville,2851.0,25.039857919724604,2850
2851,Watsonville,9/27/2021,mulch,,36.84893666600004,-121.78939124599998,2,2021-09-27 Watsonville,2853.0,24.517424757868305,2852
2853,Watsonville,9/27/2021,mulch,,36.84949437800003,-121.78942707899996,2,2021-09-27 Watsonville,,,2854
2854,Watsonville,9/27/2021,mulch,,36.84908398300007,-121.78975866199994,2,2021-09-27 Watsonville,,,2855
2855,Watsonville,9/27/2021,mulch,,36.84872540200007,-121.78971534199997,2,2021-09-27 Watsonville,,,2856
2856,Watsonville,9/27/2021,mulch,,36.84883862600003,-121.79019506199997,2,2021-09-27 Watsonville,,,2857
2857,Watsonville,9/27/2021,mulch,,36.84843217500002,-121.79024169599997,2,2021-09-27 Watsonville,2859.0,27.64821064738996,2858
2859,Watsonville,9/27/2021,mulch,,36.84858830400003,-121.79091130699997,2,2021-09-27 Watsonville,,,2860
2860,Watsonville,9/27/2021,mulch,,36.84814283400004,-121.79057086599992,2,2021-09-27 Watsonville,,,2861
2861,Watsonville,9/27/2021,mulch,,36.84788405100005,-121.79091435499998,2,2021-09-27 Watsonville,2863.0,23.667942524685337,2862
2863,Watsonville,9/27/2021,mulch,,36.848194300000046,-121.791232692,2,2021-09-27 Watsonville,2863.0,20.972996592256013,2864
2864,Watsonville,9/27/2021,mulch,,36.847599503000026,-121.79256168299996,2,2021-09-27 Watsonville,,,2865
2865,Watsonville,9/27/2021,mulch,,36.84776163500004,-121.79137568699996,2,2021-09-27 Watsonville,2867.0,23.511553063634373,2866
2867,Watsonville,9/27/2021,mulch,,36.84736851500002,-121.79230373999997,2,2021-09-27 Watsonville,,,2868
2868,Watsonville,9/27/2021,mulch,,36.84747863600006,-121.79167386999995,2,2021-09-27 Watsonville,,,2869
2869,Watsonville,9/27/2021,mulch,,36.847700805000045,-121.79187536299996,2,2021-09-27 Watsonville,,,2870
2870,Watsonville,9/27/2021,mulch,,36.84715690000007,-121.79277457099992,2,2021-09-27 Watsonville,,,2871
2871,Watsonville,9/27/2021,mulch,,36.86291791200006,-121.77857913499996,2,2021-09-27 Watsonville,,,2872
2872,Watsonville,9/27/2021,mulch,,36.86303201000004,-121.778973539,2,2021-09-27 Watsonville,,,2873
2873,Watsonville,9/27/2021,mulch,,36.86325022500006,-121.77857252899996,2,2021-09-27 Watsonville,2876.0,26.368447215807656,2874
2874,Watsonville,9/27/2021,mulch,,36.86337472000002,-121.77897428299995,2,2021-09-27 Watsonville,2876.0,21.49139679975288,2875
2876,Watsonville,9/27/2021,mulch,,36.866949678000026,-121.77662344899994,2,2021-09-27 Watsonville,2879.0,24.28528455197704,2877
2877,Watsonville,9/27/2021,mulch,,36.86691036000008,-121.777035405,2,2021-09-27 Watsonville,,,2878
2879,Watsonville,9/27/2021,mulch,,36.86693723100007,-121.77738055299994,2,2021-09-27 Watsonville,2886.0,28.84033140260983,2880
2880,Watsonville,9/27/2021,mulch,,36.86642611700007,-121.77745176199994,2,2021-09-27 Watsonville,,,2881
2881,Watsonville,9/27/2021,mulch,,36.86664331000002,-121.77771655599996,2,2021-09-27 Watsonville,2886.0,28.351533987112948,2882
2882,Watsonville,9/27/2021,mulch,,36.86616096200004,-121.77794704299998,2,2021-09-27 Watsonville,,,2883
2883,Watsonville,9/27/2021,mulch,,36.86610004200002,-121.777341676,2,2021-09-27 Watsonville,,,2884
2884,Watsonville,9/27/2021,mulch,,36.86596956300008,-121.77767017599996,2,2021-09-27 Watsonville,,,2885
2886,Watsonville,9/27/2021,mulch,,36.865530902000046,-121.77761433899995,2,2021-09-27 Watsonville,2888.0,27.13399186569745,2887
2888,Watsonville,9/27/2021,mulch,,36.86576829800004,-121.77816665299996,2,2021-09-27 Watsonville,2888.0,28.96959771067495,2889
2889,Watsonville,9/27/2021,mulch,,36.86519739000005,-121.77793761999997,2,2021-09-27 Watsonville,2891.0,26.013869187040815,2890
2891,Watsonville,9/27/2021,mulch,,36.86538129600007,-121.77844701699996,2,2021-09-27 Watsonville,2891.0,23.78052881198385,2892
2892,Watsonville,9/27/2021,mulch,,36.86485713000008,-121.77808080399996,2,2021-09-27 Watsonville,,,2893
2893,Watsonville,9/27/2021,mulch,,36.864994094000046,-121.77861441199995,2,2021-09-27 Watsonville,,,2894
2894,Watsonville,9/27/2021,mulch,,36.86449347100007,-121.778317556,2,2021-09-27 Watsonville,,,2895
2895,Watsonville,9/27/2021,mulch,,36.86452545100008,-121.77865936199998,2,2021-09-27 Watsonville,,,2896
2896,Watsonville,9/27/2021,hoop,,36.90876514500008,-121.71746037899997,2,2021-09-27 Watsonville,,,2897
2897,Watsonville,9/27/2021,hoop,,36.90839551700003,-121.717688195,2,2021-09-27 Watsonville,,,2898
2898,Watsonville,9/27/2021,hoop,,36.90871894100008,-121.71791326699996,2,2021-09-27 Watsonville,,,2899
2899,Watsonville,9/27/2021,hoop,,36.90839439000007,-121.71813814299996,2,2021-09-27 Watsonville,2901.0,16.882362521817644,2900
2901,Watsonville,9/27/2021,hoop,,36.90875862900003,-121.71845356799996,2,2021-09-27 Watsonville,,,2902
2902,Watsonville,9/27/2021,hoop,,36.90834887500006,-121.71859084199995,2,2021-09-27 Watsonville,,,2903
2903,Watsonville,9/27/2021,hoop,,36.90865976000004,-121.71880448199992,2,2021-09-27 Watsonville,2906.0,22.049295782756804,2904
2904,Watsonville,9/27/2021,hoop,,36.90831800300003,-121.71904020399997,2,2021-09-27 Watsonville,,,2905
2906,Watsonville,9/27/2021,hoop,,36.908047387000074,-121.71422258299998,2,2021-09-27 Watsonville,,,2907
2907,Watsonville,9/27/2021,hoop,,36.90763983600005,-121.71448287899995,2,2021-09-27 Watsonville,,,2908
2908,Watsonville,9/27/2021,hoop,,36.90798890400004,-121.71483490099996,2,2021-09-27 Watsonville,,,2909
2909,Watsonville,9/27/2021,hoop,,36.90765294800008,-121.71499938299996,2,2021-09-27 Watsonville,2911.0,27.505592851813503,2910
2911,Watsonville,9/27/2021,hoop,,36.90801561800004,-121.71549192499998,2,2021-09-27 Watsonville,2914.0,28.712748835334764,2912
2912,Watsonville,9/27/2021,hoop,,36.907617174000045,-121.71558250199996,2,2021-09-27 Watsonville,,,2913
2914,Watsonville,9/27/2021,hoop,,36.90759513000006,-121.71595976099997,2,2021-09-27 Watsonville,2916.0,29.12427935037762,2915
2916,Watsonville,9/27/2021,hoop,,36.90798106900007,-121.71662599299998,2,2021-09-27 Watsonville,2919.0,29.607336496644848,2917
2917,Watsonville,9/27/2021,hoop,,36.90758602700004,-121.71662358699996,2,2021-09-27 Watsonville,,,2918
2919,Watsonville,9/27/2021,hoop,,36.90803106600004,-121.71708993399994,2,2021-09-27 Watsonville,,,2920
2920,Watsonville,9/27/2021,hoop,,36.90765535100008,-121.71709190999997,2,2021-09-27 Watsonville,2919.0,25.46267654984884,2921
2921,Watsonville,9/27/2021,hoop,,36.90798290900005,-121.71820759699995,2,2021-09-27 Watsonville,,,2922
2922,Watsonville,9/27/2021,hoop,,36.907644022000056,-121.71828125499997,2,2021-09-27 Watsonville,2926.0,25.607378252126537,2923
2923,Watsonville,9/27/2021,hoop,,36.90799394300007,-121.71858171399998,2,2021-09-27 Watsonville,2926.0,25.064543668527023,2924
2924,Watsonville,9/27/2021,hoop,,36.90762972100004,-121.71887896799996,2,2021-09-27 Watsonville,,,2925
2926,Watsonville,9/27/2021,hoop,,36.90726598700007,-121.71428054699997,2,2021-09-27 Watsonville,,,2927
2927,Watsonville,9/27/2021,hoop,,36.906866040000075,-121.714465137,2,2021-09-27 Watsonville,,,2928
2928,Watsonville,9/27/2021,hoop,,36.90707845000002,-121.71467700299996,2,2021-09-27 Watsonville,,,2929
2929,Watsonville,9/27/2021,hoop,,36.90729849400003,-121.71510177999994,2,2021-09-27 Watsonville,,,2930
2930,Watsonville,9/27/2021,hoop,,36.90694687400003,-121.71512786699996,2,2021-09-27 Watsonville,,,2931
2931,Watsonville,9/27/2021,hoop,,36.90731714800006,-121.71574111199998,2,2021-09-27 Watsonville,,,2932
2932,Watsonville,9/27/2021,hoop,,36.90689811800007,-121.71574443799994,2,2021-09-27 Watsonville,,,2933
2933,Watsonville,9/27/2021,hoop,,36.90710064800004,-121.71603822099996,2,2021-09-27 Watsonville,2935.0,27.841699043643807,2934
2935,Watsonville,9/27/2021,hoop,,36.906909605000074,-121.71640200699994,2,2021-09-27 Watsonville,2938.0,27.748653925091464,2936
2936,Watsonville,9/27/2021,hoop,,36.907282003000034,-121.71671438499997,2,2021-09-27 Watsonville,,,2937
2938,Watsonville,9/27/2021,hoop,,36.90710221200004,-121.71701073399998,2,2021-09-27 Watsonville,2940.0,29.219271791168406,2939
2940,Watsonville,9/27/2021,hoop,,36.90685803200006,-121.71723754199996,2,2021-09-27 Watsonville,,,2941
2941,Watsonville,9/27/2021,hoop,,36.90730399900008,-121.71778081399998,2,2021-09-27 Watsonville,,,2942
2942,Watsonville,9/27/2021,hoop,,36.90690103500003,-121.717832295,2,2021-09-27 Watsonville,,,2943
2943,Watsonville,9/27/2021,hoop,,36.907126240000025,-121.71821289699994,2,2021-09-27 Watsonville,,,2944
2944,Watsonville,9/27/2021,hoop,,36.90728682400004,-121.71867895599996,2,2021-09-27 Watsonville,,,2945
2945,Watsonville,9/27/2021,hoop,,36.906942945000026,-121.71875178799996,2,2021-09-27 Watsonville,,,2946
2946,Watsonville,9/27/2021,other,,36.911715807000064,-121.71372632499998,2,2021-09-27 Watsonville,,,2947
2947,Watsonville,9/27/2021,other,,36.911306308000064,-121.71405153599994,2,2021-09-27 Watsonville,,,2948
2948,Watsonville,9/27/2021,other,,36.91066425900004,-121.71441464599997,2,2021-09-27 Watsonville,,,2949
2949,Watsonville,9/27/2021,other,,36.911042947000055,-121.71457297799996,2,2021-09-27 Watsonville,,,2950
2950,Watsonville,9/27/2021,other,,36.911683811000046,-121.71422204499999,2,2021-09-27 Watsonville,,,2951
2951,Watsonville,9/27/2021,other,,36.91736366500004,-121.71339635499999,2,2021-09-27 Watsonville,,,2952
2952,Watsonville,9/27/2021,other,,36.91694418600008,-121.71400425399996,2,2021-09-27 Watsonville,,,2953
2953,Watsonville,9/27/2021,other,,36.916988220000064,-121.71292531599993,2,2021-09-27 Watsonville,,,2954
2954,Watsonville,9/27/2021,other,,36.91631739900004,-121.71347911499998,2,2021-09-27 Watsonville,,,2955
2955,Watsonville,9/27/2021,other,,36.91678594200005,-121.71346632899996,2,2021-09-27 Watsonville,,,2956
2956,Watsonville,9/27/2021,other,,36.916534901000034,-121.71194177399995,2,2021-09-27 Watsonville,,,2957
2957,Watsonville,9/27/2021,other,,36.91627510600006,-121.71281423099998,2,2021-09-27 Watsonville,,,2958
2958,Watsonville,9/27/2021,other,,36.91564034200008,-121.71319149399994,2,2021-09-27 Watsonville,,,2959
2959,Watsonville,9/27/2021,other,,36.91526350200007,-121.71420073599997,2,2021-09-27 Watsonville,,,2960
2960,Watsonville,9/27/2021,other,,36.91612553600004,-121.71107507899995,2,2021-09-27 Watsonville,,,2961
2961,Watsonville,9/27/2021,other,,36.91610108800006,-121.70909044799998,2,2021-09-27 Watsonville,,,2962
2962,Watsonville,9/27/2021,other,,36.916217139000025,-121.71001712299994,2,2021-09-27 Watsonville,,,2963
2963,Watsonville,9/27/2021,other,,36.916566387000046,-121.71004893399999,2,2021-09-27 Watsonville,,,2964
2964,Watsonville,9/27/2021,other,,36.91663886000004,-121.71080145899998,2,2021-09-27 Watsonville,,,2965
2965,Watsonville,9/27/2021,other,,36.91689803100007,-121.71066500199998,2,2021-09-27 Watsonville,,,2966
2966,Watsonville,9/27/2021,other,,36.916910751000046,-121.71140136499996,2,2021-09-27 Watsonville,,,2967
2967,Watsonville,9/27/2021,other,,36.91727518300007,-121.71143582199994,2,2021-09-27 Watsonville,,,2968
2968,Watsonville,9/27/2021,other,,36.917278002000046,-121.71208002299994,2,2021-09-27 Watsonville,2970.0,29.43404005740025,2969
2970,Watsonville,9/27/2021,other,,36.917618557000026,-121.71264469899997,2,2021-09-27 Watsonville,,,2971
2971,Watsonville,9/27/2021,other,,36.918503832000056,-121.71250352299997,2,2021-09-27 Watsonville,,,2972
2972,Watsonville,9/27/2021,other,,36.91815293700006,-121.71236578199994,2,2021-09-27 Watsonville,,,2973
2973,Watsonville,9/27/2021,other,,36.91812473300007,-121.71178222299994,2,2021-09-27 Watsonville,,,2974
2974,Watsonville,9/27/2021,other,,36.91757421500006,-121.711418606,2,2021-09-27 Watsonville,,,2975
2975,Watsonville,9/27/2021,other,,36.91771205400005,-121.710970842,2,2021-09-27 Watsonville,,,2976
2976,Watsonville,9/27/2021,other,,36.91730844900008,-121.71064512599996,2,2021-09-27 Watsonville,,,2977
2977,Watsonville,9/27/2021,other,,36.91727603200008,-121.710087978,2,2021-09-27 Watsonville,,,2978
2978,Watsonville,9/27/2021,other,,36.91686303000006,-121.71000632,2,2021-09-27 Watsonville,,,2979
2979,Watsonville,9/27/2021,other,,36.91695338900007,-121.70956236399996,2,2021-09-27 Watsonville,,,2980
2980,Watsonville,9/27/2021,other,,36.91654888700003,-121.70894604799996,2,2021-09-27 Watsonville,,,2981
2981,Watsonville,9/27/2021,other,,36.91890572400007,-121.712134591,2,2021-09-27 Watsonville,,,2982
2982,Watsonville,9/27/2021,other,,36.91845896900002,-121.71183680599997,2,2021-09-27 Watsonville,,,2983
2983,Watsonville,9/27/2021,other,,36.91835668800008,-121.71111847999998,2,2021-09-27 Watsonville,,,2984
2984,Watsonville,9/27/2021,other,,36.91836263100004,-121.71060211199995,2,2021-09-27 Watsonville,,,2985
2985,Watsonville,9/27/2021,other,,36.91900092600002,-121.71145626699996,2,2021-09-27 Watsonville,,,2986
2986,Watsonville,9/27/2021,other,,36.917385188000026,-121.707892717,2,2021-09-27 Watsonville,,,2987
2987,Watsonville,9/27/2021,other,,36.91755149900007,-121.70902004599996,2,2021-09-27 Watsonville,,,2988
2988,Watsonville,9/27/2021,other,,36.91813368400005,-121.70952793899994,2,2021-09-27 Watsonville,,,2989
2989,Watsonville,9/27/2021,other,,36.91765875300007,-121.70999970399998,2,2021-09-27 Watsonville,,,2990
2990,Watsonville,9/27/2021,other,,36.91708495100005,-121.708862835,2,2021-09-27 Watsonville,,,2991
2991,Watsonville,9/11/2022,mulch,,36.92594502800006,-121.81470740599995,1,2022-09-11 Watsonville,2994.0,13.681035446399056,2992
2994,Watsonville,9/11/2022,mulch,,36.92608951900007,-121.81502187199997,1,2022-09-11 Watsonville,2998.0,19.713775238072987,2995
2996,Watsonville,9/11/2022,mulch,,36.926323585000034,-121.81477256999995,1,2022-09-11 Watsonville,2999.0,10.905520864426588,2997
3001,Watsonville,9/11/2022,mulch,,36.92571510300007,-121.81516596199998,1,2022-09-11 Watsonville,3003.0,16.542786363278232,3002
3012,Watsonville,9/11/2022,mulch,,36.92625007600003,-121.81607244199996,1,2022-09-11 Watsonville,3015.0,14.07933643961846,3013
3020,Watsonville,9/11/2022,mulch,,36.92556171800004,-121.81575009499994,1,2022-09-11 Watsonville,3020.0,21.68795584867772,3021
3021,Watsonville,9/11/2022,mulch,,36.92536011400006,-121.81611632599999,1,2022-09-11 Watsonville,3024.0,21.65544558197548,3022
3025,Watsonville,9/11/2022,mulch,,36.92552654600007,-121.81654859499996,1,2022-09-11 Watsonville,3029.0,12.837167436119596,3026
3030,Watsonville,9/11/2022,mulch,,36.925936584000056,-121.81637936299995,1,2022-09-11 Watsonville,3028.0,15.648076917412034,3031
3032,Watsonville,9/11/2022,mulch,,36.92482568600008,-121.81579049599996,1,2022-09-11 Watsonville,3036.0,19.26165439259117,3033
3034,Watsonville,9/11/2022,mulch,,36.92466247000005,-121.81640108199996,1,2022-09-11 Watsonville,3037.0,21.20270696943997,3035
3040,Watsonville,9/11/2022,mulch,,36.92495019900008,-121.816463683,1,2022-09-11 Watsonville,3042.0,17.05639462607543,3041
3042,Watsonville,9/11/2022,mulch,,36.92303019100007,-121.81307487999997,1,2022-09-11 Watsonville,3441.0,18.80855066856564,3043
3043,Watsonville,9/11/2022,mulch,,36.92304561800007,-121.81356198799995,1,2022-09-11 Watsonville,3441.0,25.434569017687963,3044
3046,Watsonville,9/11/2022,mulch,,36.923510607000026,-121.81369209599995,1,2022-09-11 Watsonville,3445.0,13.805437724488826,3047
3047,Watsonville,9/11/2022,mulch,,36.923579680000046,-121.81414727699996,1,2022-09-11 Watsonville,3050.0,24.23364229594226,3048
3050,Watsonville,9/11/2022,mulch,,36.92393785100006,-121.81408812999996,1,2022-09-11 Watsonville,3049.0,27.232624059419983,3051
3051,Watsonville,9/11/2022,mulch,,36.92389637500003,-121.81452422299996,1,2022-09-11 Watsonville,3050.0,24.442324291924194,3052
3052,Watsonville,9/11/2022,mulch,,36.924165438000045,-121.814270578,1,2022-09-11 Watsonville,3444.0,17.155666921694444,3053
3053,Watsonville,9/11/2022,mulch,,36.92418395800007,-121.81472306999996,1,2022-09-11 Watsonville,3443.0,21.458240641713527,3054
3054,Watsonville,9/11/2022,mulch,,36.92442328600004,-121.81452480699994,1,2022-09-11 Watsonville,3443.0,20.944456498837734,3055
3055,Watsonville,9/11/2022,mulch,,36.92439587400003,-121.81505176799998,1,2022-09-11 Watsonville,3443.0,26.71206670250764,3056
3056,Watsonville,9/11/2022,mulch,,36.92458970300004,-121.81479514199998,1,2022-09-11 Watsonville,3443.0,24.10148009741928,3057
3057,Watsonville,9/11/2022,mulch,,36.92459497500005,-121.81558481299999,1,2022-09-11 Watsonville,3448.0,22.67868345012377,3058
3059,Watsonville,9/11/2022,mulch,,36.92434467600003,-121.81538772,1,2022-09-11 Watsonville,3448.0,17.053516851122286,3060
3060,Watsonville,9/11/2022,mulch,,36.92407444500003,-121.81544325299996,1,2022-09-11 Watsonville,3084.0,26.204380960610884,3061
3062,Watsonville,9/11/2022,mulch,,36.92385236300004,-121.81512808699993,1,2022-09-11 Watsonville,3064.0,22.71583749711086,3063
3064,Watsonville,9/11/2022,mulch,,36.923624794000034,-121.81489662599996,1,2022-09-11 Watsonville,,,3065
3066,Watsonville,9/11/2022,mulch,,36.923385849000056,-121.81470318899994,1,2022-09-11 Watsonville,3066.0,26.653707236575848,3067
3067,Watsonville,9/11/2022,mulch,,36.92330595800007,-121.81432635199997,1,2022-09-11 Watsonville,3069.0,23.867002266012538,3068
3069,Watsonville,9/11/2022,mulch,,36.92309539600007,-121.81410519899998,1,2022-09-11 Watsonville,3046.0,29.014014955144088,3070
3070,Watsonville,9/11/2022,mulch,,36.92272214400003,-121.81363629699996,1,2022-09-11 Watsonville,,,3071
3071,Watsonville,9/11/2022,mulch,,36.922790259000074,-121.81404555199998,1,2022-09-11 Watsonville,,,3072
3072,Watsonville,9/11/2022,mulch,,36.922820202000025,-121.81456840199996,1,2022-09-11 Watsonville,3074.0,28.188236579530557,3073
3074,Watsonville,9/11/2022,mulch,,36.92313206400007,-121.81489135699996,1,2022-09-11 Watsonville,3449.0,21.998203021726074,3075
3075,Watsonville,9/11/2022,mulch,,36.923025477000074,-121.81535511599996,1,2022-09-11 Watsonville,3077.0,21.85484872632582,3076
3078,Watsonville,9/11/2022,mulch,,36.92331435700004,-121.81567945199998,1,2022-09-11 Watsonville,,,3079
3079,Watsonville,9/11/2022,mulch,,36.92356862400004,-121.81551927399993,1,2022-09-11 Watsonville,3082.0,20.32372758763741,3080
3080,Watsonville,9/11/2022,mulch,,36.92365382000003,-121.81584433499997,1,2022-09-11 Watsonville,3083.0,18.97182911621552,3081
3084,Watsonville,9/11/2022,mulch,,36.92395830100003,-121.81596182799996,1,2022-09-11 Watsonville,3083.0,20.083835852751424,3085
3086,Watsonville,9/11/2022,mulch,,36.92431195300002,-121.81624167599993,1,2022-09-11 Watsonville,3086.0,23.956941497034595,3087
3087,Watsonville,9/11/2022,mulch,,36.92456062700006,-121.81382411199996,1,2022-09-11 Watsonville,3092.0,16.614626617955608,3088
3090,Watsonville,9/11/2022,mulch,,36.92464036100006,-121.81421255599996,1,2022-09-11 Watsonville,3092.0,19.190558940272275,3091
3092,Watsonville,9/11/2022,mulch,,36.92494736900005,-121.81408068099996,1,2022-09-11 Watsonville,3097.0,21.24360965492098,3093
3094,Watsonville,9/11/2022,mulch,,36.92520256300002,-121.81424933199996,1,2022-09-11 Watsonville,3446.0,17.692110651469324,3095
3100,Watsonville,9/11/2022,mulch,,36.92558252500004,-121.81449499799999,1,2022-09-11 Watsonville,3102.0,19.00267653738012,3101
3102,Watsonville,9/11/2022,hoop,,36.944858131000046,-121.80152703199995,1,2022-09-11 Watsonville,,,3103
3103,Watsonville,9/11/2022,hoop,,36.94512223200008,-121.80205186899995,1,2022-09-11 Watsonville,,,3104
3104,Watsonville,9/11/2022,hoop,,36.944815924000075,-121.80214586399995,1,2022-09-11 Watsonville,,,3105
3105,Watsonville,9/11/2022,hoop,,36.94486822800008,-121.80265414599997,1,2022-09-11 Watsonville,,,3106
3106,Watsonville,9/11/2022,hoop,,36.94452790700007,-121.802503974,1,2022-09-11 Watsonville,,,3107
3107,Watsonville,9/11/2022,hoop,,36.94472422100006,-121.80305704999996,1,2022-09-11 Watsonville,,,3108
3108,Watsonville,9/11/2022,hoop,,36.94431318400007,-121.80303311299996,1,2022-09-11 Watsonville,,,3109
3109,Watsonville,9/11/2022,hoop,,36.944357069000034,-121.80350849699992,1,2022-09-11 Watsonville,,,3110
3110,Watsonville,9/11/2022,hoop,,36.94438504900006,-121.80411047899996,1,2022-09-11 Watsonville,,,3111
3111,Watsonville,9/11/2022,hoop,,36.94398775600007,-121.80400980999995,1,2022-09-11 Watsonville,,,3112
3112,Watsonville,9/11/2022,hoop,,36.945420925000064,-121.80218835699996,1,2022-09-11 Watsonville,,,3113
3113,Watsonville,9/11/2022,hoop,,36.94566404700004,-121.80280772299994,1,2022-09-11 Watsonville,,,3114
3114,Watsonville,9/11/2022,hoop,,36.94524396600008,-121.80299075899995,1,2022-09-11 Watsonville,,,3115
3115,Watsonville,9/11/2022,hoop,,36.94545176700007,-121.80338270599997,1,2022-09-11 Watsonville,,,3116
3116,Watsonville,9/11/2022,hoop,,36.94516895900006,-121.80370322199995,1,2022-09-11 Watsonville,,,3117
3117,Watsonville,9/11/2022,hoop,,36.94485663800003,-121.80379775199998,1,2022-09-11 Watsonville,,,3118
3118,Watsonville,9/11/2022,hoop,,36.94530193800006,-121.80424541999996,1,2022-09-11 Watsonville,,,3119
3119,Watsonville,9/11/2022,hoop,,36.94497484800007,-121.80427670199998,1,2022-09-11 Watsonville,,,3120
3120,Watsonville,9/11/2022,hoop,,36.944691740000046,-121.80451598199994,1,2022-09-11 Watsonville,,,3121
3121,Watsonville,9/11/2022,hoop,,36.94495136300003,-121.804710474,1,2022-09-11 Watsonville,,,3122
3122,Watsonville,9/11/2022,hoop,,36.946030220000075,-121.80312653199996,1,2022-09-11 Watsonville,,,3123
3123,Watsonville,9/11/2022,hoop,,36.94632195700007,-121.80352291999996,1,2022-09-11 Watsonville,,,3124
3124,Watsonville,9/11/2022,hoop,,36.945813827000045,-121.80379189899996,1,2022-09-11 Watsonville,,,3125
3125,Watsonville,9/11/2022,hoop,,36.946236301000056,-121.80392479299996,1,2022-09-11 Watsonville,,,3126
3126,Watsonville,9/11/2022,hoop,,36.94608966700002,-121.80439230899997,1,2022-09-11 Watsonville,3132.0,29.585773299287755,3127
3127,Watsonville,9/11/2022,hoop,,36.94569197000004,-121.80417057099999,1,2022-09-11 Watsonville,3132.0,19.605477747104967,3128
3128,Watsonville,9/11/2022,hoop,,36.945454073000064,-121.80476939999994,1,2022-09-11 Watsonville,3131.0,26.654905719922645,3129
3129,Watsonville,9/11/2022,hoop,,36.945830605000026,-121.805212402,1,2022-09-11 Watsonville,,,3130
3132,Watsonville,9/11/2022,hoop,,36.94663176400008,-121.80369590599996,1,2022-09-11 Watsonville,,,3133
3133,Watsonville,9/11/2022,hoop,,36.94691406000004,-121.80407801899996,1,2022-09-11 Watsonville,,,3134
3134,Watsonville,9/11/2022,hoop,,36.94653224700005,-121.80427237999999,1,2022-09-11 Watsonville,3137.0,24.422208084894304,3135
3135,Watsonville,9/11/2022,hoop,,36.94702208300004,-121.80447148099996,1,2022-09-11 Watsonville,,,3136
3137,Watsonville,9/11/2022,hoop,,36.946846333000046,-121.80481305399996,1,2022-09-11 Watsonville,,,3138
3138,Watsonville,9/11/2022,hoop,,36.94634813100004,-121.80476782099998,1,2022-09-11 Watsonville,3140.0,29.29205428138456,3139
3140,Watsonville,9/11/2022,hoop,,36.94622541600006,-121.80518957599996,1,2022-09-11 Watsonville,,,3141
3141,Watsonville,9/11/2022,hoop,,36.94673196200006,-121.80530736599997,1,2022-09-11 Watsonville,,,3142
3142,Watsonville,9/11/2022,hoop,,36.947337367000046,-121.80443203099996,1,2022-09-11 Watsonville,3144.0,29.65163693203509,3143
3144,Watsonville,9/11/2022,hoop,,36.94722947800005,-121.80482347099996,1,2022-09-11 Watsonville,3147.0,19.37559851820336,3145
3147,Watsonville,9/11/2022,hoop,,36.94768374200004,-121.80523547899996,1,2022-09-11 Watsonville,3146.0,25.43304753303229,3148
3149,Watsonville,9/11/2022,hoop,,36.94700213600004,-121.80535712399995,1,2022-09-11 Watsonville,3151.0,25.716974473561947,3150
3151,Watsonville,9/11/2022,hoop,,36.94732416300008,-121.805572757,1,2022-09-11 Watsonville,3151.0,15.633321814836425,3152
3152,Watsonville,9/11/2022,hoop,,36.953737537000045,-121.79819043699996,1,2022-09-11 Watsonville,3154.0,21.20739666748092,3153
3154,Watsonville,9/11/2022,hoop,,36.95399938200006,-121.79851362799997,1,2022-09-11 Watsonville,3154.0,21.842443975707724,3155
3155,Watsonville,9/11/2022,hoop,,36.953554419000056,-121.798446889,1,2022-09-11 Watsonville,3157.0,20.471210317751552,3156
3157,Watsonville,9/11/2022,hoop,,36.953833819000074,-121.79892163299996,1,2022-09-11 Watsonville,3160.0,20.757512020314895,3158
3160,Watsonville,9/11/2022,hoop,,36.95434908500005,-121.79870791899998,1,2022-09-11 Watsonville,3159.0,14.592324773405885,3161
3162,Watsonville,9/11/2022,hoop,,36.953253850000074,-121.79881981399996,1,2022-09-11 Watsonville,3164.0,20.0540312382244,3163
3164,Watsonville,9/11/2022,hoop,,36.95313111300004,-121.79932124699997,1,2022-09-11 Watsonville,3167.0,13.326638269321512,3165
3167,Watsonville,9/11/2022,hoop,,36.953490163000026,-121.79907261199996,1,2022-09-11 Watsonville,3171.0,12.054160664738664,3168
3171,Watsonville,9/11/2022,hoop,,36.953657474000075,-121.79959435099993,1,2022-09-11 Watsonville,3194.0,27.0233339652365,3172
3172,Watsonville,9/11/2022,hoop,,36.95280339900006,-121.79950968199996,1,2022-09-11 Watsonville,3174.0,25.29240921892282,3173
3174,Watsonville,9/11/2022,hoop,,36.95250431300008,-121.79991148799996,1,2022-09-11 Watsonville,3174.0,29.15687320953493,3175
3175,Watsonville,9/11/2022,hoop,,36.95306185700008,-121.79972485999996,1,2022-09-11 Watsonville,3179.0,19.03059476085332,3176
3176,Watsonville,9/11/2022,hoop,,36.95276577800007,-121.80013159599996,1,2022-09-11 Watsonville,3180.0,18.89439759995184,3177
3181,Watsonville,9/11/2022,hoop,,36.95315894500004,-121.80045111899994,1,2022-09-11 Watsonville,3181.0,26.43853663555115,3182
3182,Watsonville,9/11/2022,hoop,,36.95229917100005,-121.80017835299996,1,2022-09-11 Watsonville,3185.0,28.835074099735003,3183
3185,Watsonville,9/11/2022,hoop,,36.95218798000008,-121.80086831099997,1,2022-09-11 Watsonville,3188.0,15.07480271265892,3186
3186,Watsonville,9/11/2022,hoop,,36.95255981400004,-121.80046504199998,1,2022-09-11 Watsonville,3189.0,19.99866233749025,3187
3190,Watsonville,9/11/2022,hoop,,36.95273283800003,-121.80079569799994,1,2022-09-11 Watsonville,3189.0,16.24254162416654,3191
3191,Watsonville,9/11/2022,hoop,,36.952408095000074,-121.80142716199998,1,2022-09-11 Watsonville,3193.0,26.8031505977836,3192
3194,Watsonville,9/11/2022,hoop,,36.95332349700004,-121.80013557599995,1,2022-09-11 Watsonville,3181.0,20.119657483843287,3195
3195,Watsonville,9/11/2022,hoop,,36.95335752300008,-121.79955432199993,1,2022-09-11 Watsonville,3169.0,14.12885245218188,3196
3196,Watsonville,9/11/2022,other,,36.95364807900006,-121.80058090699998,1,2022-09-11 Watsonville,,,3197
3197,Watsonville,9/11/2022,other,,36.953673997000074,-121.801100938,1,2022-09-11 Watsonville,3199.0,29.60305889896336,3198
3199,Watsonville,9/11/2022,other,,36.95394818600005,-121.80131764999997,1,2022-09-11 Watsonville,,,3200
3200,Watsonville,9/11/2022,other,,36.95420152500003,-121.80112723899998,1,2022-09-11 Watsonville,,,3201
3201,Watsonville,9/11/2022,other,,36.95332019700004,-121.80078341499996,1,2022-09-11 Watsonville,,,3202
3203,Watsonville,9/11/2022,other,,36.954393820000064,-121.801376474,1,2022-09-11 Watsonville,3203.0,16.51726694322822,3204
3205,Watsonville,9/11/2022,other,,36.95439751600002,-121.80185707799995,1,2022-09-11 Watsonville,3203.0,29.05109253799732,3206
3206,Watsonville,9/11/2022,other,,36.95329695000004,-121.80116351299993,1,2022-09-11 Watsonville,,,3207
3207,Watsonville,9/11/2022,other,,36.953387193000026,-121.80162427399993,1,2022-09-11 Watsonville,,,3208
3208,Watsonville,9/11/2022,other,,36.95312935800007,-121.80184357299999,1,2022-09-11 Watsonville,,,3209
3209,Watsonville,9/11/2022,other,,36.95377640000004,-121.80173235999996,1,2022-09-11 Watsonville,,,3210
3210,Watsonville,9/11/2022,other,,36.95319320500005,-121.80234188199996,1,2022-09-11 Watsonville,,,3211
3211,Watsonville,9/11/2022,other,,36.95166892000003,-121.80288179599997,1,2022-09-11 Watsonville,3213.0,20.193547339747447,3212
3214,Watsonville,9/11/2022,other,,36.95187128300007,-121.80313504799994,1,2022-09-11 Watsonville,3213.0,17.733471448408647,3215
3215,Watsonville,9/11/2022,other,,36.95194802500004,-121.80262507599996,1,2022-09-11 Watsonville,3214.0,20.645410923831708,3216
3216,Watsonville,9/11/2022,other,,36.95063255600007,-121.80030557299995,1,2022-09-11 Watsonville,,,3217
3217,Watsonville,9/11/2022,other,,36.95062341700003,-121.80065468299993,1,2022-09-11 Watsonville,,,3218
3218,Watsonville,9/11/2022,other,,36.950293530000074,-121.80077002299998,1,2022-09-11 Watsonville,3220.0,24.185084396686015,3219
3220,Watsonville,9/11/2022,other,,36.95059094100003,-121.80099363999994,1,2022-09-11 Watsonville,3220.0,21.896104797145608,3221
3221,Watsonville,9/11/2022,other,,36.95031351100005,-121.80129939399995,1,2022-09-11 Watsonville,3220.0,27.18085504984272,3222
3222,Watsonville,9/11/2022,other,,36.95094187800004,-121.80008540699998,1,2022-09-11 Watsonville,,,3223
3223,Watsonville,9/11/2022,other,,36.94865715900005,-121.802002658,1,2022-09-11 Watsonville,,,3224
3224,Watsonville,9/11/2022,other,,36.94950288700005,-121.800763771,1,2022-09-11 Watsonville,,,3225
3225,Watsonville,9/11/2022,other,,36.94794836700004,-121.803748494,1,2022-09-11 Watsonville,3230.0,10.35273924113088,3229
3229,Watsonville,9/11/2022,other,,36.948307511000046,-121.80305681199997,1,2022-09-11 Watsonville,3231.0,23.23940229603205,3241
3230,Watsonville,9/11/2022,other,,36.94888750100006,-121.80350490899995,1,2022-09-11 Watsonville,,,3245
3231,Watsonville,9/11/2022,other,,36.95067554800005,-121.80646023999996,1,2022-09-11 Watsonville,,,3246
3232,Watsonville,9/11/2022,other,,36.93646354600003,-121.78131168599998,1,2022-09-11 Watsonville,,,3247
3233,Watsonville,9/11/2022,other,,36.93669688500007,-121.78307174899999,1,2022-09-11 Watsonville,,,3248
3234,Watsonville,9/11/2022,other,,36.93584361800004,-121.78238837999999,1,2022-09-11 Watsonville,,,3249
3235,Watsonville,9/11/2022,other,,36.93573401100008,-121.78294545999997,1,2022-09-11 Watsonville,,,3250
3236,Watsonville,9/11/2022,other,,36.93545465100004,-121.78243680899998,1,2022-09-11 Watsonville,,,3251
3238,Watsonville,9/11/2022,other,,36.93459452000008,-121.78372468899992,1,2022-09-11 Watsonville,,,3253
3239,Watsonville,9/11/2022,other,,36.93489317500007,-121.78400285799997,1,2022-09-11 Watsonville,3252.0,29.82104599293188,3254
3240,Watsonville,9/11/2022,other,,36.93514024700005,-121.78413956699995,1,2022-09-11 Watsonville,3257.0,19.39107513900596,3255
3241,Watsonville,9/11/2022,other,,36.93460051100004,-121.78414448899996,1,2022-09-11 Watsonville,,,3256
3243,Watsonville,9/11/2022,other,,36.93468016500003,-121.78450171699996,1,2022-09-11 Watsonville,3260.0,22.217210601272907,3258
3244,Watsonville,9/11/2022,other,,36.93510124900007,-121.784518145,1,2022-09-11 Watsonville,3257.0,14.582295712788907,3259
3246,Watsonville,9/11/2022,other,,36.93513249900008,-121.78489767699995,1,2022-09-11 Watsonville,,,3261
3247,Watsonville,9/11/2022,other,,36.934675981000055,-121.78511048599997,1,2022-09-11 Watsonville,,,3262
3248,Watsonville,9/11/2022,other,,36.93566476900003,-121.78396249099995,1,2022-09-11 Watsonville,,,3263
3249,Watsonville,9/11/2022,other,,36.935675272000026,-121.78466844199994,1,2022-09-11 Watsonville,,,3264
3250,Watsonville,9/11/2022,other,,36.93586869800004,-121.78432865999996,1,2022-09-11 Watsonville,3267.0,28.740865683858274,3265
3251,Watsonville,9/11/2022,other,,36.93582848900007,-121.78522924299995,1,2022-09-11 Watsonville,,,3266
3253,Watsonville,9/11/2022,other,,36.93600963600005,-121.78471543499997,1,2022-09-11 Watsonville,,,3268
3254,Watsonville,9/11/2022,other,,36.93539469500007,-121.786398637,1,2022-09-11 Watsonville,,,3269
3255,Watsonville,9/11/2022,other,,36.93575566300007,-121.786315334,1,2022-09-11 Watsonville,,,3270
3256,Watsonville,9/11/2022,other,,36.93583638500007,-121.78699485299995,1,2022-09-11 Watsonville,,,3271
3257,Watsonville,9/11/2022,other,,36.93606439800004,-121.78604055899996,1,2022-09-11 Watsonville,,,3272
3258,Watsonville,9/11/2022,other,,36.93619711900004,-121.78686858499997,1,2022-09-11 Watsonville,,,3273
3259,Watsonville,9/11/2022,other,,36.936412449000045,-121.78597521899997,1,2022-09-11 Watsonville,,,3274
3260,Watsonville,9/11/2022,other,,36.93644345900003,-121.78658379299996,1,2022-09-11 Watsonville,,,3275
3261,Watsonville,9/11/2022,other,,36.93149827800005,-121.79023705399997,1,2022-09-11 Watsonville,,,3276
3262,Watsonville,9/11/2022,other,,36.93191522800004,-121.79099113499996,1,2022-09-11 Watsonville,,,3277
3263,Watsonville,9/11/2022,other,,36.93127559300007,-121.79123380099996,1,2022-09-11 Watsonville,,,3278
3264,Watsonville,9/11/2022,other,,36.93156746100004,-121.79139856599994,1,2022-09-11 Watsonville,,,3279
3265,Watsonville,9/11/2022,other,,36.93119526200008,-121.79182373099997,1,2022-09-11 Watsonville,,,3280
3266,Watsonville,9/11/2022,other,,36.93249806700004,-121.78835201599996,1,2022-09-11 Watsonville,,,3281
3267,Watsonville,9/11/2022,other,,36.93784331300003,-121.788726108,1,2022-09-11 Watsonville,3283.0,25.452830805322673,3282
3269,Watsonville,9/11/2022,other,,36.935479804000074,-121.79054166499996,1,2022-09-11 Watsonville,,,3284
3270,Watsonville,9/11/2022,other,,36.93560953400004,-121.79089668399996,1,2022-09-11 Watsonville,,,3285
3271,Watsonville,9/11/2022,other,,36.929220804000074,-121.79554965999993,1,2022-09-11 Watsonville,3287.0,28.5085048912272,3286
3273,Watsonville,9/11/2022,other,,36.93414165000007,-121.79057965699997,1,2022-09-11 Watsonville,,,3288
3274,Watsonville,9/11/2022,other,,36.93319079300005,-121.79275039999997,1,2022-09-11 Watsonville,,,3289
3275,Watsonville,9/11/2022,other,,36.93701533200005,-121.79066723999993,1,2022-09-11 Watsonville,,,3290
3278,Watsonville,9/11/2022,mulch,,36.90269922700002,-121.80849609799996,1,2022-09-11 Watsonville,3291.0,7.084794525327079,3293
3286,Watsonville,9/11/2022,mulch,,36.90263299900005,-121.80893549199997,1,2022-09-11 Watsonville,3303.0,8.677448629978539,3301
3292,Watsonville,9/11/2022,mulch,,36.90255271500007,-121.80958642999995,1,2022-09-11 Watsonville,3302.0,23.205374147330915,3307
3293,Watsonville,9/11/2022,mulch,,36.90178094300006,-121.809683442,1,2022-09-11 Watsonville,,,3308
3294,Watsonville,9/11/2022,mulch,,36.902309356000046,-121.81034154099996,1,2022-09-11 Watsonville,,,3309
3295,Watsonville,9/11/2022,mulch,,36.90192906100003,-121.81038903199997,1,2022-09-11 Watsonville,,,3310
3296,Watsonville,9/11/2022,mulch,,36.90228914400007,-121.811111386,1,2022-09-11 Watsonville,,,3311
3297,Watsonville,9/11/2022,mulch,,36.90182452000005,-121.81107753199996,1,2022-09-11 Watsonville,,,3312
3298,Watsonville,9/11/2022,mulch,,36.90221208500003,-121.811801775,1,2022-09-11 Watsonville,,,3313
3299,Watsonville,9/11/2022,mulch,,36.901461547000046,-121.81166011599998,1,2022-09-11 Watsonville,,,3314
3300,Watsonville,9/11/2022,mulch,,36.90213059000007,-121.81247405,1,2022-09-11 Watsonville,,,3315
3301,Watsonville,9/11/2022,mulch,,36.901466613000025,-121.81235324,1,2022-09-11 Watsonville,,,3316
3302,Watsonville,9/11/2022,mulch,,36.90158732100008,-121.80850645799995,1,2022-09-11 Watsonville,,,3317
3303,Watsonville,9/11/2022,mulch,,36.90108991700004,-121.808888621,1,2022-09-11 Watsonville,,,3318
3304,Watsonville,9/11/2022,mulch,,36.901101596000046,-121.80957004299997,1,2022-09-11 Watsonville,,,3319
3305,Watsonville,9/11/2022,mulch,,36.90064037600007,-121.81090675899996,1,2022-09-11 Watsonville,,,3320
3306,Watsonville,9/11/2022,mulch,,36.90099008800007,-121.81118972299998,1,2022-09-11 Watsonville,,,3321
3307,Watsonville,9/11/2022,mulch,,36.90093008900004,-121.81189489399996,1,2022-09-11 Watsonville,,,3322
3308,Watsonville,9/11/2022,mulch,,36.90053006300008,-121.81156558099995,1,2022-09-11 Watsonville,,,3323
3309,Watsonville,9/11/2022,mulch,,36.90041464000007,-121.81227619099997,1,2022-09-11 Watsonville,,,3324
3310,Watsonville,9/11/2022,mulch,,36.90009072300006,-121.81176396399997,1,2022-09-11 Watsonville,,,3325
3311,Watsonville,9/11/2022,mulch,,36.89985620800008,-121.81225199299996,1,2022-09-11 Watsonville,,,3326
3312,Watsonville,9/11/2022,mulch,,36.90073999400005,-121.80996967599998,1,2022-09-11 Watsonville,,,3327
3313,Watsonville,9/11/2022,mulch,,36.89936638800003,-121.81217848099998,1,2022-09-11 Watsonville,,,3328
3314,Watsonville,9/11/2022,mulch,,36.90021905100008,-121.80937359299996,1,2022-09-11 Watsonville,,,3329
3315,Watsonville,9/11/2022,mulch,,36.90002151700003,-121.81121696699996,1,2022-09-11 Watsonville,,,3330
3316,Watsonville,9/11/2022,mulch,,36.89970547300004,-121.80967883399995,1,2022-09-11 Watsonville,,,3331
3317,Watsonville,9/11/2022,mulch,,36.89968095100005,-121.81100133199998,1,2022-09-11 Watsonville,,,3332
3318,Watsonville,9/11/2022,mulch,,36.90076577000008,-121.808313221,1,2022-09-11 Watsonville,,,3333
3319,Watsonville,9/11/2022,mulch,,36.89984435600008,-121.80823286999998,1,2022-09-11 Watsonville,,,3334
3321,Watsonville,9/11/2022,mulch,,36.90249248200007,-121.80924809199996,1,2022-09-11 Watsonville,3302.0,10.446254696215854,3336
3322,Watsonville,9/11/2022,hoop,,36.92923447400005,-121.75495116199994,1,2022-09-11 Watsonville,,,3337
3323,Watsonville,9/11/2022,hoop,,36.93009502900002,-121.75531023999996,1,2022-09-11 Watsonville,,,3338
3324,Watsonville,9/11/2022,hoop,,36.93072639400003,-121.75514911899997,1,2022-09-11 Watsonville,,,3339
3325,Watsonville,9/11/2022,hoop,,36.93090413200008,-121.75584515899997,1,2022-09-11 Watsonville,,,3340
3326,Watsonville,9/11/2022,hoop,,36.93020470500005,-121.75624205099996,1,2022-09-11 Watsonville,,,3341
3327,Watsonville,9/11/2022,hoop,,36.929798395000034,-121.75412040999998,1,2022-09-11 Watsonville,,,3342
3328,Watsonville,9/11/2022,hoop,,36.92994384200006,-121.75467474099996,1,2022-09-11 Watsonville,,,3343
3329,Watsonville,9/11/2022,hoop,,36.92975802900003,-121.75323336099996,1,2022-09-11 Watsonville,,,3344
3330,Watsonville,9/11/2022,hoop,,36.93144374100007,-121.756961435,1,2022-09-11 Watsonville,,,3345
3331,Watsonville,9/11/2022,hoop,,36.93117439100007,-121.75651211499996,1,2022-09-11 Watsonville,,,3346
3332,Watsonville,9/11/2022,hoop,,36.93102340600007,-121.75554184699996,1,2022-09-11 Watsonville,,,3347
3333,Watsonville,9/11/2022,hoop,,36.92906057300007,-121.75330629499996,1,2022-09-11 Watsonville,,,3348
3334,Watsonville,9/11/2022,hoop,,36.92907568300007,-121.75400844199999,1,2022-09-11 Watsonville,,,3349
3335,Watsonville,9/11/2022,hoop,,36.92965100400005,-121.75632791899994,1,2022-09-11 Watsonville,,,3350
3336,Watsonville,9/11/2022,hoop,,36.92938704000005,-121.75555529599995,1,2022-09-11 Watsonville,,,3351
3337,Watsonville,9/11/2022,hoop,,36.93605628900008,-121.75020062099996,1,2022-09-11 Watsonville,,,3352
3338,Watsonville,9/11/2022,hoop,,36.93563800400005,-121.75109946499998,1,2022-09-11 Watsonville,,,3353
3339,Watsonville,9/11/2022,hoop,,36.93356231100007,-121.75143621299996,1,2022-09-11 Watsonville,,,3354
3340,Watsonville,9/11/2022,hoop,,36.93433077900005,-121.75138903399994,1,2022-09-11 Watsonville,,,3355
3341,Watsonville,9/11/2022,hoop,,36.93476768800008,-121.75098788699997,1,2022-09-11 Watsonville,,,3356
3342,Watsonville,9/11/2022,hoop,,36.93587025000005,-121.749704313,1,2022-09-11 Watsonville,,,3357
3343,Watsonville,9/11/2022,hoop,,36.93521759600003,-121.74935150399995,1,2022-09-11 Watsonville,,,3358
3344,Watsonville,9/11/2022,hoop,,36.93485679300005,-121.75014293799995,1,2022-09-11 Watsonville,,,3359
3345,Watsonville,9/11/2022,hoop,,36.93415368800004,-121.74979534699996,1,2022-09-11 Watsonville,,,3360
3346,Watsonville,9/11/2022,hoop,,36.93364897000004,-121.75058618599996,1,2022-09-11 Watsonville,,,3361
3347,Watsonville,9/11/2022,hoop,,36.93308071800004,-121.74680490599997,1,2022-09-11 Watsonville,,,3362
3348,Watsonville,9/11/2022,hoop,,36.92936978500006,-121.74834623899994,1,2022-09-11 Watsonville,,,3363
3349,Watsonville,9/11/2022,hoop,,36.933518133000064,-121.74740218399997,1,2022-09-11 Watsonville,,,3364
3350,Watsonville,9/11/2022,hoop,,36.933154452000046,-121.74803181899993,1,2022-09-11 Watsonville,,,3365
3351,Watsonville,9/11/2022,hoop,,36.93364369200003,-121.74809179599998,1,2022-09-11 Watsonville,,,3366
3352,Watsonville,9/11/2022,hoop,,36.93341002500006,-121.74901392799995,1,2022-09-11 Watsonville,,,3367
3353,Watsonville,9/11/2022,hoop,,36.932152873000064,-121.74710710099998,1,2022-09-11 Watsonville,,,3368
3354,Watsonville,9/11/2022,hoop,,36.93259987500005,-121.74772966699997,1,2022-09-11 Watsonville,,,3369
3355,Watsonville,9/11/2022,hoop,,36.93237960400006,-121.74855849599999,1,2022-09-11 Watsonville,,,3370
3356,Watsonville,9/11/2022,hoop,,36.93287017600005,-121.74881719099994,1,2022-09-11 Watsonville,,,3371
3357,Watsonville,9/11/2022,hoop,,36.93301993800002,-121.74950851699998,1,2022-09-11 Watsonville,,,3372
3358,Watsonville,9/11/2022,hoop,,36.931528210000074,-121.74731696999999,1,2022-09-11 Watsonville,,,3373
3359,Watsonville,9/11/2022,hoop,,36.93112587300004,-121.748275461,1,2022-09-11 Watsonville,,,3374
3360,Watsonville,9/11/2022,hoop,,36.93172380200008,-121.748181924,1,2022-09-11 Watsonville,,,3375
3361,Watsonville,9/11/2022,hoop,,36.93134256200005,-121.74907166899997,1,2022-09-11 Watsonville,,,3376
3362,Watsonville,9/11/2022,hoop,,36.931942161000045,-121.74909635199998,1,2022-09-11 Watsonville,,,3377
3363,Watsonville,9/11/2022,hoop,,36.93194211200006,-121.749915252,1,2022-09-11 Watsonville,,,3378
3364,Watsonville,9/11/2022,hoop,,36.93029291800008,-121.74798457399999,1,2022-09-11 Watsonville,,,3379
3365,Watsonville,9/11/2022,hoop,,36.93073800900004,-121.74873080199995,1,2022-09-11 Watsonville,,,3380
3366,Watsonville,9/11/2022,hoop,,36.93043595400008,-121.74923476699996,1,2022-09-11 Watsonville,,,3381
3367,Watsonville,9/11/2022,hoop,,36.93100513700006,-121.74926335099995,1,2022-09-11 Watsonville,,,3382
3368,Watsonville,9/11/2022,hoop,,36.93110132200008,-121.75019796999997,1,2022-09-11 Watsonville,,,3383
3369,Watsonville,9/11/2022,hoop,,36.92985673100002,-121.74909879999996,1,2022-09-11 Watsonville,,,3384
3370,Watsonville,9/11/2022,hoop,,36.92994581300008,-121.75106322099998,1,2022-09-11 Watsonville,,,3385
3371,Watsonville,9/11/2022,hoop,,36.92995215900004,-121.75004482699995,1,2022-09-11 Watsonville,,,3386
3372,Watsonville,9/11/2022,hoop,,36.930468201000046,-121.75074336699998,1,2022-09-11 Watsonville,,,3387
3373,Watsonville,9/11/2022,other,,36.93416833100008,-121.74702297899996,1,2022-09-11 Watsonville,,,3388
3374,Watsonville,9/11/2022,other,,36.93388835300004,-121.74756523899998,1,2022-09-11 Watsonville,,,3389
3375,Watsonville,9/11/2022,other,,36.93427123800007,-121.74751564299999,1,2022-09-11 Watsonville,,,3390
3376,Watsonville,9/11/2022,other,,36.93445447100004,-121.74785639999997,1,2022-09-11 Watsonville,,,3391
3377,Watsonville,9/11/2022,other,,36.93482333400004,-121.748857913,1,2022-09-11 Watsonville,,,3392
3378,Watsonville,9/11/2022,other,,36.93669728300006,-121.74742093499998,1,2022-09-11 Watsonville,,,3393
3379,Watsonville,9/11/2022,other,,36.93657007600007,-121.74772258599997,1,2022-09-11 Watsonville,3404.0,26.804138481478475,3394
3380,Watsonville,9/11/2022,other,,36.93634371400003,-121.74752628399995,1,2022-09-11 Watsonville,3400.0,25.83916635529228,3395
3381,Watsonville,9/11/2022,other,,36.936190631000045,-121.747870192,1,2022-09-11 Watsonville,3405.0,26.598610696850415,3396
3382,Watsonville,9/11/2022,other,,36.93569741600004,-121.74779533399997,1,2022-09-11 Watsonville,,,3397
3383,Watsonville,9/11/2022,other,,36.93650367300006,-121.74647567299996,1,2022-09-11 Watsonville,,,3398
3384,Watsonville,9/11/2022,other,,36.93649953700003,-121.74693092399995,1,2022-09-11 Watsonville,,,3399
3386,Watsonville,9/11/2022,other,,36.93609228200006,-121.74656773199996,1,2022-09-11 Watsonville,,,3401
3387,Watsonville,9/11/2022,other,,36.936068660000046,-121.74705425699995,1,2022-09-11 Watsonville,,,3402
3388,Watsonville,9/11/2022,other,,36.936863208000034,-121.74786618999995,1,2022-09-11 Watsonville,,,3403
3391,Watsonville,9/11/2022,other,,36.93674215500005,-121.74824333599996,1,2022-09-11 Watsonville,3404.0,27.121864784624872,3406
3392,Watsonville,9/11/2022,other,,36.936356346000025,-121.748372868,1,2022-09-11 Watsonville,3405.0,23.61213737124392,3407
3393,Watsonville,9/11/2022,other,,36.936169738000046,-121.74505550799996,1,2022-09-11 Watsonville,3409.0,13.056525827727407,3408
3396,Watsonville,9/11/2022,other,,36.936047901000045,-121.74546456299998,1,2022-09-11 Watsonville,3409.0,25.853408496115033,3411
3397,Watsonville,9/11/2022,other,,36.935823209000034,-121.74521341099997,1,2022-09-11 Watsonville,,,3412
3398,Watsonville,9/11/2022,other,,36.93538845000006,-121.74427474499998,1,2022-09-11 Watsonville,3414.0,24.009586764186707,3413
3400,Watsonville,9/11/2022,other,,36.935513171000025,-121.74470947999998,1,2022-09-11 Watsonville,3416.0,18.844648645054104,3415
3403,Watsonville,9/11/2022,other,,36.93263989700006,-121.75063500799996,1,2022-09-11 Watsonville,,,3418
3404,Watsonville,9/11/2022,other,,36.93271523800007,-121.75113244199996,1,2022-09-11 Watsonville,3422.0,26.489884728386684,3419
3405,Watsonville,9/11/2022,other,,36.93216187000007,-121.75096583199996,1,2022-09-11 Watsonville,,,3420
3406,Watsonville,9/11/2022,other,,36.932067979000074,-121.75139198599997,1,2022-09-11 Watsonville,,,3421
3408,Watsonville,9/11/2022,other,,36.93302195600006,-121.75145506799998,1,2022-09-11 Watsonville,,,3423
3409,Watsonville,9/11/2022,other,,36.933159903000046,-121.75215302499998,1,2022-09-11 Watsonville,,,3424
3410,Watsonville,9/11/2022,other,,36.932931762000074,-121.75184690599995,1,2022-09-11 Watsonville,,,3425
3411,Watsonville,9/11/2022,other,,36.93206340500007,-121.75197810299994,1,2022-09-11 Watsonville,,,3426
3412,Watsonville,9/11/2022,other,,36.93218561800006,-121.752524844,1,2022-09-11 Watsonville,,,3427
3413,Watsonville,9/11/2022,other,,36.93040772900008,-121.753442469,1,2022-09-11 Watsonville,3430.0,25.324718057060245,3428
3416,Watsonville,9/11/2022,other,,36.930336287000046,-121.754027238,1,2022-09-11 Watsonville,3432.0,27.720684473723946,3431
3418,Watsonville,9/11/2022,other,,36.93048643600002,-121.75446275999995,1,2022-09-11 Watsonville,,,3433
3419,Watsonville,9/11/2022,other,,36.92656090400004,-121.75144211599996,1,2022-09-11 Watsonville,,,3434
3420,Watsonville,9/11/2022,other,,36.926627973000045,-121.75177667199993,1,2022-09-11 Watsonville,,,3435
3421,Watsonville,9/11/2022,other,,36.92681683200004,-121.75096261299996,1,2022-09-11 Watsonville,,,3436
3422,Watsonville,9/11/2022,other,,36.92630872600006,-121.75162385799996,1,2022-09-11 Watsonville,,,3437
3423,Watsonville,9/11/2022,other,,36.92755033000003,-121.75175828799996,1,2022-09-11 Watsonville,,,3438
3424,Watsonville,9/11/2022,mulch,,36.92486412100004,-121.81478959499997,1,2022-09-11 Watsonville,3096.0,27.9069426008142,3439
3427,Watsonville,9/11/2022,mulch,,36.926504868000045,-121.815120375,1,2022-09-11 Watsonville,3001.0,13.25072440400967,3442
3435,Watsonville,9/11/2022,mulch,,36.92997474800006,-121.75935715999996,1,2022-09-11 Watsonville,,,3450
3436,Watsonville,9/11/2022,mulch,,36.93122281300003,-121.75893492199998,1,2022-09-11 Watsonville,3453.0,22.49034489460784,3451
3437,Watsonville,9/11/2022,mulch,,36.93092667600007,-121.75880137999997,1,2022-09-11 Watsonville,3454.0,21.82536017140299,3452
3441,Watsonville,9/11/2022,mulch,,36.93099150700005,-121.75933066699996,1,2022-09-11 Watsonville,3454.0,25.90233946404721,3456
3442,Watsonville,9/11/2022,mulch,,36.92946764000004,-121.75930602399995,1,2022-09-11 Watsonville,,,3457
3444,Watsonville,9/11/2022,mulch,,36.93121395900005,-121.759695003,1,2022-09-11 Watsonville,3455.0,26.876873753422053,3459
3445,Watsonville,9/11/2022,mulch,,36.93094307900003,-121.75974276899996,1,2022-09-11 Watsonville,3462.0,25.130036088441376,3460
3448,Watsonville,9/11/2022,mulch,,36.93067445600008,-121.759906646,1,2022-09-11 Watsonville,3461.0,21.55886390567897,3463
3449,Watsonville,9/11/2022,mulch,,36.92937621400006,-121.75869446699994,1,2022-09-11 Watsonville,,,3464
3450,Watsonville,9/11/2022,mulch,,36.929984971000074,-121.76044678,1,2022-09-11 Watsonville,,,3465
3451,Watsonville,9/11/2022,mulch,,36.92979798800008,-121.75984429899997,1,2022-09-11 Watsonville,,,3466
3453,Watsonville,9/11/2022,mulch,,36.930684003000074,-121.7605625,1,2022-09-11 Watsonville,3467.0,25.119985853014207,3468
3454,Watsonville,9/11/2022,mulch,,36.93051676100004,-121.76020487399995,1,2022-09-11 Watsonville,3467.0,28.33588509538,3469
3455,Watsonville,9/11/2022,mulch,,36.93041658200008,-121.76061123799995,1,2022-09-11 Watsonville,3471.0,26.594615847973213,3470
3457,Watsonville,9/11/2022,mulch,,36.93056271700004,-121.758687507,1,2022-09-11 Watsonville,,,3472
3458,Watsonville,9/11/2022,mulch,,36.93020006900008,-121.75856999899996,1,2022-09-11 Watsonville,,,3473
3459,Watsonville,9/11/2022,mulch,,36.93027434600003,-121.75892703099998,1,2022-09-11 Watsonville,3475.0,23.368530200881935,3474
3461,Watsonville,9/11/2022,mulch,,36.93037332200004,-121.75943943699995,1,2022-09-11 Watsonville,,,3476
3462,Watsonville,4/12/2023,mulch,,36.91518012100005,-121.83366507199996,1,2023-04-12 Watsonville,3480.0,22.052861988185363,3477
3464,Watsonville,4/12/2023,mulch,,36.91466077800004,-121.83387407999999,1,2023-04-12 Watsonville,3482.0,21.803035080155485,3479
3468,Watsonville,4/12/2023,mulch,,36.914995240000046,-121.834124197,1,2023-04-12 Watsonville,3485.0,19.613014718118603,3483
3471,Watsonville,4/12/2023,mulch,,36.91464165300005,-121.83443911299996,1,2023-04-12 Watsonville,3484.0,17.918700016386843,3486
3473,Watsonville,4/12/2023,mulch,,36.91472083400004,-121.83496696999998,1,2023-04-12 Watsonville,,,3488
3474,Watsonville,4/12/2023,mulch,,36.91423922400002,-121.83472191399994,1,2023-04-12 Watsonville,3490.0,28.361962056584527,3489
3476,Watsonville,4/12/2023,mulch,,36.91457524000003,-121.83531989699996,1,2023-04-12 Watsonville,3494.0,25.850019324331047,3491
3477,Watsonville,4/12/2023,mulch,,36.91412921600005,-121.83509642299998,1,2023-04-12 Watsonville,3493.0,19.54515573341253,3492
3481,Watsonville,4/12/2023,mulch,,36.91416639400006,-121.83562925399995,1,2023-04-12 Watsonville,3495.0,23.65969038536828,3496
3483,Watsonville,4/12/2023,mulch,,36.91436457900005,-121.83592872699997,1,2023-04-12 Watsonville,3501.0,28.043421298692834,3498
3484,Watsonville,4/12/2023,mulch,,36.91380143600002,-121.83596912799997,1,2023-04-12 Watsonville,3497.0,22.703782167494616,3499
3488,Watsonville,4/12/2023,mulch,,36.91411102700005,-121.83651147799996,1,2023-04-12 Watsonville,3502.0,24.226246568043553,3503
3489,Watsonville,4/12/2023,mulch,,36.91434015900006,-121.83398045599994,1,2023-04-12 Watsonville,3482.0,27.401798357385367,3504
3490,Watsonville,4/12/2023,mulch,,36.91420811400008,-121.83429228399996,1,2023-04-12 Watsonville,3506.0,24.421188820344874,3505
3492,Watsonville,4/12/2023,mulch,,36.91393760700004,-121.83456752299996,1,2023-04-12 Watsonville,3510.0,27.342370551603405,3507
3493,Watsonville,4/12/2023,mulch,,36.91361023700006,-121.83435232899996,1,2023-04-12 Watsonville,3509.0,27.13419004023252,3508
3496,Watsonville,4/12/2023,mulch,,36.91340955600003,-121.83471986299996,1,2023-04-12 Watsonville,3512.0,25.687436319700065,3511
3500,Watsonville,4/12/2023,mulch,,36.91364036700002,-121.83534935499993,1,2023-04-12 Watsonville,3513.0,24.000666291902128,3515
3502,Watsonville,4/12/2023,mulch,,36.913181184000045,-121.83543345799995,1,2023-04-12 Watsonville,3518.0,21.727657629579348,3517
3504,Watsonville,4/12/2023,mulch,,36.913506750000074,-121.835744719,1,2023-04-12 Watsonville,3518.0,24.89734890620477,3519
3505,Watsonville,4/12/2023,mulch,,36.91309908700004,-121.83417740799996,1,2023-04-12 Watsonville,,,3520
3506,Watsonville,4/12/2023,mulch,,36.912926481000056,-121.83451127199999,1,2023-04-12 Watsonville,,,3521
3507,Watsonville,4/12/2023,mulch,,36.91294170400005,-121.83488810899996,1,2023-04-12 Watsonville,,,3522
3508,Watsonville,4/12/2023,mulch,,36.91281432200003,-121.83518809599995,1,2023-04-12 Watsonville,,,3523
3509,Watsonville,4/12/2023,mulch,,36.91307068300006,-121.83591596099996,1,2023-04-12 Watsonville,3525.0,19.729552379598324,3524
3511,Watsonville,4/12/2023,mulch,,36.91268461600004,-121.83618813899994,1,2023-04-12 Watsonville,,,3526
3512,Watsonville,4/12/2023,mulch,,36.912911921000045,-121.83641369199997,1,2023-04-12 Watsonville,3530.0,27.55650696320352,3527
3513,Watsonville,4/12/2023,mulch,,36.91318250500007,-121.83647404799996,1,2023-04-12 Watsonville,3531.0,26.156281665311425,3528
3514,Watsonville,4/12/2023,mulch,,36.912625392000045,-121.83656030499996,1,2023-04-12 Watsonville,3530.0,23.121625756545864,3529
3518,Watsonville,4/12/2023,mulch,,36.912810284000045,-121.83694853799994,1,2023-04-12 Watsonville,3530.0,22.767801143857724,3533
3519,Watsonville,4/12/2023,mulch,,36.91293301400003,-121.83726131799995,1,2023-04-12 Watsonville,3536.0,24.710969488379824,3534
3520,Watsonville,4/12/2023,mulch,,36.912523099000055,-121.83722558299996,1,2023-04-12 Watsonville,3537.0,24.98798437337829,3535
3523,Watsonville,4/12/2023,mulch,,36.91269230400008,-121.83769313799996,1,2023-04-12 Watsonville,3537.0,21.383543595675444,3538
3524,Watsonville,4/12/2023,mulch,,36.91542966100008,-121.832510588,1,2023-04-12 Watsonville,,,3539
3525,Watsonville,4/12/2023,mulch,,36.91508432400008,-121.83267137299998,1,2023-04-12 Watsonville,3541.0,26.094781596823907,3540
3527,Watsonville,4/12/2023,mulch,,36.91466941500005,-121.83284925799995,1,2023-04-12 Watsonville,3541.0,26.971794824114767,3542
3528,Watsonville,4/12/2023,mulch,,36.91440253200005,-121.83293356399996,1,2023-04-12 Watsonville,3544.0,18.33510920806304,3543
3530,Watsonville,4/12/2023,mulch,,36.91413426600008,-121.83302117499994,1,2023-04-12 Watsonville,3547.0,23.203005051904253,3545
3531,Watsonville,4/12/2023,mulch,,36.91404592300007,-121.832677376,1,2023-04-12 Watsonville,3547.0,23.95440972908929,3546
3533,Watsonville,4/12/2023,mulch,,36.91380866100008,-121.83316698799996,1,2023-04-12 Watsonville,3547.0,27.025876878081615,3548
3534,Watsonville,4/12/2023,mulch,,36.91370520900006,-121.832544483,1,2023-04-12 Watsonville,3550.0,28.09339109280649,3549
3537,Watsonville,4/12/2023,mulch,,36.91325995300008,-121.83340536799994,1,2023-04-12 Watsonville,,,3552
3538,Watsonville,4/12/2023,mulch,,36.913441361000025,-121.832616514,1,2023-04-12 Watsonville,3550.0,25.170919359504808,3553
3539,Watsonville,4/12/2023,mulch,,36.913154494000025,-121.83250095499994,1,2023-04-12 Watsonville,3595.0,26.201766432401776,3554
3540,Watsonville,4/12/2023,mulch,,36.913018204000025,-121.83208453099996,1,2023-04-12 Watsonville,3557.0,23.383962596504546,3555
3543,Watsonville,4/12/2023,mulch,,36.91268000500003,-121.83191648899998,1,2023-04-12 Watsonville,3557.0,27.001558599308616,3558
3544,Watsonville,4/12/2023,mulch,,36.91247640400008,-121.83225381499994,1,2023-04-12 Watsonville,3561.0,27.66642480279273,3559
3545,Watsonville,4/12/2023,mulch,,36.91238055200006,-121.83180980799995,1,2023-04-12 Watsonville,3561.0,29.30223918357477,3560
3549,Watsonville,4/12/2023,mulch,,36.911864483000045,-121.83150109999995,1,2023-04-12 Watsonville,,,3564
3550,Watsonville,4/12/2023,mulch,,36.91181390400004,-121.83185029199996,1,2023-04-12 Watsonville,3563.0,28.050881376235175,3565
3551,Watsonville,4/12/2023,mulch,,36.91159140900004,-121.83130509499993,1,2023-04-12 Watsonville,,,3566
3552,Watsonville,4/12/2023,mulch,,36.91156974800003,-121.83169753899995,1,2023-04-12 Watsonville,,,3567
3553,Watsonville,4/12/2023,mulch,,36.91122626600002,-121.83108967399994,1,2023-04-12 Watsonville,,,3568
3554,Watsonville,4/12/2023,mulch,,36.91113430100006,-121.83143131399999,1,2023-04-12 Watsonville,,,3569
3555,Watsonville,4/12/2023,mulch,,36.911000800000075,-121.83179842899995,1,2023-04-12 Watsonville,,,3570
3556,Watsonville,4/12/2023,mulch,,36.91081849200003,-121.83228398799996,1,2023-04-12 Watsonville,,,3571
3557,Watsonville,4/12/2023,mulch,,36.91124081600003,-121.83199056299996,1,2023-04-12 Watsonville,3574.0,24.38061865496175,3572
3558,Watsonville,4/12/2023,mulch,,36.91107950500003,-121.83245374399996,1,2023-04-12 Watsonville,3574.0,25.526949680550032,3573
3561,Watsonville,4/12/2023,mulch,,36.91138555100008,-121.832567687,1,2023-04-12 Watsonville,,,3576
3562,Watsonville,4/12/2023,mulch,,36.91167004000005,-121.83224009099996,1,2023-04-12 Watsonville,3579.0,17.03532022104116,3577
3563,Watsonville,4/12/2023,mulch,,36.91167706900006,-121.83267435999994,1,2023-04-12 Watsonville,3580.0,18.802307712191684,3578
3571,Watsonville,4/12/2023,mulch,,36.91233511000007,-121.83255182099998,1,2023-04-12 Watsonville,3588.0,19.46309649734203,3586
3572,Watsonville,4/12/2023,mulch,,36.91227811800008,-121.83300578999996,1,2023-04-12 Watsonville,3589.0,21.527859584652713,3587
3575,Watsonville,4/12/2023,mulch,,36.91274800300005,-121.83276220999994,1,2023-04-12 Watsonville,3592.0,18.265533938206005,3590
3578,Watsonville,4/12/2023,mulch,,36.912836524000056,-121.83338088,1,2023-04-12 Watsonville,,,3593
3579,Watsonville,4/12/2023,mulch,,36.913334045000056,-121.83302423499998,1,2023-04-12 Watsonville,3551.0,18.575373362228675,3594
3581,Watsonville,4/12/2023,hoop,,36.91122530900003,-121.833064063,1,2023-04-12 Watsonville,3599.0,21.380394818697265,3596
3582,Watsonville,4/12/2023,hoop,,36.91097839200006,-121.83355594999993,1,2023-04-12 Watsonville,3600.0,20.428073479,3597
3583,Watsonville,4/12/2023,hoop,,36.910762588000075,-121.834188402,1,2023-04-12 Watsonville,3601.0,22.735727652071535,3598
3587,Watsonville,4/12/2023,hoop,,36.91151996200006,-121.83329316899994,1,2023-04-12 Watsonville,3599.0,17.378257724319266,3602
3588,Watsonville,4/12/2023,hoop,,36.91138161600002,-121.833827795,1,2023-04-12 Watsonville,3606.0,28.780488472515827,3603
3589,Watsonville,4/12/2023,hoop,,36.91116549600002,-121.83426060599999,1,2023-04-12 Watsonville,3601.0,22.792627628265706,3604
3590,Watsonville,4/12/2023,hoop,,36.91177304100007,-121.83343147599999,1,2023-04-12 Watsonville,3608.0,23.67782827990569,3605
3594,Watsonville,4/12/2023,hoop,,36.91171270300004,-121.83405409599997,1,2023-04-12 Watsonville,3606.0,13.215386326924104,3609
3595,Watsonville,4/12/2023,hoop,,36.91156501000006,-121.83455878899996,1,2023-04-12 Watsonville,3607.0,23.69895029619208,3610
3596,Watsonville,4/12/2023,hoop,,36.912134139000045,-121.83366781499996,1,2023-04-12 Watsonville,3613.0,18.821801814114167,3611
3597,Watsonville,4/12/2023,hoop,,36.91201435800008,-121.83420047399994,1,2023-04-12 Watsonville,3614.0,23.544303791188216,3612
3600,Watsonville,4/12/2023,hoop,,36.91211179300007,-121.83453179599996,1,2023-04-12 Watsonville,3617.0,29.020870664685408,3615
3601,Watsonville,4/12/2023,hoop,,36.91248045000003,-121.83389460599994,1,2023-04-12 Watsonville,3613.0,26.346296495518693,3616
3603,Watsonville,4/12/2023,hoop,,36.90873443600003,-121.84598640699994,1,2023-04-12 Watsonville,3619.0,16.99103163319008,3618
3606,Watsonville,4/12/2023,hoop,,36.90816280400002,-121.84576378199993,1,2023-04-12 Watsonville,3620.0,20.531009330990265,3621
3607,Watsonville,4/12/2023,hoop,,36.908449244000046,-121.84594709499999,1,2023-04-12 Watsonville,3619.0,15.167696743574782,3622
3611,Watsonville,4/12/2023,hoop,,36.907500208000044,-121.84276936799994,1,2023-04-12 Watsonville,3631.0,17.369195621096384,3626
3612,Watsonville,4/12/2023,hoop,,36.90737435600005,-121.84246461699996,1,2023-04-12 Watsonville,3630.0,19.58930574277521,3627
3613,Watsonville,4/12/2023,hoop,,36.90713018300005,-121.84224340699996,1,2023-04-12 Watsonville,3629.0,18.825870729583198,3628
3617,Watsonville,4/12/2023,hoop,,36.90686075800005,-121.84248041299996,1,2023-04-12 Watsonville,3636.0,17.410841017577408,3632
3620,Watsonville,4/12/2023,hoop,,36.90717176000004,-121.84297086299993,1,2023-04-12 Watsonville,3637.0,20.06149364428713,3635
3626,Watsonville,4/12/2023,hoop,,36.90689294100002,-121.84331466299994,1,2023-04-12 Watsonville,3644.0,16.040413529604002,3641
3630,Watsonville,4/12/2023,hoop,,36.90643800300006,-121.84290600099996,1,2023-04-12 Watsonville,3642.0,19.079892188181443,3645
3632,Watsonville,4/12/2023,hoop,,36.906792903000046,-121.84183023599996,1,2023-04-12 Watsonville,3650.0,20.522363906114588,3647
3634,Watsonville,4/12/2023,hoop,,36.90656364100005,-121.84159763399998,1,2023-04-12 Watsonville,3650.0,23.939277103816146,3649
3639,Watsonville,4/12/2023,hoop,,36.906581823000074,-121.84232162199999,1,2023-04-12 Watsonville,3651.0,20.60746026741752,3654
3642,Watsonville,4/12/2023,hoop,,36.90612101700003,-121.84203691399993,1,2023-04-12 Watsonville,3655.0,19.47311943145566,3657
3644,Watsonville,4/12/2023,hoop,,36.90634386300008,-121.84258351799996,1,2023-04-12 Watsonville,3656.0,29.09549519082365,3659
3645,Watsonville,4/12/2023,hoop,,36.90630609700003,-121.84094242699996,1,2023-04-12 Watsonville,3664.0,13.992400831888345,3660
3646,Watsonville,4/12/2023,hoop,,36.906461681000046,-121.84126968899994,1,2023-04-12 Watsonville,3662.0,19.644715317627647,3661
3654,Watsonville,4/12/2023,hoop,,36.90576392200006,-121.84139759399994,1,2023-04-12 Watsonville,3670.0,16.565882107021487,3669
3657,Watsonville,4/12/2023,hoop,,36.90587805900003,-121.84174351399996,1,2023-04-12 Watsonville,3673.0,6.977218575095253,3672
3661,Watsonville,4/12/2023,hoop,,36.90590965900003,-121.84356364999996,1,2023-04-12 Watsonville,3677.0,16.065106879072903,3676
3663,Watsonville,4/12/2023,hoop,,36.90605138100005,-121.84307206199996,1,2023-04-12 Watsonville,3674.0,15.355302408826354,3678
3666,Watsonville,4/12/2023,hoop,,36.90578194600005,-121.84292696899996,1,2023-04-12 Watsonville,3684.0,16.728080122548345,3681
3668,Watsonville,4/12/2023,hoop,,36.90561637900004,-121.84352411199995,1,2023-04-12 Watsonville,3686.0,14.357480128865502,3683
3672,Watsonville,4/12/2023,hoop,,36.90547857100007,-121.84279115499999,1,2023-04-12 Watsonville,3690.0,14.603422374069307,3687
3678,Watsonville,4/12/2023,hoop,,36.90527128900004,-121.84303487999993,1,2023-04-12 Watsonville,3691.0,14.611951691668407,3693
3679,Watsonville,4/12/2023,hoop,,36.90526649800007,-121.84338715799998,1,2023-04-12 Watsonville,3689.0,22.132522763272323,3694
3680,Watsonville,4/12/2023,hoop,,36.90516265900004,-121.84202767999994,1,2023-04-12 Watsonville,3696.0,22.55975808086286,3695
3682,Watsonville,4/12/2023,other,,36.90502969800008,-121.837259427,1,2023-04-12 Watsonville,,,3697
3683,Watsonville,4/12/2023,other,,36.90523673500008,-121.83759515799994,1,2023-04-12 Watsonville,,,3698
3684,Watsonville,4/12/2023,other,,36.90552649600005,-121.83762861799994,1,2023-04-12 Watsonville,,,3699
3685,Watsonville,4/12/2023,other,,36.905733187000074,-121.83794604399996,1,2023-04-12 Watsonville,,,3700
3686,Watsonville,4/12/2023,other,,36.90678300500008,-121.83858475299996,1,2023-04-12 Watsonville,,,3701
3687,Watsonville,4/12/2023,other,,36.90707373200007,-121.83881741799996,1,2023-04-12 Watsonville,,,3702
3688,Watsonville,4/12/2023,other,,36.90657187400007,-121.83947183599996,1,2023-04-12 Watsonville,,,3703
3689,Watsonville,4/12/2023,other,,36.90755564800003,-121.83906205999995,1,2023-04-12 Watsonville,,,3704
3690,Watsonville,4/12/2023,other,,36.90723973500008,-121.83947787399995,1,2023-04-12 Watsonville,,,3705
3691,Watsonville,4/12/2023,other,,36.90721952800004,-121.83847246199996,1,2023-04-12 Watsonville,,,3706
3692,Watsonville,4/12/2023,other,,36.90960900600004,-121.83673037899996,1,2023-04-12 Watsonville,,,3707
3693,Watsonville,4/12/2023,other,,36.91002971200004,-121.83757384499997,1,2023-04-12 Watsonville,,,3708
3694,Watsonville,4/12/2023,other,,36.909127758000075,-121.83738327999998,1,2023-04-12 Watsonville,,,3709
3695,Watsonville,4/12/2023,other,,36.90824259600004,-121.84035334799997,1,2023-04-12 Watsonville,,,3710
3696,Watsonville,4/12/2023,other,,36.90878208800007,-121.84266303399994,1,2023-04-12 Watsonville,,,3711
3697,Watsonville,4/12/2023,other,,36.90753967200004,-121.84419002399994,1,2023-04-12 Watsonville,,,3712
3698,Watsonville,4/12/2023,other,,36.908633218000034,-121.84388902299996,1,2023-04-12 Watsonville,,,3713
3699,Watsonville,4/12/2023,other,,36.90937703600008,-121.84233280799998,1,2023-04-12 Watsonville,,,3714
3700,Watsonville,4/12/2023,other,,36.90911168100007,-121.842967381,1,2023-04-12 Watsonville,,,3715
3701,Watsonville,4/12/2023,other,,36.91120261000003,-121.84074571199994,1,2023-04-12 Watsonville,3718.0,21.47441392138459,3716
3706,Watsonville,4/12/2023,other,,36.91116335300006,-121.84118112199997,1,2023-04-12 Watsonville,,,3721
3707,Watsonville,4/12/2023,other,,36.91084632400003,-121.84096328399994,1,2023-04-12 Watsonville,3719.0,27.538678722260215,3722
3708,Watsonville,4/12/2023,other,,36.91111603100006,-121.84029269599993,1,2023-04-12 Watsonville,3717.0,27.250625340622268,3723
3709,Watsonville,4/12/2023,other,,36.91056212600006,-121.84075841299995,1,2023-04-12 Watsonville,3720.0,28.837109542893916,3724
3710,Watsonville,4/12/2023,other,,36.91124762800007,-121.84480876899994,1,2023-04-12 Watsonville,,,3725
3711,Watsonville,4/12/2023,other,,36.91105649700006,-121.84523177499995,1,2023-04-12 Watsonville,,,3726
3712,Watsonville,4/12/2023,other,,36.91091862900004,-121.84447139799992,1,2023-04-12 Watsonville,,,3727
3713,Watsonville,4/12/2023,other,,36.91063333900007,-121.84489734899996,1,2023-04-12 Watsonville,,,3728
3714,Watsonville,4/12/2023,other,,36.91083439700003,-121.84568855799994,1,2023-04-12 Watsonville,,,3729
3715,Watsonville,4/12/2023,other,,36.91019861600006,-121.84514100299998,1,2023-04-12 Watsonville,,,3730
3716,Watsonville,4/12/2023,other,,36.91191823700007,-121.84521812799994,1,2023-04-12 Watsonville,3732.0,16.541039953276417,3731
3719,Watsonville,4/12/2023,other,,36.91207942400007,-121.84554747299995,1,2023-04-12 Watsonville,3733.0,20.443870784664263,3734
3720,Watsonville,4/12/2023,other,,36.91157297400008,-121.84488627099996,1,2023-04-12 Watsonville,,,3735
3721,Watsonville,4/12/2023,other,,36.91140066500003,-121.84524647399996,1,2023-04-12 Watsonville,,,3736
3722,Watsonville,4/12/2023,other,,36.91135806200003,-121.84584884599995,1,2023-04-12 Watsonville,,,3737
3723,Watsonville,4/12/2023,other,,36.91161097500003,-121.84445376699993,1,2023-04-12 Watsonville,,,3738
3724,Watsonville,4/12/2023,other,,36.91179207100004,-121.84569413399998,1,2023-04-12 Watsonville,3732.0,28.44890144946467,3739
3725,Watsonville,4/12/2023,other,,36.91299111600006,-121.84774504399996,1,2023-04-12 Watsonville,,,3748
3726,Watsonville,4/12/2023,other,,36.912448574000045,-121.84780974399996,1,2023-04-12 Watsonville,,,3749
3727,Watsonville,4/12/2023,other,,36.91326663700005,-121.84780561199995,1,2023-04-12 Watsonville,3752.0,14.26616287864682,3751
3729,Watsonville,4/12/2023,other,,36.91128790900007,-121.82207981599998,1,2023-04-12 Watsonville,,,3753
3730,Watsonville,4/12/2023,other,,36.91119098000007,-121.82247345499997,1,2023-04-12 Watsonville,,,3754
3731,Watsonville,4/12/2023,other,,36.91078042600003,-121.822201324,1,2023-04-12 Watsonville,,,3755
3732,Watsonville,4/12/2023,other,,36.91074152200008,-121.82291883199996,1,2023-04-12 Watsonville,,,3756
3733,Watsonville,4/12/2023,other,,36.91239495600007,-121.81995458999997,1,2023-04-12 Watsonville,,,3757
3734,Watsonville,4/12/2023,other,,36.91277791600004,-121.81974921799996,1,2023-04-12 Watsonville,,,3758
3735,Watsonville,4/12/2023,other,,36.91247826900008,-121.82029776399996,1,2023-04-12 Watsonville,,,3759
3736,Watsonville,4/12/2023,other,,36.91121809600003,-121.81931113199992,1,2023-04-12 Watsonville,,,3760
3737,Watsonville,4/12/2023,other,,36.911682745000064,-121.81911639699996,1,2023-04-12 Watsonville,,,3761
3738,Watsonville,4/12/2023,other,,36.91105233500008,-121.81878658399997,1,2023-04-12 Watsonville,,,3762
3739,Watsonville,4/12/2023,other,,36.91145909000005,-121.81872060399996,1,2023-04-12 Watsonville,,,3763
3740,Watsonville,4/12/2023,other,,36.914221746000074,-121.81503765199994,1,2023-04-12 Watsonville,,,3764
3741,Watsonville,4/12/2023,other,,36.915128036000056,-121.81583291899994,1,2023-04-12 Watsonville,,,3765
3744,Watsonville,4/12/2023,other,,36.91416382200004,-121.81074515499996,1,2023-04-12 Watsonville,,,3768
3745,Watsonville,4/12/2023,other,,36.91328413000008,-121.81054817399996,1,2023-04-12 Watsonville,,,3769
3746,Watsonville,4/12/2023,other,,36.91398278200006,-121.80977908999996,1,2023-04-12 Watsonville,,,3770
3747,Watsonville,4/12/2023,other,,36.91364521600008,-121.80973663099996,1,2023-04-12 Watsonville,,,3771
3748,Watsonville,4/12/2023,other,,36.91374862600002,-121.81043600399992,1,2023-04-12 Watsonville,3767.0,27.297387064782956,3772
3749,Watsonville,4/12/2023,other,,36.91476132300005,-121.81071133299996,1,2023-04-12 Watsonville,,,3773
3750,Watsonville,4/12/2023,other,,36.91430197300008,-121.81041495,1,2023-04-12 Watsonville,3766.0,29.965262068478488,3774
3751,Watsonville,4/12/2023,other,,36.914462464000046,-121.811247155,1,2023-04-12 Watsonville,,,3775
3752,Watsonville,4/12/2023,other,,36.91225860200007,-121.80697508299994,1,2023-04-12 Watsonville,,,3776
3753,Watsonville,4/12/2023,other,,36.91201120900007,-121.80618627899996,1,2023-04-12 Watsonville,,,3777
3754,Watsonville,4/12/2023,other,,36.92363487000006,-121.80994337299995,1,2023-04-12 Watsonville,3779.0,21.864810797646083,3778
3756,Watsonville,4/12/2023,other,,36.92360237300005,-121.810755428,1,2023-04-12 Watsonville,3783.0,23.76717378806589,3780
3757,Watsonville,4/12/2023,other,,36.924131987000074,-121.81039695899995,1,2023-04-12 Watsonville,3782.0,28.86868593445691,3781
3760,Watsonville,4/12/2023,other,,36.92403353700007,-121.80983864599995,1,2023-04-12 Watsonville,,,3784
3761,Watsonville,4/12/2023,other,,36.92407480000002,-121.80936634299997,1,2023-04-12 Watsonville,,,3785
3762,Watsonville,4/12/2023,other,,36.92361233500003,-121.81124329499994,1,2023-04-12 Watsonville,,,3786
3763,Watsonville,4/12/2023,other,,36.92324666500008,-121.80992122299995,1,2023-04-12 Watsonville,,,3787
3764,Watsonville,4/12/2023,other,,36.92325363600003,-121.80937567499996,1,2023-04-12 Watsonville,3789.0,12.642332556527307,3788
3766,Watsonville,4/12/2023,other,,36.91061061600004,-121.80814088999993,1,2023-04-12 Watsonville,,,3794
3767,Watsonville,4/12/2023,other,,36.91023533300007,-121.80774694499996,1,2023-04-12 Watsonville,,,3795
3768,Watsonville,4/12/2023,other,,36.90779976500005,-121.80834443899992,1,2023-04-12 Watsonville,,,3796
3769,Watsonville,4/12/2023,other,,36.93225579400007,-121.78625510799996,1,2023-04-12 Watsonville,3798.0,12.81811902294449,3797
3771,Watsonville,4/12/2023,other,,36.93212056000005,-121.78658845099994,1,2023-04-12 Watsonville,3798.0,21.12390666796256,3799
3772,Watsonville,4/12/2023,other,,36.93218492100005,-121.78799073599998,1,2023-04-12 Watsonville,,,3800
3773,Watsonville,4/12/2023,other,,36.92952568300007,-121.79019496299996,1,2023-04-12 Watsonville,,,3801
3774,Watsonville,4/12/2023,mulch,,36.89963968600006,-121.82882089499996,1,2023-04-12 Watsonville,3805.0,29.535753699086698,3802
3775,Watsonville,4/12/2023,mulch,,36.89903349800005,-121.82836366999997,1,2023-04-12 Watsonville,,,3803
3776,Watsonville,4/12/2023,mulch,,36.899266873000045,-121.828563036,1,2023-04-12 Watsonville,3805.0,18.344969072932106,3804
3778,Watsonville,4/12/2023,mulch,,36.89965691700007,-121.82923116299996,1,2023-04-12 Watsonville,,,3806
3779,Watsonville,4/12/2023,mulch,,36.89938503700006,-121.82929248,1,2023-04-12 Watsonville,3808.0,27.772270875849618,3807
3781,Watsonville,4/12/2023,mulch,,36.89901703100002,-121.82908178999996,1,2023-04-12 Watsonville,3808.0,25.976505472765375,3809
3782,Watsonville,4/12/2023,mulch,,36.89924485200004,-121.83014027899996,1,2023-04-12 Watsonville,,,3810
3783,Watsonville,4/12/2023,mulch,,36.89921552700002,-121.82973509299995,1,2023-04-12 Watsonville,,,3811
3784,Watsonville,4/12/2023,mulch,,36.89891172100005,-121.82999339699997,1,2023-04-12 Watsonville,,,3812
3785,Watsonville,4/12/2023,mulch,,36.89881603300007,-121.82947882299997,1,2023-04-12 Watsonville,3847.0,20.530207851788937,3813
3786,Watsonville,4/12/2023,mulch,,36.898635140000074,-121.82981258999996,1,2023-04-12 Watsonville,,,3814
3787,Watsonville,4/12/2023,mulch,,36.89818855800007,-121.83064071999996,1,2023-04-12 Watsonville,,,3815
3788,Watsonville,4/12/2023,mulch,,36.89900934500002,-121.83124109,1,2023-04-12 Watsonville,,,3816
3789,Watsonville,4/12/2023,mulch,,36.89900640500008,-121.83053364399996,1,2023-04-12 Watsonville,,,3817
3790,Watsonville,4/12/2023,mulch,,36.898687086000045,-121.83107600799995,1,2023-04-12 Watsonville,,,3818
3791,Watsonville,4/12/2023,mulch,,36.89837944600004,-121.83038186399995,1,2023-04-12 Watsonville,,,3819
3792,Watsonville,4/12/2023,mulch,,36.89862547900003,-121.83188985599996,1,2023-04-12 Watsonville,,,3820
3793,Watsonville,4/12/2023,mulch,,36.89845377200004,-121.83280458699994,1,2023-04-12 Watsonville,,,3821
3794,Watsonville,4/12/2023,mulch,,36.89798378500007,-121.83356641499996,1,2023-04-12 Watsonville,,,3822
3795,Watsonville,4/12/2023,mulch,,36.897772599000064,-121.83448654299995,1,2023-04-12 Watsonville,,,3823
3796,Watsonville,4/12/2023,mulch,,36.89774747300004,-121.83503507299996,1,2023-04-12 Watsonville,,,3824
3797,Watsonville,4/12/2023,mulch,,36.89792027800007,-121.831479716,1,2023-04-12 Watsonville,,,3825
3798,Watsonville,4/12/2023,mulch,,36.89787684300006,-121.83220140399997,1,2023-04-12 Watsonville,,,3826
3799,Watsonville,4/12/2023,mulch,,36.897431073000064,-121.83308852299996,1,2023-04-12 Watsonville,,,3827
3800,Watsonville,4/12/2023,mulch,,36.89726900900007,-121.83396393099996,1,2023-04-12 Watsonville,,,3828
3801,Watsonville,4/12/2023,mulch,,36.897401745000025,-121.83358659699996,1,2023-04-12 Watsonville,,,3829
3802,Watsonville,4/12/2023,mulch,,36.89865988200006,-121.82811340399996,1,2023-04-12 Watsonville,,,3830
3803,Watsonville,4/12/2023,mulch,,36.89864334000004,-121.82858344699996,1,2023-04-12 Watsonville,3846.0,27.96975979915056,3831
3804,Watsonville,4/12/2023,mulch,,36.89834805700008,-121.82892892199997,1,2023-04-12 Watsonville,,,3832
3805,Watsonville,4/12/2023,mulch,,36.89829248800004,-121.82926795699996,1,2023-04-12 Watsonville,3834.0,27.74936255448289,3833
3807,Watsonville,4/12/2023,mulch,,36.89825035300004,-121.82804473599998,1,2023-04-12 Watsonville,3845.0,26.39414016134598,3835
3808,Watsonville,4/12/2023,mulch,,36.898221342000056,-121.82841620099998,1,2023-04-12 Watsonville,3845.0,16.10047381369082,3836
3809,Watsonville,4/12/2023,mulch,,36.89793414900004,-121.82879438799993,1,2023-04-12 Watsonville,3838.0,28.781799812712848,3837
3811,Watsonville,4/12/2023,mulch,,36.89774803700004,-121.82931909299998,1,2023-04-12 Watsonville,3838.0,23.97530118394297,3839
3812,Watsonville,4/12/2023,mulch,,36.89793149600007,-121.82771450399996,1,2023-04-12 Watsonville,3841.0,27.103505711668976,3840
3814,Watsonville,4/12/2023,mulch,,36.89774916700002,-121.82816372899998,1,2023-04-12 Watsonville,3841.0,20.63260513631091,3842
3815,Watsonville,4/12/2023,mulch,,36.89761024000006,-121.82859481399998,1,2023-04-12 Watsonville,,,3843
3816,Watsonville,4/12/2023,mulch,,36.897474783000064,-121.82896661199997,1,2023-04-12 Watsonville,,,3844
3820,Watsonville,4/12/2023,mulch,,36.90001160200006,-121.828955942,1,2023-04-12 Watsonville,,,3848
3821,Watsonville,4/12/2023,hoop,,36.888892402000074,-121.81210968399996,1,2023-04-12 Watsonville,3852.0,15.162591736327585,3849
3822,Watsonville,4/12/2023,hoop,,36.88867763300004,-121.81239255699997,1,2023-04-12 Watsonville,3851.0,20.712693155011674,3850
3829,Watsonville,4/12/2023,hoop,,36.88922685000006,-121.81246378599997,1,2023-04-12 Watsonville,3856.0,15.192341556959787,3857
3832,Watsonville,4/12/2023,hoop,,36.88857860300004,-121.81294701799997,1,2023-04-12 Watsonville,3862.0,12.716113585977295,3860
3837,Watsonville,4/12/2023,hoop,,36.88881885700005,-121.81321400399996,1,2023-04-12 Watsonville,3867.0,7.415438556784342,3865
3841,Watsonville,4/12/2023,hoop,,36.887834230000074,-121.81200441899993,1,2023-04-12 Watsonville,3871.0,15.66244424203006,3869
3850,Watsonville,4/12/2023,hoop,,36.88820947300008,-121.812303564,1,2023-04-12 Watsonville,3876.0,13.432609667833091,3878
3851,Watsonville,4/12/2023,hoop,,36.88669176600007,-121.81084540299996,1,2023-04-12 Watsonville,3881.0,19.98642085650765,3879
3852,Watsonville,4/12/2023,hoop,,36.88670231900005,-121.81118457899998,1,2023-04-12 Watsonville,3882.0,13.119521431581738,3880
3857,Watsonville,4/12/2023,hoop,,36.886992752000026,-121.81109553099996,1,2023-04-12 Watsonville,3883.0,9.524764230643218,3885
3860,Watsonville,4/12/2023,hoop,,36.88704638600007,-121.81149551799996,1,2023-04-12 Watsonville,3886.0,9.193965345314414,3888
3861,Watsonville,4/12/2023,hoop,,36.88828150500007,-121.81031089499999,1,2023-04-12 Watsonville,3891.0,27.825208356913368,3889
3864,Watsonville,4/12/2023,hoop,,36.88805787200005,-121.81086190999996,1,2023-04-12 Watsonville,3890.0,20.706622928907528,3892
3866,Watsonville,4/12/2023,hoop,,36.88775404300002,-121.81011636999995,1,2023-04-12 Watsonville,3896.0,21.8486928574322,3894
3867,Watsonville,4/12/2023,hoop,,36.88757363900004,-121.81046842599994,1,2023-04-12 Watsonville,3896.0,25.39044995996789,3895
3870,Watsonville,4/12/2023,hoop,,36.88780306100006,-121.81073553799996,1,2023-04-12 Watsonville,,,3898
3871,Watsonville,4/12/2023,other,,36.88811159000005,-121.80749954899994,1,2023-04-12 Watsonville,,,3899
3872,Watsonville,4/12/2023,other,,36.88780867000003,-121.80809039499997,1,2023-04-12 Watsonville,,,3900
3873,Watsonville,4/12/2023,other,,36.88824591400004,-121.80792382699995,1,2023-04-12 Watsonville,,,3901
3874,Watsonville,4/12/2023,other,,36.88780871500006,-121.80869771699996,1,2023-04-12 Watsonville,,,3902
3875,Watsonville,4/12/2023,other,,36.88815938700003,-121.80845004899999,1,2023-04-12 Watsonville,,,3903
3876,Watsonville,4/12/2023,other,,36.88749125100002,-121.80659954899994,1,2023-04-12 Watsonville,3905.0,20.1868004812704,3904
3878,Watsonville,4/12/2023,other,,36.88701860200007,-121.80695531199996,1,2023-04-12 Watsonville,,,3906
3879,Watsonville,4/12/2023,other,,36.887144380000045,-121.80737738299996,1,2023-04-12 Watsonville,,,3907
3880,Watsonville,4/12/2023,other,,36.88741718200004,-121.80737543799997,1,2023-04-12 Watsonville,,,3908
3881,Watsonville,4/12/2023,other,,36.89146789100005,-121.80859777599994,1,2023-04-12 Watsonville,,,3909
3882,Watsonville,4/12/2023,other,,36.89127193500008,-121.80915621099996,1,2023-04-12 Watsonville,,,3910
3883,Watsonville,4/12/2023,other,,36.89155590100006,-121.80907807499995,1,2023-04-12 Watsonville,,,3911
3884,Watsonville,4/12/2023,other,,36.89192222300005,-121.80910643399994,1,2023-04-12 Watsonville,,,3912
3885,Watsonville,4/12/2023,other,,36.89158823900004,-121.80951994299994,1,2023-04-12 Watsonville,,,3913
3886,Watsonville,4/12/2023,other,,36.89300001200007,-121.80694662699995,1,2023-04-12 Watsonville,3915.0,12.290292102412591,3914
3891,Watsonville,4/12/2023,other,,36.89331336400005,-121.80607288199997,1,2023-04-12 Watsonville,3920.0,8.52523312619387,3919
3895,Watsonville,4/12/2023,other,,36.893561502000075,-121.805703785,1,2023-04-12 Watsonville,3922.0,21.720208537656855,3923
3896,Watsonville,4/12/2023,other,,36.89146249200007,-121.81159097799996,1,2023-04-12 Watsonville,3925.0,25.636262856749514,3924
3898,Watsonville,4/12/2023,other,,36.89104623600008,-121.81199963399996,1,2023-04-12 Watsonville,3927.0,21.99601484814094,3926
3900,Watsonville,4/12/2023,other,,36.89088620100006,-121.81252736899997,1,2023-04-12 Watsonville,,,3928
3902,Watsonville,4/12/2023,other,,36.89151383000007,-121.81277905999995,1,2023-04-12 Watsonville,3933.0,21.20665727672416,3930
3903,Watsonville,4/12/2023,other,,36.89136930500007,-121.81311352199998,1,2023-04-12 Watsonville,,,3931
3904,Watsonville,4/12/2023,other,,36.891066427000055,-121.81308874799998,1,2023-04-12 Watsonville,,,3932
3906,Watsonville,4/12/2023,other,,36.89169202900007,-121.81223501,1,2023-04-12 Watsonville,3936.0,24.263070337476822,3934
3910,Watsonville,4/12/2023,other,,36.89218563400004,-121.81204580499995,1,2023-04-12 Watsonville,3937.0,22.867793957265945,3938
3911,Watsonville,4/12/2023,other,,36.89101532500007,-121.81409113499996,1,2023-04-12 Watsonville,3941.0,11.220904531468426,3939
3916,Watsonville,4/12/2023,other,,36.89155964900005,-121.81429420899995,1,2023-04-12 Watsonville,3947.0,8.27895751019753,3944
3921,Watsonville,11/17/2019,other,,36.90471664100005,-121.79787517399996,2,2019-11-17 Watsonville,,,3949
3922,Watsonville,11/17/2019,other,,36.890121718000046,-121.76965043799999,2,2019-11-17 Watsonville,,,3950
3923,Watsonville,11/17/2019,other,,36.863451929000064,-121.76533593899995,2,2019-11-17 Watsonville,,,3951
3924,Watsonville,11/17/2019,other,,36.86706515200007,-121.76520985299997,2,2019-11-17 Watsonville,,,3952
3925,Watsonville,11/17/2019,other,,36.84450205400003,-121.79064140799994,2,2019-11-17 Watsonville,,,3953
3926,Watsonville,11/17/2019,other,,36.828133861000026,-121.78572601399996,2,2019-11-17 Watsonville,,,3954
3927,Watsonville,11/17/2019,other,,36.83980670500006,-121.774934939,2,2019-11-17 Watsonville,,,3955
3928,Watsonville,11/17/2019,other,,36.90009672200006,-121.83653414799994,2,2019-11-17 Watsonville,,,3956
3929,Watsonville,11/17/2019,other,,36.902788677000046,-121.83770751599997,2,2019-11-17 Watsonville,,,3957
3930,Watsonville,11/17/2019,other,,36.92261029500003,-121.83048627799997,2,2019-11-17 Watsonville,,,3958
3931,Watsonville,11/17/2019,other,,36.921192879000046,-121.83126179899995,2,2019-11-17 Watsonville,,,3959
3932,Watsonville,11/17/2019,other,,36.92740071800006,-121.80956254699998,2,2019-11-17 Watsonville,,,3960
3933,Watsonville,11/17/2019,other,,36.92478440400004,-121.80891436399996,2,2019-11-17 Watsonville,,,3961
3934,Watsonville,11/17/2019,other,,36.91919296800006,-121.79639046899996,2,2019-11-17 Watsonville,,,3962
3935,Watsonville,11/17/2019,other,,36.904030056000074,-121.78956349799996,2,2019-11-17 Watsonville,,,3963
3936,Watsonville,11/17/2019,other,,36.88763350300008,-121.752255591,2,2019-11-17 Watsonville,,,3964
3937,Watsonville,11/17/2019,other,,36.91606590700008,-121.70511987799993,2,2019-11-17 Watsonville,,,3965
3938,Watsonville,11/17/2019,other,,36.92109932500006,-121.70626434299999,2,2019-11-17 Watsonville,,,3966
3939,Watsonville,11/17/2019,other,,36.945993068000064,-121.71456462599996,2,2019-11-17 Watsonville,,,3967
3940,Watsonville,11/17/2019,other,,36.953729942000045,-121.72272672499996,2,2019-11-17 Watsonville,,,3968
3941,Watsonville,11/17/2019,other,,36.95274992800007,-121.72894725299994,2,2019-11-17 Watsonville,,,3969
3942,Watsonville,11/17/2019,other,,36.96178747700003,-121.72846060899997,2,2019-11-17 Watsonville,,,3970
3943,Watsonville,11/17/2019,other,,36.96259105300004,-121.74749896399997,2,2019-11-17 Watsonville,,,3971
3944,Watsonville,11/17/2019,other,,36.956096641000045,-121.76711725399996,2,2019-11-17 Watsonville,,,3972
3945,Watsonville,11/17/2019,other,,36.94802534600007,-121.75614547099995,2,2019-11-17 Watsonville,,,3973
3946,Watsonville,11/17/2019,other,,36.944178487000045,-121.75637117199994,2,2019-11-17 Watsonville,,,3974
3947,Watsonville,11/17/2019,other,,36.93686798200002,-121.75668109499996,2,2019-11-17 Watsonville,,,3975
3948,Watsonville,11/17/2019,other,,36.879207801000064,-121.79071837999999,2,2019-11-17 Watsonville,,,3976
3949,Watsonville,11/17/2019,other,,36.87418353900006,-121.78508294299996,2,2019-11-17 Watsonville,,,3977
3950,Watsonville,11/17/2019,other,,36.87022574100007,-121.780359638,2,2019-11-17 Watsonville,,,3978
3951,Watsonville,11/17/2019,black mulch,,36.91224450200008,-121.82859044399999,2,2019-11-17 Watsonville,,,3979
3952,Watsonville,11/17/2019,black mulch,,36.91293137700006,-121.82605695799998,2,2019-11-17 Watsonville,,,3980
3953,Watsonville,11/17/2019,black mulch,,36.912658701000055,-121.82762890599996,2,2019-11-17 Watsonville,,,3981
3954,Watsonville,11/17/2019,black mulch,,36.91212256100005,-121.82748588299997,2,2019-11-17 Watsonville,,,3982
3955,Watsonville,11/17/2019,black mulch,,36.91312517400007,-121.82983325699996,2,2019-11-17 Watsonville,,,3983
3956,Watsonville,11/17/2019,black mulch,,36.91431324200005,-121.83026910999996,2,2019-11-17 Watsonville,,,3984
3957,Watsonville,11/17/2019,black mulch,,36.91104629400007,-121.82730916199993,2,2019-11-17 Watsonville,,,3985
3958,Watsonville,11/17/2019,black mulch,,36.91506090400002,-121.83056394899997,2,2019-11-17 Watsonville,,,3986
3959,Watsonville,11/17/2019,black mulch,,36.91575768300004,-121.82869372899997,2,2019-11-17 Watsonville,,,3987
3960,Watsonville,11/17/2019,black mulch,,36.91304345100008,-121.82838565699996,2,2019-11-17 Watsonville,,,3988
3961,Watsonville,11/17/2019,black mulch,,36.91505093300003,-121.82877043099997,2,2019-11-17 Watsonville,,,3989
3962,Watsonville,11/17/2019,black mulch,,36.91600323000006,-121.83053857199997,2,2019-11-17 Watsonville,,,3990
3963,Watsonville,11/17/2019,black mulch,,36.91282859200004,-121.82665620899996,2,2019-11-17 Watsonville,,,3991
3964,Watsonville,11/17/2019,black mulch,,36.91555295000006,-121.82784816499996,2,2019-11-17 Watsonville,,,3992
3965,Watsonville,11/17/2019,black mulch,,36.91242924900007,-121.82570816199996,2,2019-11-17 Watsonville,,,3993
3966,Watsonville,11/17/2019,black mulch,,36.90078071600004,-121.82660372199996,2,2019-11-17 Watsonville,,,3994
3967,Watsonville,11/17/2019,black mulch,,36.900476440000034,-121.827262384,2,2019-11-17 Watsonville,,,3995
3968,Watsonville,11/17/2019,black mulch,,36.90014988600007,-121.82804165099996,2,2019-11-17 Watsonville,,,3996
3969,Watsonville,11/17/2019,black mulch,,36.89981624300003,-121.82636230699995,2,2019-11-17 Watsonville,,,3997
3970,Watsonville,11/17/2019,black mulch,,36.89906700000006,-121.825536452,2,2019-11-17 Watsonville,,,3998
3971,Watsonville,11/17/2019,black mulch,,36.89827293900004,-121.82709492999999,2,2019-11-17 Watsonville,,,3999
3972,Watsonville,11/17/2019,black mulch,,36.89931153700008,-121.82783735699996,2,2019-11-17 Watsonville,,,4000
3973,Watsonville,11/17/2019,black mulch,,36.89897786900008,-121.82635286399994,2,2019-11-17 Watsonville,,,4001
3974,Watsonville,11/17/2019,black mulch,,36.898710623000056,-121.82749395699994,2,2019-11-17 Watsonville,,,4002
3975,Watsonville,11/17/2019,black mulch,,36.89944711000004,-121.75647801999996,2,2019-11-17 Watsonville,,,4003
3976,Watsonville,11/17/2019,black mulch,,36.89780643800003,-121.75529630899996,2,2019-11-17 Watsonville,,,4004
3977,Watsonville,11/17/2019,black mulch,,36.89853527900004,-121.756708442,2,2019-11-17 Watsonville,,,4005
3978,Watsonville,11/17/2019,black mulch,,36.89597497600005,-121.75363825999995,2,2019-11-17 Watsonville,,,4006
3979,Watsonville,11/17/2019,black mulch,,36.896696234000046,-121.75338242199996,2,2019-11-17 Watsonville,,,4007
3980,Watsonville,11/17/2019,black mulch,,36.89785501900008,-121.75733867099996,2,2019-11-17 Watsonville,,,4008
3981,Watsonville,11/17/2019,black mulch,,36.89714576100005,-121.75413945499996,2,2019-11-17 Watsonville,,,4009
3982,Watsonville,11/17/2019,black mulch,,36.89665616500002,-121.75497379099994,2,2019-11-17 Watsonville,,,4010
3983,Watsonville,11/17/2019,black mulch,,36.89713985700007,-121.75605417699995,2,2019-11-17 Watsonville,,,4011
3984,Watsonville,11/17/2019,black mulch,,36.89760112800008,-121.75290517499997,2,2019-11-17 Watsonville,,,4012
3985,Watsonville,11/17/2019,black mulch,,36.89817323700004,-121.75383232599997,2,2019-11-17 Watsonville,,,4013
3986,Watsonville,7/9/2023,other,,36.70847907800004,-121.72547295299997,2,2023-07-09 Watsonville,,,4014
3987,Watsonville,7/9/2023,other,,36.71473520700005,-121.73325639599994,2,2023-07-09 Watsonville,,,4015
3988,Watsonville,7/9/2023,other,,36.72245513600007,-121.73352990999996,2,2023-07-09 Watsonville,,,4016
3989,Watsonville,7/9/2023,other,,36.724083903000064,-121.73239585299996,2,2023-07-09 Watsonville,,,4017
3990,Watsonville,7/9/2023,other,,36.728936932000074,-121.74590019899993,2,2023-07-09 Watsonville,,,4018
3991,Watsonville,7/9/2023,other,,36.72992882500006,-121.74796480699996,2,2023-07-09 Watsonville,,,4019
3992,Watsonville,7/9/2023,other,,36.734751268000025,-121.74454741599997,2,2023-07-09 Watsonville,,,4020
3993,Watsonville,7/9/2023,other,,36.73677764100007,-121.74591390899997,2,2023-07-09 Watsonville,,,4021
3994,Watsonville,7/9/2023,other,,36.73821727700005,-121.747094555,2,2023-07-09 Watsonville,,,4022
3995,Watsonville,7/9/2023,other,,36.73792931500003,-121.75362672699998,2,2023-07-09 Watsonville,,,4023
3996,Watsonville,7/9/2023,other,,36.73757011000004,-121.75759111899998,2,2023-07-09 Watsonville,,,4024
3997,Watsonville,7/9/2023,other,,36.740993694000046,-121.75178988799996,2,2023-07-09 Watsonville,,,4025
3998,Watsonville,7/9/2023,other,,36.74451363600008,-121.74639239099996,2,2023-07-09 Watsonville,,,4026
3999,Watsonville,7/9/2023,other,,36.75258243700006,-121.73173199899996,2,2023-07-09 Watsonville,,,4027
4000,Watsonville,7/9/2023,other,,36.75346302500003,-121.72857228299993,2,2023-07-09 Watsonville,,,4028
4001,Watsonville,7/9/2023,other,,36.749685562000025,-121.73268113599994,2,2023-07-09 Watsonville,,,4029
4002,Watsonville,7/9/2023,other,,36.74874617700005,-121.736559909,2,2023-07-09 Watsonville,,,4030
4003,Watsonville,7/9/2023,other,,36.765052997000055,-121.721439498,2,2023-07-09 Watsonville,,,4031
4004,Watsonville,7/9/2023,other,,36.76291624700008,-121.72317093199996,2,2023-07-09 Watsonville,,,4032
4005,Watsonville,7/9/2023,other,,36.77441673300007,-121.74183262199993,2,2023-07-09 Watsonville,,,4033
4006,Watsonville,7/9/2023,other,,36.77176394600008,-121.74033951699992,2,2023-07-09 Watsonville,,,4034
4007,Watsonville,7/9/2023,other,,36.77404579800003,-121.74448888199998,2,2023-07-09 Watsonville,,,4035
4008,Watsonville,7/9/2023,other,,36.77673422300006,-121.74827883199998,2,2023-07-09 Watsonville,,,4036
4009,Watsonville,7/9/2023,other,,36.78683282900005,-121.73367325899994,2,2023-07-09 Watsonville,,,4037
4010,Watsonville,7/9/2023,other,,36.79251595900007,-121.74278666099995,2,2023-07-09 Watsonville,,,4038
4011,Watsonville,7/9/2023,other,,36.839729615000074,-121.759742384,2,2023-07-09 Watsonville,,,4039
4012,Watsonville,7/9/2023,other,,36.84629894100004,-121.77342629099996,2,2023-07-09 Watsonville,,,4040
4013,Watsonville,7/9/2023,other,,36.84814193100004,-121.773733043,2,2023-07-09 Watsonville,,,4041
4014,Watsonville,7/9/2023,other,,36.85035639200004,-121.77304936899996,2,2023-07-09 Watsonville,,,4042
4015,Watsonville,7/9/2023,other,,36.85157882600004,-121.76855100599992,2,2023-07-09 Watsonville,,,4043
4016,Watsonville,7/9/2023,other,,36.85773421300007,-121.78274636599996,2,2023-07-09 Watsonville,,,4044
4017,Santa Maria,8/26/2022,hoop,,34.93319689400005,-120.48036867599996,2,2022-08-26 Santa Maria,,,4924
4018,Santa Maria,8/26/2022,hoop,,34.934205115000054,-120.48169892399994,2,2022-08-26 Santa Maria,,,4925
4019,Santa Maria,8/26/2022,hoop,,34.934072323000066,-120.48052944299997,2,2022-08-26 Santa Maria,,,4926
4020,Santa Maria,8/26/2022,hoop,,34.93388397600006,-120.48119876099996,2,2022-08-26 Santa Maria,,,4927
4021,Santa Maria,8/26/2022,hoop,,34.93390270100008,-120.47994918499997,2,2022-08-26 Santa Maria,,,4928
4022,Santa Maria,8/26/2022,hoop,,34.93420018300003,-120.47944842799996,2,2022-08-26 Santa Maria,,,4929
4023,Santa Maria,8/26/2022,hoop,,34.93384213500008,-120.47897082099996,2,2022-08-26 Santa Maria,,,4930
4024,Santa Maria,8/26/2022,hoop,,34.933999431000075,-120.47804194099996,2,2022-08-26 Santa Maria,,,4931
4025,Santa Maria,8/26/2022,hoop,,34.93397605200005,-120.47743229999996,2,2022-08-26 Santa Maria,,,4932
4026,Santa Maria,8/26/2022,hoop,,34.933943860000056,-120.47694166099996,2,2022-08-26 Santa Maria,,,4933
4027,Santa Maria,8/26/2022,hoop,,34.93347868700005,-120.48171882799994,2,2022-08-26 Santa Maria,,,4934
4028,Santa Maria,8/26/2022,hoop,,34.933121964000065,-120.48149982499996,2,2022-08-26 Santa Maria,,,4935
4029,Santa Maria,8/26/2022,hoop,,34.933390056000064,-120.48083556699999,2,2022-08-26 Santa Maria,,,4936
4030,Santa Maria,8/26/2022,hoop,,34.93305034300005,-120.47996445399995,2,2022-08-26 Santa Maria,,,4937
4031,Santa Maria,8/26/2022,hoop,,34.933193499000026,-120.47799356799997,2,2022-08-26 Santa Maria,,,4938
4032,Santa Maria,8/26/2022,hoop,,34.930458688000044,-120.477430777,2,2022-08-26 Santa Maria,,,4939
4033,Santa Maria,8/26/2022,hoop,,34.931772755000054,-120.47813159999998,2,2022-08-26 Santa Maria,,,4940
4034,Santa Maria,8/26/2022,hoop,,34.93180991100007,-120.481551272,2,2022-08-26 Santa Maria,,,4941
4035,Santa Maria,8/26/2022,hoop,,34.93116012100006,-120.481390461,2,2022-08-26 Santa Maria,,,4942
4036,Santa Maria,8/26/2022,hoop,,34.93174043000005,-120.48065354499992,2,2022-08-26 Santa Maria,,,4943
4037,Santa Maria,8/26/2022,hoop,,34.93243715600005,-120.48038431799993,2,2022-08-26 Santa Maria,,,4944
4038,Santa Maria,8/26/2022,hoop,,34.931581950000066,-120.48010020599996,2,2022-08-26 Santa Maria,,,4945
4039,Santa Maria,8/26/2022,hoop,,34.93198692200008,-120.47888538599994,2,2022-08-26 Santa Maria,,,4946
4040,Santa Maria,8/26/2022,hoop,,34.93141625900006,-120.47707027599994,2,2022-08-26 Santa Maria,,,4947
4041,Santa Maria,8/26/2022,hoop,,34.93260562900008,-120.47808261499993,2,2022-08-26 Santa Maria,,,4948
4042,Santa Maria,8/26/2022,hoop,,34.93268325100007,-120.48166892299996,2,2022-08-26 Santa Maria,,,4949
4043,Santa Maria,8/26/2022,hoop,,34.93348856100005,-120.47693901499996,2,2022-08-26 Santa Maria,,,4950
4044,Santa Maria,8/26/2022,hoop,,34.93229006400003,-120.47771353499996,2,2022-08-26 Santa Maria,,,4951
4045,Santa Maria,8/26/2022,hoop,,34.92855785100005,-120.49763400199998,2,2022-08-26 Santa Maria,,,4952
4046,Santa Maria,8/26/2022,hoop,,34.928063321000025,-120.49754824299998,2,2022-08-26 Santa Maria,,,4953
4047,Santa Maria,8/26/2022,hoop,,34.92833608700005,-120.49711178399996,2,2022-08-26 Santa Maria,,,4954
4048,Santa Maria,8/26/2022,hoop,,34.927954939000074,-120.49685827699994,2,2022-08-26 Santa Maria,,,4955
4049,Santa Maria,8/26/2022,hoop,,34.92842404600003,-120.49393184499996,2,2022-08-26 Santa Maria,,,4956
4050,Santa Maria,8/26/2022,hoop,,34.92797243700005,-120.49557720499996,2,2022-08-26 Santa Maria,,,4957
4051,Santa Maria,8/26/2022,hoop,,34.92827452200004,-120.49508240699998,2,2022-08-26 Santa Maria,,,4958
4052,Santa Maria,8/26/2022,hoop,,34.92794585900003,-120.49354130799996,2,2022-08-26 Santa Maria,,,4959
4053,Santa Maria,8/26/2022,hoop,,34.92821949100005,-120.49184005599994,2,2022-08-26 Santa Maria,,,4960
4054,Santa Maria,8/26/2022,hoop,,34.927342030000034,-120.49345784499997,2,2022-08-26 Santa Maria,,,4961
4055,Santa Maria,8/26/2022,hoop,,34.927469323000025,-120.49099885199996,2,2022-08-26 Santa Maria,,,4962
4056,Santa Maria,8/26/2022,hoop,,34.92635369900006,-120.49748254999996,2,2022-08-26 Santa Maria,,,4963
4057,Santa Maria,8/26/2022,hoop,,34.92737579800007,-120.49679902099996,2,2022-08-26 Santa Maria,,,4964
4058,Santa Maria,8/26/2022,hoop,,34.927564053000026,-120.49558135499996,2,2022-08-26 Santa Maria,,,4965
4059,Santa Maria,8/26/2022,hoop,,34.926468053000065,-120.49570126699996,2,2022-08-26 Santa Maria,,,4966
4060,Santa Maria,8/26/2022,hoop,,34.92641920600005,-120.49336220999999,2,2022-08-26 Santa Maria,,,4967
4061,Santa Maria,8/26/2022,hoop,,34.92647494700003,-120.49253175399996,2,2022-08-26 Santa Maria,,,4968
4062,Santa Maria,8/26/2022,hoop,,34.92058441800003,-120.48554535299996,2,2022-08-26 Santa Maria,,,4969
4063,Santa Maria,8/26/2022,hoop,,34.92026079800007,-120.48464468299994,2,2022-08-26 Santa Maria,,,4970
4064,Santa Maria,8/26/2022,hoop,,34.92062830400005,-120.483759578,2,2022-08-26 Santa Maria,,,4971
4065,Santa Maria,8/26/2022,hoop,,34.91958917900007,-120.48575859899996,2,2022-08-26 Santa Maria,,,4972
4066,Santa Maria,8/26/2022,hoop,,34.91944657600004,-120.48457428399996,2,2022-08-26 Santa Maria,,,4973
4067,Santa Maria,8/26/2022,hoop,,34.91886804000006,-120.48556333699996,2,2022-08-26 Santa Maria,,,4974
4068,Santa Maria,8/26/2022,hoop,,34.920131567000055,-120.48286372299998,2,2022-08-26 Santa Maria,,,4975
4069,Santa Maria,8/26/2022,hoop,,34.91899182000003,-120.48485274899996,2,2022-08-26 Santa Maria,,,4976
4070,Santa Maria,8/26/2022,mulch,,34.930533291000074,-120.49155682399999,2,2022-08-26 Santa Maria,,,4977
4071,Santa Maria,8/26/2022,mulch,,34.93043320000004,-120.49117555199996,2,2022-08-26 Santa Maria,4986.0,28.461081114610025,4978
4072,Santa Maria,8/26/2022,mulch,,34.93010656900003,-120.491653795,2,2022-08-26 Santa Maria,,,4979
4073,Santa Maria,8/26/2022,mulch,,34.92909775000004,-120.49180340699996,2,2022-08-26 Santa Maria,,,4980
4074,Santa Maria,8/26/2022,mulch,,34.92943197100004,-120.49168518899997,2,2022-08-26 Santa Maria,,,4981
4075,Santa Maria,8/26/2022,mulch,,34.92964290200007,-120.49131124599997,2,2022-08-26 Santa Maria,,,4982
4076,Santa Maria,8/26/2022,mulch,,34.92904947200003,-120.49108532999996,2,2022-08-26 Santa Maria,4985.0,29.16211133527037,4983
4077,Santa Maria,8/26/2022,mulch,,34.92906141700007,-120.49041112099997,2,2022-08-26 Santa Maria,,,4984
4080,Santa Maria,8/26/2022,mulch,,34.93026450400004,-120.49035300699995,2,2022-08-26 Santa Maria,,,4987
4081,Santa Maria,8/26/2022,mulch,,34.930139027000045,-120.49079727799995,2,2022-08-26 Santa Maria,,,4988
4082,Santa Maria,8/26/2022,mulch,,34.92977126900007,-120.49058888699994,2,2022-08-26 Santa Maria,,,4989
4083,Santa Maria,8/26/2022,mulch,,34.92895928500008,-120.49271659399994,2,2022-08-26 Santa Maria,4991.0,15.882267458083462,4990
4085,Santa Maria,8/26/2022,mulch,,34.93038377200003,-120.49228745999994,2,2022-08-26 Santa Maria,,,4992
4086,Santa Maria,8/26/2022,mulch,,34.93328305800003,-120.47589178799996,2,2022-08-26 Santa Maria,,,4993
4087,Santa Maria,8/26/2022,mulch,,34.93383522600004,-120.47580763699995,2,2022-08-26 Santa Maria,,,4994
4088,Santa Maria,8/26/2022,mulch,,34.93381227100008,-120.475419322,2,2022-08-26 Santa Maria,,,4995
4089,Santa Maria,8/26/2022,mulch,,34.93428443200003,-120.47400851799993,2,2022-08-26 Santa Maria,,,4996
4090,Santa Maria,8/26/2022,mulch,,34.93296627700005,-120.47395348099997,2,2022-08-26 Santa Maria,,,4997
4091,Santa Maria,8/26/2022,mulch,,34.933352856000056,-120.47459514699995,2,2022-08-26 Santa Maria,,,4998
4092,Santa Maria,8/26/2022,mulch,,34.93396028500007,-120.47465537299996,2,2022-08-26 Santa Maria,,,4999
4093,Santa Maria,8/26/2022,mulch,,34.93082665900005,-120.47597989099997,2,2022-08-26 Santa Maria,,,5000
4094,Santa Maria,8/26/2022,mulch,,34.93106092800008,-120.47574184299998,2,2022-08-26 Santa Maria,,,5001
4095,Santa Maria,8/26/2022,mulch,,34.93141017700003,-120.47597023299994,2,2022-08-26 Santa Maria,,,5002
4096,Santa Maria,8/26/2022,mulch,,34.93118863400008,-120.474938007,2,2022-08-26 Santa Maria,,,5003
4097,Santa Maria,8/26/2022,mulch,,34.93088988300008,-120.47424904099996,2,2022-08-26 Santa Maria,,,5004
4098,Santa Maria,8/26/2022,mulch,,34.93181458600003,-120.47585066099998,2,2022-08-26 Santa Maria,,,5005
4099,Santa Maria,8/26/2022,mulch,,34.93169271100004,-120.47535303399997,2,2022-08-26 Santa Maria,5009.0,25.80467874985603,5006
4100,Santa Maria,8/26/2022,mulch,,34.93134902700007,-120.47416869799996,2,2022-08-26 Santa Maria,,,5007
4101,Santa Maria,8/26/2022,mulch,,34.93074971600004,-120.47462956299997,2,2022-08-26 Santa Maria,,,5008
4103,Santa Maria,8/26/2022,mulch,,34.97292169800005,-120.46576335999998,1,2022-08-26 Santa Maria,,,5010
4104,Santa Maria,8/26/2022,mulch,,34.97240550500004,-120.46490514499997,1,2022-08-26 Santa Maria,,,5011
4105,Santa Maria,8/26/2022,mulch,,34.97216852500003,-120.46574822799992,1,2022-08-26 Santa Maria,,,5012
4106,Santa Maria,8/26/2022,mulch,,34.973043320000045,-120.46400478799995,1,2022-08-26 Santa Maria,,,5013
4107,Santa Maria,8/26/2022,mulch,,34.971733924000034,-120.46586319899995,1,2022-08-26 Santa Maria,,,5014
4108,Santa Maria,8/26/2022,mulch,,34.97139659700008,-120.46410579599996,1,2022-08-26 Santa Maria,,,5015
4109,Santa Maria,8/26/2022,mulch,,34.97006592200006,-120.46567864499995,1,2022-08-26 Santa Maria,,,5016
4110,Santa Maria,8/26/2022,mulch,,34.97070254800008,-120.463777285,1,2022-08-26 Santa Maria,,,5017
4111,Santa Maria,8/26/2022,mulch,,34.971007127000064,-120.46461556999996,1,2022-08-26 Santa Maria,,,5018
4112,Santa Maria,8/26/2022,mulch,,34.96851575900007,-120.46537897299999,1,2022-08-26 Santa Maria,,,5019
4113,Santa Maria,8/26/2022,mulch,,34.96987505100003,-120.46437324599998,1,2022-08-26 Santa Maria,,,5020
4114,Santa Maria,8/26/2022,mulch,,34.96851550900004,-120.46438941099996,1,2022-08-26 Santa Maria,,,5021
4115,Santa Maria,8/26/2022,mulch,,34.97593518700006,-120.45750366699995,2,2022-08-26 Santa Maria,,,5022
4116,Santa Maria,8/26/2022,mulch,,34.97550399200003,-120.45625154399994,2,2022-08-26 Santa Maria,,,5023
4117,Santa Maria,8/26/2022,mulch,,34.97585103900008,-120.45451987399996,2,2022-08-26 Santa Maria,,,5024
4118,Santa Maria,8/26/2022,mulch,,34.977086943000074,-120.45746698799996,2,2022-08-26 Santa Maria,,,5025
4119,Santa Maria,8/26/2022,mulch,,34.976776752000035,-120.45502917599998,2,2022-08-26 Santa Maria,,,5026
4120,Santa Maria,8/26/2022,other,,34.95809428100006,-120.46669094999999,2,2022-08-26 Santa Maria,,,5027
4121,Santa Maria,8/26/2022,other,,34.95858425400007,-120.46597860799994,2,2022-08-26 Santa Maria,,,5028
4122,Santa Maria,8/26/2022,other,,34.96000888500004,-120.46528636699996,2,2022-08-26 Santa Maria,,,5029
4123,Santa Maria,8/26/2022,other,,34.95838418900007,-120.46936959899995,2,2022-08-26 Santa Maria,,,5030
4124,Santa Maria,8/26/2022,other,,34.960466161000056,-120.46758532399996,2,2022-08-26 Santa Maria,,,5031
4125,Santa Maria,8/26/2022,other,,34.959326918000045,-120.47236053899996,2,2022-08-26 Santa Maria,,,5032
4126,Santa Maria,8/26/2022,other,,34.96028652300004,-120.470523835,2,2022-08-26 Santa Maria,,,5033
4127,Santa Maria,8/26/2022,other,,34.95957811900007,-120.47343834799995,2,2022-08-26 Santa Maria,,,5034
4128,Santa Maria,8/26/2022,other,,34.957995260000075,-120.47128157799995,2,2022-08-26 Santa Maria,,,5035
4129,Santa Maria,8/26/2022,other,,34.95757462100005,-120.47144373299994,2,2022-08-26 Santa Maria,,,5036
4130,Santa Maria,8/26/2022,other,,34.957050166000045,-120.47236498199997,2,2022-08-26 Santa Maria,,,5037
4131,Santa Maria,8/26/2022,other,,34.95695714900006,-120.47188304399998,2,2022-08-26 Santa Maria,,,5038
4132,Santa Maria,8/26/2022,other,,34.95696852000003,-120.47079180799994,2,2022-08-26 Santa Maria,,,5039
4133,Santa Maria,8/26/2022,other,,34.956912052000064,-120.47043838899998,2,2022-08-26 Santa Maria,,,5040
4134,Santa Maria,8/26/2022,other,,34.955239230000075,-120.46610825899997,2,2022-08-26 Santa Maria,,,5041
4135,Santa Maria,8/26/2022,other,,34.95525363500008,-120.46563163699994,2,2022-08-26 Santa Maria,,,5042
4136,Santa Maria,8/26/2022,other,,34.95494740600003,-120.46611635899995,2,2022-08-26 Santa Maria,,,5043
4137,Santa Maria,8/26/2022,other,,34.95296179500008,-120.45966259399997,2,2022-08-26 Santa Maria,,,5044
4138,Santa Maria,8/26/2022,other,,34.95462181500005,-120.45888845399996,2,2022-08-26 Santa Maria,,,5045
4139,Santa Maria,8/26/2022,other,,34.952921272000026,-120.45876304599994,2,2022-08-26 Santa Maria,,,5046
4140,Santa Maria,8/26/2022,other,,34.95244564700005,-120.459880339,2,2022-08-26 Santa Maria,,,5047
4141,Santa Maria,8/26/2022,other,,34.95291254400007,-120.45758046999998,2,2022-08-26 Santa Maria,,,5048
4142,Santa Maria,8/26/2022,other,,34.953835678000075,-120.45617395599999,2,2022-08-26 Santa Maria,,,5049
4143,Santa Maria,8/26/2022,other,,34.95245229200003,-120.45686768499996,2,2022-08-26 Santa Maria,,,5050
4144,Santa Maria,8/26/2022,other,,34.95295486300006,-120.45712659099996,2,2022-08-26 Santa Maria,,,5051
4145,Santa Maria,8/26/2022,other,,34.952798924000035,-120.45596197499998,2,2022-08-26 Santa Maria,,,5052
4146,Santa Maria,8/26/2022,other,,34.95483495900004,-120.45849305599997,2,2022-08-26 Santa Maria,,,5053
4147,Santa Maria,8/26/2022,other,,34.95256462500004,-120.45450766099998,2,2022-08-26 Santa Maria,,,5054
4148,Santa Maria,8/26/2022,other,,34.955052142000056,-120.45745130999995,2,2022-08-26 Santa Maria,,,5055
4149,Santa Maria,8/26/2022,other,,34.955081017000055,-120.45787703199994,2,2022-08-26 Santa Maria,,,5056
4150,Santa Maria,8/26/2022,other,,34.956153941000025,-120.45700736799996,2,2022-08-26 Santa Maria,,,5057
4151,Santa Maria,8/26/2022,other,,34.95562259900004,-120.45747934099995,2,2022-08-26 Santa Maria,5060.0,25.851946328988845,5058
4152,Santa Maria,8/26/2022,other,,34.955414603000065,-120.45629877299996,2,2022-08-26 Santa Maria,,,5059
4154,Santa Maria,8/26/2022,other,,34.95558564700008,-120.45592896999995,2,2022-08-26 Santa Maria,,,5061
4155,Santa Maria,8/26/2022,other,,34.95442243700006,-120.45517684299995,2,2022-08-26 Santa Maria,,,5062
4156,Santa Maria,8/26/2022,other,,34.954842847000066,-120.45321885499997,2,2022-08-26 Santa Maria,,,5063
4157,Santa Maria,8/26/2022,other,,34.95432768000006,-120.45236225899998,2,2022-08-26 Santa Maria,,,5064
4158,Santa Maria,8/26/2022,other,,34.95552154400008,-120.45017399099999,2,2022-08-26 Santa Maria,,,5065
4159,Santa Maria,8/26/2022,other,,34.95629111300008,-120.45208392299996,2,2022-08-26 Santa Maria,,,5066
4160,Santa Maria,8/26/2022,other,,34.956152418000045,-120.45019985,2,2022-08-26 Santa Maria,,,5067
4161,Santa Maria,8/26/2022,other,,34.95590250500004,-120.45099214199996,2,2022-08-26 Santa Maria,,,5068
4162,Santa Maria,8/26/2022,other,,34.97127639000007,-120.461742228,2,2022-08-26 Santa Maria,,,5069
4163,Santa Maria,8/26/2022,other,,34.981807580000066,-120.45664742999996,2,2022-08-26 Santa Maria,,,5070
4164,Santa Maria,8/26/2022,other,,34.98175805200003,-120.45552991499994,2,2022-08-26 Santa Maria,,,5071
4165,Santa Maria,8/26/2022,other,,34.98261509500003,-120.45597620099994,2,2022-08-26 Santa Maria,,,5072
4166,Santa Maria,8/26/2022,other,,34.98115754100007,-120.455168943,2,2022-08-26 Santa Maria,,,5073
4167,Santa Maria,8/26/2022,other,,34.984800774000064,-120.45536990899996,2,2022-08-26 Santa Maria,,,5074
4168,Santa Maria,8/26/2022,other,,34.985223648000044,-120.45846217999996,2,2022-08-26 Santa Maria,,,5075
4169,Santa Maria,8/26/2022,other,,34.98530163200007,-120.460536876,2,2022-08-26 Santa Maria,,,5076
4170,Santa Maria,8/26/2022,other,,34.985674481000046,-120.45976268599996,2,2022-08-26 Santa Maria,,,5077
4171,Santa Maria,5/5/2023,other,,34.94692511400007,-120.53619624699996,1,2023-05-05 Santa Maria,,,5078
4172,Santa Maria,5/5/2023,other,,34.951650235000045,-120.53756843599996,1,2023-05-05 Santa Maria,,,5079
4173,Santa Maria,5/5/2023,other,,34.952623594000045,-120.53732994299996,1,2023-05-05 Santa Maria,,,5080
4174,Santa Maria,5/5/2023,other,,34.95158654300008,-120.53049941799996,1,2023-05-05 Santa Maria,,,5081
4175,Santa Maria,5/5/2023,other,,34.954341828000054,-120.523804026,1,2023-05-05 Santa Maria,,,5082
4176,Santa Maria,5/5/2023,other,,34.95243227700007,-120.523890199,1,2023-05-05 Santa Maria,,,5083
4177,Santa Maria,5/5/2023,other,,34.95485400700005,-120.54870243899995,1,2023-05-05 Santa Maria,,,5084
4178,Santa Maria,5/5/2023,other,,34.95182365800002,-120.55620003099995,1,2023-05-05 Santa Maria,,,5085
4179,Santa Maria,5/5/2023,other,,34.95018547500007,-120.56023155499996,1,2023-05-05 Santa Maria,,,5086
4180,Santa Maria,5/5/2023,other,,34.94805129100007,-120.56291716699997,1,2023-05-05 Santa Maria,,,5087
4181,Santa Maria,5/5/2023,other,,34.945555902000024,-120.56349897599993,1,2023-05-05 Santa Maria,,,5088
4182,Santa Maria,5/5/2023,other,,34.94799319300006,-120.56800121699996,1,2023-05-05 Santa Maria,,,5089
4183,Santa Maria,5/5/2023,other,,34.945930969000074,-120.575883864,1,2023-05-05 Santa Maria,,,5090
4184,Santa Maria,5/5/2023,other,,34.94701257000003,-120.57595480299995,1,2023-05-05 Santa Maria,,,5091
4185,Santa Maria,5/5/2023,other,,34.94978040700005,-120.58038426499996,1,2023-05-05 Santa Maria,,,5092
4186,Santa Maria,5/5/2023,other,,34.945998549000024,-120.58205263599996,1,2023-05-05 Santa Maria,,,5093
4187,Santa Maria,5/5/2023,other,,34.89445937000005,-120.50831378799997,1,2023-05-05 Santa Maria,5308.0,12.465036363928032,5094
4188,Santa Maria,5/5/2023,other,,34.89251899100003,-120.50776979699998,1,2023-05-05 Santa Maria,,,5095
4189,Santa Maria,5/5/2023,other,,34.90019698100008,-120.50994048299998,1,2023-05-05 Santa Maria,,,5096
4190,Santa Maria,5/5/2023,other,,34.89099139300004,-120.52646638699996,1,2023-05-05 Santa Maria,,,5097
4191,Santa Maria,5/5/2023,other,,34.89494190000005,-120.52825948999998,1,2023-05-05 Santa Maria,,,5098
4192,Santa Maria,5/5/2023,other,,34.89613495300006,-120.52842741599994,1,2023-05-05 Santa Maria,,,5099
4193,Santa Maria,5/5/2023,other,,34.90431218000003,-120.53332725399996,1,2023-05-05 Santa Maria,,,5100
4194,Santa Maria,5/5/2023,other,,34.90198964100006,-120.53364177099996,1,2023-05-05 Santa Maria,,,5101
4195,Santa Maria,5/5/2023,other,,34.90479376600007,-120.54198579399996,1,2023-05-05 Santa Maria,,,5102
4196,Santa Maria,5/5/2023,other,,34.91025022300005,-120.54348718699998,1,2023-05-05 Santa Maria,,,5103
4197,Santa Maria,5/5/2023,other,,34.903342493000025,-120.52190258599995,1,2023-05-05 Santa Maria,,,5104
4198,Santa Maria,5/5/2023,other,,34.88788610000006,-120.50990432299994,1,2023-05-05 Santa Maria,,,5105
4199,Santa Maria,5/5/2023,other,,34.89191190100007,-120.51822283999996,1,2023-05-05 Santa Maria,5371.0,19.405460172480524,5106
4200,Santa Maria,5/5/2023,other,,34.896034187000055,-120.51847093099995,1,2023-05-05 Santa Maria,,,5107
4201,Santa Maria,5/5/2023,other,,34.87146670200008,-120.473162646,1,2023-05-05 Santa Maria,,,5108
4202,Santa Maria,5/5/2023,hoop,,34.91826432700003,-120.39029502499994,1,2023-05-05 Santa Maria,,,5109
4203,Santa Maria,5/5/2023,hoop,,34.91794289200004,-120.39068054299996,1,2023-05-05 Santa Maria,,,5110
4204,Santa Maria,5/5/2023,hoop,,34.87690260200003,-120.49659017099998,1,2023-05-05 Santa Maria,,,5111
4205,Santa Maria,5/5/2023,hoop,,34.876888559000065,-120.49597940499996,1,2023-05-05 Santa Maria,,,5112
4206,Santa Maria,5/5/2023,hoop,,34.87639940100007,-120.49551597499998,1,2023-05-05 Santa Maria,,,5113
4207,Santa Maria,5/5/2023,hoop,,34.87739557100008,-120.49422255099996,1,2023-05-05 Santa Maria,,,5114
4208,Santa Maria,5/5/2023,hoop,,34.877231761000075,-120.493460401,1,2023-05-05 Santa Maria,,,5115
4209,Santa Maria,5/5/2023,hoop,,34.87691291600004,-120.49286986099996,1,2023-05-05 Santa Maria,,,5116
4210,Santa Maria,5/5/2023,hoop,,34.87821667600008,-120.49371234499993,1,2023-05-05 Santa Maria,,,5117
4211,Santa Maria,5/5/2023,hoop,,34.87799236500007,-120.49285981999996,1,2023-05-05 Santa Maria,,,5118
4212,Santa Maria,5/5/2023,hoop,,34.87904519800003,-120.493368122,1,2023-05-05 Santa Maria,,,5119
4213,Santa Maria,5/5/2023,hoop,,34.878682053000034,-120.49276049999996,1,2023-05-05 Santa Maria,,,5120
4214,Santa Maria,5/5/2023,hoop,,34.87684866300003,-120.48978679399994,1,2023-05-05 Santa Maria,,,5121
4215,Santa Maria,5/5/2023,hoop,,34.875457538000035,-120.48915816199997,1,2023-05-05 Santa Maria,,,5122
4216,Santa Maria,5/5/2023,hoop,,34.90623993000003,-120.538382776,1,2023-05-05 Santa Maria,,,5123
4217,Santa Maria,5/5/2023,hoop,,34.905771049000066,-120.53770520799996,1,2023-05-05 Santa Maria,,,5124
4218,Santa Maria,5/5/2023,hoop,,34.906803084000046,-120.53796297399998,1,2023-05-05 Santa Maria,,,5125
4219,Santa Maria,5/5/2023,hoop,,34.90733970100007,-120.53730812099997,1,2023-05-05 Santa Maria,,,5126
4220,Santa Maria,5/5/2023,hoop,,34.90654987000005,-120.53661112199995,1,2023-05-05 Santa Maria,,,5127
4221,Santa Maria,5/5/2023,hoop,,34.90524432900003,-120.53695334599996,1,2023-05-05 Santa Maria,,,5128
4222,Santa Maria,5/5/2023,hoop,,34.906430767000074,-120.53724322299996,1,2023-05-05 Santa Maria,,,5129
4223,Santa Maria,5/5/2023,hoop,,34.90482316300006,-120.536230021,1,2023-05-05 Santa Maria,,,5130
4224,Santa Maria,5/5/2023,hoop,,34.878261071000054,-120.47158719599996,1,2023-05-05 Santa Maria,,,5131
4225,Santa Maria,5/5/2023,hoop,,34.877951231000054,-120.470982543,1,2023-05-05 Santa Maria,,,5132
4226,Santa Maria,5/5/2023,hoop,,34.877588865000064,-120.47041445899998,1,2023-05-05 Santa Maria,,,5133
4227,Santa Maria,5/5/2023,hoop,,34.87726644400004,-120.46963153099993,1,2023-05-05 Santa Maria,,,5134
4228,Santa Maria,5/5/2023,hoop,,34.87711649100004,-120.46923029299997,1,2023-05-05 Santa Maria,,,5135
4229,Santa Maria,5/5/2023,hoop,,34.87676649500003,-120.46891466099999,1,2023-05-05 Santa Maria,5137.0,25.24821686197244,5136
4231,Santa Maria,5/5/2023,hoop,,34.87637134700003,-120.46848492599996,1,2023-05-05 Santa Maria,,,5138
4232,Santa Maria,5/5/2023,hoop,,34.876136288000055,-120.46827498199995,1,2023-05-05 Santa Maria,,,5139
4233,Santa Maria,5/5/2023,hoop,,34.875630330000035,-120.46754066999993,1,2023-05-05 Santa Maria,,,5140
4234,Santa Maria,5/5/2023,hoop,,34.875600578000046,-120.466860613,1,2023-05-05 Santa Maria,,,5141
4235,Santa Maria,5/5/2023,hoop,,34.87517438400005,-120.46753229599994,1,2023-05-05 Santa Maria,,,5142
4236,Santa Maria,5/5/2023,hoop,,34.87492191100006,-120.46709424799997,1,2023-05-05 Santa Maria,,,5143
4237,Santa Maria,5/5/2023,hoop,,34.875113941000045,-120.46657595499993,1,2023-05-05 Santa Maria,,,5144
4238,Santa Maria,5/5/2023,hoop,,34.87482117800005,-120.465995669,1,2023-05-05 Santa Maria,,,5145
4239,Santa Maria,5/5/2023,hoop,,34.874152991000074,-120.46696744299997,1,2023-05-05 Santa Maria,,,5146
4240,Santa Maria,5/5/2023,hoop,,34.87430082800006,-120.46616335099996,1,2023-05-05 Santa Maria,,,5147
4241,Santa Maria,5/5/2023,hoop,,34.87394124900004,-120.465599409,1,2023-05-05 Santa Maria,,,5148
4242,Santa Maria,5/5/2023,hoop,,34.87345252500006,-120.46650743299995,1,2023-05-05 Santa Maria,,,5149
4243,Santa Maria,5/5/2023,hoop,,34.87337187900005,-120.46587830699995,1,2023-05-05 Santa Maria,,,5150
4244,Santa Maria,5/5/2023,hoop,,34.87318703900007,-120.46623243199996,1,2023-05-05 Santa Maria,,,5151
4245,Santa Maria,5/5/2023,hoop,,34.872670767000045,-120.46627354099996,1,2023-05-05 Santa Maria,,,5152
4246,Santa Maria,5/5/2023,hoop,,34.87255761600005,-120.46580457899996,1,2023-05-05 Santa Maria,,,5153
4247,Santa Maria,5/5/2023,hoop,,34.859212101000026,-120.38944142199993,1,2023-05-05 Santa Maria,,,5154
4248,Santa Maria,5/5/2023,hoop,,34.859298145000025,-120.38815158799996,1,2023-05-05 Santa Maria,,,5155
4249,Santa Maria,5/5/2023,hoop,,34.859244250000074,-120.38691112099995,1,2023-05-05 Santa Maria,,,5156
4250,Santa Maria,5/5/2023,hoop,,34.860223070000075,-120.39016641299996,1,2023-05-05 Santa Maria,,,5157
4251,Santa Maria,5/5/2023,hoop,,34.860275340000044,-120.388041338,1,2023-05-05 Santa Maria,,,5158
4252,Santa Maria,5/5/2023,hoop,,34.86010945500004,-120.38612240099997,1,2023-05-05 Santa Maria,,,5159
4253,Santa Maria,5/5/2023,hoop,,34.86127348400004,-120.39079793499997,1,2023-05-05 Santa Maria,,,5160
4254,Santa Maria,5/5/2023,hoop,,34.86130945400004,-120.38797119099996,1,2023-05-05 Santa Maria,,,5161
4255,Santa Maria,5/5/2023,hoop,,34.86126625500003,-120.38638295899995,1,2023-05-05 Santa Maria,,,5162
4256,Santa Maria,5/5/2023,hoop,,34.86219345500007,-120.38432315999997,1,2023-05-05 Santa Maria,,,5163
4257,Santa Maria,5/5/2023,hoop,,34.86229489500005,-120.38602562999993,1,2023-05-05 Santa Maria,,,5164
4258,Santa Maria,5/5/2023,hoop,,34.862323248000045,-120.39077524699997,1,2023-05-05 Santa Maria,,,5165
4259,Santa Maria,5/5/2023,hoop,,34.86232214100005,-120.39184751699996,1,2023-05-05 Santa Maria,,,5166
4260,Santa Maria,5/5/2023,hoop,,34.863293328000054,-120.39279112499996,1,2023-05-05 Santa Maria,,,5167
4261,Santa Maria,5/5/2023,hoop,,34.86325169000003,-120.39126485999996,1,2023-05-05 Santa Maria,,,5168
4262,Santa Maria,5/5/2023,hoop,,34.86450765600006,-120.39334921099999,1,2023-05-05 Santa Maria,,,5169
4263,Santa Maria,5/5/2023,hoop,,34.864474819000066,-120.39216960399995,1,2023-05-05 Santa Maria,,,5170
4264,Santa Maria,5/5/2023,hoop,,34.864363352000055,-120.39060968799998,1,2023-05-05 Santa Maria,,,5171
4265,Santa Maria,5/5/2023,hoop,,34.86344164700006,-120.38782002099998,1,2023-05-05 Santa Maria,,,5172
4266,Santa Maria,5/5/2023,hoop,,34.86436560800007,-120.38796287999996,1,2023-05-05 Santa Maria,,,5173
4267,Santa Maria,5/5/2023,hoop,,34.86448203000003,-120.38635459999993,1,2023-05-05 Santa Maria,,,5174
4268,Santa Maria,5/5/2023,hoop,,34.863381865000065,-120.38590779499998,1,2023-05-05 Santa Maria,,,5175
4269,Santa Maria,5/5/2023,hoop,,34.86472045600004,-120.37959099799995,1,2023-05-05 Santa Maria,,,5176
4270,Santa Maria,5/5/2023,hoop,,34.86469014100004,-120.37890702399994,1,2023-05-05 Santa Maria,,,5177
4271,Santa Maria,5/5/2023,hoop,,34.86453394800003,-120.37791953799996,1,2023-05-05 Santa Maria,,,5178
4272,Santa Maria,5/5/2023,hoop,,34.86464636100004,-120.37701536999998,1,2023-05-05 Santa Maria,,,5179
4273,Santa Maria,5/5/2023,hoop,,34.86377041600008,-120.37687744099996,1,2023-05-05 Santa Maria,,,5180
4274,Santa Maria,5/5/2023,hoop,,34.86349415900003,-120.37655783999996,1,2023-05-05 Santa Maria,,,5181
4275,Santa Maria,5/5/2023,hoop,,34.863147850000075,-120.37695142599993,1,2023-05-05 Santa Maria,,,5182
4276,Santa Maria,5/5/2023,hoop,,34.862767029000054,-120.376577667,1,2023-05-05 Santa Maria,,,5183
4277,Santa Maria,5/5/2023,hoop,,34.87438001100003,-120.35581791599996,1,2023-05-05 Santa Maria,,,5184
4278,Santa Maria,5/5/2023,hoop,,34.873647646000045,-120.35585682799996,1,2023-05-05 Santa Maria,,,5185
4279,Santa Maria,5/5/2023,hoop,,34.874026800000024,-120.35521007999994,1,2023-05-05 Santa Maria,,,5186
4280,Santa Maria,5/5/2023,hoop,,34.87438979700005,-120.35443821599993,1,2023-05-05 Santa Maria,,,5187
4281,Santa Maria,5/5/2023,hoop,,34.873755645000074,-120.35399631699994,1,2023-05-05 Santa Maria,,,5188
4282,Santa Maria,5/5/2023,hoop,,34.874422491000075,-120.35321726599994,1,2023-05-05 Santa Maria,,,5189
4283,Santa Maria,5/5/2023,hoop,,34.87547800800007,-120.35574767399999,1,2023-05-05 Santa Maria,,,5190
4284,Santa Maria,5/5/2023,hoop,,34.87557459800007,-120.35456360499995,1,2023-05-05 Santa Maria,,,5191
4285,Santa Maria,5/5/2023,hoop,,34.875277209000046,-120.35393211899996,1,2023-05-05 Santa Maria,,,5192
4286,Santa Maria,5/5/2023,hoop,,34.875486618000025,-120.35305834599995,1,2023-05-05 Santa Maria,,,5193
4287,Santa Maria,5/5/2023,hoop,,34.87518343800008,-120.35216432799996,1,2023-05-05 Santa Maria,,,5194
4288,Santa Maria,5/5/2023,hoop,,34.87546192900004,-120.35025416599996,1,2023-05-05 Santa Maria,,,5195
4289,Santa Maria,5/5/2023,hoop,,34.87530970000006,-120.34855517999993,1,2023-05-05 Santa Maria,,,5196
4290,Santa Maria,5/5/2023,mulch,,34.883788337000055,-120.365754848,1,2023-05-05 Santa Maria,,,5197
4291,Santa Maria,5/5/2023,mulch,,34.886667396000064,-120.36806347899994,1,2023-05-05 Santa Maria,,,5198
4292,Santa Maria,5/5/2023,mulch,,34.88581457200007,-120.367848628,1,2023-05-05 Santa Maria,,,5199
4293,Santa Maria,5/5/2023,mulch,,34.884402309000045,-120.36941617899998,1,2023-05-05 Santa Maria,,,5200
4294,Santa Maria,5/5/2023,mulch,,34.88474542000006,-120.36878027599992,1,2023-05-05 Santa Maria,,,5201
4295,Santa Maria,5/5/2023,mulch,,34.88436279900003,-120.36795628599998,1,2023-05-05 Santa Maria,,,5202
4296,Santa Maria,5/5/2023,mulch,,34.88675555900005,-120.36705482299998,1,2023-05-05 Santa Maria,,,5203
4297,Santa Maria,5/5/2023,mulch,,34.886025647000054,-120.36719628199997,1,2023-05-05 Santa Maria,,,5204
4298,Santa Maria,5/5/2023,mulch,,34.88528647000004,-120.36640951699997,1,2023-05-05 Santa Maria,,,5205
4299,Santa Maria,5/5/2023,mulch,,34.885085712000034,-120.36574190199995,1,2023-05-05 Santa Maria,,,5206
4300,Santa Maria,5/5/2023,mulch,,34.88453293200007,-120.36673338399999,1,2023-05-05 Santa Maria,,,5207
4301,Santa Maria,5/5/2023,mulch,,34.88442977400007,-120.36590251799998,1,2023-05-05 Santa Maria,,,5208
4302,Santa Maria,5/5/2023,mulch,,34.886412558000075,-120.36604955499996,1,2023-05-05 Santa Maria,,,5209
4303,Santa Maria,5/5/2023,mulch,,34.88379084700006,-120.36661324999994,1,2023-05-05 Santa Maria,,,5210
4304,Santa Maria,5/5/2023,mulch,,34.88331609900007,-120.36646121899996,1,2023-05-05 Santa Maria,,,5211
4305,Santa Maria,5/5/2023,mulch,,34.88293707400004,-120.36564155399996,1,2023-05-05 Santa Maria,,,5212
4306,Santa Maria,5/5/2023,mulch,,34.88284724300007,-120.36637326899996,1,2023-05-05 Santa Maria,,,5213
4307,Santa Maria,5/5/2023,mulch,,34.88241258800008,-120.36658998799999,1,2023-05-05 Santa Maria,,,5214
4308,Santa Maria,5/5/2023,mulch,,34.88228165800007,-120.36584524199996,1,2023-05-05 Santa Maria,,,5215
4309,Santa Maria,5/5/2023,mulch,,34.89155800100008,-120.37639935699995,1,2023-05-05 Santa Maria,,,5216
4310,Santa Maria,5/5/2023,mulch,,34.89130342400006,-120.37568435499996,1,2023-05-05 Santa Maria,,,5217
4311,Santa Maria,5/5/2023,mulch,,34.89153287000005,-120.37476722399998,1,2023-05-05 Santa Maria,,,5218
4312,Santa Maria,5/5/2023,mulch,,34.89024209100006,-120.37607715799999,1,2023-05-05 Santa Maria,,,5219
4313,Santa Maria,5/5/2023,mulch,,34.89069867300003,-120.37570798399996,1,2023-05-05 Santa Maria,,,5220
4314,Santa Maria,5/5/2023,mulch,,34.89048746000003,-120.37478256999997,1,2023-05-05 Santa Maria,,,5221
4315,Santa Maria,5/5/2023,mulch,,34.891584360000024,-120.373851377,1,2023-05-05 Santa Maria,,,5222
4316,Santa Maria,5/5/2023,mulch,,34.89123370800007,-120.37330729799999,1,2023-05-05 Santa Maria,,,5223
4317,Santa Maria,5/5/2023,mulch,,34.89058375400003,-120.37382865199999,1,2023-05-05 Santa Maria,,,5224
4318,Santa Maria,5/5/2023,mulch,,34.89026850400006,-120.37323845299994,1,2023-05-05 Santa Maria,,,5225
4319,Santa Maria,5/5/2023,mulch,,34.89162319900004,-120.37281743399996,1,2023-05-05 Santa Maria,,,5226
4320,Santa Maria,5/5/2023,mulch,,34.89068596800007,-120.37265617999996,1,2023-05-05 Santa Maria,,,5227
4321,Santa Maria,5/5/2023,mulch,,34.89132902900008,-120.37225779399996,1,2023-05-05 Santa Maria,,,5228
4322,Santa Maria,5/5/2023,mulch,,34.890438921000055,-120.37214307999994,1,2023-05-05 Santa Maria,,,5229
4323,Santa Maria,5/5/2023,mulch,,34.89149277700005,-120.37012111799999,1,2023-05-05 Santa Maria,,,5230
4324,Santa Maria,5/5/2023,mulch,,34.890972353000045,-120.36999158099997,1,2023-05-05 Santa Maria,,,5231
4325,Santa Maria,5/5/2023,mulch,,34.891542396000034,-120.36902773499996,1,2023-05-05 Santa Maria,,,5232
4326,Santa Maria,5/5/2023,mulch,,34.891083424000044,-120.36918323199995,1,2023-05-05 Santa Maria,,,5233
4327,Santa Maria,5/5/2023,mulch,,34.89151157600003,-120.36799703499996,1,2023-05-05 Santa Maria,,,5234
4328,Santa Maria,5/5/2023,mulch,,34.89096757000004,-120.36806382399998,1,2023-05-05 Santa Maria,,,5235
4329,Santa Maria,5/5/2023,mulch,,34.89040246500008,-120.37002441199996,1,2023-05-05 Santa Maria,,,5236
4330,Santa Maria,5/5/2023,mulch,,34.89013732700005,-120.36922896899993,1,2023-05-05 Santa Maria,,,5237
4331,Santa Maria,5/5/2023,mulch,,34.89015611700006,-120.36836143,1,2023-05-05 Santa Maria,,,5238
4332,Santa Maria,5/5/2023,mulch,,34.89034458800006,-120.36734662099995,1,2023-05-05 Santa Maria,,,5239
4333,Santa Maria,5/5/2023,mulch,,34.89145929600005,-120.36619209999996,1,2023-05-05 Santa Maria,,,5240
4334,Santa Maria,5/5/2023,mulch,,34.89027827000007,-120.36634039699997,1,2023-05-05 Santa Maria,,,5241
4335,Santa Maria,5/5/2023,mulch,,34.889370487000065,-120.36757401999996,1,2023-05-05 Santa Maria,,,5242
4336,Santa Maria,5/5/2023,mulch,,34.889387396000075,-120.36632775399994,1,2023-05-05 Santa Maria,,,5243
4337,Santa Maria,5/5/2023,mulch,,34.888717617000054,-120.36746733899996,1,2023-05-05 Santa Maria,,,5244
4338,Santa Maria,5/5/2023,mulch,,34.888740443000074,-120.36631870599996,1,2023-05-05 Santa Maria,,,5245
4339,Santa Maria,5/5/2023,mulch,,34.888201880000054,-120.36718527099998,1,2023-05-05 Santa Maria,,,5246
4340,Santa Maria,5/5/2023,mulch,,34.88814783400005,-120.36609133699994,1,2023-05-05 Santa Maria,,,5247
4341,Santa Maria,5/5/2023,mulch,,34.89598820400005,-120.37863623899995,1,2023-05-05 Santa Maria,,,5248
4342,Santa Maria,5/5/2023,mulch,,34.89592634700006,-120.37804276599996,1,2023-05-05 Santa Maria,5251.0,23.38984691869242,5249
4343,Santa Maria,5/5/2023,mulch,,34.89548560700007,-120.37864950399997,1,2023-05-05 Santa Maria,,,5250
4345,Santa Maria,5/5/2023,mulch,,34.89550892800003,-120.37765395799993,1,2023-05-05 Santa Maria,,,5252
4346,Santa Maria,5/5/2023,mulch,,34.89583588900007,-120.37632640099996,1,2023-05-05 Santa Maria,,,5253
4347,Santa Maria,5/5/2023,mulch,,34.89549632500007,-120.37617036399996,1,2023-05-05 Santa Maria,,,5254
4348,Santa Maria,5/5/2023,hoop,,34.900020932000075,-120.37250639699992,1,2023-05-05 Santa Maria,,,5255
4349,Santa Maria,5/5/2023,mulch,,34.901147320000064,-120.37253220399998,1,2023-05-05 Santa Maria,,,5256
4350,Santa Maria,5/5/2023,other,,34.91845090000004,-120.41913702399997,1,2023-05-05 Santa Maria,,,5257
4351,Santa Maria,5/5/2023,other,,34.91809910300003,-120.41899372199998,1,2023-05-05 Santa Maria,,,5258
4352,Santa Maria,5/5/2023,other,,34.91964365700005,-120.41921667799994,1,2023-05-05 Santa Maria,,,5259
4353,Santa Maria,5/5/2023,other,,34.920277017000046,-120.41899612499996,1,2023-05-05 Santa Maria,,,5260
4354,Santa Maria,5/5/2023,other,,34.920760417000054,-120.41912276499994,1,2023-05-05 Santa Maria,,,5261
4355,Santa Maria,5/5/2023,other,,34.921708341000055,-120.41912071999997,1,2023-05-05 Santa Maria,,,5262
4356,Santa Maria,5/5/2023,other,,34.91778479200008,-120.42010153099994,1,2023-05-05 Santa Maria,,,5263
4357,Santa Maria,5/5/2023,other,,34.91714772200004,-120.41994165099997,1,2023-05-05 Santa Maria,,,5264
4358,Santa Maria,5/5/2023,other,,34.916986466000026,-120.418911391,1,2023-05-05 Santa Maria,,,5265
4359,Santa Maria,5/5/2023,other,,34.924460847000034,-120.42088055999994,1,2023-05-05 Santa Maria,,,5266
4360,Santa Maria,5/5/2023,other,,34.92658916000005,-120.41902663599996,1,2023-05-05 Santa Maria,,,5267
4361,Santa Maria,5/5/2023,other,,34.92012076700007,-120.42271778999996,1,2023-05-05 Santa Maria,,,5268
4362,Santa Maria,5/5/2023,other,,34.92524485900003,-120.42280442099997,1,2023-05-05 Santa Maria,,,5269
4363,Santa Maria,5/5/2023,other,,34.92958604200004,-120.42011588199993,1,2023-05-05 Santa Maria,,,5270
4364,Santa Maria,5/5/2023,other,,34.92495626700003,-120.42451829199996,1,2023-05-05 Santa Maria,,,5271
4365,Santa Maria,5/5/2023,other,,34.93515727800008,-120.42324045499998,1,2023-05-05 Santa Maria,,,5272
4366,Santa Maria,5/5/2023,other,,34.935259091000034,-120.42138186699998,1,2023-05-05 Santa Maria,,,5273
4367,Santa Maria,5/5/2023,other,,34.93654296100004,-120.42293555599996,1,2023-05-05 Santa Maria,5275.0,28.596263694204588,5274
4369,Santa Maria,5/5/2023,other,,34.93723345500007,-120.42237804599993,1,2023-05-05 Santa Maria,,,5276
4370,Santa Maria,5/5/2023,other,,34.937696198000026,-120.42241284899995,1,2023-05-05 Santa Maria,,,5277
4371,Santa Maria,5/5/2023,other,,34.93652881200006,-120.42030704899996,1,2023-05-05 Santa Maria,,,5278
4372,Santa Maria,5/5/2023,other,,34.93721580100004,-120.42293263699996,1,2023-05-05 Santa Maria,,,5279
4373,Santa Maria,5/5/2023,other,,34.936525810000035,-120.42155021899998,1,2023-05-05 Santa Maria,,,5280
4374,Santa Maria,5/5/2023,other,,34.93700694100005,-120.42168321899997,1,2023-05-05 Santa Maria,,,5281
4375,Santa Maria,5/5/2023,other,,34.93484354100008,-120.42432196799996,1,2023-05-05 Santa Maria,,,5282
4376,Santa Maria,5/5/2023,other,,34.94343758400004,-120.40808527699994,1,2023-05-05 Santa Maria,,,5283
4377,Santa Maria,5/5/2023,other,,34.94142084400005,-120.40768059599996,1,2023-05-05 Santa Maria,,,5284
4378,Santa Maria,5/5/2023,other,,34.959970852000026,-120.39943431299996,1,2023-05-05 Santa Maria,,,5285
4379,Santa Maria,5/5/2023,other,,34.89497603700005,-120.497161845,1,2023-05-05 Santa Maria,,,5286
4380,Santa Maria,5/5/2023,other,,34.89455778100006,-120.49654158199996,1,2023-05-05 Santa Maria,,,5287
4381,Santa Maria,5/5/2023,other,,34.894151141000066,-120.49709481199994,1,2023-05-05 Santa Maria,,,5288
4382,Santa Maria,5/5/2023,other,,34.89418153100007,-120.49590259699994,1,2023-05-05 Santa Maria,,,5289
4383,Santa Maria,5/5/2023,other,,34.89312306100004,-120.497070485,1,2023-05-05 Santa Maria,,,5290
4384,Santa Maria,5/5/2023,other,,34.89375482100007,-120.49645612399996,1,2023-05-05 Santa Maria,,,5291
4385,Santa Maria,5/5/2023,other,,34.892840798000066,-120.49515425199996,1,2023-05-05 Santa Maria,,,5292
4386,Santa Maria,5/5/2023,other,,34.89312043100006,-120.49591635699994,1,2023-05-05 Santa Maria,,,5293
4387,Santa Maria,5/5/2023,other,,34.892509637000046,-120.49704011499993,1,2023-05-05 Santa Maria,,,5294
4388,Santa Maria,5/5/2023,other,,34.89385611500006,-120.49813580799996,1,2023-05-05 Santa Maria,,,5295
4389,Santa Maria,5/5/2023,other,,34.89373439700006,-120.49903303099995,1,2023-05-05 Santa Maria,,,5296
4390,Santa Maria,5/5/2023,other,,34.89300369100005,-120.49808656099998,1,2023-05-05 Santa Maria,,,5297
4391,Santa Maria,5/5/2023,other,,34.89308043300008,-120.49868330399994,1,2023-05-05 Santa Maria,,,5298
4392,Santa Maria,5/5/2023,other,,34.894634464000035,-120.498353942,1,2023-05-05 Santa Maria,,,5299
4393,Santa Maria,5/5/2023,other,,34.894538580000074,-120.49868600699995,1,2023-05-05 Santa Maria,,,5300
4394,Santa Maria,5/5/2023,other,,34.89364434100003,-120.502997059,1,2023-05-05 Santa Maria,,,5301
4395,Santa Maria,5/5/2023,other,,34.893667020000066,-120.50231564199999,1,2023-05-05 Santa Maria,,,5302
4396,Santa Maria,5/5/2023,other,,34.893407429000035,-120.50345123999993,1,2023-05-05 Santa Maria,,,5303
4397,Santa Maria,5/5/2023,other,,34.89349724600004,-120.50381184599996,1,2023-05-05 Santa Maria,,,5304
4398,Santa Maria,5/5/2023,other,,34.89255549800004,-120.50341789099996,1,2023-05-05 Santa Maria,,,5305
4399,Santa Maria,5/5/2023,other,,34.89367928900003,-120.50868537499996,1,2023-05-05 Santa Maria,,,5306
4400,Santa Maria,5/5/2023,other,,34.89358292500003,-120.50774271799996,1,2023-05-05 Santa Maria,,,5307
4402,Santa Maria,5/5/2023,other,,34.89309916900004,-120.50860309599994,1,2023-05-05 Santa Maria,,,5309
4403,Santa Maria,5/5/2023,other,,34.893639679000046,-120.509187683,1,2023-05-05 Santa Maria,,,5310
4404,Santa Maria,5/5/2023,other,,34.888992065000025,-120.50771504199996,1,2023-05-05 Santa Maria,,,5311
4405,Santa Maria,5/5/2023,other,,34.890272203000045,-120.52041184999996,1,2023-05-05 Santa Maria,,,5312
4406,Santa Maria,5/5/2023,other,,34.889700892000064,-120.51918603599997,1,2023-05-05 Santa Maria,,,5313
4407,Santa Maria,5/5/2023,other,,34.890713822000066,-120.519836721,1,2023-05-05 Santa Maria,,,5314
4408,Santa Maria,5/5/2023,other,,34.89073953000008,-120.51837945299997,1,2023-05-05 Santa Maria,,,5315
4409,Santa Maria,5/5/2023,other,,34.89217304500005,-120.51880949799992,1,2023-05-05 Santa Maria,,,5316
4410,Santa Maria,5/5/2023,hoop,,34.90000433800003,-120.37060033599992,1,2023-05-05 Santa Maria,,,5317
4411,Santa Maria,5/5/2023,hoop,,34.89853435200007,-120.370601777,1,2023-05-05 Santa Maria,,,5318
4412,Santa Maria,5/5/2023,hoop,,34.89886977500004,-120.37253306699994,1,2023-05-05 Santa Maria,,,5319
4413,Santa Maria,5/5/2023,mulch,,34.90139836800006,-120.37346373399998,1,2023-05-05 Santa Maria,5323.0,29.87941978674351,5320
4414,Santa Maria,5/5/2023,mulch,,34.90140327300003,-120.37300133499996,1,2023-05-05 Santa Maria,5323.0,28.266504785146704,5321
4415,Santa Maria,5/5/2023,mulch,,34.90125155000004,-120.37176895099996,1,2023-05-05 Santa Maria,,,5322
4417,Santa Maria,5/5/2023,mulch,,34.900905634000026,-120.37352293799997,1,2023-05-05 Santa Maria,,,5324
4418,Santa Maria,5/5/2023,other,,34.90208228500006,-120.371180886,1,2023-05-05 Santa Maria,,,5325
4419,Santa Maria,5/5/2023,mulch,,34.880462825000045,-120.38895802699994,1,2023-05-05 Santa Maria,,,5326
4420,Santa Maria,5/5/2023,mulch,,34.88007317000006,-120.39027663299998,1,2023-05-05 Santa Maria,,,5327
4421,Santa Maria,5/5/2023,mulch,,34.882073700000035,-120.390983985,1,2023-05-05 Santa Maria,,,5328
4422,Santa Maria,5/5/2023,mulch,,34.880987352000034,-120.39121026799997,1,2023-05-05 Santa Maria,,,5329
4423,Santa Maria,5/5/2023,mulch,,34.88129204200004,-120.39066076199998,1,2023-05-05 Santa Maria,,,5330
4424,Santa Maria,5/5/2023,mulch,,34.88072892400004,-120.39033733599996,1,2023-05-05 Santa Maria,,,5331
4425,Santa Maria,5/5/2023,mulch,,34.88173510200005,-120.38972222199997,1,2023-05-05 Santa Maria,,,5332
4426,Santa Maria,5/5/2023,mulch,,34.88104334700006,-120.38954137499996,1,2023-05-05 Santa Maria,,,5333
4427,Santa Maria,5/5/2023,mulch,,34.88011883000007,-120.38965079599996,1,2023-05-05 Santa Maria,,,5334
4428,Santa Maria,5/5/2023,mulch,,34.88134172100007,-120.388538096,1,2023-05-05 Santa Maria,,,5335
4429,Santa Maria,5/5/2023,mulch,,34.880109110000035,-120.38847252199996,1,2023-05-05 Santa Maria,,,5336
4430,Santa Maria,5/5/2023,mulch,,34.881139983000025,-120.38786340099993,1,2023-05-05 Santa Maria,,,5337
4431,Santa Maria,5/5/2023,mulch,,34.88047696000007,-120.387825035,1,2023-05-05 Santa Maria,,,5338
4432,Santa Maria,5/5/2023,mulch,,34.88007281000006,-120.38768868899996,1,2023-05-05 Santa Maria,,,5339
4433,Santa Maria,5/5/2023,mulch,,34.88011615900007,-120.386565024,1,2023-05-05 Santa Maria,,,5340
4434,Santa Maria,5/5/2023,mulch,,34.88077926300008,-120.38726883599996,1,2023-05-05 Santa Maria,,,5341
4435,Santa Maria,5/5/2023,mulch,,34.88392648800004,-120.395031841,1,2023-05-05 Santa Maria,,,5342
4436,Santa Maria,5/5/2023,mulch,,34.88276497800007,-120.394885381,1,2023-05-05 Santa Maria,,,5343
4437,Santa Maria,5/5/2023,mulch,,34.88311151600004,-120.39431870799996,1,2023-05-05 Santa Maria,,,5344
4438,Santa Maria,5/5/2023,mulch,,34.88369595900008,-120.39391175999998,1,2023-05-05 Santa Maria,,,5345
4439,Santa Maria,5/5/2023,mulch,,34.88279088100006,-120.39388712299996,1,2023-05-05 Santa Maria,,,5346
4440,Santa Maria,5/5/2023,mulch,,34.883122694000065,-120.39329278599996,1,2023-05-05 Santa Maria,,,5347
4441,Santa Maria,5/5/2023,mulch,,34.88283694400008,-120.39279545999995,1,2023-05-05 Santa Maria,,,5348
4442,Santa Maria,5/5/2023,mulch,,34.88198512200006,-120.39493308199997,1,2023-05-05 Santa Maria,,,5349
4443,Santa Maria,5/5/2023,mulch,,34.882278394000025,-120.39441112799994,1,2023-05-05 Santa Maria,,,5350
4444,Santa Maria,5/5/2023,mulch,,34.88190542800004,-120.39416136799996,1,2023-05-05 Santa Maria,,,5351
4445,Santa Maria,5/5/2023,mulch,,34.88212429200007,-120.39325587599996,1,2023-05-05 Santa Maria,,,5352
4446,Santa Maria,5/5/2023,mulch,,34.881816068000035,-120.39209617299996,1,2023-05-05 Santa Maria,,,5353
4447,Santa Maria,5/5/2023,mulch,,34.88109310800007,-120.39494804699996,1,2023-05-05 Santa Maria,,,5354
4448,Santa Maria,5/5/2023,mulch,,34.88144447700006,-120.39438411499998,1,2023-05-05 Santa Maria,,,5355
4449,Santa Maria,5/5/2023,mulch,,34.88120422700007,-120.39360334099996,1,2023-05-05 Santa Maria,,,5356
4450,Santa Maria,5/5/2023,mulch,,34.88146406900006,-120.39281708899993,1,2023-05-05 Santa Maria,,,5357
4451,Santa Maria,5/5/2023,mulch,,34.88119177600004,-120.39237374899994,1,2023-05-05 Santa Maria,,,5358
4452,Santa Maria,5/5/2023,mulch,,34.88063443600004,-120.39491237799996,1,2023-05-05 Santa Maria,,,5359
4453,Santa Maria,5/5/2023,mulch,,34.88014697500006,-120.39454793899993,1,2023-05-05 Santa Maria,,,5360
4454,Santa Maria,5/5/2023,mulch,,34.880461635000074,-120.39399469699998,1,2023-05-05 Santa Maria,,,5361
4455,Santa Maria,5/5/2023,mulch,,34.88031058800004,-120.39353129499995,1,2023-05-05 Santa Maria,,,5362
4456,Santa Maria,5/5/2023,mulch,,34.88064170300004,-120.392904924,1,2023-05-05 Santa Maria,,,5363
4457,Santa Maria,5/5/2023,mulch,,34.884529118000046,-120.40028204499998,1,2023-05-05 Santa Maria,,,5364
4458,Santa Maria,5/5/2023,mulch,,34.885777619000066,-120.39863227299996,1,2023-05-05 Santa Maria,,,5365
4459,Santa Maria,5/5/2023,mulch,,34.88581276700006,-120.39997729599996,1,2023-05-05 Santa Maria,,,5366
4460,Santa Maria,5/5/2023,mulch,,34.88446309300008,-120.39904590599996,1,2023-05-05 Santa Maria,,,5367
4461,Santa Maria,5/5/2023,other,,34.89014369800003,-120.51968957999996,1,2023-05-05 Santa Maria,,,5368
4462,Santa Maria,5/5/2023,other,,34.890581643000075,-120.519068114,1,2023-05-05 Santa Maria,,,5369
4463,Santa Maria,5/5/2023,other,,34.89218820100007,-120.51746828399996,1,2023-05-05 Santa Maria,,,5370
4465,Santa Maria,5/5/2023,other,,34.89169128500004,-120.51783998099997,1,2023-05-05 Santa Maria,,,5372
4466,Santa Maria,5/5/2023,other,,34.890786441000046,-120.52025374199997,1,2023-05-05 Santa Maria,,,5373
4467,Santa Maria,5/5/2023,other,,34.88518398900004,-120.486072289,1,2023-05-05 Santa Maria,,,5374
4468,Santa Maria,5/5/2023,other,,34.883564603000025,-120.48611403599995,1,2023-05-05 Santa Maria,,,5375
4469,Santa Maria,5/5/2023,other,,34.882634309000025,-120.48441252599996,1,2023-05-05 Santa Maria,,,5376
4470,Santa Maria,5/5/2023,other,,34.882433363000075,-120.483378529,1,2023-05-05 Santa Maria,,,5377
4471,Santa Maria,5/5/2023,other,,34.88412557000004,-120.471282369,1,2023-05-05 Santa Maria,,,5378
4472,Santa Maria,5/5/2023,other,,34.883203723000065,-120.47128897599998,1,2023-05-05 Santa Maria,,,5379
4473,Santa Maria,5/5/2023,other,,34.88242468100003,-120.471252532,1,2023-05-05 Santa Maria,,,5380
4474,Santa Maria,5/5/2023,other,,34.88143732500004,-120.47129742299995,1,2023-05-05 Santa Maria,,,5381
4475,Santa Maria,5/5/2023,other,,34.88377929600006,-120.470162389,1,2023-05-05 Santa Maria,,,5382
4476,Santa Maria,5/5/2023,other,,34.88258141900008,-120.46979244,1,2023-05-05 Santa Maria,,,5383
4477,Santa Maria,5/5/2023,other,,34.88141775500003,-120.46996947899999,1,2023-05-05 Santa Maria,,,5384
4478,Santa Maria,5/5/2023,other,,34.87962320200006,-120.47096033799994,1,2023-05-05 Santa Maria,,,5385
4479,Santa Maria,5/5/2023,other,,34.879722307000065,-120.46976496599996,1,2023-05-05 Santa Maria,,,5386
4480,Santa Maria,5/5/2023,other,,34.87939902900007,-120.46795782699996,1,2023-05-05 Santa Maria,,,5387
4481,Santa Maria,5/5/2023,other,,34.878083942000046,-120.46920548899998,1,2023-05-05 Santa Maria,,,5388
4482,Santa Maria,5/5/2023,other,,34.878570109000066,-120.46777094999997,1,2023-05-05 Santa Maria,,,5389
4483,Santa Maria,5/5/2023,other,,34.87722340600004,-120.467646318,1,2023-05-05 Santa Maria,,,5390
4484,Santa Maria,5/5/2023,other,,34.878977977000034,-120.47017683699994,1,2023-05-05 Santa Maria,,,5391
4485,Santa Maria,5/5/2023,other,,34.879076000000055,-120.46652553699992,1,2023-05-05 Santa Maria,,,5392
4486,Santa Maria,5/5/2023,other,,34.87735794300005,-120.46625695399996,1,2023-05-05 Santa Maria,,,5393
4487,Santa Maria,5/5/2023,other,,34.896023427000046,-120.47360721599993,1,2023-05-05 Santa Maria,,,5394
4488,Santa Maria,5/5/2023,other,,34.89546521200003,-120.472848194,1,2023-05-05 Santa Maria,,,5395
4489,Santa Maria,5/5/2023,other,,34.89697323900003,-120.46922112799996,1,2023-05-05 Santa Maria,,,5396
4490,Santa Maria,5/5/2023,other,,34.89492720900006,-120.47193155199994,1,2023-05-05 Santa Maria,,,5397
4491,Santa Maria,5/5/2023,other,,34.89425701400006,-120.47090635999996,1,2023-05-05 Santa Maria,,,5398
4492,Santa Maria,5/5/2023,other,,34.894785641000055,-120.47358655,1,2023-05-05 Santa Maria,,,5399
4493,Santa Maria,5/5/2023,other,,34.89405381700004,-120.47214204299996,1,2023-05-05 Santa Maria,,,5400
4494,Santa Maria,5/5/2023,other,,34.89398836000004,-120.46743198399996,1,2023-05-05 Santa Maria,,,5401
4495,Santa Maria,5/5/2023,other,,34.89472257700004,-120.46672470399994,1,2023-05-05 Santa Maria,,,5402
4496,Santa Maria,5/5/2023,other,,34.89679315500007,-120.46489532699997,1,2023-05-05 Santa Maria,,,5403
4497,Santa Maria,5/5/2023,other,,34.895887155000025,-120.46578022799996,1,2023-05-05 Santa Maria,,,5404
4498,Santa Maria,5/5/2023,other,,34.89614043000006,-120.46937062099992,1,2023-05-05 Santa Maria,,,5405
4499,Santa Maria,5/5/2023,other,,34.89690772500006,-120.47075384599998,1,2023-05-05 Santa Maria,,,5406
4500,Santa Maria,5/5/2023,other,,34.897520299000064,-120.47234581499998,1,2023-05-05 Santa Maria,,,5407
4501,Santa Maria,5/5/2023,other,,34.89813219500007,-120.47066498599996,1,2023-05-05 Santa Maria,,,5408
4502,Santa Maria,5/5/2023,other,,34.90812876600006,-120.46417056799999,1,2023-05-05 Santa Maria,,,5409
4503,Santa Maria,5/5/2023,other,,34.91184696300007,-120.46277434299996,1,2023-05-05 Santa Maria,,,5410
4504,Santa Maria,5/5/2023,other,,34.911006934000056,-120.46244019399995,1,2023-05-05 Santa Maria,,,5411
4505,Santa Maria,5/5/2023,other,,34.90466694500003,-120.45613801099996,1,2023-05-05 Santa Maria,,,5412
4506,Santa Maria,5/5/2023,other,,34.90464998600004,-120.45560354199993,1,2023-05-05 Santa Maria,,,5413
4507,Santa Maria,5/5/2023,other,,34.90403506000007,-120.45536228199995,1,2023-05-05 Santa Maria,,,5414
4508,Santa Maria,5/5/2023,other,,34.90374954600003,-120.454851266,1,2023-05-05 Santa Maria,,,5415
4509,Santa Maria,5/5/2023,other,,34.908902255000044,-120.45274339599996,1,2023-05-05 Santa Maria,,,5416
4510,Santa Maria,5/5/2023,other,,34.90770870000006,-120.45269154599998,1,2023-05-05 Santa Maria,,,5417
4511,Santa Maria,5/5/2023,other,,34.908214663000024,-120.45196287899996,1,2023-05-05 Santa Maria,,,5418
4512,Santa Maria,5/5/2023,other,,34.902101911000045,-120.45709640099994,1,2023-05-05 Santa Maria,,,5419
4513,Santa Maria,5/5/2023,other,,34.899062049000065,-120.44922409699996,1,2023-05-05 Santa Maria,,,5420
4514,Santa Maria,5/5/2023,other,,34.898828692000045,-120.44856774799996,1,2023-05-05 Santa Maria,,,5421
4515,Santa Maria,5/5/2023,other,,34.89754427200006,-120.447299677,1,2023-05-05 Santa Maria,,,5422
4516,Santa Maria,5/5/2023,other,,34.90111948800006,-120.45021804799995,1,2023-05-05 Santa Maria,,,5423
4517,Santa Maria,5/5/2023,other,,34.896597757000045,-120.44609731099996,1,2023-05-05 Santa Maria,,,5424
4518,Santa Maria,5/5/2023,other,,34.894398473000024,-120.44331257099996,1,2023-05-05 Santa Maria,,,5425
4519,Santa Maria,5/5/2023,other,,34.92179094200003,-120.45680367899996,1,2023-05-05 Santa Maria,,,5426
4520,Santa Maria,5/5/2023,other,,34.92163354100006,-120.45642006699995,1,2023-05-05 Santa Maria,,,5427
4521,Santa Maria,5/5/2023,other,,34.921463553000024,-120.45672597899994,1,2023-05-05 Santa Maria,,,5428
4522,Santa Maria,5/5/2023,other,,34.921423737000055,-120.45591390099996,1,2023-05-05 Santa Maria,,,5429
4523,Santa Maria,5/5/2023,other,,34.921276087000024,-120.45636702899996,1,2023-05-05 Santa Maria,,,5430
4524,Santa Maria,5/5/2023,other,,34.92164200700006,-120.45521258099996,1,2023-05-05 Santa Maria,,,5431
4525,Santa Maria,5/5/2023,other,,34.92165251800003,-120.45458760899999,1,2023-05-05 Santa Maria,,,5432
4526,Santa Maria,5/5/2023,other,,34.921213642000055,-120.45537385499993,1,2023-05-05 Santa Maria,,,5433
4527,Santa Maria,5/5/2023,other,,34.92122016800005,-120.45446167499993,1,2023-05-05 Santa Maria,,,5434
4528,Santa Maria,5/5/2023,other,,34.92111523500006,-120.45684212499998,1,2023-05-05 Santa Maria,,,5435
4529,Santa Maria,5/5/2023,other,,34.92111878600008,-120.45599323799996,1,2023-05-05 Santa Maria,,,5436
4530,Santa Maria,5/5/2023,other,,34.920263602000034,-120.45592330699996,1,2023-05-05 Santa Maria,,,5437
4531,Santa Maria,5/5/2023,other,,34.91997783700003,-120.45587182399998,1,2023-05-05 Santa Maria,,,5438
4532,Santa Maria,5/5/2023,other,,34.920200309000045,-120.45541348299996,1,2023-05-05 Santa Maria,,,5439
4533,Santa Maria,5/5/2023,other,,34.92189621400007,-120.45816199499995,1,2023-05-05 Santa Maria,,,5440
4534,Santa Maria,5/5/2023,other,,34.921359436000046,-120.45310931999995,1,2023-05-05 Santa Maria,,,5441
4535,Santa Maria,5/5/2023,other,,34.920261339000035,-120.448824334,1,2023-05-05 Santa Maria,,,5442
4536,Santa Maria,5/5/2023,other,,34.918947252000066,-120.45168228899996,1,2023-05-05 Santa Maria,5446.0,23.43485982249537,5443
4537,Santa Maria,5/5/2023,other,,34.92002497500005,-120.45064040199996,1,2023-05-05 Santa Maria,5445.0,26.617561875159968,5444
4540,Santa Maria,5/5/2023,other,,34.918996151000044,-120.45249770499998,1,2023-05-05 Santa Maria,5448.0,22.806428948669023,5447
4542,Santa Maria,5/5/2023,other,,34.918572254000026,-120.452565473,1,2023-05-05 Santa Maria,5448.0,24.92217777766556,5449
4543,Santa Maria,3/10/2022,mulch,,34.945719405000034,-120.50666826699997,1,2022-03-10 Santa Maria,,,5450
4544,Santa Maria,3/10/2022,mulch,,34.94549381600007,-120.50637162599996,1,2022-03-10 Santa Maria,,,5451
4545,Santa Maria,3/10/2022,mulch,,34.94519907900008,-120.50653309299996,1,2022-03-10 Santa Maria,,,5452
4546,Santa Maria,3/10/2022,mulch,,34.945710993000034,-120.50577294799996,1,2022-03-10 Santa Maria,,,5453
4547,Santa Maria,3/10/2022,mulch,,34.94528257400003,-120.50588254899996,1,2022-03-10 Santa Maria,,,5454
4548,Santa Maria,3/10/2022,mulch,,34.94465538700007,-120.50531035799996,1,2022-03-10 Santa Maria,,,5455
4549,Santa Maria,3/10/2022,mulch,,34.94570655300004,-120.50522122599995,1,2022-03-10 Santa Maria,,,5456
4550,Santa Maria,3/10/2022,mulch,,34.94529898900004,-120.50527074099995,1,2022-03-10 Santa Maria,,,5457
4551,Santa Maria,3/10/2022,mulch,,34.94559569900008,-120.504803859,1,2022-03-10 Santa Maria,,,5458
4552,Santa Maria,3/10/2022,mulch,,34.945163888000025,-120.50469665999996,1,2022-03-10 Santa Maria,,,5459
4553,Santa Maria,3/10/2022,mulch,,34.945436906000054,-120.50400031699996,1,2022-03-10 Santa Maria,,,5460
4554,Santa Maria,3/10/2022,mulch,,34.94478970400007,-120.50664094299997,1,2022-03-10 Santa Maria,,,5461
4555,Santa Maria,3/10/2022,mulch,,34.94449399200005,-120.50621173899998,1,2022-03-10 Santa Maria,,,5462
4556,Santa Maria,3/10/2022,mulch,,34.94433513100006,-120.50567771799996,1,2022-03-10 Santa Maria,,,5463
4557,Santa Maria,3/10/2022,mulch,,34.94413310400006,-120.50470220299997,1,2022-03-10 Santa Maria,,,5464
4558,Santa Maria,3/10/2022,mulch,,34.94469854300007,-120.50451269899996,1,2022-03-10 Santa Maria,,,5465
4559,Santa Maria,3/10/2022,mulch,,34.944599062000066,-120.50367326999996,1,2022-03-10 Santa Maria,,,5466
4560,Santa Maria,3/10/2022,mulch,,34.94432111300006,-120.50415173799996,1,2022-03-10 Santa Maria,,,5467
4561,Santa Maria,3/10/2022,mulch,,34.94376944700008,-120.50667433199997,1,2022-03-10 Santa Maria,,,5468
4562,Santa Maria,3/10/2022,mulch,,34.943433639000034,-120.506144157,1,2022-03-10 Santa Maria,,,5469
4563,Santa Maria,3/10/2022,mulch,,34.94323866000008,-120.50517933599996,1,2022-03-10 Santa Maria,,,5470
4564,Santa Maria,3/10/2022,mulch,,34.943703449000054,-120.505139397,1,2022-03-10 Santa Maria,,,5471
4565,Santa Maria,3/10/2022,mulch,,34.94353717800004,-120.50379426099992,1,2022-03-10 Santa Maria,,,5472
4566,Santa Maria,3/10/2022,mulch,,34.943514278000066,-120.50444407499998,1,2022-03-10 Santa Maria,,,5473
4567,Santa Maria,3/10/2022,mulch,,34.942777629000034,-120.50664569199996,1,2022-03-10 Santa Maria,,,5474
4568,Santa Maria,3/10/2022,mulch,,34.94220000900003,-120.50582352899994,1,2022-03-10 Santa Maria,,,5475
4569,Santa Maria,3/10/2022,mulch,,34.942679766000026,-120.50568151999992,1,2022-03-10 Santa Maria,,,5476
4570,Santa Maria,3/10/2022,mulch,,34.94283109400004,-120.50339698599998,1,2022-03-10 Santa Maria,,,5477
4571,Santa Maria,3/10/2022,mulch,,34.942659810000066,-120.50454300099994,1,2022-03-10 Santa Maria,,,5478
4572,Santa Maria,3/10/2022,mulch,,34.942155480000054,-120.50364261399994,1,2022-03-10 Santa Maria,,,5479
4573,Santa Maria,3/10/2022,mulch,,34.980897261000045,-120.50361180299996,1,2022-03-10 Santa Maria,,,5480
4574,Santa Maria,3/10/2022,mulch,,34.98036558700005,-120.50364281499996,1,2022-03-10 Santa Maria,,,5481
4575,Santa Maria,3/10/2022,mulch,,34.979965142000026,-120.50248997399996,1,2022-03-10 Santa Maria,,,5482
4576,Santa Maria,3/10/2022,mulch,,34.97954030900007,-120.50326906299993,1,2022-03-10 Santa Maria,,,5483
4577,Santa Maria,3/10/2022,mulch,,34.97921353600003,-120.50283256199998,1,2022-03-10 Santa Maria,,,5484
4578,Santa Maria,3/10/2022,mulch,,34.97905221800005,-120.501361423,1,2022-03-10 Santa Maria,,,5485
4579,Santa Maria,3/10/2022,mulch,,34.97864996800007,-120.50325503599998,1,2022-03-10 Santa Maria,,,5486
4580,Santa Maria,3/10/2022,mulch,,34.97807554000008,-120.50019009199995,1,2022-03-10 Santa Maria,,,5487
4581,Santa Maria,3/10/2022,mulch,,34.97848416900007,-120.50178615599998,1,2022-03-10 Santa Maria,,,5488
4582,Santa Maria,3/10/2022,mulch,,34.97827102700006,-120.50271268899996,1,2022-03-10 Santa Maria,,,5489
4583,Santa Maria,3/10/2022,mulch,,34.97765679400004,-120.50300539799996,1,2022-03-10 Santa Maria,,,5490
4584,Santa Maria,3/10/2022,mulch,,34.97750347200002,-120.50204279099997,1,2022-03-10 Santa Maria,,,5491
4585,Santa Maria,3/10/2022,mulch,,34.97714798900006,-120.50303724199993,1,2022-03-10 Santa Maria,,,5492
4586,Santa Maria,3/10/2022,mulch,,34.97735732500007,-120.50056710999996,1,2022-03-10 Santa Maria,,,5493
4587,Santa Maria,3/10/2022,mulch,,34.977131917000065,-120.49869864299995,1,2022-03-10 Santa Maria,,,5494
4588,Santa Maria,3/10/2022,mulch,,34.97752895700006,-120.49940719399996,1,2022-03-10 Santa Maria,,,5495
4589,Santa Maria,3/10/2022,mulch,,34.97653127800004,-120.50214179099999,1,2022-03-10 Santa Maria,,,5496
4590,Santa Maria,3/10/2022,mulch,,34.97622695200005,-120.50137884599997,1,2022-03-10 Santa Maria,,,5497
4591,Santa Maria,3/10/2022,mulch,,34.97660992900006,-120.49826812099997,1,2022-03-10 Santa Maria,,,5498
4592,Santa Maria,3/10/2022,mulch,,34.976180296000045,-120.49755386599996,1,2022-03-10 Santa Maria,,,5499
4593,Santa Maria,3/10/2022,mulch,,34.97671931800005,-120.49945924599996,1,2022-03-10 Santa Maria,,,5500
4594,Santa Maria,3/10/2022,mulch,,34.97646149700006,-120.49996115299996,1,2022-03-10 Santa Maria,,,5501
4595,Santa Maria,3/10/2022,mulch,,34.975829934000046,-120.50268256799995,1,2022-03-10 Santa Maria,,,5502
4596,Santa Maria,3/10/2022,mulch,,34.97552719700008,-120.50125372399998,1,2022-03-10 Santa Maria,,,5503
4597,Santa Maria,3/10/2022,mulch,,34.97522052000005,-120.49632389599996,1,2022-03-10 Santa Maria,,,5504
4598,Santa Maria,3/10/2022,mulch,,34.975593530000026,-120.49931648499997,1,2022-03-10 Santa Maria,,,5505
4599,Santa Maria,3/10/2022,mulch,,34.97481722200007,-120.49969487199996,1,2022-03-10 Santa Maria,,,5506
4600,Santa Maria,3/10/2022,mulch,,34.97431037200005,-120.49800743099996,1,2022-03-10 Santa Maria,,,5507
4601,Santa Maria,3/10/2022,mulch,,34.974435837000044,-120.49540829799996,1,2022-03-10 Santa Maria,,,5508
4602,Santa Maria,3/10/2022,mulch,,34.97545203100003,-120.49751748299995,1,2022-03-10 Santa Maria,,,5509
4603,Santa Maria,3/10/2022,mulch,,34.97530807700008,-120.50270841899999,1,2022-03-10 Santa Maria,,,5510
4604,Santa Maria,3/10/2022,mulch,,34.97484236100007,-120.50262515399999,1,2022-03-10 Santa Maria,,,5511
4605,Santa Maria,3/10/2022,mulch,,34.974382167000044,-120.50256685599997,1,2022-03-10 Santa Maria,,,5512
4606,Santa Maria,3/10/2022,mulch,,34.97393683100006,-120.50249800899996,1,2022-03-10 Santa Maria,,,5513
4607,Santa Maria,3/10/2022,mulch,,34.97354412100003,-120.50241940999996,1,2022-03-10 Santa Maria,,,5514
4608,Santa Maria,3/10/2022,mulch,,34.97320310200007,-120.50230779299994,1,2022-03-10 Santa Maria,,,5515
4609,Santa Maria,3/10/2022,mulch,,34.972240887000055,-120.50206837599995,1,2022-03-10 Santa Maria,,,5516
4610,Santa Maria,3/10/2022,mulch,,34.97151378500007,-120.50212403599994,1,2022-03-10 Santa Maria,,,5517
4611,Santa Maria,3/10/2022,mulch,,34.97070194100007,-120.50174039799998,1,2022-03-10 Santa Maria,,,5518
4612,Santa Maria,3/10/2022,mulch,,34.96962903300005,-120.50162749599995,1,2022-03-10 Santa Maria,,,5519
4613,Santa Maria,3/10/2022,mulch,,34.98438095400007,-120.50680938,1,2022-03-10 Santa Maria,,,5520
4614,Santa Maria,3/10/2022,mulch,,34.99099785200008,-120.503126942,1,2022-03-10 Santa Maria,,,5521
4615,Santa Maria,3/10/2022,mulch,,34.990278190000026,-120.50318064599996,1,2022-03-10 Santa Maria,,,5522
4616,Santa Maria,3/10/2022,mulch,,34.99074707600005,-120.50223354499995,1,2022-03-10 Santa Maria,,,5523
4617,Santa Maria,3/10/2022,mulch,,34.99046181700004,-120.50127585899996,1,2022-03-10 Santa Maria,,,5524
4618,Santa Maria,3/10/2022,mulch,,34.98985456600008,-120.503259588,1,2022-03-10 Santa Maria,,,5525
4619,Santa Maria,3/10/2022,mulch,,34.98947448600006,-120.50269696499998,1,2022-03-10 Santa Maria,,,5526
4620,Santa Maria,3/10/2022,mulch,,34.98985763400003,-120.50165534899996,1,2022-03-10 Santa Maria,,,5527
4621,Santa Maria,3/10/2022,mulch,,34.98989608000005,-120.50083698499996,1,2022-03-10 Santa Maria,,,5528
4622,Santa Maria,3/10/2022,mulch,,34.989959930000055,-120.49964829199996,1,2022-03-10 Santa Maria,,,5529
4623,Santa Maria,3/10/2022,mulch,,34.990506554000035,-120.50064916499996,1,2022-03-10 Santa Maria,,,5530
4624,Santa Maria,3/10/2022,mulch,,34.990542531000074,-120.49971619799997,1,2022-03-10 Santa Maria,,,5531
4625,Santa Maria,3/10/2022,mulch,,34.990348795000045,-120.498611617,1,2022-03-10 Santa Maria,,,5532
4626,Santa Maria,3/10/2022,mulch,,34.99033482800007,-120.49766615699995,1,2022-03-10 Santa Maria,,,5533
4627,Santa Maria,3/10/2022,mulch,,34.99054188300005,-120.49571331599996,1,2022-03-10 Santa Maria,,,5534
4628,Santa Maria,3/10/2022,mulch,,34.99230374000007,-120.498466356,1,2022-03-10 Santa Maria,,,5535
4629,Santa Maria,3/10/2022,mulch,,34.99197663000007,-120.49744184499995,1,2022-03-10 Santa Maria,,,5536
4630,Santa Maria,3/10/2022,mulch,,34.99139298900008,-120.49815359799997,1,2022-03-10 Santa Maria,,,5537
4631,Santa Maria,3/10/2022,mulch,,34.99111491400004,-120.49684160799995,1,2022-03-10 Santa Maria,,,5538
4632,Santa Maria,3/10/2022,mulch,,34.998503250000056,-120.50439845699997,1,2022-03-10 Santa Maria,,,5539
4633,Santa Maria,3/10/2022,mulch,,34.998995156000035,-120.50439824499993,1,2022-03-10 Santa Maria,,,5540
4634,Santa Maria,3/10/2022,mulch,,34.98424868500007,-120.50539657599997,1,2022-03-10 Santa Maria,,,5541
4635,Santa Maria,3/10/2022,mulch,,34.98415344600005,-120.50285141599994,1,2022-03-10 Santa Maria,,,5542
4636,Santa Maria,3/10/2022,mulch,,34.98321301400006,-120.50541291399996,1,2022-03-10 Santa Maria,,,5543
4637,Santa Maria,3/10/2022,mulch,,34.98360047500006,-120.50349704799999,1,2022-03-10 Santa Maria,,,5544
4638,Santa Maria,3/10/2022,mulch,,34.98406603900003,-120.50209710499996,1,2022-03-10 Santa Maria,,,5545
4639,Santa Maria,3/10/2022,mulch,,34.98496631800003,-120.49994750499997,1,2022-03-10 Santa Maria,,,5546
4640,Santa Maria,3/10/2022,mulch,,34.98372168900005,-120.50134524799996,1,2022-03-10 Santa Maria,,,5547
4641,Santa Maria,3/10/2022,mulch,,34.98383330100006,-120.49982605699996,1,2022-03-10 Santa Maria,,,5548
4642,Santa Maria,3/10/2022,mulch,,34.984644348000074,-120.49735140799999,1,2022-03-10 Santa Maria,,,5549
4643,Santa Maria,3/10/2022,hoop,,34.99775910900007,-120.50737713799998,1,2022-03-10 Santa Maria,5552.0,29.088314167748734,5550
4644,Santa Maria,3/10/2022,hoop,,34.99720563100004,-120.507473227,1,2022-03-10 Santa Maria,,,5551
4646,Santa Maria,3/10/2022,hoop,,34.997253199000056,-120.50693614499994,1,2022-03-10 Santa Maria,,,5553
4647,Santa Maria,3/10/2022,hoop,,34.99778506400003,-120.50677351399996,1,2022-03-10 Santa Maria,,,5554
4648,Santa Maria,3/10/2022,hoop,,34.99751953600003,-120.50663522999996,1,2022-03-10 Santa Maria,,,5555
4649,Santa Maria,3/10/2022,hoop,,34.99727630700005,-120.50630463399995,1,2022-03-10 Santa Maria,,,5556
4650,Santa Maria,3/10/2022,hoop,,34.99777827400004,-120.50608448999996,1,2022-03-10 Santa Maria,,,5557
4651,Santa Maria,3/10/2022,hoop,,34.99738977800007,-120.50564622499996,1,2022-03-10 Santa Maria,,,5558
4652,Santa Maria,3/10/2022,hoop,,34.99790070200004,-120.50548481399994,1,2022-03-10 Santa Maria,,,5559
4653,Santa Maria,3/10/2022,hoop,,34.99788456600004,-120.50475389299999,1,2022-03-10 Santa Maria,,,5560
4654,Santa Maria,3/10/2022,hoop,,34.99746615000004,-120.50487329199996,1,2022-03-10 Santa Maria,,,5561
4655,Santa Maria,3/10/2022,hoop,,34.997671086000025,-120.50436584999994,1,2022-03-10 Santa Maria,,,5562
4656,Santa Maria,3/10/2022,hoop,,34.997300145000054,-120.50449353899997,1,2022-03-10 Santa Maria,,,5563
4657,Santa Maria,3/10/2022,hoop,,34.99788285400007,-120.50397341999997,1,2022-03-10 Santa Maria,,,5564
4658,Santa Maria,3/10/2022,hoop,,34.99760593900004,-120.503984646,1,2022-03-10 Santa Maria,,,5565
4659,Santa Maria,3/10/2022,hoop,,34.997178277000046,-120.50369577499998,1,2022-03-10 Santa Maria,,,5566
4660,Santa Maria,3/10/2022,hoop,,34.99683899500008,-120.50703599199994,1,2022-03-10 Santa Maria,,,5567
4661,Santa Maria,3/10/2022,hoop,,34.99655145200006,-120.507054961,1,2022-03-10 Santa Maria,,,5568
4662,Santa Maria,3/10/2022,hoop,,34.99628470800008,-120.50683620599995,1,2022-03-10 Santa Maria,,,5569
4663,Santa Maria,3/10/2022,hoop,,34.99633193900007,-120.50628395899996,1,2022-03-10 Santa Maria,5575.0,26.32505097168612,5570
4664,Santa Maria,3/10/2022,hoop,,34.996935896000025,-120.506504442,1,2022-03-10 Santa Maria,5572.0,25.365238665039172,5571
4666,Santa Maria,3/10/2022,hoop,,34.99682420200003,-120.50591892999996,1,2022-03-10 Santa Maria,5574.0,27.96329075478435,5573
4669,Santa Maria,3/10/2022,hoop,,34.996325797000054,-120.50725587899996,1,2022-03-10 Santa Maria,,,5576
4670,Santa Maria,3/10/2022,hoop,,34.99679004300003,-120.50552457299995,1,2022-03-10 Santa Maria,,,5577
4671,Santa Maria,3/10/2022,hoop,,34.99652275600005,-120.50572753799996,1,2022-03-10 Santa Maria,,,5578
4672,Santa Maria,3/10/2022,hoop,,34.99633050600005,-120.505409451,1,2022-03-10 Santa Maria,,,5579
4673,Santa Maria,3/10/2022,hoop,,34.99680056300008,-120.50509352499996,1,2022-03-10 Santa Maria,,,5580
4674,Santa Maria,3/10/2022,hoop,,34.99650858200005,-120.50482081299998,1,2022-03-10 Santa Maria,,,5581
4675,Santa Maria,3/10/2022,hoop,,34.99674894100008,-120.50370308599996,1,2022-03-10 Santa Maria,,,5582
4676,Santa Maria,3/10/2022,hoop,,34.99584489500006,-120.50695601799998,1,2022-03-10 Santa Maria,5585.0,28.21582013110603,5583
4677,Santa Maria,3/10/2022,hoop,,34.995381294000026,-120.50711022499996,1,2022-03-10 Santa Maria,,,5584
4679,Santa Maria,3/10/2022,hoop,,34.99561920000008,-120.50676720299998,1,2022-03-10 Santa Maria,5587.0,27.49953208117478,5586
4681,Santa Maria,3/10/2022,hoop,,34.99591621800005,-120.50652358399996,1,2022-03-10 Santa Maria,,,5588
4682,Santa Maria,3/10/2022,hoop,,34.995241760000056,-120.50626947299996,1,2022-03-10 Santa Maria,,,5589
4683,Santa Maria,3/10/2022,hoop,,34.99564400400004,-120.50639844899996,1,2022-03-10 Santa Maria,,,5590
4684,Santa Maria,3/10/2022,hoop,,34.995890270000075,-120.50587619099996,1,2022-03-10 Santa Maria,,,5591
4685,Santa Maria,3/10/2022,hoop,,34.99562885900008,-120.50600449799998,1,2022-03-10 Santa Maria,,,5592
4686,Santa Maria,3/10/2022,hoop,,34.99536295300004,-120.50569572499997,1,2022-03-10 Santa Maria,,,5593
4687,Santa Maria,3/10/2022,hoop,,34.995899974000054,-120.50532877299996,1,2022-03-10 Santa Maria,,,5594
4688,Santa Maria,3/10/2022,hoop,,34.99568996200003,-120.520011609,1,2022-03-10 Santa Maria,,,5595
4689,Santa Maria,3/10/2022,hoop,,34.99540743500006,-120.51959805099995,1,2022-03-10 Santa Maria,,,5596
4690,Santa Maria,3/10/2022,hoop,,34.995784134000075,-120.51924828399996,1,2022-03-10 Santa Maria,,,5597
4691,Santa Maria,3/10/2022,hoop,,34.99531301500008,-120.518927454,1,2022-03-10 Santa Maria,,,5598
4692,Santa Maria,3/10/2022,hoop,,34.99567125800007,-120.51855037999997,1,2022-03-10 Santa Maria,,,5599
4693,Santa Maria,3/10/2022,hoop,,34.995402213000034,-120.51806627199994,1,2022-03-10 Santa Maria,,,5600
4694,Santa Maria,3/10/2022,hoop,,34.99560784200003,-120.51703977199996,1,2022-03-10 Santa Maria,,,5601
4695,Santa Maria,3/10/2022,hoop,,34.995272355000054,-120.51643127999994,1,2022-03-10 Santa Maria,,,5602
4696,Santa Maria,3/10/2022,hoop,,34.99468770900006,-120.51710825999999,1,2022-03-10 Santa Maria,,,5603
4697,Santa Maria,3/10/2022,hoop,,34.99453758400006,-120.51645485599992,1,2022-03-10 Santa Maria,,,5604
4698,Santa Maria,3/10/2022,hoop,,34.99371333600004,-120.51573363899996,1,2022-03-10 Santa Maria,,,5605
4699,Santa Maria,3/10/2022,hoop,,34.99362750900008,-120.51505188399994,1,2022-03-10 Santa Maria,,,5606
4700,Santa Maria,3/10/2022,hoop,,34.99332936700006,-120.51448853699996,1,2022-03-10 Santa Maria,,,5607
4701,Santa Maria,3/10/2022,hoop,,34.99339885000006,-120.515408832,1,2022-03-10 Santa Maria,,,5608
4702,Santa Maria,3/10/2022,hoop,,34.99339029400005,-120.51624873499996,1,2022-03-10 Santa Maria,,,5609
4703,Santa Maria,3/10/2022,hoop,,34.994207827000025,-120.51568434499995,1,2022-03-10 Santa Maria,,,5610
4704,Santa Maria,3/10/2022,hoop,,34.99436332400006,-120.516947502,1,2022-03-10 Santa Maria,,,5611
4705,Santa Maria,3/10/2022,hoop,,34.99515493900003,-120.51557616399998,1,2022-03-10 Santa Maria,,,5612
4706,Santa Maria,3/10/2022,hoop,,34.99499238300007,-120.51463197399994,1,2022-03-10 Santa Maria,,,5613
4707,Santa Maria,3/10/2022,hoop,,34.995265594000045,-120.51694041399996,1,2022-03-10 Santa Maria,,,5614
4708,Santa Maria,3/10/2022,hoop,,34.99299112400007,-120.51849717399995,1,2022-03-10 Santa Maria,,,5615
4709,Santa Maria,3/10/2022,hoop,,34.99265079200006,-120.51811694699995,1,2022-03-10 Santa Maria,,,5616
4710,Santa Maria,3/10/2022,hoop,,34.992818218000025,-120.51762622099994,1,2022-03-10 Santa Maria,,,5617
4711,Santa Maria,3/10/2022,hoop,,34.992051322000066,-120.51735005399996,1,2022-03-10 Santa Maria,,,5618
4712,Santa Maria,3/10/2022,hoop,,34.99244536600003,-120.517677516,1,2022-03-10 Santa Maria,,,5619
4713,Santa Maria,3/10/2022,hoop,,34.99171059100007,-120.516702684,1,2022-03-10 Santa Maria,,,5620
4714,Santa Maria,3/10/2022,hoop,,34.99251539200003,-120.51604057099996,1,2022-03-10 Santa Maria,,,5621
4715,Santa Maria,3/10/2022,hoop,,34.99268510100006,-120.51545714899999,1,2022-03-10 Santa Maria,,,5622
4716,Santa Maria,3/10/2022,hoop,,34.99117621400006,-120.51602660799993,1,2022-03-10 Santa Maria,,,5623
4717,Santa Maria,3/10/2022,hoop,,34.991658002000065,-120.51446867099996,1,2022-03-10 Santa Maria,,,5624
4718,Santa Maria,3/10/2022,hoop,,34.990477156000054,-120.51532814099994,1,2022-03-10 Santa Maria,,,5625
4719,Santa Maria,3/10/2022,hoop,,34.991865751000034,-120.51534919699996,1,2022-03-10 Santa Maria,,,5626
4720,Santa Maria,3/10/2022,hoop,,34.989292944000056,-120.50848550299996,1,2022-03-10 Santa Maria,5631.0,27.146002142083304,5627
4721,Santa Maria,3/10/2022,hoop,,34.98967056300006,-120.50745299699996,1,2022-03-10 Santa Maria,,,5628
4722,Santa Maria,3/10/2022,hoop,,34.98903211100003,-120.506911157,1,2022-03-10 Santa Maria,5630.0,16.935305711360744,5629
4725,Santa Maria,3/10/2022,hoop,,34.98869331800006,-120.50836127999996,1,2022-03-10 Santa Maria,,,5632
4726,Santa Maria,3/10/2022,hoop,,34.98918748500006,-120.50798037299997,1,2022-03-10 Santa Maria,,,5633
4727,Santa Maria,3/10/2022,hoop,,34.988985808000045,-120.50757258999992,1,2022-03-10 Santa Maria,,,5634
4728,Santa Maria,3/10/2022,hoop,,34.98829348500004,-120.50829257499998,1,2022-03-10 Santa Maria,,,5635
4729,Santa Maria,3/10/2022,hoop,,34.98857969200003,-120.50657681299998,1,2022-03-10 Santa Maria,,,5636
4730,Santa Maria,3/10/2022,hoop,,34.99026820000006,-120.50587203999999,1,2022-03-10 Santa Maria,,,5637
4731,Santa Maria,3/10/2022,hoop,,34.98977607900008,-120.50638227499996,1,2022-03-10 Santa Maria,,,5638
4732,Santa Maria,3/10/2022,hoop,,34.993818574000045,-120.51663867199994,1,2022-03-10 Santa Maria,,,5639
4733,Santa Maria,3/10/2022,hoop,,34.99365126500004,-120.51690385299996,1,2022-03-10 Santa Maria,,,5640
4734,Santa Maria,3/10/2022,hoop,,34.99545626100007,-120.51582952999996,1,2022-03-10 Santa Maria,,,5641
4735,Santa Maria,3/10/2022,hoop,,34.99541430000005,-120.51507290499995,1,2022-03-10 Santa Maria,,,5642
4736,Santa Maria,3/10/2022,hoop,,34.994568524000044,-120.51461164099997,1,2022-03-10 Santa Maria,,,5643
4737,Santa Maria,3/10/2022,hoop,,34.994597372000044,-120.51582807999993,1,2022-03-10 Santa Maria,,,5644
4738,Santa Maria,3/10/2022,hoop,,34.99440574000005,-120.51516661299996,1,2022-03-10 Santa Maria,,,5645
4739,Santa Maria,3/10/2022,hoop,,35.008712227000046,-120.45962984999994,1,2022-03-10 Santa Maria,,,5646
4740,Santa Maria,3/10/2022,hoop,,35.00831730600004,-120.45938892099996,1,2022-03-10 Santa Maria,,,5647
4741,Santa Maria,3/10/2022,hoop,,35.00871149400007,-120.45874211699999,1,2022-03-10 Santa Maria,,,5648
4742,Santa Maria,3/10/2022,hoop,,35.008384017000026,-120.45739096299997,1,2022-03-10 Santa Maria,,,5649
4743,Santa Maria,3/10/2022,other,,34.94166850800008,-120.477757194,1,2022-03-10 Santa Maria,,,5650
4744,Santa Maria,3/10/2022,other,,34.94341472400004,-120.47779030799995,1,2022-03-10 Santa Maria,,,5651
4745,Santa Maria,3/10/2022,other,,34.94285556600005,-120.479548175,1,2022-03-10 Santa Maria,,,5652
4746,Santa Maria,3/10/2022,other,,34.94341602900005,-120.47696099299996,1,2022-03-10 Santa Maria,,,5653
4747,Santa Maria,3/10/2022,other,,34.94228991400007,-120.48049682299995,1,2022-03-10 Santa Maria,,,5654
4748,Santa Maria,3/10/2022,other,,34.94183706600006,-120.47672663199997,1,2022-03-10 Santa Maria,,,5655
4749,Santa Maria,3/10/2022,other,,34.94320673500005,-120.47466620199998,1,2022-03-10 Santa Maria,,,5656
4750,Santa Maria,3/10/2022,other,,34.94312499200004,-120.47424457799995,1,2022-03-10 Santa Maria,,,5657
4751,Santa Maria,3/10/2022,other,,34.94133920500008,-120.47430720899996,1,2022-03-10 Santa Maria,,,5658
4752,Santa Maria,3/10/2022,other,,34.939583638000045,-120.47451367599996,1,2022-03-10 Santa Maria,,,5659
4753,Santa Maria,3/10/2022,other,,34.93800233800005,-120.47784051699993,1,2022-03-10 Santa Maria,,,5660
4754,Santa Maria,3/10/2022,other,,34.93792236000007,-120.47951961799998,1,2022-03-10 Santa Maria,,,5661
4755,Santa Maria,3/10/2022,other,,34.93713052500004,-120.47793991699996,1,2022-03-10 Santa Maria,,,5662
4756,Santa Maria,3/10/2022,other,,34.93806044200005,-120.47693027999996,1,2022-03-10 Santa Maria,,,5663
4757,Santa Maria,3/10/2022,other,,34.93748967200003,-120.47929588299996,1,2022-03-10 Santa Maria,,,5664
4758,Santa Maria,3/10/2022,other,,34.93794566100007,-120.47860758599997,1,2022-03-10 Santa Maria,,,5665
4759,Santa Maria,3/10/2022,other,,34.94095155300005,-120.48517828699994,1,2022-03-10 Santa Maria,,,5666
4760,Santa Maria,3/10/2022,other,,34.944486977000054,-120.484405929,1,2022-03-10 Santa Maria,,,5667
4761,Santa Maria,3/10/2022,other,,34.94339225400006,-120.48433763399998,1,2022-03-10 Santa Maria,,,5668
4762,Santa Maria,3/10/2022,other,,34.943094605000056,-120.45561916699997,1,2022-03-10 Santa Maria,,,5669
4763,Santa Maria,3/10/2022,other,,34.93767768200007,-120.45741505999996,1,2022-03-10 Santa Maria,,,5670
4764,Santa Maria,3/10/2022,other,,34.941005518000054,-120.45671028099996,1,2022-03-10 Santa Maria,,,5671
4765,Santa Maria,3/10/2022,other,,34.93767729800004,-120.45626928699994,1,2022-03-10 Santa Maria,,,5672
4766,Santa Maria,3/10/2022,other,,34.936191019000034,-120.45853613599996,1,2022-03-10 Santa Maria,,,5673
4767,Santa Maria,3/10/2022,other,,34.94798210800008,-120.44880548799993,1,2022-03-10 Santa Maria,,,5674
4768,Santa Maria,3/10/2022,other,,34.94638769200003,-120.448377903,1,2022-03-10 Santa Maria,,,5675
4769,Santa Maria,3/10/2022,other,,34.950610608000034,-120.43256075299996,1,2022-03-10 Santa Maria,,,5676
4770,Santa Maria,3/10/2022,other,,34.937628862000054,-120.41417666899996,1,2022-03-10 Santa Maria,,,5677
4771,Santa Maria,3/10/2022,other,,34.952216915000065,-120.40840872999996,1,2022-03-10 Santa Maria,,,5678
4772,Santa Maria,3/10/2022,other,,34.95097063400004,-120.40826841699997,1,2022-03-10 Santa Maria,,,5679
4773,Santa Maria,3/10/2022,other,,34.94994894600006,-120.40849422699993,1,2022-03-10 Santa Maria,,,5680
4774,Santa Maria,3/10/2022,other,,34.948794314000054,-120.40801785099995,1,2022-03-10 Santa Maria,,,5681
4775,Santa Maria,3/10/2022,other,,34.961169459000075,-120.39507734299995,1,2022-03-10 Santa Maria,,,5682
4776,Santa Maria,3/10/2022,other,,34.92874440500003,-120.37566011399996,1,2022-03-10 Santa Maria,,,5683
4777,Santa Maria,3/10/2022,other,,34.93061546300004,-120.377278521,1,2022-03-10 Santa Maria,,,5684
4778,Santa Maria,3/10/2022,other,,34.93049634100004,-120.37571311,1,2022-03-10 Santa Maria,,,5685
4779,Santa Maria,3/10/2022,other,,34.92891760200007,-120.37357984099998,1,2022-03-10 Santa Maria,,,5686
4780,Santa Maria,3/10/2022,other,,34.93032835900004,-120.37279856499998,1,2022-03-10 Santa Maria,,,5687
4781,Santa Maria,3/10/2022,other,,34.91568738600006,-120.33721211499994,1,2022-03-10 Santa Maria,,,5688
4782,Santa Maria,3/10/2022,other,,34.91435821500005,-120.33755156299996,1,2022-03-10 Santa Maria,,,5689
4783,Santa Maria,3/10/2022,other,,34.913928113000054,-120.33547445499994,1,2022-03-10 Santa Maria,,,5690
4784,Santa Maria,3/10/2022,other,,34.910511634000045,-120.33887695499998,1,2022-03-10 Santa Maria,,,5691
4785,Santa Maria,3/10/2022,other,,34.91187191300003,-120.34738927499995,1,2022-03-10 Santa Maria,,,5692
4786,Santa Maria,3/10/2022,other,,34.912033242000064,-120.34955951399996,1,2022-03-10 Santa Maria,,,5693
4787,Santa Maria,3/10/2022,other,,34.92704980000008,-120.41238756799999,1,2022-03-10 Santa Maria,,,5694
4788,Santa Maria,3/10/2022,other,,34.93420897800007,-120.40125030899996,1,2022-03-10 Santa Maria,,,5695
4789,Santa Maria,3/10/2022,other,,34.93430198300007,-120.40016932599995,1,2022-03-10 Santa Maria,,,5696
4790,Santa Maria,3/10/2022,other,,34.93404664800005,-120.39938959999994,1,2022-03-10 Santa Maria,,,5697
4791,Santa Maria,3/10/2022,other,,34.93343444000004,-120.40006010899998,1,2022-03-10 Santa Maria,,,5698
4792,Santa Maria,3/10/2022,other,,34.941261807000046,-120.39341379999996,1,2022-03-10 Santa Maria,,,5699
4793,Santa Maria,3/10/2022,other,,34.93991381400008,-120.390992768,1,2022-03-10 Santa Maria,,,5700
4794,Santa Maria,3/10/2022,other,,34.940424988000075,-120.395455315,1,2022-03-10 Santa Maria,,,5701
4795,Santa Maria,3/10/2022,other,,34.947826349000024,-120.37242988399998,1,2022-03-10 Santa Maria,,,5702
4796,Santa Maria,3/10/2022,other,,34.947555298000054,-120.37403820299994,1,2022-03-10 Santa Maria,,,5703
4797,Santa Maria,3/10/2022,other,,34.946833939000044,-120.37357195699995,1,2022-03-10 Santa Maria,,,5704
4798,Santa Maria,3/10/2022,other,,34.946380748000024,-120.37281359499995,1,2022-03-10 Santa Maria,,,5705
4799,Santa Maria,3/10/2022,other,,34.944708856000034,-120.37540062299996,1,2022-03-10 Santa Maria,,,5706
4800,Santa Maria,3/10/2022,other,,34.94488929100004,-120.37318240199994,1,2022-03-10 Santa Maria,,,5707
4801,Santa Maria,3/10/2022,other,,34.94424763500007,-120.37328288099997,1,2022-03-10 Santa Maria,,,5708
4802,Santa Maria,3/10/2022,other,,34.94160473300008,-120.37332946999997,1,2022-03-10 Santa Maria,,,5709
4803,Santa Maria,3/10/2022,other,,34.94226640800008,-120.36851056899997,1,2022-03-10 Santa Maria,,,5710
4804,Santa Maria,3/10/2022,other,,34.913101245000064,-120.35353851699993,1,2022-03-10 Santa Maria,,,5711
4805,Santa Maria,3/10/2022,other,,34.910404706000065,-120.356985469,1,2022-03-10 Santa Maria,,,5712
4806,Santa Maria,3/10/2022,other,,34.910997888000054,-120.359326152,1,2022-03-10 Santa Maria,,,5713
4807,Santa Maria,3/10/2022,hoop,,34.899324103000026,-120.36140165899997,1,2022-03-10 Santa Maria,,,5714
4808,Santa Maria,3/10/2022,other,,34.907441264000056,-120.39839201399997,1,2022-03-10 Santa Maria,,,5715
4809,Santa Maria,3/10/2022,other,,34.91048389100007,-120.39940587099994,1,2022-03-10 Santa Maria,,,5716
4810,Santa Maria,3/10/2022,other,,34.91067452600004,-120.39843933699996,1,2022-03-10 Santa Maria,,,5717
4811,Santa Maria,3/10/2022,other,,34.909522664000065,-120.39886540699996,1,2022-03-10 Santa Maria,5719.0,24.159135657256478,5718
4813,Santa Maria,3/10/2022,other,,34.91025186400003,-120.39855038199993,1,2022-03-10 Santa Maria,,,5720
4814,Santa Maria,3/10/2022,other,,34.908977195000034,-120.40152234599996,1,2022-03-10 Santa Maria,,,5721
4815,Santa Maria,3/10/2022,other,,34.90885203800008,-120.40098052499997,1,2022-03-10 Santa Maria,,,5722
4816,Santa Maria,3/10/2022,other,,34.908683419000056,-120.40147825499996,1,2022-03-10 Santa Maria,5725.0,29.86495282831096,5723
4817,Santa Maria,3/10/2022,other,,34.90848502600005,-120.40103925199996,1,2022-03-10 Santa Maria,,,5724
4819,Santa Maria,3/10/2022,other,,34.90862779500003,-120.39850922099998,1,2022-03-10 Santa Maria,,,5726
4820,Santa Maria,3/10/2022,other,,34.90716045100004,-120.39847220299998,1,2022-03-10 Santa Maria,,,5727
4821,Santa Maria,3/10/2022,other,,34.90807434300007,-120.39589034,1,2022-03-10 Santa Maria,,,5728
4822,Santa Maria,3/10/2022,other,,34.909673687000065,-120.398385637,1,2022-03-10 Santa Maria,,,5729
4823,Santa Maria,3/10/2022,other,,34.907320309000056,-120.39666386599998,1,2022-03-10 Santa Maria,,,5730
4824,Santa Maria,3/10/2022,other,,34.90713133600008,-120.39717956699997,1,2022-03-10 Santa Maria,,,5731
4825,Santa Maria,3/10/2022,other,,34.90768710800006,-120.39486609099998,1,2022-03-10 Santa Maria,,,5732
4826,Santa Maria,3/10/2022,other,,34.90779668500005,-120.393072868,1,2022-03-10 Santa Maria,,,5733
4827,Santa Maria,3/10/2022,other,,34.906536190000054,-120.39686727199997,1,2022-03-10 Santa Maria,,,5734
4828,Santa Maria,3/10/2022,other,,34.90647243600006,-120.39591016799994,1,2022-03-10 Santa Maria,,,5735
4829,Santa Maria,3/10/2022,other,,34.90391931200003,-120.39552168499993,1,2022-03-10 Santa Maria,,,5736
4830,Santa Maria,3/10/2022,other,,34.90187960600008,-120.394557551,1,2022-03-10 Santa Maria,,,5737
4831,Santa Maria,3/10/2022,other,,34.90541868300005,-120.38859330999996,1,2022-03-10 Santa Maria,,,5738
4832,Santa Maria,3/10/2022,other,,34.90428472800005,-120.38742862799997,1,2022-03-10 Santa Maria,,,5739
4833,Santa Maria,3/10/2022,other,,34.909455954000066,-120.38261002799997,1,2022-03-10 Santa Maria,,,5740
4834,Santa Maria,3/10/2022,other,,34.90915087900004,-120.38259164299996,1,2022-03-10 Santa Maria,,,5741
4835,Santa Maria,3/10/2022,other,,34.90879246800006,-120.38139527199996,1,2022-03-10 Santa Maria,5743.0,27.839316804238585,5742
4837,Santa Maria,3/10/2022,other,,34.919076156000074,-120.37969003199998,1,2022-03-10 Santa Maria,,,5744
4838,Santa Maria,3/10/2022,other,,34.918487611000046,-120.379663946,1,2022-03-10 Santa Maria,,,5745
4839,Santa Maria,3/10/2022,other,,34.91952768700003,-120.38606525299996,1,2022-03-10 Santa Maria,,,5746
4840,Santa Maria,3/10/2022,other,,34.91906629300007,-120.38411658899996,1,2022-03-10 Santa Maria,,,5747
4841,Santa Maria,3/10/2022,other,,34.918664834000026,-120.38249854999998,1,2022-03-10 Santa Maria,,,5748
4842,Santa Maria,3/10/2022,other,,34.92530121600004,-120.38942449899996,1,2022-03-10 Santa Maria,,,5749
4843,Santa Maria,3/10/2022,other,,34.92561999600008,-120.38614352499997,1,2022-03-10 Santa Maria,,,5750
4844,Santa Maria,3/10/2022,other,,34.924477436000075,-120.38934049899996,1,2022-03-10 Santa Maria,,,5751
4845,Santa Maria,3/10/2022,other,,34.92501266000005,-120.386152628,1,2022-03-10 Santa Maria,,,5752
4846,Santa Maria,3/10/2022,other,,35.02136697200007,-120.53226948599996,1,2022-03-10 Santa Maria,,,5753
4847,Santa Maria,3/10/2022,other,,35.02590824300006,-120.530953652,1,2022-03-10 Santa Maria,5755.0,20.963183898727078,5754
4849,Santa Maria,3/10/2022,other,,35.026252499000066,-120.53024360099992,1,2022-03-10 Santa Maria,,,5756
4850,Santa Maria,2/6/2021,other,,35.03952643200006,-120.56886369399996,2,2021-02-06 Santa Maria,,,5757
4851,Santa Maria,2/6/2021,other,,35.03909218800004,-120.56922215699996,2,2021-02-06 Santa Maria,5767.0,16.60003913868186,5758
4852,Santa Maria,2/6/2021,other,,35.03872167800006,-120.56916749499997,2,2021-02-06 Santa Maria,,,5759
4853,Santa Maria,2/6/2021,other,,35.038963043000024,-120.56892963299998,2,2021-02-06 Santa Maria,,,5760
4854,Santa Maria,2/6/2021,other,,35.03923769600004,-120.568723676,2,2021-02-06 Santa Maria,,,5761
4855,Santa Maria,2/6/2021,other,,35.039713705000054,-120.56859266099995,2,2021-02-06 Santa Maria,5763.0,21.78249738651045,5762
4857,Santa Maria,2/6/2021,other,,35.03939388200007,-120.56804507399994,2,2021-02-06 Santa Maria,,,5764
4858,Santa Maria,2/6/2021,other,,35.03853728200005,-120.56880899799997,2,2021-02-06 Santa Maria,,,5765
4859,Santa Maria,2/6/2021,other,,35.03884749100007,-120.56851232699997,2,2021-02-06 Santa Maria,,,5766
4861,Santa Maria,2/6/2021,other,,35.03963975000005,-120.57065002499996,2,2021-02-06 Santa Maria,,,5768
4862,Santa Maria,2/6/2021,other,,35.03729967700008,-120.57538335999998,2,2021-02-06 Santa Maria,,,5769
4863,Santa Maria,2/6/2021,other,,35.038548564000045,-120.57561902299994,2,2021-02-06 Santa Maria,,,5770
4864,Santa Maria,2/6/2021,other,,35.045076753000046,-120.57632545399996,2,2021-02-06 Santa Maria,,,5771
4865,Santa Maria,2/6/2021,other,,35.04509986800008,-120.57511173399996,2,2021-02-06 Santa Maria,,,5772
4866,Santa Maria,2/6/2021,other,,35.04557784100007,-120.57607231699996,2,2021-02-06 Santa Maria,,,5773
4867,Santa Maria,2/6/2021,other,,35.04589603800002,-120.57595352899995,2,2021-02-06 Santa Maria,,,5774
4868,Santa Maria,2/6/2021,other,,35.046232718000056,-120.57595640499994,2,2021-02-06 Santa Maria,,,5775
4869,Santa Maria,2/6/2021,other,,35.04678931300003,-120.57657142899996,2,2021-02-06 Santa Maria,,,5776
4870,Santa Maria,2/6/2021,other,,35.04649954800004,-120.57610947399996,2,2021-02-06 Santa Maria,,,5777
4871,Santa Maria,2/6/2021,other,,35.04597453500003,-120.57536957399996,2,2021-02-06 Santa Maria,,,5778
4872,Santa Maria,2/6/2021,other,,35.045993656000064,-120.574975731,2,2021-02-06 Santa Maria,,,5779
4873,Santa Maria,2/6/2021,other,,35.04659743700006,-120.57543227199994,2,2021-02-06 Santa Maria,,,5780
4874,Santa Maria,2/6/2021,other,,35.04672698300004,-120.57446474499994,2,2021-02-06 Santa Maria,,,5781
4875,Santa Maria,2/6/2021,other,,35.046276686000056,-120.57417454199998,2,2021-02-06 Santa Maria,5783.0,27.970747533208034,5782
4877,Santa Maria,2/6/2021,other,,35.04593359400008,-120.574149848,2,2021-02-06 Santa Maria,,,5784
4878,Santa Maria,2/6/2021,other,,35.045728299000075,-120.57314195699996,2,2021-02-06 Santa Maria,,,5785
4879,Santa Maria,2/6/2021,other,,35.044414593000056,-120.57644808699996,2,2021-02-06 Santa Maria,,,5786
4880,Santa Maria,2/6/2021,other,,35.04228178300008,-120.58290093299996,2,2021-02-06 Santa Maria,,,5787
4881,Santa Maria,2/6/2021,other,,35.045011411000075,-120.585156515,2,2021-02-06 Santa Maria,,,5788
4882,Santa Maria,2/6/2021,other,,35.04626979600005,-120.58177035799996,2,2021-02-06 Santa Maria,,,5789
4883,Santa Maria,2/6/2021,other,,35.045764220000024,-120.58320375099999,2,2021-02-06 Santa Maria,,,5790
4884,Santa Maria,2/6/2021,other,,35.04467353800004,-120.57809854299995,2,2021-02-06 Santa Maria,,,5791
4885,Santa Maria,2/6/2021,other,,35.04253259200004,-120.57645904599995,2,2021-02-06 Santa Maria,,,5792
4886,Santa Maria,2/6/2021,other,,35.04212151500008,-120.57792386999996,2,2021-02-06 Santa Maria,5795.0,28.2097813467787,5793
4887,Santa Maria,2/6/2021,other,,35.04307529500005,-120.57727970199994,2,2021-02-06 Santa Maria,,,5794
4889,Santa Maria,2/6/2021,other,,35.04204486200007,-120.59337439799998,2,2021-02-06 Santa Maria,,,5796
4890,Santa Maria,2/6/2021,other,,35.04150942500007,-120.59268477899997,2,2021-02-06 Santa Maria,,,5797
4891,Santa Maria,2/6/2021,other,,35.02890195500004,-120.59606402199996,2,2021-02-06 Santa Maria,,,5798
4892,Santa Maria,2/6/2021,other,,35.02764680400003,-120.59400095899996,2,2021-02-06 Santa Maria,,,5799
4893,Santa Maria,2/6/2021,other,,35.03208559500007,-120.60297374699996,2,2021-02-06 Santa Maria,,,5800
4894,Santa Maria,2/6/2021,other,,35.03200315400005,-120.60127129199996,2,2021-02-06 Santa Maria,,,5801
4895,Santa Maria,2/6/2021,other,,35.032051129000024,-120.60197065799996,2,2021-02-06 Santa Maria,,,5802
4896,Santa Maria,2/6/2021,other,,35.03061924700006,-120.60300892599996,2,2021-02-06 Santa Maria,,,5803
4897,Santa Maria,2/6/2021,other,,35.03092246700004,-120.59915409399996,2,2021-02-06 Santa Maria,,,5804
4898,Santa Maria,2/6/2021,hoop,,35.03955744500007,-120.57281075799995,2,2021-02-06 Santa Maria,,,5805
4899,Santa Maria,2/6/2021,hoop,,35.039150875000075,-120.57229983399996,2,2021-02-06 Santa Maria,,,5806
4900,Santa Maria,2/6/2021,hoop,,35.037984864000066,-120.56644924799996,2,2021-02-06 Santa Maria,,,5807
4901,Santa Maria,2/6/2021,hoop,,35.03524522000004,-120.57068011099994,2,2021-02-06 Santa Maria,,,5808
4902,Santa Maria,2/6/2021,hoop,,35.03548185700004,-120.56984050899996,2,2021-02-06 Santa Maria,,,5809
4903,Santa Maria,2/6/2021,hoop,,35.03512526700007,-120.56761528599996,2,2021-02-06 Santa Maria,,,5810
4904,Santa Maria,2/6/2021,hoop,,35.03724274100006,-120.56797801399993,2,2021-02-06 Santa Maria,,,5811
4905,Santa Maria,2/6/2021,hoop,,35.038791221000054,-120.56740057899998,2,2021-02-06 Santa Maria,,,5812
4906,Santa Maria,2/6/2021,hoop,,35.03830167800004,-120.57336269599995,2,2021-02-06 Santa Maria,,,5813
4907,Santa Maria,2/6/2021,hoop,,35.03809128000006,-120.57229272899995,2,2021-02-06 Santa Maria,,,5814
4908,Santa Maria,2/6/2021,hoop,,35.037903546000045,-120.56870696799996,2,2021-02-06 Santa Maria,,,5815
4909,Santa Maria,2/6/2021,hoop,,35.038389995000045,-120.57101575299998,2,2021-02-06 Santa Maria,,,5816
4910,Santa Maria,2/6/2021,hoop,,35.03804495400004,-120.57008577599998,2,2021-02-06 Santa Maria,,,5817
4911,Santa Maria,2/6/2021,hoop,,35.038205266000034,-120.56764671899998,2,2021-02-06 Santa Maria,,,5818
4912,Santa Maria,2/6/2021,hoop,,35.03714387400004,-120.57299625199992,2,2021-02-06 Santa Maria,,,5819
4913,Santa Maria,2/6/2021,hoop,,35.041493941000056,-120.56770061999998,2,2021-02-06 Santa Maria,,,5820
4914,Santa Maria,2/6/2021,hoop,,35.04089087500006,-120.56766905699997,2,2021-02-06 Santa Maria,,,5821
4915,Santa Maria,2/6/2021,hoop,,35.04083871800003,-120.567197825,2,2021-02-06 Santa Maria,,,5822
4916,Santa Maria,2/6/2021,hoop,,35.04047057100007,-120.56733253899993,2,2021-02-06 Santa Maria,,,5823
4917,Santa Maria,2/6/2021,hoop,,35.043418889000066,-120.56775432699997,2,2021-02-06 Santa Maria,,,5824
4918,Santa Maria,2/6/2021,hoop,,35.04291413400006,-120.56760625599996,2,2021-02-06 Santa Maria,,,5825
4919,Santa Maria,2/6/2021,hoop,,35.04339490800004,-120.56692805399996,2,2021-02-06 Santa Maria,,,5826
4920,Santa Maria,2/6/2021,hoop,,35.04323696300003,-120.56660407099996,2,2021-02-06 Santa Maria,,,5827
4921,Santa Maria,2/6/2021,hoop,,35.04336030200005,-120.56552837299996,2,2021-02-06 Santa Maria,,,5828
4922,Santa Maria,2/6/2021,hoop,,35.04313982000008,-120.56515044499996,2,2021-02-06 Santa Maria,,,5829
4923,Santa Maria,2/6/2021,hoop,,35.04338078500007,-120.56498546299996,2,2021-02-06 Santa Maria,,,5830
4924,Santa Maria,2/6/2021,hoop,,35.04196107000007,-120.56564244499998,2,2021-02-06 Santa Maria,,,5831
4925,Santa Maria,2/6/2021,hoop,,35.04219750100003,-120.56486766999996,2,2021-02-06 Santa Maria,,,5832
4926,Santa Maria,2/6/2021,hoop,,35.04194618900004,-120.56504685899993,2,2021-02-06 Santa Maria,,,5833
4927,Santa Maria,2/6/2021,hoop,,35.04271936600003,-120.56549954899998,2,2021-02-06 Santa Maria,,,5834
4928,Santa Maria,2/6/2021,hoop,,35.04320056500006,-120.56418019299996,2,2021-02-06 Santa Maria,,,5835
4929,Santa Maria,2/6/2021,hoop,,35.042615296000065,-120.56438905699996,2,2021-02-06 Santa Maria,,,5836
4930,Santa Maria,2/6/2021,hoop,,35.04253315900007,-120.56509873199995,2,2021-02-06 Santa Maria,,,5837
4931,Santa Maria,2/6/2021,hoop,,35.04163978400004,-120.56565444699999,2,2021-02-06 Santa Maria,,,5838
4932,Santa Maria,2/6/2021,hoop,,35.04162183700004,-120.56460076999996,2,2021-02-06 Santa Maria,,,5839
4933,Santa Maria,2/6/2021,hoop,,35.04117579700005,-120.56557088599997,2,2021-02-06 Santa Maria,,,5840
4934,Santa Maria,2/6/2021,hoop,,35.041604594000034,-120.56608895999995,2,2021-02-06 Santa Maria,,,5841
4935,Santa Maria,2/6/2021,hoop,,35.04221435100004,-120.56390490399995,2,2021-02-06 Santa Maria,,,5842
4936,Santa Maria,2/6/2021,hoop,,35.04330339200004,-120.56312436599995,2,2021-02-06 Santa Maria,,,5843
4937,Santa Maria,2/6/2021,hoop,,35.04293525300005,-120.56303818199996,2,2021-02-06 Santa Maria,,,5844
4938,Santa Maria,2/6/2021,hoop,,35.04146240000006,-120.56394644299996,2,2021-02-06 Santa Maria,,,5845
4939,Santa Maria,2/6/2021,hoop,,35.04058816100007,-120.56520082699996,2,2021-02-06 Santa Maria,,,5846
4940,Santa Maria,2/6/2021,hoop,,35.044739340000035,-120.56222852499997,2,2021-02-06 Santa Maria,,,5847
4941,Santa Maria,2/6/2021,hoop,,35.04441067700003,-120.56198857299997,2,2021-02-06 Santa Maria,,,5848
4942,Santa Maria,2/6/2021,hoop,,35.04427356100007,-120.56118733499994,2,2021-02-06 Santa Maria,,,5849
4943,Santa Maria,2/6/2021,hoop,,35.043985716000066,-120.56070867899996,2,2021-02-06 Santa Maria,,,5850
4944,Santa Maria,2/6/2021,hoop,,35.043204607000064,-120.56068610699998,2,2021-02-06 Santa Maria,,,5851
4945,Santa Maria,2/6/2021,hoop,,35.044912485000054,-120.55706171999996,2,2021-02-06 Santa Maria,,,5852
4946,Santa Maria,2/6/2021,hoop,,35.04559735300006,-120.55711393499996,2,2021-02-06 Santa Maria,,,5853
4947,Santa Maria,2/6/2021,mulch,,35.001303661000065,-120.50255571999996,2,2021-02-06 Santa Maria,,,5854
4948,Santa Maria,2/6/2021,mulch,,35.00116485900003,-120.50170844099993,2,2021-02-06 Santa Maria,,,5855
4949,Santa Maria,2/6/2021,mulch,,35.00102269900003,-120.50254205799996,2,2021-02-06 Santa Maria,,,5856
4950,Santa Maria,2/6/2021,mulch,,35.001095828000075,-120.50205904199998,2,2021-02-06 Santa Maria,,,5857
4951,Santa Maria,2/6/2021,mulch,,35.00035882200007,-120.50184227499994,2,2021-02-06 Santa Maria,,,5858
4952,Santa Maria,2/6/2021,mulch,,35.000752103000025,-120.502183345,2,2021-02-06 Santa Maria,,,5859
4953,Santa Maria,2/6/2021,mulch,,35.00020456500005,-120.50270653999996,2,2021-02-06 Santa Maria,,,5860
4954,Santa Maria,2/6/2021,mulch,,35.000052125000025,-120.50228314199995,2,2021-02-06 Santa Maria,,,5861
4955,Santa Maria,2/6/2021,mulch,,34.99968688200005,-120.502076747,2,2021-02-06 Santa Maria,,,5862
4956,Santa Maria,2/6/2021,mulch,,34.99938752500003,-120.50275678999996,2,2021-02-06 Santa Maria,,,5863
4957,Santa Maria,2/6/2021,mulch,,34.99980098100008,-120.50267162899996,2,2021-02-06 Santa Maria,,,5864
4958,Santa Maria,2/6/2021,mulch,,34.99927059300006,-120.50196616999995,2,2021-02-06 Santa Maria,,,5865
4959,Santa Maria,2/6/2021,mulch,,34.99956411000005,-120.50237620899996,2,2021-02-06 Santa Maria,,,5866
4960,Santa Maria,2/6/2021,mulch,,34.99907605800007,-120.50280660199996,2,2021-02-06 Santa Maria,,,5867
4961,Santa Maria,2/6/2021,mulch,,34.999007654000025,-120.50239233399996,2,2021-02-06 Santa Maria,,,5868
4962,Santa Maria,2/6/2021,mulch,,34.998957314000045,-120.50195924099997,2,2021-02-06 Santa Maria,,,5869
4963,Santa Maria,2/6/2021,mulch,,34.998795177000034,-120.50276709699995,2,2021-02-06 Santa Maria,5874.0,27.924171038436697,5870
4964,Santa Maria,2/6/2021,mulch,,34.99871819400005,-120.50239981899993,2,2021-02-06 Santa Maria,,,5871
4965,Santa Maria,2/6/2021,mulch,,34.99832820300003,-120.50214050799995,2,2021-02-06 Santa Maria,,,5872
4966,Santa Maria,2/6/2021,mulch,,34.99834109100004,-120.50256086699994,2,2021-02-06 Santa Maria,,,5873
4968,Santa Maria,2/6/2021,mulch,,34.99788089400005,-120.50291932899997,2,2021-02-06 Santa Maria,,,5875
4969,Santa Maria,2/6/2021,mulch,,34.997783120000065,-120.50220777899995,2,2021-02-06 Santa Maria,,,5876
4970,Santa Maria,2/6/2021,mulch,,34.99715512000006,-120.50219888099996,2,2021-02-06 Santa Maria,,,5877
4971,Santa Maria,2/6/2021,mulch,,34.99709202400004,-120.50272187699994,2,2021-02-06 Santa Maria,,,5878
4972,Santa Maria,2/6/2021,mulch,,34.98825558200008,-120.50175318999997,2,2021-02-06 Santa Maria,,,5879
4973,Santa Maria,2/6/2021,mulch,,34.98846673700007,-120.50032006799997,2,2021-02-06 Santa Maria,,,5880
4974,Santa Maria,2/6/2021,mulch,,34.987918396000055,-120.50141982399998,2,2021-02-06 Santa Maria,,,5881
4975,Santa Maria,2/6/2021,mulch,,34.98797490700008,-120.50033866799998,2,2021-02-06 Santa Maria,,,5882
4976,Santa Maria,2/6/2021,mulch,,34.98907306700005,-120.49717943199992,2,2021-02-06 Santa Maria,,,5883
4977,Santa Maria,2/6/2021,mulch,,34.98724163300005,-120.49904574099996,2,2021-02-06 Santa Maria,,,5884
4978,Santa Maria,2/6/2021,mulch,,34.986331396000026,-120.49925037199993,2,2021-02-06 Santa Maria,,,5885
4979,Santa Maria,2/6/2021,mulch,,34.98590726700007,-120.49605372899998,2,2021-02-06 Santa Maria,,,5886
4980,Santa Maria,2/6/2021,mulch,,34.98588711000008,-120.49692472699996,2,2021-02-06 Santa Maria,,,5887
4981,Santa Maria,2/6/2021,mulch,,34.986932970000055,-120.49665435299994,2,2021-02-06 Santa Maria,,,5888
4982,Santa Maria,2/6/2021,mulch,,34.98767765100007,-120.49787159399995,2,2021-02-06 Santa Maria,,,5889
4983,Santa Maria,2/6/2021,mulch,,34.986891247000074,-120.49790488599996,2,2021-02-06 Santa Maria,,,5890
4984,Santa Maria,2/6/2021,mulch,,34.98734972500006,-120.50150171999996,2,2021-02-06 Santa Maria,,,5891
4985,Santa Maria,2/6/2021,mulch,,34.98571200400005,-120.50048329699996,2,2021-02-06 Santa Maria,,,5892
4986,Santa Maria,2/6/2021,mulch,,34.98601001900005,-120.50002800299995,2,2021-02-06 Santa Maria,,,5893
4987,Santa Maria,2/6/2021,mulch,,34.986371639000026,-120.50056332799994,2,2021-02-06 Santa Maria,,,5894
4988,Santa Maria,2/6/2021,mulch,,34.98614949700004,-120.50136492699994,2,2021-02-06 Santa Maria,,,5895
4989,Santa Maria,2/6/2021,mulch,,34.98863078300008,-120.49955409799996,2,2021-02-06 Santa Maria,,,5896
4990,Santa Maria,2/6/2021,mulch,,34.98997254700004,-120.49966719499996,2,2021-02-06 Santa Maria,,,5897
4991,Santa Maria,2/6/2021,mulch,,34.99086352100005,-120.49982772699995,2,2021-02-06 Santa Maria,,,5898
4992,Santa Maria,2/6/2021,mulch,,34.990409724000074,-120.49720308199994,2,2021-02-06 Santa Maria,,,5899
4993,Santa Maria,2/6/2021,mulch,,34.99067591700003,-120.50147313999996,2,2021-02-06 Santa Maria,,,5900
4994,Santa Maria,2/6/2021,mulch,,34.989570104000045,-120.50151915299995,2,2021-02-06 Santa Maria,,,5901
4995,Santa Maria,2/6/2021,mulch,,34.99062297900008,-120.50254728299996,2,2021-02-06 Santa Maria,,,5902
4996,Santa Maria,2/6/2021,mulch,,34.98979765400003,-120.50255705399996,2,2021-02-06 Santa Maria,,,5903
